lemma	pos	date	grouping	identifier	description	context	indexes_target_token	indexes_target_sentence
бюрократ	NOUN	1682-1916	1	бюрократ-0		Ну бюрократы!	3:12	0:13
бюрократ	NOUN	1918-1990	2	бюрократ-1		Но спрашивается: когда и какой бюрократ предлагал что-либо иное -- Никакой и никогда.	31:39	0:85
бюрократ	NOUN	1682-1916	1	бюрократ-2		"Что такое бюрократ" -- спрашивает Фетюк-Мижуев.	11:19	0:48
бюрократ	NOUN	1682-1916	1	бюрократ-3		Конечно, сеятелям хорошо; они, как молодые рыбки, резво плещутся в безбрежном океане словоизвержений; но каково другим каково тем, во-первых, кои, за недостатком семян, к сеянию не призываются, и, во-вторых, тем, коим угрожает в ближайшем будущем быстрое обсеменение Какую роль должны играть эти люди в происходящих перед их глазами словесных турнирах Должны ли они ожидать предстоящего оплодотворения с смирением и кротостью или обязаны озаботиться приисканием мер, чтобы сделать это оплодотворение взаимным, то есть со временем, в свою очередь, обсеменить самих сеятелей Но пуще всего достается тут бюрократам.	601:611	0:612
бюрократ	NOUN	1682-1916	1	бюрократ-4		-- "Я бюрократ мертвец" -- спросил сам себя Рубашкин, воротившись с одного пышного, блистательного вечера, где толковалось много о разных последних регламентациях, кодификациях и прочих бумажных реформациях и где были в числе гостей даже два статс-секретаря.	6:14	0:258
бюрократ	NOUN	1682-1916	1	бюрократ-5		Граф Блудов был олицетворением полнейшего бесстрастия: его тихий, миролюбивый и спокойный нрав не допускал в себе никакой ненависти, но весь склад его умственной личности, его служебной карьеры был таков, что он, как умный бюрократ, мирился с либерализмом как с доктриною, как с течением времени, но идеи политического влияния дворянства он не постигал и не допускал, не находя в себе к ней ни малейшего отголоска.	223:231	0:414
бюрократ	NOUN	1682-1916	1	бюрократ-6		-- Вы не дурак, -- крикнула Тоня, -- но вы бюрократ и черствая душа!	43:51	0:68
бюрократ	NOUN	1918-1990	2	бюрократ-7		Обозвав меня бюрократом, г. Ржевский для подкрепления своей правоты прибегает к булгаринству.	13:23	0:93
бюрократ	NOUN	1682-1916	1	бюрократ-8		-- Действительно, бюрократы.	18:27	0:28
бюрократ	NOUN	1918-1990	2	бюрократ-9		-- Все же, -- ораторствовала Ольга Петровна в салонах губернских дам, -- она наша, из бюрократии (Ольга Петровна никогда не говорила чиновник, а заменяла это слово словом бюрократ), дочь надворного советника, ведет себя уже с полгода прекрасно, скромно, а если что и было там, а l'etranger.	86:96	0:290
бюрократ	NOUN	1682-1916	1	бюрократ-10		-- Значит, сначала надо нанять адвоката, чтобы он доказал, что этот человек жулик или бюрократ -- спросил он.	86:94	0:109
бюрократ	NOUN	1918-1990	2	бюрократ-11		Бюрократы, гимназисты, писатели, художник, адвокат, светские львы и львицы, купчихи, учителя, земский начальник, доктор, пейзане.	0:9	0:129
бюрократ	NOUN	1918-1990	2	бюрократ-12		-- Но неужели вы думаете, Лев Николаевич, что заводчик, жандарм, бюрократ возлюбят когда-нибудь страждущего.	65:73	0:108
бюрократ	NOUN	1918-1990	2	бюрократ-13		Такого же характера "Записки чудака", -- где говорится о машине времени, якобы действующей в прошлом не далее 1915 года, в эпоху которого захотел вернуться старый чиновник-бюрократ.	-1:15	0:181
бюрократ	NOUN	1918-1990	2	бюрократ-14		-- Тебе, бюрократ, рабочий человек одним пальцем должен приказывать, а ты гордишься!	9:17	0:84
бюрократ	NOUN	1918-1990	2	бюрократ-15		-- И если таких, как ты, бюрократы Федяевы вздумают выпихивать за дверь.	25:34	0:72
бюрократ	NOUN	1682-1916	1	бюрократ-16		Бюрократы наши смотрят на разные исповедания, как на разные ведомства: есть, видите ли, тайные советники по министерству внутренних дел, но есть они и по министерству финансов, и по другим ведомствам.	0:9	0:200
бюрократ	NOUN	1682-1916	1	бюрократ-17		В "Рассказе неизвестного человека" революционер спрашивает бюрократа, оказываясь с ним в одной общей скобке: "Отчего я раньше времени ослабел и упал, объяснить не трудно.	59:68	0:170
бюрократ	NOUN	1918-1990	2	бюрократ-18		А ведь у нас, по мнению бюрократов, которые управляют искусством, нет пороков, а недостатки столь ничтожны, что лучше -- прямо приступить к описанию добродетели".	24:34	0:162
бюрократ	NOUN	1918-1990	2	бюрократ-19		В наши дни бюрократ и мещанин -- понятия однозначные, и обе они, -- медицинская сестра и общественница -- прежде всего мещанки.	11:19	0:127
бюрократ	NOUN	1918-1990	2	бюрократ-20		А чтобы этого паразитирующего бюрократа не было, вам и вашим товарищам надо самим создавать обстоятельства: начинать снизу борьбу за рабочее самоуправление, требуя (в том числе и при помощи публичного "битья"), чтобы ученые помогли вам решать эту задачу.	30:39	0:254
бюрократ	NOUN	1918-1990	2	бюрократ-21		Бюрократы с нагрудными значками и перьями показали нам, кто кого.	0:9	0:65
бюрократ	NOUN	1682-1916	1	бюрократ-22		Александра пугала иногда горделивая уверенность этого умнейшего и даровитейшего бюрократа, который полагал, что новые учреждения могут породить новых людей.	80:89	0:156
бюрократ	NOUN	1918-1990	2	бюрократ-23		Что бы бюрократы, доктринеры и утописты ни придумывали против этого исконного зла человеческого общества, все повредит только настоящему -- это главное; а для отдаленного будущего беспрестанно ломать и перестраивать неустановившиеся еще порядком настоящие преобразования нелепо, да мало что нелепо, преступно.	7:16	0:309
бюрократ	NOUN	1682-1916	1	бюрократ-24		Бегушев писал: "Ты -- пропитанный насквозь чернилами бюрократ; для тебя скудная ясность изложения и наша спорная грамотность превыше всего; и каким образом ты мог оскорбляться, когда Трахов не принял к себе на службу тобою рекомендованного господина, уже изобличенного в плутовстве, а Долгов пока еще человек безукоризненной честности".	53:61	0:336
бюрократ	NOUN	1682-1916	1	бюрократ-25		В высших сословиях он проявляется разве только еще в виде национального тщеславия; но и это тщеславие уже так слабо, уже так подрезано в корне буржуазною необходимостью и привычкою жертвовать интересам реальным всеми идеальными интересами, что во время последней войны оно не могло даже, как делало прежде, превратить хоть на время в самоотверженных героев и патриотов лавочников, дельцов, биржевых спекуляторов, офицеров, генералов, бюрократов, капиталистов, собственников и иезуитами воспитанных дворян.	434:444	0:505
бюрократ	NOUN	1682-1916	1	бюрократ-26		Беспомощные перед волей зарвавшихся бюрократов.	36:46	0:47
бюрократ	NOUN	1918-1990	2	бюрократ-27		Присутствие юных бюрократов, усвоивших себе всю глубину новых исходящих и входящих регистров, не волнует их, но приводит в кроткое умиление; они не говорят при виде их "щенки!", как говаривали прежде, когда были старые входящие и исходящие регистры, но, напротив того, благоговеют и ловят на лету слова мудрости, вылетающие бурным потоком из уст их...	17:27	0:351
бюрократ	NOUN	1682-1916	1	бюрократ-28		В городе Нововласьевске некоторый фабрикант, благодетельствуя своим меньшим братьям, деятельно выкупает их на волю, как вдруг налетает на него бюрократ и как дважды два -- четыре доказывает, что товаром сим спекулировать воспрещается ("Ваше превосходительство! позвольте мне двадцать тысяч на общеполезное устройство пожертвовать!" -- как белуга ревет фабрикант, силясь освободить попавшую в капкан лапу.	143:151	0:404
бюрократ	NOUN	1682-1916	1	бюрократ-29		Слишком утонченные и выхоленные, наши бюрократы напоминают ту французскую аристократию, которая до такой степени изнежила себя, что в эпоху великой революции не сумела отстоять ни короля, ни трона, ни наследственных замков, ни прав.	38:47	0:232
бюрократ	NOUN	1918-1990	2	бюрократ-30		В деле Бродского рядом с Фридой, вместе с Фридой действовали, работали, сочувствовали, огорчались и радовались друзья; в деле Бродского она ни минуты не была одна; в своем депутатстве, лицом к лицу с бедами, Фрида была, наоборот, одинока; хоть и не "одна среди людоедов", но "одна среди бюрократов".	287:297	0:299
бюрократ	NOUN	1918-1990	2	бюрократ-31		Как она у меня работает Не имея достаточных средств и будучи отфутболиваем различными бюрократами, она у меня пока не полностью автоматизирована.	86:97	0:145
бюрократ	NOUN	1918-1990	2	бюрократ-32		В деле Бродского, как гной в нарыве, собралась вся испорченная вонючая кровь общественного организма: полицейщина, ненависть бюрократов-мещан к интеллигентам (в особенности евреям), исконное неуважение к литературе.	125:140	0:215
бюрократ	NOUN	1918-1990	2	бюрократ-33		И еще там, конечно, танцевали люди в цепях, во фраках, в пятнистой боевой форме отвоевавших в Трансильвании десантников, в старых костюмах бюрократов восьмидесятых годов, в балетных пачках, даже в древних джинсах.	139:149	0:213
бюрократ	NOUN	1682-1916	1	бюрократ-34		В один прекрасный день он получил по городской почте письмо, в котором довольно красивым женским почерком было выражено, что "слух о женском приюте, основанном им, Белоярцевым, разнесся повсюду и обрадовал не одно угнетенное женское сердце; что имя его будет более драгоценным достоянием истории, чем имена всех людей, величаемых ею героями и спасителями; что с него только начинается новая эпоха для лишенных всех прав и обессиленных воспитанием русских женщин" и т. п. Далее автор письма сообщал, что она девушка, что ей девятнадцатый год, что ее отец -- рутинист, мать -- ханжа, а братья -- бюрократы, что из нее делают куклу, тогда как она чувствует в себе много силы, энергии и желания жить жизнью самостоятельной.	594:603	0:719
бюрократ	NOUN	1682-1916	1	бюрократ-35		Образуются одни обширные объятия, которые заключат в себе и сеятелей, и сеемых, да кстати прихватят и бюрократов.	102:112	0:113
бюрократ	NOUN	1682-1916	1	бюрократ-36		Ваш заместитель Гранатов показался мне бюрократом и неврастеником.	39:49	0:66
бюрократ	NOUN	1918-1990	2	бюрократ-37		Райский, кружась в свете петербургской "золотой молодежи", бывший молодым офицером, потом молодым бюрократом, заплатил обильную дань поклонения этой красоте и, уходя, унес глубокую грусть надолго и много опытов, без которых мог обойтись.	98:108	0:237
бюрократ	NOUN	1682-1916	1	бюрократ-38		Вообще -- какого-то крупного бюрократа.	29:38	0:39
бюрократ	NOUN	1918-1990	2	бюрократ-39		Он долго тер себе лоб и протирал глаза, прочтя о себе слова: "Бюрократы отжили свой век; у канцелярского стола -- России не узнаешь; надо ехать изучать ее в провинции; туда теперь отодвигается все лучшее, там должна возрождаться заново наша жизнь".	62:71	0:248
бюрократ	NOUN	1682-1916	1	бюрократ-40		Впрочем, различать некоторые европейские государства, хотя бы по названиям, могут лишь наиболее ученые и развитые; прочие же, к которым принадлежит большинство, наравне с массой китайского народа, знают всех европейцев под одним названием ян-гоузы ("заморские черти"); в Баян-Сусу один чиновник выразил удивление, узнав, что с проживающими там французскими миссионерами я разговаривал не на русском языке: этот бюрократ Поднебесной империи был уверен, что все ян-гоузы говорят на одном языке.	411:419	0:492
бюрократ	NOUN	1682-1916	1	бюрократ-41		Кто живет в Павловске Разжиревшая буржуазия, гнусные аристократы, бюрократы, гвардейцы, а я -- мыслящий пролетариат.	66:75	0:116
бюрократ	NOUN	1682-1916	1	бюрократ-42		Выведены плугом черты громадной деревни, свезен материал, стали строиться превосходные избы, на все отпускались деньги щедрою рукою, а поверенный был питерский бюрократ и все любил вести на щегольскую ногу.	160:168	0:206
бюрократ	NOUN	1682-1916	1	бюрократ-43		И ежели эти "друзья" были литераторы, то они очень остроумно по этому поводу подшучивали над Кашириным, но ежели "друзья" были бюрократы, то они задумывались и крепко сжимали счастливцу руки.	127:136	0:191
бюрократ	NOUN	1682-1916	1	бюрократ-44		Доминировали, не считаясь с человеком, растаптывая нравственность и традиции, уничтожая культуру и историю, каленым железом выжигая здравый смысл и творческий дух, подменяя экономику и демократию произволом бюрократов.	207:217	0:218
бюрократ	NOUN	1918-1990	2	бюрократ-45		Обратившись к своей памяти, я нашел в ней такую бесконечную вереницу молодых адвокатов, молодых земских деятелей, молодых бюрократов, молодых фельетонистов (они же, по нужде, и публицисты), что подозрительность моего друга-мизантропа показалась мне просто смешным парадоксом.	122:132	0:275
бюрократ	NOUN	1918-1990	2	бюрократ-46		Есть нехитрый софизм, дающий охранную грамоту бюрократам, чиновникам, бездарностям, -- это критикуют не их, а принципы соцреализма.	46:56	0:131
бюрократ	NOUN	1918-1990	2	бюрократ-47		Здесь всем захребетникам и бюрократам было так удобно и столь хорошо, что можно было сказать -- для них-то уже создано идеальное общество.	27:37	0:138
бюрократ	NOUN	1682-1916	1	бюрократ-48		И вот тут-то я увидел, как меняет самого лучшего человека атмосфера петербургского бюрократа.	83:92	0:93
бюрократ	NOUN	1682-1916	1	бюрократ-49		Еще до отъезда своего в Петербург он постепенно образовал около себя целое поколение молодых бюрократов, которые отличались тем, что ходили в щегольских пиджаках, целые дни шатались с визитами, очаровывали дам отличным знанием французского диалекта и немилосерднейшим образом лгали.	93:103	0:282
бюрократ	NOUN	1682-1916	1	бюрократ-50		И вы все, остальные милые, добрые Амини, пишите самовластным бюрократам то, чего они заслуживают, и пусть они по количеству ежегодно получаемых писем высчитывают, собравшись, кто из них популярнее и должен быть произведен в следующий высший чин".	61:71	0:246
бюрократ	NOUN	1682-1916	1	бюрократ-51		Немцы, государственники и бюрократы, молено сказать, от природы, опирают свои претензии на своем историческом праве, т. е. на праве завоевания и давности, с одной стороны, а с другой, на мнимом превосходстве своей культуры.	26:35	0:223
бюрократ	NOUN	1682-1916	1	бюрократ-52		И таким образом проходят годы, десятки лет, а настоящих, серьезных соглядатаев не нарождается, как не нарождается и серьезных бюрократов.	126:136	0:137
бюрократ	NOUN	1682-1916	1	бюрократ-53		Горький исторический опыт показывает, что демократы, как скоро получают власть в свои руки, превращаются в тех же бюрократов, на коих прежде столь сильно негодовали, становятся тоже властными распорядителями народной жизни, отрешенными от жизни народной, от духа его и истории, произвольными властителями жизни народной, не только не лучше, но иногда еще и хуже прежних чиновников.	114:124	0:381
бюрократ	NOUN	1682-1916	1	бюрократ-54		Игнатьева Первое имя, которое произносили бюрократы, было имя Островского, стоявшего тогда, если не ошибаюсь, во главе министерства государственных имуществ.	42:51	0:157
бюрократ	NOUN	1682-1916	1	бюрократ-55		Это был смелый, самоуверенный бюрократ, знавший себе цену, но при этом заботливый и доброжелательный к управляемым, с деятельным и деловым умом; во всем и прежде всего он имел в виду государственный интерес, общее благо.	30:38	0:220
бюрократ	NOUN	1682-1916	1	бюрократ-56		Из всех бюрократов, которых я видел в своей жизни, он, пожалуй, был наиболее совершенным.	8:18	0:89
бюрократ	NOUN	1918-1990	2	бюрократ-57		Непременно понадобился самый дурной, закоснелый бюрократ, вдруг ставший либералом.	48:56	0:82
бюрократ	NOUN	1918-1990	2	бюрократ-58		Из словаря бюрократа.)	11:20	0:22
бюрократ	NOUN	1918-1990	2	бюрократ-59		А тут говорят, что бюрократ -- как его -- зодчий и вроде кормилец.	19:27	0:66
