lemma	pos	date	grouping	identifier	description	context	indexes_target_token	indexes_target_sentence
бюрократ	NOUN	1918-1990	2	бюрократ-60		Из средоточия старых придворных бюрократов и молодых заговорщиков я попадал, наконец, в единственную славянскую страну, где национальный и политический конфликт обещал разрешиться цивилизованным способом.	32:42	0:204
бюрократ	NOUN	1918-1990	2	бюрократ-61		Автор заключал свою заметку опасениями, что его смелые в научном отношении мысли могут быть превратно истолкованы консерваторами и бюрократами, и писал, что именно поэтому он пока не может открыть своего имени широкой читающей публике.	131:142	0:235
бюрократ	NOUN	1918-1990	2	бюрократ-62		К кому пойдет он со своей крестьянской душой, где отведет душу, "ругнет бюрократов", но правды добьется Обязательно добьется правды, ибо правда у нас у всех одна.	72:82	0:162
бюрократ	NOUN	1918-1990	2	бюрократ-63		-- Уходите, гражданин! -- сказал Корейко голосом геркулесовского бюрократа.	65:74	0:75
бюрократ	NOUN	1682-1916	1	бюрократ-64		Как я уже говорил, Император Александр III был такой человек, что всякий, кто имел счастье к нему приблизиться -- не мог не преклоняться перед этим великим Царем, но я не ожидал, что бы этот сухой бюрократ Гирс был так к нему привязан.	197:205	0:235
бюрократ	NOUN	1682-1916	1	бюрократ-65		Затем, обрисовывая идеал образцового бюрократа, в дружининском стиле, он в то же время облекает созданный им тип в одежду патриархальной простоты и патриархальных добродетелей.	37:46	0:176
бюрократ	NOUN	1682-1916	1	бюрократ-66		Матвей Ильич отзывался с большим уважением о Гизо и старался внушить всем и каждому, что он не принадлежит к числу рутинеров и отсталых бюрократов, что он не оставляет без внимания ни одного важного проявления общественной жизни.	136:146	0:229
бюрократ	NOUN	1682-1916	1	бюрократ-67		Меня это удивило, потому что я никак не мог себе представить, чтобы такой, по-видимому, сухой бюрократ, такой сухарь, мог бы так привязаться к человеку, как он был привязан к Императору Александру III.	94:102	0:201
бюрократ	NOUN	1918-1990	2	бюрократ-68		Меньше всего я могла себе представить, что эту страстно вымечтанную свободу мы будем получать из рук все того же (выражаясь по-нынешнему) "истеблишмента", будем стоять за этой свободой в огромных очередях, захлебываться в потоке казенных бумаг, лениво составляемых все теми же бюрократами, в лучшем случае равнодушными, в худшем -- еле скрывающими свое недовольство этими непредвиденными эксцентричными реформами.	277:288	0:413
бюрократ	NOUN	1918-1990	2	бюрократ-69		Свалился, конечно, бюрократ со своего венского стула.	19:27	0:53
бюрократ	NOUN	1682-1916	1	бюрократ-70		Народ отвергает аппаратный деготь, который бюрократы пытаются залить вместо горючего в двигатели перестройки.	43:52	0:109
бюрократ	NOUN	1918-1990	2	бюрократ-71		Мысль остепенялась, да и сам бюрократ смотрел осанистее, умнее.	29:37	0:63
бюрократ	NOUN	1682-1916	1	бюрократ-72		Нельзя допустить, чтобы это дело потонуло в бумажной волоките по вине равнодушных людей и бюрократов".	90:100	0:102
бюрократ	NOUN	1918-1990	2	бюрократ-73		Что-то говорило ему, что встреча с этим прилизанным бюрократом, каким он мысленно представлял его себе, не кончится добром.	52:62	0:123
бюрократ	NOUN	1918-1990	2	бюрократ-74		Необходимо победить бюрократов, ибо бюрократы -- это босховский корабль дураков!	20:30	0:80
бюрократ	NOUN	1918-1990	2	бюрократ-75		Я думаю, что у нас в ЦК в самом деле бюрократы и формалисты, а не революционеры.	37:46	0:80
бюрократ	NOUN	1682-1916	1	бюрократ-76		Но в самом департаменте то, что я не был назначен директором, произвело большую сенсацию, и вокруг меня началось то неуловимое чиновничье "играй назад", которое испытывал всякий бюрократ, впавший в немилость.	178:186	0:208
бюрократ	NOUN	1682-1916	1	бюрократ-77		Тут и купец-негоциант, и веский бюрократ-чиновник, и артист, и аферист, но более всего кинутся вам в глаза титулованные фамилии разных аристократов, аристократиков, генералов и генераликов, и вообще имена люда, более или менее крупного.	32:48	0:236
бюрократ	NOUN	1918-1990	2	бюрократ-78		Но даже на этом внушительном фоне конкретному заявителю, попавшему в пресловутый треугольник бюрократов, ничуть не легче от сознания собственной печальной исключительности.	93:103	0:172
бюрократ	NOUN	1918-1990	2	бюрократ-79		Станиславского, "театральное дело в те времена находилось, с одной стороны, в руках буфетчиков, а о другой, -- в руках бюрократов".	119:129	0:131
бюрократ	NOUN	1918-1990	2	бюрократ-80		Но когда я в восьми фельетонах "Последних новостей" извлек оттуда документальные данные для этого обвинительного акта, аккуратный и добросовестный бюрократ, верный служитель неограниченной монархии, был как будто удивлен и недоволен: он вовсе не хотел этого!	147:155	0:258
бюрократ	NOUN	1918-1990	2	бюрократ-81		как их, бюрократов.	8:18	0:19
бюрократ	NOUN	1918-1990	2	бюрократ-82		Но эти поспешные утверждения испуганного бюрократа свидетельствовали о возбужденной думскими заявлениями тревоге.	41:50	0:113
бюрократ	NOUN	1918-1990	2	бюрократ-83		Один даже кричал при мне: "Требую, я требую, чтобы мне выплатили гонорар за все, что я не смог опубликовать по вине бюрократов в застойные годы!"), эти разговоры поражают какой-то своей провиденциальной неметкостью.	116:126	0:215
бюрократ	NOUN	1682-1916	1	бюрократ-84		Одним словом, получалось, что бюрократов не держим и не собирались держать, а витязей почему же, витязей, пожалуйста.	30:40	0:117
бюрократ	NOUN	1918-1990	2	бюрократ-85		А ежели он был из бюрократов, то непременно -- "Русский архив".	18:28	0:63
бюрократ	NOUN	1682-1916	1	бюрократ-86		Он обращается к своему бюрократу со словами: "Будь патриархом!" -- и так далее.	23:32	0:79
бюрократ	NOUN	1682-1916	1	бюрократ-87		Коли хочешь, уступлю еще и бюрократов.	27:37	0:38
бюрократ	NOUN	1682-1916	1	бюрократ-88		Перевощиков был тип сухого, безжизненного, скрытного или, по крайней мере, ничего не выражающего бюрократа; самая походка его, плавная, равномерная и как бы предусмотренная, выражала характер идущего.	97:106	0:200
бюрократ	NOUN	1682-1916	1	бюрократ-89		Он не обвиняет меня в неблагонамеренности, а только дает слегка почувствовать, что был, дескать, на свете француз Бабёф и русский полковник Скалозуб, что бывают заблуждения, проистекающие из увлечения "направлением известной школы реформаторов, желающих во что бы ни стало благодетельствовать низшим классам" и т. д. (вот оно, истинное-то значение слова "бюрократ"!).	355:363	0:367
бюрократ	NOUN	1682-1916	1	бюрократ-90		По всей вероятности, и г. Ржевский разумеет это дело точно таким же образом, но ему было нужно слово "бюрократ", и нужно совсем для других целей.	102:110	0:145
бюрократ	NOUN	1682-1916	1	бюрократ-91		Пока либералы жужжали о "проявлении общественного самосознания" и ликовали по поводу "взятия Бастилии", бюрократы и всякого сорта "друзья порядка" вырабатывали себе однообразный взгляд на дело и соответственную "ligne de conduite".	104:113	0:231
бюрократ	NOUN	1918-1990	2	бюрократ-92		Поэтому-то так называемый, всеми злоумышленниками и глупцами поносимый бюрократ есть как раз зодчий грядущего членораздельного социалистического мира.	71:79	0:150
бюрократ	NOUN	1918-1990	2	бюрократ-93		С каждым годом вас становится все больше, и вы, как верные сторожевые псы, охраняете напуганного на всю жизнь бюрократа от возможных неприятностей.	110:119	0:147
бюрократ	NOUN	1682-1916	1	бюрократ-94		Право "первой ночи" бюрократов так и останется их правом.	20:30	0:57
бюрократ	NOUN	1918-1990	2	бюрократ-95		Нынче довольно много развелось таких бюрократов.	37:47	0:48
бюрократ	NOUN	1682-1916	1	бюрократ-96		Ржевский обносит меня именем "бюрократа".	30:39	0:41
бюрократ	NOUN	1682-1916	1	бюрократ-97		Кто же таков этот Илья Ильич С одной стороны, это пропагандист либерализма, ревнитель свободы, с другой -- это отчасти департаментский сторож, отчасти бюрократ чичеринской школы, отчасти один из тех дрянных Робеспьериков, сведения о которых можно почерпать в исторических анекдотах, лихо рассказываемых гг.	151:159	0:306
бюрократ	NOUN	1682-1916	1	бюрократ-98		Россия бьется теперь двумя сердцами: одно сердце -- сердце бюрократа и дворянина, рассылающее по всему телу народа ядовитые соки старческой злобы, своекорыстного страха, безграмотной и бессмысленной ненависти.	59:68	0:209
бюрократ	NOUN	1682-1916	1	бюрократ-99		Телефон (от нашего петерб. корреспондента) Бюрократы на отдыхе Вслед за уехавшим в отпуск П.А. Столыпиным потянулись на отдых и его сотрудники.	43:52	0:143
бюрократ	NOUN	1682-1916	1	бюрократ-100		Сейчас все грехи списывают на мифического бюрократа, как будто бюрократ -- это какая-то автономная каста злоумышленников, десантировавшая к нам с Марса.	42:51	0:152
бюрократ	NOUN	1918-1990	2	бюрократ-101		Я также обратил внимание на тот замечательный внимательно-умный взгляд, с которым он слушал обращенные к нему слова своего министра, и потом, в беседах с ним с глазу на глаз, этот же внимательный слушающий взгляд, столь редкий на лице наших бюрократов, я видел обращенным ко мне.	241:251	0:279
бюрократ	NOUN	1918-1990	2	бюрократ-102		Совсем странно: какие дела у Белы с ЦК, о которых не знал бы он, её муж Как ни торопился Мутный отыскать ключ от дачи, внезапно возникшее любопытство взяло верх: взгляд с привычной лёгкостью бюрократа побежал по неразборчивым строкам, наскоро, видимо, в волнении, набросанным его женой.	191:200	0:286
бюрократ	NOUN	1918-1990	2	бюрократ-103		Так, совсем рядом, за спиной, обсуждалось грядущее за победой житье, останутся ли там глупцы да бюрократы -- казенные сердца! -- и прежде всего как обезопаситься при коммунизме от природной жадности людской, чтобы каждый ложку свою в общий котел запускал в очередь, по совести, а не загребал бы вчетверо да про запас.	96:105	0:317
бюрократ	NOUN	1682-1916	1	бюрократ-104		Страшно, если бюрократ захватывает ведущие позиции в педагогике, в книгоиздательстве, тогда появляются дутые, неинтересные произведения, выходят ученики без знаний.	14:22	0:164
бюрократ	NOUN	1918-1990	2	бюрократ-105		Ужели, например, гоголевский губернатор, отлично вышивающий по канве, может претендовать на название бюрократа Ужели этот добродушный человек когда-либо помышлял о каких-то государственных целях, преследуемых бюрократией Нет, воля ваша, это совсем не бюрократ; это просто патриарх, отец семейства, беседующий с пасомым им стадом в халате, запросто, и только в указанные дни натягивающий на себя досадный мундир.	101:110	0:411
бюрократ	NOUN	1918-1990	2	бюрократ-106		Теперь, наряду со многим, что было когда-то тайным, становится явным и то, что ощущение глубокого неблагополучия, вулканичности политической подпочвы и неуверенности в ближайшем будущем не было чуждо самым неподатливым бюрократам, самым непримиримым врагам революционеров.	219:229	0:272
бюрократ	NOUN	1918-1990	2	бюрократ-107		Теперь я вижу, что Лузгин прав: Ермасов чинуша и бюрократ.	49:57	0:58
бюрократ	NOUN	1918-1990	2	бюрократ-108		Щедрин, будучи по своему прошлому сам бюрократ, был верным выразителем этого настроения.	38:46	0:88
бюрократ	NOUN	1918-1990	2	бюрократ-109		Таким образом, между творчеством рабочей массы и культурной средой стоит неизвестный тем и другим бюрократ (а впрочем, бюрократ в другом плане есть детище диктатуры).	98:106	0:166
бюрократ	NOUN	1682-1916	1	бюрократ-110		Эмбер собирал, как хороший журналист, материал из всех упреков, которые расточали собеседники и по адресу Жоффра, окружившего себя бюрократами в военных мундирах, и Альбера Тома, раздавшего тепленькие места своим политическим друзьям, вплоть до учителей арифметики, решавших задачи по металлургии.	131:142	0:297
бюрократ	NOUN	1918-1990	2	бюрократ-111		И что всего замечательнее, бюрократы не только не протестуют, но, напротив того, понуривают головы и поджимают хвосты, как бы говоря: "Что с нас взять! известно, мы народ отпетый!" Удостоверяются ли они, что время постепенно ощипывает их, провидят ли, что история, в деле ощипыванья, никогда не останавливается на половине пути, но всегда покажет сначала цветочки, а потом уже ягоды и плоды Вообще вопросов возникает множество.	27:36	0:427
бюрократ	NOUN	1682-1916	1	бюрократ-112		Этим "кто-то" если кто и станет, то как раз бюрократ, который будет стричь купоны с того роста производства, который он выжмет из рабочих.	44:52	0:138
бюрократ	NOUN	1918-1990	2	бюрократ-113		Г. Чубинский является графом, помещиком и благонадежным бюрократом, зовут его Вовочкой. неизвестный.	56:66	0:100
бюрократ	NOUN	1918-1990	2	бюрократ-114		Это была продолжительная и бесплодная борьба, в которой бюрократы из Комитета искусств настаивали на своем, свято соблюдая свой дутый "престиж".	56:65	0:144
бюрократ	NOUN	1918-1990	2	бюрократ-115		И на 458-й снова четко и недвусмысленно: "...при социализме должностные лица перестают быть "бюрократами", быть "чиновниками".	93:104	0:126
бюрократ	NOUN	1682-1916	1	бюрократ-116		Этот отец -- знаменитый бюрократ, реакционный деятель, ради убийства которого герой и поступил на службу к сыну старика, тоже бюрократу, но пока что помельче.	24:32	0:158
бюрократ	NOUN	1918-1990	2	бюрократ-117		Словом сказать, настоящих, "отпетых" бюрократов, которые не прощают, очень мало, да и те вынуждены вести уединенную жизнь.	37:47	0:122
бюрократ	NOUN	1682-1916	1	бюрократ-118		Я, мол, специалист по дамским прическам, а мне квартиры бюрократы не дают.	56:65	0:74
бюрократ	NOUN	1918-1990	2	бюрократ-119		Решение князя Меньшикова относительно груза взволновало комиссариатских чиновников и содержателей магазинов; они старались делать мне на каждом шагу всевозможные затруднения, но в этом деле приняли участие почтенные адмиралы, генерал-интендант Васильев, главный командир кронштадтского порта Беллингсгаузен и начальник штаба Васильев; они остановили эту бюрократическую бурю и, в конце концов, довели моих бюрократов до того, что они начали усердно хлопотать, чтобы как можно скорее спровадить меня из Кронштадта.	354:369	0:513
