lemma	pos	date	grouping	identifier	description	context	indexes_target_token	indexes_target_sentence
овес	NOUN	1918-1990	2	овес-0		"Иль гиганте" поднял сложенные руки над головой, потом надел роскошный, как у куртизанки, шелковый халат, нырнул под веревки ринга и степенно отправился переодеваться, отправился походкой старой работящей лошади, возвращающейся в конюшню, чтобы засунуть свою длинную морду в торбу с овсом.	44:45	0:289
овес	NOUN	1918-1990	2	овес-1		Из растительных продуктов для подагриков вредны овес, горох, бобы, чечевица, каштаны, спаржа, шпинат, цветная капуста, грибы.	48:52	0:125
овес	NOUN	1682-1916	1	овес-2		"У меня, -- говорит, -- тогда овса не хватит, если я полностью буду выдавать".	30:34	0:78
овес	NOUN	1918-1990	2	овес-3		Лошадей привязал кучер к деревьям, в недальнем расстоянии, и задал им овса, которым запасся на дорогу; потом перескочил по камням через речку, пробрался сквозь рощу, в которой, сказали мы, терялась по косогору дорога в Менцен, прополз по обнаженной высоте за крестом и у мрачной ограды соснового леса, к стороне Мариенбурга, вскарабкавшись на дерево, которого вершина была обожжена молниею, привязал к нему красный лоскут, неприметный с холма, где были наши путешественники, но видный вкось на мызе.	11:12	0:499
овес	NOUN	1918-1990	2	овес-4		) обыкновенно с большим усердием потчивают путешественника сеном и овсом, как будто бы он был почтовая лошадь".	2:13	0:111
овес	NOUN	1918-1990	2	овес-5		Конь тихо бил ногой и мерно жевал овес.	34:38	0:39
овес	NOUN	1918-1990	2	овес-6		-- Овес бы поберегли.	3:7	0:21
овес	NOUN	1918-1990	2	овес-7		Ну, я, как куль с овсом, упаду, и все поплывет перед глазами.	16:17	0:61
овес	NOUN	1918-1990	2	овес-8		-- Овес есть Гаврила трудно двинулся от крыльца, подавленный виденным, не мог совладать с онемевшим языком.	3:7	0:107
овес	NOUN	1918-1990	2	овес-9		Говорит, что если в Августе закупить овес и сено, то содержание лошади обойдется 20 р. в месяц.	37:41	0:95
овес	NOUN	1682-1916	1	овес-10		-- А чем же они промышляют -- Чем овсом да репой торгуют; капусту еще садят.	34:39	0:76
овес	NOUN	1682-1916	1	овес-11		В прошлом 1815 году посеяно было разного рода хлеба, как-то: ржи, пшеницы, кукурузы, проса, ячменю, овса и гороха 19.939 четвертей, а уродилось 70.092 четверти.	100:104	0:160
овес	NOUN	1682-1916	1	овес-12		-- И овес есть -- Авжеж есть.	5:9	0:29
овес	NOUN	1682-1916	1	овес-13		"Дед" -- хороший хозяин, знает все приметы, и его мнение всегда уважается на совете "стариков", который решает, когда сеять коноплю, овес, рожь и лен: у крестьян всегда бывает предварительное совещание, когда начать сев, особенно конопли, которую сеют все за раз, и как решат старики, так и делается.	133:137	0:300
овес	NOUN	1682-1916	1	овес-14		-- Не могу ли я, голубчик, купить у вас четвертей пять овса Мне продают наши мужички овес, да уж больно плохой.	85:89	0:111
овес	NOUN	1682-1916	1	овес-15		Около Воздвиженья священник ездит по приходу в телеге и собирает новую рожь и овес.	78:82	0:83
овес	NOUN	1682-1916	1	овес-16		-- Ну, овса, -- сказали парашкинцы.	7:11	0:35
овес	NOUN	1682-1916	1	овес-17		Тысяча шестьсот заключенных, содержащихся в ней, изготовляют железные кровати, рамы для картин, зеркала, меры, бархат, полотно, дамские корсеты, мелкие вещицы из перламутра, деревянные башмаки и вместе с тем возделывают несколько пшеницы, овса и овощей.	42:43	0:253
овес	NOUN	1918-1990	2	овес-18		-- Овсом кормлю, а вот не поправляется.	3:8	0:39
овес	NOUN	1918-1990	2	овес-19		Завязался нудный спор, в котором часто упоминались цены на овес и ключ от квартиры, где деньги лежат.	59:63	0:101
овес	NOUN	1918-1990	2	овес-20		-- Погоди, -- отвечаю, -- будем овес сеять, и поглядишь.	32:36	0:56
овес	NOUN	1918-1990	2	овес-21		Кок -- негр много уже лет ходил по морям на кораблях, развешивая по утрам овес для порича, соленую баранину для бекена, варенье из апельсинных корок, у него давно атрофировалось понятие свежего, тухлого, соленого, сладкого и горького, -- он лежал на нижней койке, под французом, и француз безразлично слушал, как рыгает негр, как бесповоротно навсегда испорчен желудок кока, точно желудок подступал к самому горлу и выворачивался в рыготе в рот, в смраде несваренного мяса.	74:78	0:473
овес	NOUN	1682-1916	1	овес-22		.. подожди овса это лучше.	11:15	0:26
овес	NOUN	1682-1916	1	овес-23		-- Да я бегу по вашему приказу, чтоб клюшника послать, овса добыть, овса нетути.	55:59	0:80
овес	NOUN	1682-1916	1	овес-24		Овес вчерашний день кончили, -- отвечала та.	0:4	0:44
овес	NOUN	1682-1916	1	овес-25		О том, как велик был этот изъян, можно судить по следующему расчету: пуд сена лошадям (овес был свой) -- 20 коп.; завтрак кучеру и лакею -- 30 коп.; самовар и кринка молока -- 30 коп.	87:91	0:183
овес	NOUN	1918-1990	2	овес-26		А без хомута и овса не дадут.	15:19	0:29
овес	NOUN	1918-1990	2	овес-27		На кафедральном соборе глухо ворковали голуби, за площадью на Житомирской улице, отнимая у проезжего крестьянина мешок с овсом, громко ругались два петлюровца.	121:126	0:159
овес	NOUN	1682-1916	1	овес-28		Болезнь Ромки Он вырос на объемистом корме, ел много овсянки (ошпаривается кипятком растертый на мельнице овес).	106:110	0:112
овес	NOUN	1918-1990	2	овес-29		-- Ну, мы тебе дадим восемь гривен за четверть; давай овса.	54:58	0:59
овес	NOUN	1682-1916	1	овес-30		В 1933 году, когда Татария за успехи в сельском хозяйстве была награждена орденам Ленина, портреты "первого бригадира Татарстана" носили с песнями по городу, а на сельскохозяйственной выставке эти портреты были изготовлены из различных злаков -- от овса до чечевицы.	37:38	0:266
овес	NOUN	1918-1990	2	овес-31		А кто же станет возиться С подскребками, когда гречиха и овес стоят и осыпаются в поле Впрочем, великое спасибо и за то, что сделали конные грабли.	57:61	0:147
овес	NOUN	1682-1916	1	овес-32		В двадцати шагах от нас шелестели овсы, на дальних лугах бродили коровы, и уклон в сельскохозяйственную тематику представлялся вполне извинительным.	34:38	0:148
овес	NOUN	1918-1990	2	овес-33		Речь зашла об овсе и сене.	14:18	0:26
овес	NOUN	1682-1916	1	овес-34		В конце июля наступили теплые дни -- овес выкинул метелку, мелькнула надежда на семя.	37:41	0:85
овес	NOUN	1918-1990	2	овес-35		Врезавшись в полосу овса, стоит телега.	20:24	0:39
овес	NOUN	1682-1916	1	овес-36		В мае, когда зацвели ландыши и в лесу заголубели фиалки, а в полях закудрявился зелено-бледный овес и поднялась волнистая озимь, вернулся из японского плена старший сын Александр.	95:99	0:179
овес	NOUN	1918-1990	2	овес-37		Не распрягая лошади, он поставил ее к яслям, под навес, взял у дворника сена и овса, всыпал овес в торбу, а сам прилег в сани, прислушиваясь к возне и говору на замолкавшем дворе.	92:96	0:179
овес	NOUN	1918-1990	2	овес-38		В поле еще свежо дуло, жнивья были дики и рыжи, а там, где пахали, -- уже пахали под овес, -- маслянисто, с первобытной мощью чернели взметы.	85:89	0:141
овес	NOUN	1918-1990	2	овес-39		И ему указали голову того, который родился на мызе в лесистой Латвии, тискал и мял добродушную серую старую кошку Фиуль, слушал, как заливается в желтой клетке ощипанный, но бодрый Фогель Ганс, видел в один страшный день, как жгли зимою их мызу и гнали их нагайками прочь в бездорожный снег; слышал в одну темную весеннюю ночь, как брат Ян говорил о смерти брата Карла; учился в тихом Тальсене и ходил в школу мимо русской вывески: "Продажа овса, дехтя, керосина и продчих лакомств".	313:321	0:483
овес	NOUN	1682-1916	1	овес-40		В совхозе 1-й Индустриальный сего числа рабочим выдано хлеба по 100 гр. на день та варили борщ а в перет давали хлеба по 800 гр. а варили овес словом кормлют как свиней да лошадей.	138:142	0:180
овес	NOUN	1918-1990	2	овес-41		Внутренние известия Иркутский губернатор издал объявление, в котором приглашает жителей спокойно относиться к обеспечению себя предметами потребления, а г.г. торговцев предупреждает, что перекупщики продуктов первой необходимости, как например: мука, овес, сало, будут подвергаться строгому взысканию.	251:255	0:301
овес	NOUN	1682-1916	1	овес-42		В той же статье показано, что машина эта в один час обмолачивает 80 снопов озимого хлеба, а овса больше, из сего видно, что у г-на Домбаля один четверик зерна получают почти из шести снопов.	41:42	0:190
овес	NOUN	1682-1916	1	овес-43		как приедешь домой, уж все велишь лишний гарнчик. засыпать, а овес, знаешь сам, в прошлое лето не уродился у меня.	62:66	0:114
овес	NOUN	1682-1916	1	овес-44		В три часа утра я гладила и целовала доброго коня своего, который, не обращая на это внимания, ел овес, купленный на последние мои два марка; Ильинский слал; работник мазал колеса нашего кабриолета, и хозяйка спрашивала меня из окна: "Гер официр, волен зи кафе" Все эти действия были прерваны поспешным приходом гневного градоначальника.	98:102	0:337
овес	NOUN	1682-1916	1	овес-45		Мы, говорят, все по душам хлеб отдавали! чем наш хлеб хуже минаевского! что ни на есть лучший хлеб отсыпали, фальши не было! какой господь уродил, такой и отсыпали! коли хлеб плох, тогда было смотреть, на что же ты десятский! ты, говорят, с двух душ мерку ячменя отдавал, Ипат с души мерку овса, Силай с Ванькой с трех душ мерку ржи ссыпали, за что ж тебе награда Все равно давали, дели восемь рублей по душам.	290:294	0:410
овес	NOUN	1682-1916	1	овес-46		Вдоль прясла привязаны казацкие лошади, они хрупали овес, отфыркивались, всхрапывали.	52:56	0:85
овес	NOUN	1918-1990	2	овес-47		Я совершенно незнаком был с этого рода охотой и потому приказал Калиуктису (фамилия литвина) поставить на открытом месте пучок намолоченного овса.	2:12	0:146
овес	NOUN	1682-1916	1	овес-48		Всего посеяно 26 га пшеницы, ярицы 8 га, овса 12, ячменя 2, подсолнуха 2, картофеля 4 и разных культур 3 га.	41:45	0:108
овес	NOUN	1918-1990	2	овес-49		А бедный секретарь стоял перед дверью в позе кающегося грешника, а la Генрих в Каноссе, и глядел на дверь, как лошадь, которая чует близко присутствие овса, но не видит его.	151:155	0:173
овес	NOUN	1682-1916	1	овес-50		Господского овса тоже оставалось.	12:16	0:33
овес	NOUN	1682-1916	1	овес-51		Печатание билетов, афиш, расклейка их, бумага, конверты 99 За вещи, купленный для лотереи-аллегри и в бочки с овсом 157 р. 02 к., Жетоны, бутоньерки, ленты 71 р. 28 к., Драпировка павильонов, эстрад, покупка материи, гвоздей 102 р. 11 к.	47:55	0:237
овес	NOUN	1918-1990	2	овес-52		До сих пор мял овсы, пугал женщин, ходивших на покосы, а прошлой ночью заломал годовалого телка.	15:19	0:96
овес	NOUN	1918-1990	2	овес-53		-- Овёс!	3:7	0:8
овес	NOUN	1918-1990	2	овес-54		Дожинают овес.	9:13	0:14
овес	NOUN	1918-1990	2	овес-55		Дед коня уже овсом накормил, оседлал.	13:18	0:37
овес	NOUN	1682-1916	1	овес-56		Еремей, Потапыч и Федя спали сном праведников, кони похрустывали овсом, костёр совсем догорал, Валерий Михайлович подбросил в него свежих сучьев, пурга выла по-прежнему, и выключатель Валерия Михайловича по-прежнему отказывался работать.	65:70	0:237
овес	NOUN	1918-1990	2	овес-57		Ты что везешь продавать-то -- Семя льняного мер двенадцать да куль овса.	67:71	0:72
овес	NOUN	1682-1916	1	овес-58		К вечеру -- в Гржималовку (севернее Чуровице) -- разоренная деревня, достали овес, беспрерывный дождь, короткая дорога в штаб для моих туфель непроходима, мучительное путешествие, позиция надвигается, пил великолепный чай, горячо, хозяйка притворилась сначала больной, деревня все время находилась в сфере боев за переправу.	77:81	0:324
овес	NOUN	1918-1990	2	овес-59		Другие мужики, прослышав про неудачу товарищей, приезжали в город с хлебом, овсом, сеном, сбивая цену друг другу до цены ниже прежней.	23:24	0:134
овес	NOUN	1682-1916	1	овес-60		Конюхи на конюшенном дворе принимают лучшего овса и ссыпают его в свои закрома, заботятся о привозе сена из лучшего стожка и скидывают его на конюшню, чтобы все это задать гостиным лошадям по приезде их, дабы люди после не осуждали господ: такие-де хозяева, что о лошадях и не позаботились.	45:49	0:290
овес	NOUN	1682-1916	1	овес-61		Позавтракав таким образом, иду осматривать свою паству, размещенную по конюшням; при мне ведут их на водопой; по веселым и бодрым прыжкам их вижу я, что уланы мои следуют примеру своего начальника: овса не крадут, не продают, но отдают весь этим прекрасным и послушным животным; вижу, как формы их, прежде искаженные худобою, принимают свою красивость, полнеют, шерсть прилегает, лоснится, глаза горят, уши, едва было не повисшие, начинают быстро двигаться и уставляться вперед; погладив и поласкав красивейших из них, приказываю оседлать ту, которая веселее прыгает, и еду гулять, куда завлечет меня любопытство или пленительный вид.	236:240	0:634
овес	NOUN	1918-1990	2	овес-62		Корреспондент: Сергей Федорович, я помню кадр в "Судьбе человека", когда Андрей Соколов лежит, разметавшись, на поле, в овсах.	28:29	0:126
овес	NOUN	1918-1990	2	овес-63		Они жили, диточка, так трудно, шо посеют мешок пшеницы и меру овса -- и того некогда убрать: хвать за серп, а тут с орудия: гу-гу-у.	62:66	0:132
овес	NOUN	1682-1916	1	овес-64		Мы только дадим съесть кадушку овса лошадям и тотчас поедем!	31:35	0:60
овес	NOUN	1682-1916	1	овес-65		Эти сельскохозяйственные мысли были, как птицы, вспугнуты неожиданно шарахнувшейся лошадью: под самыми ногами промелькнул большой заяц, легкими прыжками ускакавший в овес.	166:170	0:171
овес	NOUN	1918-1990	2	овес-66		На уборку идем -- лошадь сытая стоит, ее и чистить не надо, с овса и так блестит.	25:26	0:81
овес	NOUN	1918-1990	2	овес-67		Телеги ушли, протянул мальчишка: -- Дядинка-а, овса надо Остался один старик, дергавший гвозди.	47:51	0:95
овес	NOUN	1918-1990	2	овес-68		Начинают овес.	9:13	0:14
овес	NOUN	1918-1990	2	овес-69		Трава вскоре кончилась, и мальчишки попали в частые всходы овса.	59:63	0:64
овес	NOUN	1682-1916	1	овес-70		Немцы требуют от Антверпена доставки ежедневно 854 пуда хлеба, 1608 пуд. картофеля, 487 пуд. свежего и 183 пуда копченого мяса, 122 пуда сала, 7500 бутылок вина, 25.000 папирос, 85.000 сигар, 1220 пудов овса, табаку и много других продуктов.	203:207	0:241
овес	NOUN	1682-1916	1	овес-71		Выгоды сельских жителей от торга с Китайцами суть те, что многие будут питаться извозом и от проезда обозов, продавая извозчикам пищу, овес, сено.	135:139	0:146
овес	NOUN	1682-1916	1	овес-72		Ни сена, ни овса никто не давал.	12:16	0:32
овес	NOUN	1918-1990	2	овес-73		Войдешь в такую лавчонку, право, даже смотреть нечего: десяток мешков с мукой, в ларях на донышке овес, просо, горох, какая-нибудь крупа -- кажется, дюжины мышей не накормишь.	98:102	0:175
овес	NOUN	1682-1916	1	овес-74		Ну, чтобы было не совсем уж против бога, чтобы не обижать переселенца, кинут ему на телегу хорошую охапку сена и овса сколько-нибудь, сунут в руку буханку хлеба, если переселенец с ребятишками -- прикажут первой попавшейся бабе напоить ребятишек молоком, сколько выпьют, и -- Христос с тобой, не поминай, милай, лихом!	18:24	0:318
овес	NOUN	1918-1990	2	овес-75		Верно, ему уж до жадности захотелось тех трех рублей за четверть овса, которые, по словам Сигнея, охотно платят на базаре.	65:69	0:122
овес	NOUN	1682-1916	1	овес-76		Овса посеяно 8 гa, ячменя -- 1 га, подсолнуха 3 га, картофеля 10 га, разных культур -- 2 га и бахчей -- l гa.	0:4	0:109
овес	NOUN	1918-1990	2	овес-77		За овес наш дают 6 рублей 50 копеек; я думаю, что надо продать, потому что рискуешь вовсе не продать и потому что большая часть симбирских и оренбургских помещиков продали еще дешевле.	3:7	0:184
овес	NOUN	1918-1990	2	овес-78		Овсы аквамаринные.	0:4	0:18
овес	NOUN	1918-1990	2	овес-79		Дать овса.	5:9	0:10
овес	NOUN	1682-1916	1	овес-80		Одна изъ нихъ была сплетена изъ соломки чернаго и желтаго цвта; подбой былъ изъ палеваго гласе, а букетъ на поляхъ состоялъ изъ желтаго овса, корни котораго исчезали подъ бантами черныхъ бархатныхъ лентъ, которыми отдлана шляпа.	136:140	0:228
