lemma	pos	date	grouping	identifier	description	context	indexes_target_token	indexes_target_sentence
овес	NOUN	1682-1916	1	овес-81		-- А наш-то брат хорош, по-твоему -- с презрением перебил его кузнец и так осрамил "нашего брата", в таком потоке сквернословия потопил его, что Федотка не нашелся, что сказать, вздохнул и пошел засыпать овес лошадям.	204:208	0:217
овес	NOUN	1918-1990	2	овес-82		Однажды священник Овсов действовал на исповеди по прямому поручению полиции, которая никак не могла дознаться, кто же скинул из окна третьего этажа большое сосновое полено на проходившего внизу по тротуару инспектора Успенского.	18:23	0:228
овес	NOUN	1918-1990	2	овес-83		Эх, взыграл бы я, как сытый конь на овсе!	36:40	0:41
овес	NOUN	1682-1916	1	овес-84		Они проехали длинную Николаевку, где висели мохрами соломенные щиты и казаки вели лошадей на водопой и загородили всю улицу, проехали опрятную деревню Солози и Новую, и потянулись справа и слева мокрые от ночного ливня луга, низкие кустики ивы по ним, чахлые овсы, невысокая рожь, вся синяя от васильков, узкие полоски небогатых посевов.	259:263	0:337
овес	NOUN	1918-1990	2	овес-85		Худощавая лошадь директора гимназии, скромно питаемая пансионским овсом, вдруг почему-то вздумала молодцевато порыть землю ногою и тем ужасно рассмешила длинновязого дуралея, асессорского кучера.	66:71	0:195
овес	NOUN	1918-1990	2	овес-86		Перед смертью старик частенько забредал сюда при закате ради последней жалкой утехи -- погрузить руку по локоть в прохладную пшеницу, колкий овес, жирноватую гречку и щупать, щупать плененные ростки жизней во утоленье той смутной тоски по власти, тишине и бессмертию, какую иные лечат прикосновеньем к злату, святыне или жаркому подневольному телу.	141:145	0:348
овес	NOUN	1918-1990	2	овес-87		Извозчики вообще ленивы и нелюбопытны в отношении всего, кроме цены на овес.	71:75	0:76
овес	NOUN	1682-1916	1	овес-88		Получилась вполне съедобная вещь, так что мы решили этот овес еще использовать зимой.	57:61	0:85
овес	NOUN	1682-1916	1	овес-89		Вдруг из конюшни раздался отрывистый, сиплый, полузадушенный лай: это рыдал Ефим Цыган, скорчившись в углу, где стояли мешки с овсом, где было темно, где никто не мог увидеть Ефима -- его искаженного отчаянием лица.	127:132	0:215
овес	NOUN	1682-1916	1	овес-90		Поход лошади выдержали довольно хорошо, так как в Восточной Пруссии получали корм без всякой нормы: на полях стояло много овса в снопах, а в деревнях, на хуторах были большие запасы прекрасного сена и зернового фуража.	13:14	0:218
овес	NOUN	1918-1990	2	овес-91		-- Нет, я не брешу: помнишь, у овса в Телячьих Выпасках, забыл Ты еще ругал меня в ту пору.	31:35	0:91
овес	NOUN	1682-1916	1	овес-92		При входе сразу же охватывали живительный аромат лошадей, душистость сена и овса, могучий запах дегтя и кожи, дерева колясок и еще целый ряд других запахов, присущих конюшне...	76:80	0:176
овес	NOUN	1918-1990	2	овес-93		Получено от продажи лотерейных билетов безпроигрышной лотереи (бочки с овсом) продажи входных билетов билетов на концерт за проданные оставшаяся от лотереи вещи Оркестр 30 р. -- к.	69:70	0:180
овес	NOUN	1682-1916	1	овес-94		Смолол овса и дал с молоком.	7:11	0:28
овес	NOUN	1918-1990	2	овес-95		А тем временем дружки установили кадки с пшеницей, овсом и ячменем.	23:24	0:67
овес	NOUN	1918-1990	2	овес-96		Среднего, робкого человека, случайно попавшего сюда, били и в хвост и в голову: били по его мещанству, недостаточно изощренному пиджаку, ставя его перед фактом ананасного мороженого или Григория Аветовича Джаншиева в красной рубахе; и потом, напугав изощрением культуры (тут тебе и ананас, и автор "Эпохи великих реформ", и экстравагантная Кувшинникова, и идеи Фурье, и Пугачев, и... аристократка Новикова), -- напугав всем этим, вели к конюшне, где восемнадцатилетняя барышня Танеева в сарафане, ловко впрягая лошадь в телегу, ногой, обутой чуть ли не в сапог, упираясь в оглоблю крепкими, мускулистыми руками, подтягивала веревкой шлею и потом, вскочив в телегу с громчайшим "нооо", размахивая веревкой, неслась в поле: возить овес; после того, как случайно попавший бывал подкузьмлен "аристократическим фурьеризмом", его подкузьмляли тем, что заставляли его либо перепачкаться дегтем, либо доказать свое непригодное барство.	729:733	0:927
овес	NOUN	1918-1990	2	овес-97		Овса в Китае нет, и животных кормят главным образом горохом или бобами.	0:4	0:71
овес	NOUN	1682-1916	1	овес-98		Старик в лесу: "Вы чьи" Овсы-ячмени поспели.	7:8	0:44
овес	NOUN	1918-1990	2	овес-99		В немецкой земле, изрубив солому, намачивают или обдают ее кипятком, и смешав с овсом, дают лошадям, и тем много самого овса сберегают.	26:27	0:135
овес	NOUN	1682-1916	1	овес-100		Старики рассказывали, что в его сапоги вмещалась целая мера овса.	16:17	0:65
овес	NOUN	1682-1916	1	овес-101		Лошадям здесь овса не положено давать, за неимением его, зато травы из-под ног -- сколько хочешь.	14:18	0:97
овес	NOUN	1682-1916	1	овес-102		Староста наш в канаву залез; старостиха в подворотне застряла, благим матом кричит, свою же дворную собаку так запужала, что та с цепи долой, да через плетень, да в лес; а Кузькин отец, Дорофеич, вскочил в овес, присел, да и давай кричать перепелом: "Авось, мол, хоть птицу-то враг, душегубец, пожалеет".	206:210	0:304
овес	NOUN	1682-1916	1	овес-103		Эта любовь выражалась в том, что донской жеребчик был и вычищен лучше и овса получал больше, чем другие казенные лошади Боброва: Ласточка и Черноморец.	72:76	0:151
овес	NOUN	1918-1990	2	овес-104		Там была изображена коричневая лошадиная голова и черными буквами по голубому фону выведено: "Овес и сено".	94:98	0:107
овес	NOUN	1918-1990	2	овес-105		Овес парили в горшке, потом пропускали через мясорубку -- "через машинку", как тогда говорили, -- несколько раз, -- это трудная работа, -- затем протирали через сито -- получалась похлебка из овсяной муки.	0:4	0:205
овес	NOUN	1918-1990	2	овес-106		Уже перестали спрашивать, почем мера овса; а говорили: неужели опять выпустили Наполеона с острова.	37:41	0:99
овес	NOUN	1918-1990	2	овес-107		А вдруг да он сделал крюк, вдруг да выскочит на то самое поле овса.	62:66	0:67
овес	NOUN	1918-1990	2	овес-108		Управляющий мне показывает на овсы: я -- взрываюся: "Эти овсы есть грабеж у крестьян".	30:34	0:86
овес	NOUN	1918-1990	2	овес-109		Зажинают овсы.	9:13	0:14
овес	NOUN	1682-1916	1	овес-110		Что же, можно жить, если бы хозяин еще давал каждый день хоть одну горсточку овса.	77:81	0:82
овес	NOUN	1682-1916	1	овес-111		И овсы вот хороши.	2:6	0:18
овес	NOUN	1682-1916	1	овес-112		Чтобы предупредить эти бедствия, необходимо закупить теперь же в Одессе до 100 тысяч четвертей хлеба и до 30-ти тысяч четвертей овса или ячменя, также круп, водки, соли и прочее.	28:29	0:178
овес	NOUN	1682-1916	1	овес-113		В августе убирали овес; было тихо, тепло, даже душно; много сереньких дней, когда куропатки срываются в кустах из-под ног и чертят воздух острыми крылами; а вечером спокойная луна, лилово-дымчатая, восходит' над полями в меланхолии.	18:22	0:232
овес	NOUN	1682-1916	1	овес-114		Этого я не должен был стерпеть и отвечал: "Николай Угодник овсом не торгует, а вы должны знать, что если нужна наша Русь, то нужны ей и дьяк и священник, ибо их одних мы еще пока от немцев не приняли".	33:40	0:201
овес	NOUN	1682-1916	1	овес-115		Овса для лошадей -- сколько угодно.	0:4	0:35
овес	NOUN	1682-1916	1	овес-116		Я легко решал арифметические задачи с многозначными числами, но столбенел и терялся, если в их условии говорилось, например, о крестьянине, купившем кусок шелковой материи в 427 аршин и 3 вершка по 4 рубля 81 копейке за аршин, из которых 1 аршин 17 вершков он истратил на кафтан, 221 аршин 1 вершок на юбку жены и остаток обменял на овес, приплатив 11 копеек, -- сколько пудов овса он получил, если пуд стоит 53 рубля 20 копеек Я приставал к матери с вопросами, зачем крестьянин шил кафтан из шелка и почему так много пошло на юбку Она старалась убедить меня, что это только так, для трудности, и что крестьянин тут ни при чем, а нужно просто вычесть кафтан и юбку из куска, помножить на стоимость аршина и разделить на стоимость овса, -- но я так не мог, мне мешало лицо крестьянина, хозяина нашей дачи в деревне Загарье, зимой носившего меховую шапку, и я не мог представить себе его жену в такой огромной шелковой юбке.	333:337	0:922
овес	NOUN	1918-1990	2	овес-117		Фрол, ступай принимать овес!	23:27	0:28
овес	NOUN	1682-1916	1	овес-118		Я получу свою уплату за прокат; вы будете владеть прекрасною барынею; а что выиграет он за пот свой Обыкновенную дачу овса Он ведь не употребляет шампанского, и простонародный желудок его не варит и не ценит дорогих яств, за которые двуногие не жалеют ни души, ни тела.	100:112	0:269
овес	NOUN	1682-1916	1	овес-119		Посельщики иные богаты, продают овес и сено.	32:36	0:44
