lemma	pos	date	grouping	identifier	description	context	indexes_target_token	indexes_target_sentence
партиец	NOUN	1991-2017	2	партиец-64		Напомним, что "Единая Россия" в этом году опробовала новую форму взаимодействия с электоратом -- форумы сторонников, на которых собирались наказы населения партийцам.	156:165	0:166
партиец	NOUN	1991-2017	2	партиец-65		Заручившись поддержкой большинства членов Центрального совета (как утверждают оппоненты Березовского, партийцы встали на сторону олигарха небескорыстно), он инициировал исключение из партии Похмелкина и его ближайшего союзника, бывшего депутата Нисневича.	102:110	0:255
партиец	NOUN	1991-2017	2	партиец-66		Но особое возмущение партийцев вызвало то, что деньги, выделяемые центром на поддержку региональных "государственных" СМИ, фактически целиком используются коммунистами для своих пропагандистских целей.	21:30	0:201
партиец	NOUN	1991-2017	2	партиец-67		Но в отличие от многих наших некогда ревностных правоверных партийцев, он не бросился сломя голову менять партбилет на крест, старые идеалы на новые.	60:69	0:149
партиец	NOUN	1991-2017	2	партиец-68		Но президентское "благословение" нового имени ничуть не менее весомо, чем решение самих партийцев.	88:97	0:98
партиец	NOUN	1991-2017	2	партиец-69		Что же до самих партийцев, то из фракции, изначально насчитывавшей 20 человек, в активе "ЯБЛОКА" накануне новой избирательной кампании остается лишь 15.	16:25	0:152
партиец	NOUN	1918-1990	1	партиец-70		Ну, партийцев и этой.	4:13	0:21
партиец	NOUN	1918-1990	1	партиец-71		С такими воззваниями кучки партийцев и разлетелись в разные стороны.	27:36	0:68
партиец	NOUN	1991-2017	2	партиец-72		Однако же вот исчезла, улетучилась куда-то одежда партийца, занимавшая половину шкафа.	50:58	0:86
партиец	NOUN	1991-2017	2	партиец-73		Для путешествия из Москвы в "красную" Рязань партийцы где-то раздобыли два грязных и невероятно старых "Икаруса", на которых, вопреки обыкновению, не было никаких эмблем -- только таблички "Осторожно, дети".	45:53	0:207
партиец	NOUN	1918-1990	1	партиец-74		Они не были партийцами.	12:22	0:23
партиец	NOUN	1918-1990	1	партиец-75		После смерти Ленина Политбюро вынесло постановление, требующее от партийцев, имеющих письма, записки, обращения к ним Ленина, передать их в архив Центрального Комитета, что с 1928 г. фактически было передачей в полное распоряжение Сталина.	66:75	0:239
партиец	NOUN	1918-1990	1	партиец-76		Они стали спорить: какое место занимает пожар в народном психо, к чему он -- к добру или к худу Не успел этот спор завершиться, как пришел молодой партиец в высоких чинах, своего рода "любимец партии", каким некогда был Бухарин, Владлен Кржижановский; да-да, из тех Кржижановских.	147:154	0:280
партиец	NOUN	1991-2017	2	партиец-77		Столь же нелестные отзывы можно было бы привести и о многих других старых партийцах.	74:83	0:84
партиец	NOUN	1991-2017	2	партиец-78		Партийцы-невидимки.	-1:16	0:19
партиец	NOUN	1991-2017	2	партиец-79		По другую сторону сидела примечательная коллекция лиц, доселе не представавшая перед советским народом: некий лощеный юрист, который каждой своей улыбкой как бы приглашал партийцев не хитрить -- все равно, мол, вскроем; рядом с ним какой-то загадочный аннамит, так цокающий языком, что Генка Янаев всякий раз вздрагивал; далее рыцарски независимый негр с отменным плечевым поясом, явно не из "Лумумбы"; потом некий старец сильно еврейской внешности, по слухам, крупнейший голливудский агент, однако взиравший на славян как бы из глубины иудейских веков, и, наконец, двое самых сногсшибательных -- драгоценнейшая простигосподи с ударными маммариями, но в профессорском пенсне, и некий самый главный, крупнее всех богатырь, но не Илья Муромец, а как бы постаревший Тарзан.	171:180	0:770
партиец	NOUN	1918-1990	1	партиец-80		Пока же лидер "ЛР" наставляет своих партийцев по телефону и при помощи телемостов.	36:45	0:82
партиец	NOUN	1991-2017	2	партиец-81		Есть партийцы, есть красногвардейцы, есть случайные.	5:13	0:52
партиец	NOUN	1918-1990	1	партиец-82		Положение и впрямь получалось поганое: и партийцы не больно-то держали его за партийца, и беспартийцы перестали считать своим.	41:49	0:126
партиец	NOUN	1991-2017	2	партиец-83		Судьбу поставленного к позорному столбу решали свои же сослуживцы под особым давлением председателя комиссии по чистке и членов комиссии, кристально чистых партийцев.	156:165	0:166
партиец	NOUN	1991-2017	2	партиец-84		После взятия очередной деревеньки партиец застал Иван Иваныча на покрытом обломками поле.	34:41	0:89
партиец	NOUN	1991-2017	2	партиец-85		Людмиле Путиной, по словам партийцев, "очень понравилось".	27:36	0:58
партиец	NOUN	1918-1990	1	партиец-86		Правда, пока "смотры", устраиваемые в эти недели в кремлевских кабинетах, ничего кроме печали не вызывают: новобранцы нагнетают еще большее уныние, чем партийцы-"патриции" со стажем.	-1:15	0:182
партиец	NOUN	1991-2017	2	партиец-87		Собрались запросто посидеть, потолковать, обсудить обстановку, создавшуюся в губернии в связи с отъездом такой массы ответственных партийцев.	131:140	0:141
партиец	NOUN	1918-1990	1	партиец-88		Предлагаю немедленно выпустить воззвание к трудящемуся крестьянству, кинуть в очаги восстания самых преданных партийцев, чтобы они это воззвание как можно скорее распространили.	110:119	0:177
партиец	NOUN	1918-1990	1	партиец-89		Иногда у меня бывают колебания: а, может, все-таки и среди партийцев есть люди, живущие по заповеди -- "человек человеку -- друг, товарищ и брат".	59:68	0:146
партиец	NOUN	1991-2017	2	партиец-90		Придя в революцию, Александр Александрович верно разглядел "ахиллесову пяту" в характере очень многих партийцев.	102:111	0:112
партиец	NOUN	1991-2017	2	партиец-91		Многочисленные партийцы, которым предстоит отвечать за легитимное шествие своих соратников к победе на думских выборах, озадаченно почесывают затылки.	15:23	0:150
партиец	NOUN	1991-2017	2	партиец-92		Проверка выявила даже партийца, признанного решением суда недееспособным, но при этом имевшего стойкие политические убеждения.	22:30	0:126
партиец	NOUN	1991-2017	2	партиец-93		Из 60 новых руководителей только два человека были без техобразования: Егоров и Каганович, оба видные партийцы.	102:110	0:111
партиец	NOUN	1918-1990	1	партиец-94		Различные партийцы расположились кругом комитета на раннем солнце; многие спали с омертвевшими впадинами глаз, другие говорили что-то и глядели в широту пространства, где было много положено их молодости и силы и где сейчас уже стлался газ тракторов, блестел тес новостроек, шли на работу бригады людей, -- пустоту и скорбь капитализма сменял многолюдный социализм.	10:18	0:365
партиец	NOUN	1918-1990	1	партиец-95		Я лично очень мало знаю его и хочу просить вас, как бывшего партийца, вот о чем.	3:4	0:80
партиец	NOUN	1918-1990	1	партиец-96		Рост национального самосознания у партийцев начнется позже.	34:43	0:59
партиец	NOUN	1991-2017	2	партиец-97		Моего ближайшего сотрудника Георгия Васильевича Бутова, заведовавшего секретариатом Реввоенсовета Республики во все годы гражданской войны, арестовали и содержали в неслыханных условиях, вымогая от этого чистого и скромного человека и безупречного партийца подтверждение заведомо фальшивых, поддельных, подложных обвинений в духе термидорианских амальгам.	248:256	0:355
партиец	NOUN	1918-1990	1	партиец-98		Самгин заметил: о партийцах, о революционной работе она говорит сдержанно, неохотно.	18:27	0:84
партиец	NOUN	1918-1990	1	партиец-99		Оба -- партийцы.	7:15	0:16
партиец	NOUN	1918-1990	1	партиец-100		Самый красный из всех партийцев выразит недовольство системой "дикого капитализма", в резких выражениях осудит деятельность "глубоко антинародного" правительства, помянет недобрым словом отечественных олигархов и полный коварства Запад.	22:31	0:236
партиец	NOUN	1991-2017	2	партиец-101		"Посторонние", т.е. партийцы, не бывшие членами Думы, были допущены в общую залу только на следующий день, в полуденный перерыв.	20:28	0:128
партиец	NOUN	1918-1990	1	партиец-102		Слыл за строгого принципиального партийца.	33:41	0:42
партиец	NOUN	1991-2017	2	партиец-103		Есть и партийцы, председатель тоже человек партийный.	5:6	0:53
партиец	NOUN	1918-1990	1	партиец-104		Среди партийцев немало случаев морального разложения, злоупотребления спиртными напитками, несмотря на "сухой закон" (тогда в стране были еще полностью запрещены производство и продажа спиртных напитков).	6:15	0:204
партиец	NOUN	1918-1990	1	партиец-105		Автомобиль могли иметь только высокостоящие партийцы и так называемые "ответственные работники", то есть люди, формировавшие "привилегированный класс".	44:52	0:151
партиец	NOUN	1991-2017	2	партиец-106		Старые партийцы раздражали его высокомерием, панибратством, упреками в отступлении от ленинских заветов.	7:15	0:104
партиец	NOUN	1991-2017	2	партиец-107		Выявляя и выдвигая перспективных молодых партийцев, можно и нужно рисковать.	8:9	0:76
партиец	NOUN	1918-1990	1	партиец-108		Сюда из Москвы и России, где начинался голод, а в Крыму всего было в изобилии, приехавшие с детьми партийцы, производившие впечатление эмигрантов, образовали два независимых правительства -- центра -- в Севастополе, где власть находилась, кажется, в руках ботаника Михайлова, уч[еника] Палладина, и Симферополе.	5:6	0:311
партиец	NOUN	1918-1990	1	партиец-109		Почти никто из партийцев не понимает по-русски.	15:24	0:47
партиец	NOUN	1918-1990	1	партиец-110		Так сложилось в последние годы, что круг Сашиного общения ограничился партийцами.	70:80	0:81
партиец	NOUN	1991-2017	2	партиец-111		Как и в предыдущем году громадное большинство членов правлений будут крестьяне; число избираемых партийцев имеет тенденцию и повышению.	4:5	0:135
партиец	NOUN	1991-2017	2	партиец-112		Так что на два дня здание правительства Москвы, где проходили мероприятия, стало практически Меккой для партийцев, сторонников и сотен представителей СМИ, приехавших со всей страны.	104:113	0:181
партиец	NOUN	1991-2017	2	партиец-113		Помимо националистов-партийцев правозащитники нашли врага и в своих рядах.	-1:21	0:74
партиец	NOUN	1918-1990	1	партиец-114		У значительной части партийцев с небольшим теоретическим багажом или вовсе без багажа, с небольшим теоретическим кругозором выработалась традиция, привычка поддерживать ЦК, ибо "ЦК всегда решает правильно".	21:30	0:206
партиец	NOUN	1918-1990	1	партиец-115		Среди партийцев второй и третьей величины нашлось небольшое количество интеллигентных людей, любителей театра, которые и были назначены на руководящую работу в Комитет по делам искусств.	6:15	0:186
партиец	NOUN	1918-1990	1	партиец-116		Это были мещанские излишества, недостойные семьи молодого партийца.	58:66	0:67
партиец	NOUN	1991-2017	2	партиец-117		Оружие возмездия Ближе к концу второй мировой войны, когда даже тем из членов НСДАП, кто контролировал свои мысли со спокойным автоматизмом Марлен Дитрих, подправляющей макияж, когда даже тем из них, кто вообще обходился без мыслей, полностью сливая свое сознание с коллективным разумом партии, -- словом, когда даже самым тупым и безмозглым партийцам стали приходить в голову неприятные догадки о перспективах дальнейшего развития событий, германская пропаганда глухо и загадочно заговорила о новом оружии, разрабатываемом и почти уже созданном инженерами рейха.	287:293	0:563
партиец	NOUN	1991-2017	2	партиец-118		Я должен был привлекать редакторов партийцев, и те уже должны были подписывать рукописи к печати.	35:44	0:97
партиец	NOUN	1991-2017	2	партиец-119		Когда возникает необходимость голосовать за отставку, партийцам приходится выбирать между неизбежными серьезными последствиями такого решения и возможностью рекламировать себя, понося "преступный режим", "семейного премьера" и т.п.	54:63	0:231
