lemma	pos	date	grouping	identifier	description	context	indexes_target_token	indexes_target_sentence
продукция	NOUN	1918-1990	1	продукция-0		"За калий" В тамбовском производственном объединении "Пигмент" выработана опытная партия новой продукции -- фесутама.	95:104	0:117
продукция	NOUN	1918-1990	1	продукция-1		Когда мастер достал из-под верстака заказ, оказалось, что клиент должным образом к приему выпущенной продукции не подготовился.	101:110	0:127
продукция	NOUN	1991-2017	2	продукция-2		"Консервпром" располагает собственной испытательной лабораторией, оснащенной современным оборудованием, позволяющим выполнять весь спектр анализов и контроля как сырья, так и готовой продукции.	183:192	0:193
продукция	NOUN	1991-2017	2	продукция-3		Правда, самиздатовская продукция -- часто не та литература, которая действительно может просветить.	23:32	0:99
продукция	NOUN	1991-2017	2	продукция-4		(По прогнозам Мясного союза России, цены на продукцию могут подскочить до 30%).	44:53	0:79
продукция	NOUN	1991-2017	2	продукция-5		Более того, начало продукции цитокинов активированной глией, как выяснилось, предшествует даже процессу апоптоза нейронов [16].	19:28	0:127
продукция	NOUN	1991-2017	2	продукция-6		-- Какие у компании долгосрочные планы в России -- В России свою стратегию Valio выстраивает на том, что будет предлагать весь спектр молочной продукции, чтобы заинтересовать партнеров в торговом секторе.	143:152	0:204
продукция	NOUN	1991-2017	2	продукция-7		Вывод для России неутешительный: для того чтобы при равных исходных условиях (основных слагаемых себестоимости) обеспечить равную норму прибыли от реализации готовой продукции в России и в Великобритании, цены в России должны быть на 28% выше.	166:175	0:243
продукция	NOUN	1991-2017	2	продукция-8		6) Для решения назревших проблем рационального использования геологических информационных ресурсов о недрах как одного из видов движимой собственности, необходима постановка серьезных научно-исследовательских работ по разработке ряда нормативно-методических документов, а также дополнений и изменений к законодательным актам Российской Федерации, что позволит обеспечить их ввод в хозяйственный оборот на правовой основе в интересах государства и создателей этой продукции.	463:472	0:473
продукция	NOUN	1991-2017	2	продукция-9		Значительная часть продукции отправляется в страны дальнего зарубежья: США, Австралию, Грецию, Корею, Монголию, Вьетнам и другие.	19:28	0:129
продукция	NOUN	1918-1990	1	продукция-10		Анархичность положить на обе лопатки плановостью Промышленность, заказчики не знают плана развития приемных установок; они на глаз примеривают потребность и на риск развивают массовую продукцию, будучи в неизвестности, какое соотношение по отдельным частям радиопродукции потребует своим спросом радиолюбитель, радиослушатель.	184:193	0:326
продукция	NOUN	1918-1990	1	продукция-11		Ясно было, что Советская страна сумела завоевать целый период мирной передышки. довоенной промышленной продукции.	103:112	0:113
продукция	NOUN	1991-2017	2	продукция-12		Бизнес заключался в том, что Григорий с двумя дружками покупали на умирающем заводе пиломатериалов доски, шпон и брус, покупали, дураку ясно, за наличные, у начальника цеха, продававшего готовую продукцию как брак, по дешевке.	195:204	0:226
продукция	NOUN	1991-2017	2	продукция-13		Компания столкнулась с проблемами как на входе -- нехватка проектов, так и на выходе -- крайне низкий спрос на продукцию портфельных компаний.	111:120	0:142
продукция	NOUN	1918-1990	1	продукция-14		В азотной промышленности такие комплексы будут состоять из головного агрегата аммиака и одного или нескольких (подобранных по близости технологии и мощности) производств готовой продукции: капролактам и аммиачная селитра, капролактам и карбамид, нитроаммофоска и аммиачная селитра, только карбамид и так далее.	178:187	0:310
продукция	NOUN	1918-1990	1	продукция-15		Должен создаваться человек -- работник, энергичный, изобретательный, солидарно-дисциплинированный, чувствующий на себе веление класса -- творца и всю свою продукцию отдающий немедля на коллективное потребление.	155:164	0:210
продукция	NOUN	1991-2017	2	продукция-16		В итоге на продукцию Молдавского металлургического завода, экспортируемую в Соединенные Штаты, были установлены пошлины в размере 234% на арматурный прокат и 369% на катанку из рядовых марок стали.	11:20	0:197
продукция	NOUN	1991-2017	2	продукция-17		Основные тенденции развития мини-заводов заключаются в расширении сортамента выпускаемой продукции за счет более сложных и высококачественных ее видов, в интенсификации производства путем применения прогрессивных энергосберегающих технологий.	89:98	0:242
продукция	NOUN	1918-1990	1	продукция-18		В итоге продажи российской продукции падают, а иностранной -- растут, хотя многие потребители до сих пор ценят дешевизну комплектующих и ремонта местных марок.	27:36	0:159
продукция	NOUN	1991-2017	2	продукция-19		Это сырье для производства штапельного и шелкового волокна, сверхпрочного корда для автомобильных шин и другой продукции.	111:120	0:121
продукция	NOUN	1991-2017	2	продукция-20		В сентябре 1994 года на основе цеха лакокрасочной продукции "Полимера" было образовано ЗАО "Краплак", возглавил которое начальник цеха Юрий Сорокин, до 1990 года работавший на ответственной должности секретаря парткома производственного объединения.	50:59	0:249
продукция	NOUN	1991-2017	2	продукция-21		Во 2-4-й главах авторами показаны назначение и классификация производственных, а также товарных запасов, рассмотрена зависимость их объемов от объемов производства продукции, представлены статистические характеристики режимов поставок производственных ресурсов, функции распределения их интервалов и объемов относительно теоретических кривых распределения Вейбулла, Гаусса, Максвелла, Парето, Эрланга.	164:173	0:401
продукция	NOUN	1991-2017	2	продукция-22		В текущем году начались поставки катодной продукции за рубеж -- в Польшу, США.	42:51	0:78
продукция	NOUN	1991-2017	2	продукция-23		Стали выяснять, в чем же дело Оказалось, что в начале внутриутробного развития существует период, когда продукция тех или иных половых гормонов может изменять пол, несмотря на набор хромосом.	104:113	0:191
продукция	NOUN	1991-2017	2	продукция-24		В то же время за отчетный период больше произведено извести, гипса, крупных стеновых блоков, щебня, гравия, ПГС и других видов продукции.	127:136	0:137
продукция	NOUN	1991-2017	2	продукция-25		Для этого необходимо, чтобы православная печатная продукция была здесь широко представлена.	50:59	0:91
продукция	NOUN	1918-1990	1	продукция-26		В частности, за первое полугодие 2004 года Трубной металлургической компанией (ТМК) отгружено потребителям около 1,25 млн т продукции.	124:133	0:134
продукция	NOUN	1991-2017	2	продукция-27		Первенство получают лишь тот цех и та бригада, продукция которых по рецептуре, завертке и упаковке получила отличную оценку.	47:56	0:124
продукция	NOUN	1991-2017	2	продукция-28		Во-первых, не препятствовать намеренно распространению и использованию на рынке продукции конкурентов.	80:89	0:102
продукция	NOUN	1991-2017	2	продукция-29		К сегодняшнему дню 750 га земли выкуплено компанией в собственность, еще свыше тысячи арендуется, и на этой земле уже построены и продолжают строиться индустриальные корпуса с оборудованием для производства мини-клубней, проводится селекция новых генетически устойчивых сортов картофеля, произрастает оздоровленный семенной материал, распространяемый по другим хозяйствам, а кроме того, выращивается качественная столовая картошка, которую оптом приобретают российские и иностранные фирмы, выпускающие чипсы, соломку, фри и прочую производную продукцию, реализуемую в том числе крупными торговыми сетями вроде "Седьмого Континента" или "Перекрестка".	543:552	0:650
продукция	NOUN	1918-1990	1	продукция-30		Высокая эффективность информационных технологий внезапно привела к классическому "кризису перепроизводства" их продукции в глобальном масштабе, который был усугублен наличием на пути расширения сбыта сразу двух барьеров: благосостояния и культуры.	111:120	0:247
продукция	NOUN	1991-2017	2	продукция-31		Потребителями его продукции стали также предприятия алюминиевой промышленности.	18:27	0:79
продукция	NOUN	1918-1990	1	продукция-32		Высокие доходы горожан и соответствующая покупательская способность привлекают сюда производителей продукции не только из Самарской губернии, но и соседних регионов.	99:108	0:165
продукция	NOUN	1991-2017	2	продукция-33		Окраина России, куда до революции завозились керосин, гвозди и подковы, сегодня экспортирует свыше 300 наименований своей промышленной продукции в 70 стран мира.	135:144	0:161
продукция	NOUN	1991-2017	2	продукция-34		Выступая перед руководителями хозяйств, губернатор подчеркнул, что объем продукции, полученной в этом году в хозяйствах и подворьях Облученского района, составил всего 10 процентов от областных показателей.	73:82	0:206
продукция	NOUN	1991-2017	2	продукция-35		Фирма заверила покупателей, что объявление об отзыве продукции распространяется на все страны, где продавалась данная модель.	53:62	0:125
продукция	NOUN	1991-2017	2	продукция-36		Готовую продукцию хранить в сухом и прохладном помещении.	8:17	0:57
продукция	NOUN	1991-2017	2	продукция-37		Очевидно, что и нам следует поэтапно и последовательно внедряться в этот рынок -- поэтапно, переходя от товаров низших этажей, то есть сырьевых, к более наукоемкой и дорогой продукции.	174:183	0:184
продукция	NOUN	1918-1990	1	продукция-38		Да ведь всё это было, было, десятилетиями улыбались герои труда, и всё пустели магазины, всё падала производительность, всё ниже становилось качество продукции и всё длиннее хвосты очередей, и докатились мы до уровня слаборазвитых стран, торгующих не изделиями, а содержимым недр.	150:159	0:280
продукция	NOUN	1918-1990	1	продукция-39		Намного возрастет выпуск тканей, обуви, посуды, мяса, молочной продукции, товаров длительного пользования.	63:72	0:106
продукция	NOUN	1918-1990	1	продукция-40		Да и обо всей российской экономике в целом: нетрудно заметить, что рейтинги выше единицы имеют отрасли и компании, чьей продукцией являются металлы, энергоносители, электричество, алмазы.	120:130	0:187
продукция	NOUN	1991-2017	2	продукция-41		По Кишиневу, например, производство валовой продукции промышленности города увеличилось за последние 20 лет более чем в 5 раз.	44:53	0:126
продукция	NOUN	1918-1990	1	продукция-42		Дело в том, что в кремлевской администрации возникло некоторое перепроизводство продукции.	80:89	0:90
продукция	NOUN	1991-2017	2	продукция-43		С другой -- учитывать требования современного производства: меняется продукция, прогрессирует технология, и станки должны быть достаточно гибкими, легко переналаживаться, включаться в любые поточные и автоматические линии.	69:78	0:222
продукция	NOUN	1918-1990	1	продукция-44		Для снижения себестоимости продукции производитель прибегает к замещению натурального мяса другими компонентами, в том числе белком животного и растительного происхождения, превышение предельно допустимого содержания которого негативно сказывается на вкусовых особенностях продукта, что в дальнейшем влечет за собой отказ потребителя от покупки ранее полюбившейся продукции.	27:36	0:374
продукция	NOUN	1991-2017	2	продукция-45		Появились концерны или межотраслевые государственные объединения: "Электромаш" в Ленинграде, "Квантэмп" в Москве, собравшие под свой флаг на добровольной основе, без потери юридической и финансовой самостоятельности предприятия, которые охватывают полный цикл создания принципиально новой продукции, от фундаментальных исследований вплоть до фирменного обслуживания своих изделий у потребителя.	289:298	0:394
продукция	NOUN	1991-2017	2	продукция-46		Доля основных производителей пельменей, представивших продукцию в московском регионе в первом полугодии 2004 г. Рис. 4.	54:63	0:119
продукция	NOUN	1991-2017	2	продукция-47		В ряду наиболее рентабельной продукции сегодня стоит кокс.	29:38	0:58
продукция	NOUN	1918-1990	1	продукция-48		Замечу, что большая часть продукции научно-производственных кооперативов Москвы вполне конкурентоспособна и достойно выглядит на международных выставках, проходящих у нас в стране.	26:35	0:180
продукция	NOUN	1918-1990	1	продукция-49		Софийского собора и др. представляют продукцию этой мастерской, являясь вместе с тем жемчужинами, высшими достижениями новгородской иконописи XV ст., ее классикой.	37:46	0:163
продукция	NOUN	1918-1990	1	продукция-50		Защитные меры от избыточного объема импортной продукции были задействованы не в полной мере.	46:55	0:92
продукция	NOUN	1991-2017	2	продукция-51		Бюро экономического анализа, возглавляемое Ф. Смирновой, наметило темпы роста выпуска продукции в натуральном и денежном выражения, увеличение производительности труда, а также прибыли.	86:95	0:185
продукция	NOUN	1918-1990	1	продукция-52		Значительно возрастет производство продукции легкой и пищевой промышленности.	35:44	0:77
продукция	NOUN	1918-1990	1	продукция-53		При проверке качества продукции теперь особое внимание уделяется не только технологической, но и метрологической дисциплине.	22:31	0:124
продукция	NOUN	1918-1990	1	продукция-54		И в этих поставках продукция Чепельского комбината занимает далеко не последнее место.	19:28	0:86
продукция	NOUN	1918-1990	1	продукция-55		Хотя уже сейчас наша промышленность не только удовлетворяет внутренний спрос на стальные профили, но и поставляет часть продукции на экспорт -- в ГДР и Польшу, Венгрию и Кубу, Египет и Чехословакию и другие страны, скоро выпуск стальных фасонных профилей еще более расширится.	120:129	0:276
продукция	NOUN	1918-1990	1	продукция-56		И хочется спросить, для чего предназначены эти вещи Что это -- декоративные скульптуры, будущие фарфоровое статуэтки или эскизы к монументам Группа Шулика "Маскарад", изображающая слащаво улыбающихся юношу и девушку в доспехах Пьерро и Коломбины, -- несомненно та самая "рентабельная" продукция, которую Всекохудожник предназначает для массового распространения.	285:294	0:362
продукция	NOUN	1918-1990	1	продукция-57		3) Качество существующей продукции повышается, но это повышение идет очень медленным темпом, как в отношении сухих батарей, так и в отношении аккумуляторов.	25:34	0:156
продукция	NOUN	1918-1990	1	продукция-58		Или, при том же объеме годовой продукции, позволяют увеличить производительность труда станочников в 13 раз, сократить число станков в 7 раз и уменьшить производственные площади в 5 раз.	31:40	0:186
продукция	NOUN	1918-1990	1	продукция-59		В 1944 году они выпустили продукции более чем на 12 миллионов рублей.	26:35	0:69
продукция	NOUN	1918-1990	1	продукция-60		Каталог "Оформление музыкальной продукции" Тема каталога -- дизайн в музыке.	32:41	0:76
продукция	NOUN	1991-2017	2	продукция-61		Изучение показало, что в ряде производственных объединений на протяжении последних лет ущерб от изготовления и выпуска недоброкачественной продукции возмещается лишь в мизерных пределах.	139:148	0:186
продукция	NOUN	1918-1990	1	продукция-62		Кроме перечисленной выше продукции оборудование фирмы позволяет выпускать около 300-400 кв. метров стеклопакетов в смену, а также ударопрочные и пуленепробиваемые стекла.	25:34	0:170
