lemma	pos	date	grouping	identifier	description	context	indexes_target_token	indexes_target_sentence
продукция	NOUN	1991-2017	2	продукция-63		Военная продукция.	8:17	0:18
продукция	NOUN	1918-1990	1	продукция-64		Место для молитвы, очищения души, в супермаркете -- это ведь намного лучше, чем новый отдел с алкогольной продукцией, например.	106:116	0:127
продукция	NOUN	1991-2017	2	продукция-65		Решение ищет читатель Не лучше ли, пока не поздно, заморозить все новое строительство в экологически вредных отраслях, а запланированные на него средства использовать для реконструкции уже существующих производств, чтобы сделать их по возможности чистыми Использовать для создания при заводах специальных цехов по переработке их же продукции, которая отслужила свой век Для организации приемных пунктов тары из стекла, металла, пластмассы, а также старых вещей из хлопка, шерсти или синтетики.	332:341	0:493
продукция	NOUN	1918-1990	1	продукция-66		Минуло всего десять месяцев -- и первая очередь комбината полностью восстановлена и пущена, выдает продукцию.	99:108	0:109
продукция	NOUN	1918-1990	1	продукция-67		Однако продукция его -- яркие, красочные покрывала, шторы, салфетки -- известна не только в нашей стране, но и далеко за ее пределами.	7:16	0:134
продукция	NOUN	1991-2017	2	продукция-68		Много или мало По данным областной администрации, сегодня на главный конвейер поставляют свою продукцию около 600 отечественных поставщиков-производителей.	94:103	0:155
продукция	NOUN	1991-2017	2	продукция-69		Но повышение конкурентоспособности возможно только в случае, если бизнес -- мелкий, крупный, средний -- может находить те ниши на рынке, где он может производить и продавать конкурентоспособную продукцию.	194:203	0:204
продукция	NOUN	1918-1990	1	продукция-70		Мощная социалистическая индустрия в семь раз превысила довоенную продукцию и полностью вытеснила частную промышленность.	65:74	0:120
продукция	NOUN	1918-1990	1	продукция-71		Это -- тоже продукция "Самтреста", но.	12:21	0:38
продукция	NOUN	1918-1990	1	продукция-72		Мы считаем наиболее актуальными задачами: -- сохранение отрасли как единого комплекса, обеспечивающего отечественной высококачественной углеграфитовой продукцией черную и цветную металлургию, машиностроение, атомную и химическую промышленность, предприятия оборонного комплекса России; -- обеспечение защиты интересов отечественных производителей на внутреннем и внешнем рынках; -- концентрацию ресурсов для осуществления реконструкции и технического переоснащения электродных заводов, обеспечивающих выпуск конкурентоспособной продукции; -- исключение зависимости предприятий от импортного сырья, что означает создание отечественной сырьевой базы высококачественного углеродистого сырья с целью обеспечения малосернистым нефтяным коксом производства углеграфитовой продукции, поиск путей улучшения качества и увеличения производства каменноугольного пека и пекового кокса на коксохимических производствах металлургических заводов России.	151:161	0:938
продукция	NOUN	1991-2017	2	продукция-73		Черный войлок из Волыни Это не какая-нибудь продукция народных умельцев, а природное вещество.	44:53	0:94
продукция	NOUN	1918-1990	1	продукция-74		Например, подсистема контроля качества продукции включает в себя разработку и стандартизацию методов испытаний и контроля, а также стандартизацию и унификацию правил технического обслуживания и ремонта оборудования.	39:48	0:215
продукция	NOUN	1918-1990	1	продукция-75		Доходы от выработанной учащимися продукции пополняют фонды школы.	33:42	0:65
продукция	NOUN	1918-1990	1	продукция-76		ОАО "НИИпроектасбест" является разработчиком и изготовителем комплекса оборудования, которое позволяет внедрять гибкие технологические линии, обеспечивающие выпуск большого числа видов продукции (до 6 и более фракций) и производство щебня кубовидной формы с содержанием зерен пластинчатой формы до 15%.	185:194	0:302
продукция	NOUN	1991-2017	2	продукция-77		Нужно взять под жестокий огонь пролетарской самокритики те заводы, цехи и бригады, которые за счет рекордной погони за количеством ухудшают качество вырабатываемой продукции и тем самым объективно срывают борьбу партии и масс за быстрые темпы индустриализации страны.	164:173	0:267
продукция	NOUN	1918-1990	1	продукция-78		Однако основная прибавка достигнута за счет проволоки обыкновенного качества, которая не относится к высокоэффективным видам продукции.	125:134	0:135
продукция	NOUN	1991-2017	2	продукция-79		Несомненно, значительная часть Бирнбаумовских "бредоподобных фантазий дегенерантов", которые нередко появляются в тюрьме, в своей основе имеют "фантастическую" конституцию, и естественной основой для происхождения и изменчивости обильных продукций в психозе здесь является лживая ("фантастическая") личность больного вне психоза.	238:247	0:329
продукция	NOUN	1991-2017	2	продукция-80		Основными видами создаваемой продукции являются: радиостанции различных диапазонов частот; автоматизированные комплексы и системы радиосвязи; управляющие спецвычислители и программные продукты; оборудование внутренней связи и коммутации; пульты управления, вокодерные устройства; наземные и бортовые антенны, антенные системы; устройства обеспечения ЭМС и помехозащиты; модемы; аппаратура передачи данных; средства и системы экологического мониторинга; медицинское оборудование.	29:38	0:478
продукция	NOUN	1991-2017	2	продукция-81		В книжке Менгера "Основания политической экономии" все, конечно, гораздо тоньше и сложнее, но суть -- именно такова: добейтесь небывалого уровня производительности труда, снизьте себестоимость продукции до смехотворных значений, ужмите свою жадность сверх всяких границ и установите смешную прибавочную стоимость, а потом с гордостью выставьте свой товар на продажу -- и все для того, чтобы убедиться: никто его не покупает, потому что он никому не интересен.	193:202	0:459
продукция	NOUN	1918-1990	1	продукция-82		По словам Артема Кузнецова, в дальнейшем предстоит создание единой холдинговой компании "Пермские моторы" с целью концентрации интеллектуальных, инвестиционных и промышленных ресурсов предприятий "Пермского моторостроительного комплекса" для проведения НИОКР и модернизации производства, направленных на повышение качества продукции до международного уровня, снижение ее себестоимости.	323:332	0:385
продукция	NOUN	1991-2017	2	продукция-83		Откуда взять деньги Часть наверняка внесут заказчики, часть ассигнует отрасль, ну а часть можно образовать из налогов на устаревшую, но выпускаемую продукцию.	148:157	0:158
продукция	NOUN	1918-1990	1	продукция-84		Применение этих белков позволяет улучшить консистенцию, сочность и товарный вид продукта, стабилизировать фаршевую эмульсию, снизить риск образования бульонно-жировых отеков, и, как следствие, повысить качество и выход мясной продукции.	226:235	0:236
продукция	NOUN	1991-2017	2	продукция-85		Хороша или плоха была продукция -- государство не "чесало".	22:31	0:59
продукция	NOUN	1918-1990	1	продукция-86		Принимались меры для улучшения санитарного состояния и повышения качества продукции.	74:83	0:84
продукция	NOUN	1918-1990	1	продукция-87		Почти все крупные предприятия страны предлагали свою продукцию: станки, различные установки, легковые и грузовые машины, дизели, тепловозы и многое другое.	53:62	0:155
продукция	NOUN	1918-1990	1	продукция-88		Причем параметры всех этих устройств не уступали характеристикам продукции признанных зарубежных лидеров, а зачастую и превосходили их.	65:74	0:135
продукция	NOUN	1991-2017	2	продукция-89		Каким же из описанных двух способов оценивает ЦОС продукцию, когда в своих "Бюллетенях" он учитывает движение производительности труда при помощи средней выработки на человеко-день При оценке выработки на человеко-день ЦОС применяет ранее принятый способ.	50:59	0:255
продукция	NOUN	1918-1990	1	продукция-90		Промышленные предприятия осуществляли комплексную механизацию и автоматизацию производства, внедрили более прогрессивные технологические процессы, освоили производство новых видов промышленной продукции.	193:202	0:203
продукция	NOUN	1918-1990	1	продукция-91		СНК при рассмотрении контрольных цифр промышленности на 1929-1930 г. обратил особое внимание на необходимость улучшить качество продукции.	128:137	0:138
продукция	NOUN	1991-2017	2	продукция-92		Размер платы определяется исходя из фактических оборотов по реализации товара за истекший месяц; -- уплаты акцизов за декабрь 1995 года для плательщиков со среднемесячными платежами от 10 до 100 тыс. рублей (по акцизам на нефть, включая газовый конденсат, и природный газ -- от 100 до 300 тыс. рублей), а также для компаний, изготавливающих подакцизную продукцию, не реализуемую на сторону, и использующих ее для производства другой продукции, не облагаемой акцизами; -- представления расчетов по акцизам за декабрь 1995 года на ликероводочные изделия, водку, спирт питьевой, спирт этиловый ректификованный из всех видов сырья, коньяки, шампанское, вина, спиртованные соки, виноградные и плодовые напитки, на подакцизную продукцию, используемую в собственном производстве, а также для плательщиков со среднемесячными платежами от 10 тыс. рублей и более (по акцизам на нефть и газ -- от 100 тыс. рублей и более) и для компаний, уплачивающих акцизы по подакцизной продукции, изготовленной из давальческого сырья, а также уплачивающих акцизы по подакцизной продукции, не реализуемой на сторону и используемой для производства другой продукции; -- внесения доплаты по акцизам за декабрь 1995 года, если исчисленная по месячному расчету сумма акцизов превысила сумму, исчисленную к уплате ежедневными или декадными платежами; -- уплаты акцизов и представления расчетов по ним за IV квартал 1995 года для плательщиков со среднемесячными платежами менее 10 тыс. рублей (по акцизам на нефть, включая газовый конденсат, и природный газ -- менее 100 тыс. рублей); -- уплаты налога на реализацию ГСМ и представления расчетов по нему за декабрь 1995 года для плательщиков со среднемесячными платежами от 1 до 3 млн рублей; -- перерасчета налога на реализацию ГСМ, внесения доплаты (при необходимости), а также представления расчетов по налогу за декабрь 1995 года для плательщиков со среднемесячными платежами более 3 млн рублей; -- уплаты сбора за использование наименований "Россия", "Российская Федерация" и образованных на их основе слов и словосочетаний и представления расчета по нему за IV квартал 1995 года (кроме плательщиков, уплачивающих сбор ежегодно по фиксированной ставке); -- представления отчета о количестве древесины, разрешенной лесопользователям к заготовке, платежах за древесину, о суммах неустоек и ущерба за лесонарушения за 1995 год и за период с 1 по 15 января 1996 года для владельцев лесного фонда;	353:362	0:2415
продукция	NOUN	1991-2017	2	продукция-93		Мотивировка такова: само месторождение уже включено в перечень соглашений о разделе продукции, но финансовая модель будет ясна только после завершения и одобрения технико-экономического обоснования соглашений.	84:93	0:209
продукция	NOUN	1918-1990	1	продукция-94		Свои обязательства рассчитывает выполнить досрочно, причем продукцию выпускает высшего качества.	59:68	0:96
продукция	NOUN	1918-1990	1	продукция-95		Вывозил бесфактурную продукцию с завода впервые.	21:30	0:48
продукция	NOUN	1918-1990	1	продукция-96		Скажи, пожалуйста, разве не ясно, чего хочет Корш Ясно, что он рвется производить продукцию.	82:91	0:92
продукция	NOUN	1991-2017	2	продукция-97		Однако фюрер умолчал, что захваченные источники сырья ввиду сильных разрушений добывающих предприятий могут быть использованы для немецкой промышленности лишь в ограниченным размерах и что ввиду недостатка транспорта переброска сельскохозяйственной продукции из СССР не может быть полностью обеспечена.	249:258	0:302
продукция	NOUN	1991-2017	2	продукция-98		Способов противодействия ей, в сущности, два: усиление рекламной "пропагандистской" активности в местах продаж (POS-материалы) и... развитие своей розничной сети, способной физически ограничить присутствие на прилавках некачественной продукции конкурентов.	234:243	0:256
продукция	NOUN	1991-2017	2	продукция-99		Так, на рынке появилась импортозамещающая продукция, экспортоориентированные производства существенно повысили свою доходность даже без увеличения объема экспорта.	42:51	0:163
продукция	NOUN	1918-1990	1	продукция-100		Те готовы взять на себя все затраты, взамен получая продукцию, которую смогут продавать тем же ВИНК.	52:61	0:100
продукция	NOUN	1991-2017	2	продукция-101		Надо ли предусматривать подготовительную работу в таком большом объеме Ведь концентрация усилий на сложных моментах стимулируется самой реализацией проекта, а отдельные трудные вопросы можно выяснять даже в ходе серийного выпуска продукции".	230:239	0:241
продукция	NOUN	1918-1990	1	продукция-102		Терпеливо разъясняем: это не образцы продукции, а образцы того, что мы умеем и можем.	37:46	0:85
продукция	NOUN	1991-2017	2	продукция-103		Громадную роль в увеличении выхода продукции сыграл переход предприятия на природный газ.	35:44	0:89
продукция	NOUN	1918-1990	1	продукция-104		Тогда в Москве на Красной Пресне демонстрировали свою продукцию много разных фирм.	54:63	0:82
продукция	NOUN	1918-1990	1	продукция-105		Прекрасный опыт ударных бригад образцовой продукции, недавно возникших на московском заводе "Серп и молот" и Тормозном заводе, должен быть широко известен и стать достоянием всех предприятий СССР.	42:51	0:196
продукция	NOUN	1991-2017	2	продукция-106		Традиции торговли сельскохозяйственной продукцией складывались на Центральном колхозном рынке не одно десятилетие.	39:49	0:114
продукция	NOUN	1991-2017	2	продукция-107		Как полагают эксперты, некоторый импульс развитию отрасли может дать мартовское решение правительства России о предоставлении Роствертолу права самостоятельно экспортировать свою продукцию.	179:188	0:189
продукция	NOUN	1918-1990	1	продукция-108		Узкое место ликвидировали, участок значительно увеличил выпуск продукции.	63:72	0:73
продукция	NOUN	1918-1990	1	продукция-109		50 процентов сверхплановой продукции имеем право продать на рынке.	27:36	0:66
продукция	NOUN	1991-2017	2	продукция-110		Цель данной работы заключалась в постановке теста определения интерферонового статуса и оценке влияния аутологичной сыворотки крови человека на уровни продукции альфа- и гамма-ИФН лейкоцитами крови.	151:160	0:198
продукция	NOUN	1991-2017	2	продукция-111		Беседу вел Сергей Иващенко Ставропольский край, Буденновский район КАК ЖИВЕТСЯ В "АВАНГАРДЕ" Зерно, картофель, молоко, яблоки, ягоды, саженцы плодовых, племенной скот -- вот далеко не полный перечень продукции, которую производит и продает ЗАО "Авангард".	200:209	0:255
продукция	NOUN	1991-2017	2	продукция-112		Что это дает Прежде всего снижение стоимости закупаемого оборудования за счет отсутствия таможенных сборов на ввоз готовой продукции и производства ее в России, а также за счет использования в производстве местных комплектующих, которые, как правило, дешевле зарубежных.	123:132	0:270
