lemma	pos	date	grouping	identifier	description	context	indexes_target_token	indexes_target_sentence
продукция	NOUN	1991-2017	2	продукция-113		Ключевыми особенностями продукции RA.R.T. S.p.A. изначально стали качество, долгий срок службы и безопасность. F.A.R.T. -- это аббревиатура от "Fabbrica Apparecchiature Radio-elettriche Treviso" (итал.), что переводится как "Производство радиоэлектронных приборов в Тревизо".	24:33	0:275
продукция	NOUN	1918-1990	1	продукция-114		Это географическое положение страны определяло и ее хозяйственный облик -- Узбекистан относился к странам сельскохозяйственным, его основной продукцией были хлопок, шелк, каракуль и фрукты.	141:151	0:189
продукция	NOUN	1918-1990	1	продукция-115		К этому периоду относятся такие достижения варшавян, как улучшение жилищного строительства (в 1974 году сдано 20 тыс. квартир -- больше, чем когда-либо прежде), быстрые темпы роста промышленной продукции (ежегодно достигавшие 14%), сдача в эксплуатацию новой транспортной артерии -- Трассы Лазенковской с новым мостом на Висле -- и главного участка Вислострады, завершение восстановления Королевского замка, значительный прогресс в строительстве Центрального дворца.	194:203	0:466
продукция	NOUN	1918-1990	1	продукция-116		Этот материал, собранный и обработанный фото-кино любит. секцией ЦС ОДСК будет служить нашей фото-промышленности для правильной ориентировки на потребителя и приспособления продукции к его нуждам. д) Фото-кружки и массовая культработа Кружки фото-любителей обычно организуются при массовых общественных организациях -- ячейках ОДСК, рабочих клубах, избах-читальнях, комсомольских ячейках и т.д.	173:182	0:394
продукция	NOUN	1918-1990	1	продукция-117		Но едва японское автомобилестроение встало на ноги, его продукция прежде всего хлынула в столицу.	56:65	0:97
продукция	NOUN	1918-1990	1	продукция-118		Я хочу дать продукцию скорее и лучше.	12:21	0:37
продукция	NOUN	1918-1990	1	продукция-119		Но зато полученная "продукция" не разбрасывается по площади в тысячи квадратных километров, как было при взрыве термоядерного "Майка".	20:29	0:134
