lemma	pos	date	grouping	identifier	description	context	indexes_target_token	indexes_target_sentence
графиня	NOUN	1918-1990	2	графиня-81		Он условился с Глинским, когда посетить этот великолепный памятник искусствам, воздвигнутый Наполеоном, и оба отправились к завтраку, после которого Глинский едва только возвратился домой, как встретил слугу в ливрее графини.	217:224	0:225
графиня	NOUN	1682-1916	1	графиня-82		Одна только бабушка с усиками, говорят, ворчит и сердится на свою внучку за то, что она не будет ни графиней, ни княгиней: да кто же станет смотреть на эту брюзгливую развалину Она отстала от всего на тысячелетие, она не знает, что в наше время аристократия в деньгах, а не в титлах.	100:108	0:283
графиня	NOUN	1682-1916	1	графиня-83		Напишите мне непременно, как вы живете-можете, и что делает серпуховская покупка Я узнал, что графиня М. Н. Толстая с братом едет за границу; известите пожалуйста, куда именно.	94:101	0:176
графиня	NOUN	1682-1916	1	графиня-84		Однажды такая ссора произошла у молчаливого Эвда с горячим и скорым на худое слово Бруно, не очень почтительно отозвавшимся о прелестях графини.	136:143	0:144
графиня	NOUN	1918-1990	2	графиня-85		Сверх всего этого графиня, не спускавшая глаз с него, заметила, что он беспрестанно смотрел на дверь и всякий раз, когда она отворялась, вздрагивал и приходил в видимое беспокойство.	18:25	0:182
графиня	NOUN	1682-1916	1	графиня-86		Они приехали, осмотрели больную, потолковали с Шестаковым по-латыни и объявили, что все средства, употребленные их собратом доктором Шестаковым для излечения графини Надежды Петровны, были совершенно правильны, но что, несмотря на это, больная по ее комплекции перенести такого сильного воспаления мозга не может и что продолжать ее еще лечить -- значит брать деньги даром, а на это они не согласны.	158:165	0:399
графиня	NOUN	1682-1916	1	графиня-87		После свадьбы Григорий Александрович Кирхоф был прав, заметив, что графу Стоцкому не желательно потерять не "его", а "ее", то есть не графа Петра Васильевича Вельского, а графиню Надежду Корнильевну.	171:178	0:199
графиня	NOUN	1682-1916	1	графиня-88		Они разговаривали между собой: "-- А ты знаешь, Коко, что графиня НН наконец-то устроила файф-о-клок -- С паршивой овцы хоть файф-о-клок".	58:65	0:138
графиня	NOUN	1918-1990	2	графиня-89		Разговор между графом Стоцким и графом Петром Васильевичем после вечера, проведенного последним с женой, признавшейся ему, что она готовится быть матерью, был подслушан горничной графини -- Наташей.	179:186	0:198
графиня	NOUN	1918-1990	2	графиня-90		Плита у графини целый месяц не топилась.	8:15	0:40
графиня	NOUN	1918-1990	2	графиня-91		Елиза фон дер Реке, урожденная графиня Медем, величественная, высокая женщина, она некогда была из первых красавиц в Европе, ныне, на шестьдесят пятой году своей жизни, Елиза еще пленяет своею добротою, своим воображением.	31:38	0:222
графиня	NOUN	1682-1916	1	графиня-92		Присутствие не только Сони, но и любимой Наташи, даже мужа, раздражало графиню.	71:78	0:79
графиня	NOUN	1682-1916	1	графиня-93		В переодевшейся в костюм крестьянки, бригада сразу узнала графиню, по предъявленной фотографии; в Жмеринке она взяла билет второго класса и на замечание пассажиров, что крестьяне не ездят вторым классом, объяснила, что выходит замуж за богатого Поляка, а перед вступлением в брак едет в Ченстохов помолиться Богу.	58:65	0:313
графиня	NOUN	1682-1916	1	графиня-94		Про меня и про графиню!	15:22	0:23
графиня	NOUN	1682-1916	1	графиня-95		Рядом с этим домом на обширном дворе в углублении стоял деревянный ветхий дом графини Елизаветы Федоровны Орловой, рожденной Ртищевой, жены самого старшего из пяти братьев Орловых, графа Ивана Григорьевича, который умер задолго до того времени, как мы стали жить на Пречистенке, и я его не знала.	78:85	0:296
графиня	NOUN	1682-1916	1	графиня-96		Скинула графиня плащ и треуголку, ударила эфесом меча по столу, блеснула старуха глазами, оправила седые кудри свои и упала.	8:15	0:124
графиня	NOUN	1918-1990	2	графиня-97		Графиня рассердилась на Соню, как она редко сердилась.	0:7	0:54
графиня	NOUN	1918-1990	2	графиня-98		Судьба-"обезьяна" смеется над обоими: подобно тому, как мертвая графиня "насмешливо взглянула" на Германна, "прищуривая одним глазом" (VI, 232), шемаханская царица смеется над Дадоном за минуту до его смерти: "...а девица -- // Хи-хи-хи да ха-ха-ха!	64:71	0:249
графиня	NOUN	1918-1990	2	графиня-99		А потом все стали кричать: "Дуэль, дуэль!" Моя графиня заплакала, ейный дядюшка стал успокаивать ее и помахивать перламутровым веером.	47:54	0:134
графиня	NOUN	1918-1990	2	графиня-100		Тайна трех карт становится в этих главах очевидной реальностью: тройка, семерка и туз выигрывают, притом в той последовательности, которая была указана Германну призраком графини, явившимся тогда, когда тайна, казалось, была утеряна безвозвратно.	171:178	0:246
графиня	NOUN	1918-1990	2	графиня-101		Заметим, что изобар и изобара -- понятия столь же далекие, как графин и графиня.	63:69	0:80
графиня	NOUN	1918-1990	2	графиня-102		Так, графиня Орлова, та самая, которую увековечил В. В. Серов, тратила ежегодно (по словам сына директора императорских театров В. А. Теляковского) около ста тысяч рублей.	5:12	0:171
графиня	NOUN	1918-1990	2	графиня-103		См. в мемуарах М. А. Корфа: "Салон графини Нессельроде.	35:42	0:55
графиня	NOUN	1918-1990	2	графиня-104		Там настоящий испанский граф и графиня.	31:38	0:39
графиня	NOUN	1918-1990	2	графиня-105		Графиня, будто с зажженным фитилем, вылетела из кареты, -- в персиковом бурнусе, в огоньках драгоценных камней, дрожащих в ушах, на шее, на пальцах, с куафюрой потрепанной, но оттого не менее прелестной.	0:7	0:203
графиня	NOUN	1918-1990	2	графиня-106		Утром съехали графиня с сыном.	14:21	0:30
графиня	NOUN	1918-1990	2	графиня-107		И про кого это подумалось: "черт с ней", -- про графиню ли, про Нину ли, или про Анфису, может -- Прохора не интересовало.	48:55	0:122
графиня	NOUN	1682-1916	1	графиня-108		Что пишет наш дорогой граф, графиня -- спрашивает генерал, слегка краснея.	28:35	0:74
графиня	NOUN	1918-1990	2	графиня-109		-- не утерпела, как женщина, чтобы не перебить своего собеседника, графиня.	67:74	0:75
графиня	NOUN	1682-1916	1	графиня-110		Это огромное богатство не имело прямых наследников, ибо граф Паоло лишился не только супруги, трагически погибшей в 1748 году, но похоронил вслед за графиней Беатрисой и обоих своих детей, унесенных беспощадной болезнью.	149:157	0:220
графиня	NOUN	1918-1990	2	графиня-111		-- Я пошлю вам ее, -- сказала графиня и вышла из комнаты.	30:37	0:57
графиня	NOUN	1682-1916	1	графиня-112		Я в кухне у графини.	12:19	0:20
графиня	NOUN	1918-1990	2	графиня-113		графиня Гогормо...-- повторяла Урсула,-- вот тебе раз! что это за графиня Гогормо я знаю все фамилии, я жена придверника в знатном доме, а такой не слыхивала! пойду посмотреть и расспросить, что это за графиня...-- с сими словами она побежала вниз.	0:7	0:248
графиня	NOUN	1918-1990	2	графиня-114		Я влюбился в графиню Елену Оксинскую.	13:20	0:37
графиня	NOUN	1918-1990	2	графиня-115		В дом какой-то графини пришел знакомый маляр оклеивать комнату.	15:22	0:63
графиня	NOUN	1918-1990	2	графиня-116		Я поцеловал графиню в самые губки, посидел с ней часок, да и вернулся домой.	12:19	0:76
графиня	NOUN	1918-1990	2	графиня-117		Прабабка, графиня Бенкендорф, поднималась на башню с подзорной трубой смотреть на прохожденье корабля, державшего путь на Ревель мимо Фалля.	10:17	0:140
графиня	NOUN	1682-1916	1	графиня-118		Я читал с удовольствием: об ученых блохах -- простите, графиня, -- и об одном мужике.	55:62	0:85
графиня	NOUN	1918-1990	2	графиня-119		Единственную возможность к этому представляет богатейший архив графини, содержащий переписку с лицами, когда-либо соприкасавшимися с яснополянской семьей.	63:70	0:154
