lemma	pos	date	grouping	identifier	description	context	indexes_target_token	indexes_target_sentence
приставка	NOUN	1991-2017	2	приставка-67		Военачальникам к фамилии разрешалось добавлять приставки в честь их побед: князь В.В.Долгорукий-Крымский, князь Г.А.Потемкин-Таврический, граф А.В.Суворов-Рымникский, князь М.И.Голенищев-Кутузов-Смоленский.	47:56	0:206
приставка	NOUN	1918-1990	1	приставка-68		Некий балетоман прислал знаменитому Эдисону заказ: сконструировать "икс-лучевую" приставку к театральному биноклю, с помощью которой "можно увидеть все даже сквозь одежду".	81:90	0:172
приставка	NOUN	1918-1990	1	приставка-69		Совершенно ясно, что приставка эта не только являлась в тогдашнем обществе чем-то весьма привычным и распространенным; ей еще придавалось особое значение в разных общественных слоях и классах.	21:30	0:192
приставка	NOUN	1991-2017	2	приставка-70		Немцы же, как известно, обогатили нашу речь не только ерундой в кавычках и без, но и словами военной и бытовой лексики (гауптвахта, шлагбаум, бюстгальтер и галстук), а также калькой сложных, переведенных вместе с приставками, корнями и суффиксами существительных: председатель, представление, обновление и т.д. Когда б вы знали из какого сора.	213:224	0:343
приставка	NOUN	1991-2017	2	приставка-71		Зато устройств при них гораздо больше -- и уже знакомый нам хронометр, и термо-метр (и отсюда все, что связано с теплотой, вплоть до термо-ядерной реакции), и баро-метр (и отсюда все, что связано с весом, вплоть до бари-тона, тяжелого, низкого голоса), и арифмо-метр (число-мер), и динамо-метр (сило-мер; динамика -- наука о силе, динамо -- машина для получения электричества из неэлектрической силы, динамит -- взрывчатое вещество большой силы и т.д.) Но, пожалуй, еще интереснее сопоставлять слова не по корням, а по приставкам.	519:529	0:530
приставка	NOUN	1918-1990	1	приставка-72		Несмотря на то, что целевой программы мер поддержки населения по приобретению цифровых приставок не предусматривается, региональные власти уже разрабатывают местные программы помощи льготным категориям граждан в этом направлении.	87:96	0:229
приставка	NOUN	1991-2017	2	приставка-73		За всю историю городок сменил уже несколько "приставок" к имени Святого Антонио.	45:54	0:80
приставка	NOUN	1918-1990	1	приставка-74		Неужели эта частность, малость, подразумеваемость (для меня) -- дать -- неминуемо должна вырасти в какую-то гору, из-за приставки: мне.	120:129	0:135
приставка	NOUN	1918-1990	1	приставка-75		От внедрения двадцати приставок экономится в год 18 тыс. руб.	22:31	0:61
приставка	NOUN	1918-1990	1	приставка-76		Ни один из них никогда не может очутиться перед корнем в качестве "приставки".	55:56	0:78
приставка	NOUN	1918-1990	1	приставка-77		И приставка ПП внушала зрителям, что они присутствуют на экране, принимают участие в событиях.	2:11	0:94
приставка	NOUN	1918-1990	1	приставка-78		Однако, с другой стороны, такая приставка снижает маневренность корабля.	32:41	0:72
приставка	NOUN	1918-1990	1	приставка-79		[...] К Автобиографии Фамилия с приставкой "пан", дорого обошедшаяся ему (отцу) в 30-е г. Ной на стройке ковчега.	32:42	0:113
приставка	NOUN	1918-1990	1	приставка-80		Она заключается не только в классификации окончаний, приставок и суффиксов, которую он незаметно для себя самого производит в своем двухлетнем уме, но и в той угадке, с которой он при создании нового слова выбирает для подражания необходимый ему образец.	53:62	0:254
приставка	NOUN	1918-1990	1	приставка-81		Оба глагола можно спрягать: Я мог-у I can Ты мож-е-шь Он мож-е-т He can Мы мож-е-м We can Вы мож-е-т-е You can Они мог-у-т they can их работу исполняют, местоимения "ай", "хи", "уи", то есть "я", "он", "мы" и т. д. Точно так же мы, чтобы от одного слова произвести другое, применяем наши суффиксы (смех -- сме+ять+ся; дом -- дом+ик), приставки (за+сме+ять+ся) и окончания.	334:343	0:372
приставка	NOUN	1918-1990	1	приставка-82		Они ничего не выражают, как вкус слезы, пролитой по радостному или горестному поводу, они сами по себе невинны, как дети, в них идет своя детская игра молекул, они делятся, как клетка: корень отбрасывает тени всевозможных смыслов, суффиксы и приставки посвистывают щеглами, покрякивают добрыми утиными голосами.	242:251	0:311
приставка	NOUN	1991-2017	2	приставка-83		Я всегда подозревала, Синицына, что для тебя приставки и суффиксы "мура и ерунда".	45:54	0:82
приставка	NOUN	1918-1990	1	приставка-84		Они скорее своеобразные "приставки", дополнения к этому главному герою, выступающему под разными именами: "Ав", "Ску" или даже просто "Сидур" -- который и сам не властен ни над своим образом, ни над создаваемым им произведением.	25:34	0:228
приставка	NOUN	1991-2017	2	приставка-85		13.Дворянская приставка к французским фамилиям.	14:23	0:47
приставка	NOUN	1918-1990	1	приставка-86		Отмечу, для приёма цифрового эфирного телесигнала необходим телевизор с поддержкой специального сигнала или приставка (подробности в рубрике "Есть ответ" на 20-й стр.).	108:117	0:168
приставка	NOUN	1991-2017	2	приставка-87		Итак, существование феномена сознавания мы получили как амплифицирующее устройство, усилительную приставку к нашим органам чувств и уму.	97:106	0:136
приставка	NOUN	1918-1990	1	приставка-88		По столу были разбросаны голубые листки бумаги, негромко гудела полуавтоматическая приставка к электронному вычислителю.	83:92	0:120
приставка	NOUN	1918-1990	1	приставка-89		Фамилия его начиналась с приставки "фон".	25:34	0:41
приставка	NOUN	1991-2017	2	приставка-90		Потом, в кинозале, аналогичная приставка перед проектором расширяла изображение.	31:40	0:80
приставка	NOUN	1991-2017	2	приставка-91		Непропорциональный силовой сигнал Ни программы действии, ни штатного расписания, ни помещения, ни одного сотрудника, ни денег -- так описывает бывший сотрудник "Роснанотеха" первые месяцы работы в новой госкорпорации, призванной создать с нуля технологичную отрасль с волшебной приставкой "нано-".	278:288	0:297
приставка	NOUN	1991-2017	2	приставка-92		Потому что партия Хекматьяра называлась с приставкой "ислам" (что-то плюс "ислам").	42:52	0:83
приставка	NOUN	1991-2017	2	приставка-93		Если бы мы ставили эксперимент в Англии, можно было назвать его сэром Пина, но в этой стране ему придется обойтись без этой благородной приставки.	136:145	0:146
приставка	NOUN	1991-2017	2	приставка-94		Правда, эти существа оказались неспособны к самооплодотворению (отсюда и приставка "псевдо").	73:82	0:93
приставка	NOUN	1991-2017	2	приставка-95		Но не стоит забывать и о том, что Ростан был романтиком, но с приставкой "нео".	62:72	0:79
приставка	NOUN	1991-2017	2	приставка-96		Проходя мимо двухэтажного здания, огороженного зеленым штакетником, я сначала обратил внимание на вывеску у ворот: "Дом презрения пристарелых", где приставки "пре" и "при" перепутаны местами были, как мне показалось, символически.	148:157	0:230
приставка	NOUN	1991-2017	2	приставка-97		Исключения составляют "Пароходство "Волготанкер", вводящее в эксплуатацию 2 самоходных судна, "Донречфлот" -- 2 баржи для перевозки химических грузов, СК "Донское пароходство" -- сухогрузный теплоход, танкер с приставками и 2 обстановочных теплохода.	210:221	0:250
приставка	NOUN	1991-2017	2	приставка-98		Процесс упрощения слов можно наблюдать и при переходе их в иные языки, и в их родной языковой стихии; например, в древнегреческом (превращение приставки "пара" в приставку "па"), и поэтому превращение "парапорти" в "паперть" представляется вполне реальным.	143:152	0:256
приставка	NOUN	1991-2017	2	приставка-99		(Иногда к названию прибавляют приставку "микро-": микроспоры.	30:39	0:61
приставка	NOUN	1918-1990	1	приставка-100		Размеры приставки зависят от объектива камеры и ее конструктивных особенностей.	8:17	0:79
приставка	NOUN	1991-2017	2	приставка-101		Важнее во много раз понять, как, какими способами, при помощи каких именно суффиксов, приставок, окончаний этот язык образует существительное от глагола, глагол от существительного; как он спрягает свои глаголы, как склоняет имена, как связывает все эти части речи в предложении.	51:54	0:279
приставка	NOUN	1991-2017	2	приставка-102		Реванш года Первым чемпионом мира по шахматам, распростившимся с приставкой "экс" и передавшим ее своему сопернику, стал Александр Алехин.	65:75	0:138
приставка	NOUN	1991-2017	2	приставка-103		Предыдущий рекорд моделирования подобного типа -- симуляция поведения "всего лишь" 49 млрд атомов при производительности 369 терафлопс (приставка "пета-" означает число с 15-ю цифрами после запятой, а "тера-" -- с 12-ю).	98:101	0:220
приставка	NOUN	1918-1990	1	приставка-104		Ричи Блэкмор, хард-рокер и бузотер, основатель и главный могильщик объявивших о своей пенсии, некогда грозных Deep Purple приехал отрабатывать приставку "бывший".	143:152	0:162
приставка	NOUN	1991-2017	2	приставка-105		Приставка д' указывала на аристократизм, но д'Ансельм мнил себя демократом.	0:9	0:75
приставка	NOUN	1918-1990	1	приставка-106		С другой стороны, основные законы, определяющие построение слов, проведены с неполной последовательностью: законы гармонии гласных и употребления согласных не так ясны, а главное, не так детализованы, как в тюркских языках; из закона о единстве окончания есть целый ряд исключений, т.е. таких случаев, где два грамматических окончания комбинируются вместе; в некоторых финнских языках допускаются при глаголах, кроме суффиксов и префиксы (приставки) и т.д. * Это положение наглядно иллюстрируется и символизируется музыкой.	439:448	0:523
приставка	NOUN	1918-1990	1	приставка-107		Но сумасшедший не дал ему ничего заметить. например, путем изменения окончания можно получить следующие слова: села, селась, селся, сели, селись, селися; путем изменения приставок -- присел, надсел, засел, приусел, приподза-сел, приподзаусел, приподнасел, приподнаусел и другие; смежно: надселся, надселась, подселись, приуселся, приусе-лась, приуселись, приуселися, приподзаселись, призаселся, приподзауселись, приподнаселся, приподнаселися.	170:179	0:442
приставка	NOUN	1918-1990	1	приставка-108		Сама приставка.	5:14	0:15
приставка	NOUN	1991-2017	2	приставка-109		"Диастереоизомеры этих соединений обозначаются приставками L-алло, и D-алло, причем буква указывает конфигурацию а -углеродного атома".	47:58	0:135
приставка	NOUN	1918-1990	1	приставка-110		Структурная мифология ставит своей целью выявление и анализ архетипических структур бессознательного, которые, несмотря на приставку "бес-", входят в то, что в гуссерлевой феноменологии мыслится как область действия самого сознания -- в отличие от того, что ему дается априорно, т. е. от эйдетики.	123:132	0:297
приставка	NOUN	1991-2017	2	приставка-111		Мировая литература населена множеством героев, зачастую весьма далеких от нас по своим воззрениям, нравам и обычаям, но в каждом из них заключена по меньшей мере одна доминирующая черта, позволяющая нам хотя бы короткое время прожить его жизнью, как если б она была частью нашей собственной, радоваться его взлетам и страдать от его бед и заблуждений; проще говоря, сочувствовать ему не в том уже несколько стертом бытовом значении слова, к которому мы приучены, а в том первичном, где приставка "со" еще не окончательно приросла к корню: со-чувствовать, со-переживать.	486:495	0:569
приставка	NOUN	1918-1990	1	приставка-112		Судя по обилию приставок "экс-", лояльность к легким наркотикам как-то связана с фактом ухода с государственной службы.	15:24	0:119
приставка	NOUN	1991-2017	2	приставка-113		Действительно, какие слова более свойственны нашей речи, -- такие, как "переплет", "переправить", или же такие, как "преткновение", "преступник", "предложить" Вопрос вполне осмысленный: первая из этих приставок чисто русского происхождения, вторая заимствована из древнеславянского языка.	201:210	0:288
приставка	NOUN	1918-1990	1	приставка-114		Таких корней в английском языке становится все больше и больше; значение суффиксов и приставок в нем снижается.	85:94	0:111
приставка	NOUN	1918-1990	1	приставка-115		Наконец, еще одна группа языков: эти широко пользуются суффиксами, приставками и окончаниями, для того чтобы односложные слова превратились в многосложные.	67:78	0:155
приставка	NOUN	1918-1990	1	приставка-116		Хотя их логистическая система носит приставку "микро-", она никак не отождествляется с размерами предприятий, а лишь свидетельствует об ориентации системы на определенную хозяйственную структуру, в рамках которой может быть не одно, а несколько предприятий, объединенных общими целями и одной стратегией.	36:45	0:304
приставка	NOUN	1991-2017	2	приставка-117		Вощев обратил внимание, что у калеки не было ног -- одной совсем, а вместо другой находилась деревянная приставка; держался изувеченный опорой костылей и подсобным напряжением деревянного отростка правой отсеченной ноги.	104:113	0:220
приставка	NOUN	1991-2017	2	приставка-118		Это число было днем тезоименитства царицы Марии, но на карте России уже был один Мариинск, и, дабы избежать путаницы, добавили приставку".	127:136	0:138
приставка	NOUN	1991-2017	2	приставка-119		Так ли это бесспорно На всех материалах поселений исследуемых культур присутствует керамика, которую действительно нельзя связать ни с какой другой, кроме скифской, поморской или гетской: горшки с раздутым туловом и ямочками по венчику, "поморские" типы с орнаментом "шахматными" защипами, фрагменты клошей, имитация черепками каменного ящика в погребениях, сосуды-приставки и др.	-1:14	0:380
