lemma	pos	date	grouping	identifier	description	context	indexes_target_token	indexes_target_sentence
приставка	NOUN	1991-2017	2	приставка-0		"ЛУКОЙЛ Рейсинг" в кольцевых автогонках, "ЛУКОЙЛ-Динамо" в гандболе, "ЛУКОЙЛ-Спартак" в водном поло, "ЛУКОЙЛ-Башкортостан" в спидвее и, наконец, футбольный "Спартак", невесть каким образом уберегшийся от назойливой приставки, -- все это сегодняшние игрушки нефтяников.	215:224	0:268
приставка	NOUN	1991-2017	2	приставка-1		Оно было занесено на Русь византийскими каменщиками еще в киевские времена и быстро исказилось по образцу русских слов с приставкой из-: так получилось слово известь и все его производные -- известняк, известка и пр.	121:131	0:216
приставка	NOUN	1918-1990	1	приставка-2		"Эти люди в такие минуты начинают говорить с приставкой " (")с" (")", -- подумал майор.	45:55	0:87
приставка	NOUN	1918-1990	1	приставка-3		Эта приставка: Ur! Urquelle, Urkunde, Urzeit, Urnacht.	4:13	0:54
приставка	NOUN	1918-1990	1	приставка-4		-- Выделим в словах приставки и суффиксы, -- сказала Вера Евстигнеевна.	20:29	0:71
приставка	NOUN	1918-1990	1	приставка-5		Для выявления же понятий мещанства, буржуазности -- приставка klein: klein-burgerlich.	52:61	0:86
приставка	NOUN	1918-1990	1	приставка-6		Приставка DC (Dual Control) означает качественный скачок в развитии системы.	0:9	0:76
приставка	NOUN	1991-2017	2	приставка-7		Можно ли придумать что-нибудь более лубочное, корявое, нелепое, неискусное, подрывающее собственное дело Что касается приставки насчет радио, то она так же наивна и нелепа (зачем Львов приехал к Корнилову как посланец министра-председателя), и, конечно, Керенский, со своей стороны, объявляет ее сплошной ложью.	118:127	0:311
приставка	NOUN	1991-2017	2	приставка-8		А приставки на упаковке типа "супра", "компакт", "микро", "ультра" указывают на то, что средство в полтора раза экономичнее того же CMC, но без приставок.	2:11	0:154
приставка	NOUN	1991-2017	2	приставка-9		Но не "Меганов" и "Рено-19", а седана "Символ", который раньше с приставкой "Клио" поставлялся в Россию с турецкого завода "Рено".	65:75	0:130
приставка	NOUN	1918-1990	1	приставка-10		А если всерьез -- есть основания предположить, что слово "паперть" ведет происхождение от симбиоза греческой приставки "пара" со значением "около", "возле" и латинского слова "порта" -- "ворота".	109:118	0:195
приставка	NOUN	1991-2017	2	приставка-11		Он сделал это без возражений, изящно добавив к своей фамилии приставку "Ска".	61:70	0:77
приставка	NOUN	1991-2017	2	приставка-12		А если так, то счастливого владельца такой приставки при переключении программ ждет жуткая какофония из парфюмерных запахов телереклам, пороховых дымов сводок новостей и ароматов свинофермы из передачи "Сельский час".	43:52	0:217
приставка	NOUN	1991-2017	2	приставка-13		-- Вы никак не могли знать, как не могли этого знать и те, кто вас послал, что вилла альвиц давно вызывает у нас пристальный интерес, и мюнхенский узел ЕСИ много лет назад оборудован небольшой автоматической приставкой.	208:218	0:219
приставка	NOUN	1918-1990	1	приставка-14		А кроме того, была еще приставка присутствия -- ПП (я, автор, еще не сконструировал ее мысленно, но думаю, что Гелий сможет -- он все может, человек с КПД 1200 процентов).	23:32	0:171
приставка	NOUN	1918-1990	1	приставка-15		(Этой приставкой буквы "Д" большинство русских нетитулованных дворян стремились подчеркнуть во Франции свою принадлежность к аристократии, не учитывая, что эта приставка для французских дворян произошла от родительного падежа названия того замка, который принадлежал данной семье.	6:16	0:280
приставка	NOUN	1991-2017	2	приставка-16		А спустя несколько лет зачадила перестройка и стало не до каких-то там приставок и ледоломов.	71:80	0:93
приставка	NOUN	1991-2017	2	приставка-17		Мешок с камнями (обычный мешок с обычными камнями), банка засахаренного меда без крышки, крупа перловая в бумажном пакете (с дырочкой в левом боку), книга "Домоводство" 1911 года издания, коробка с разобранными коммуникаторами, разбитая игровая приставка, моль (живая) и восемь пачек папирос.	245:254	0:292
приставка	NOUN	1918-1990	1	приставка-18		А что изменилось На месте того автомата с самодельной приставкой стоит современный, купленный в ФРГ и налаженный еще в 1985 году зарубежными специалистами.	54:64	0:155
приставка	NOUN	1918-1990	1	приставка-19		Очень заинтересовали меня "Слова беззаконники": в них нашел я ценный материал для нового издания одной своей книжки (есть у меня такая книжка: "От двух до пяти"), но больше всего пришлась мне по душе глава "Капризы суффиксов и приставок" -- об ограничении сферы суффикса "н" и о том, как предлог преобразуется в приставку (в таких словах, как Поволжье, настольный и проч.	312:321	0:371
приставка	NOUN	1991-2017	2	приставка-20		В Советском Союзе это кино очень любили показывать: любуйтесь, дескать, на нравы современных буржуа -- им что приставку игровую, что человека купить.	110:119	0:149
приставка	NOUN	1991-2017	2	приставка-21		Представление о том, что все лучшее должно непременно иметь приставку "евро" стало с подачи СМИ для массового сознания настолько привычно, что работы, производимые в квартирах российских обывателей молдавскими и украинскими гастарбайтерами, именуются не иначе, как "евроремонтом", а реклама неизменно предлагает "евроокна", "евродвери" и т. п. На политическом уровне в вопросах законодательства, политической и социальной практики нас неизменно призывают брать пример именно с европейских стран, а не с Америки, уподобить свои общественные институты существующим в Евросоюзе, а не в США.	60:69	0:587
приставка	NOUN	1918-1990	1	приставка-22		В блоке с калибровочными станками используется также фрезерная приставка к головной лесопильной раме.	63:72	0:101
приставка	NOUN	1918-1990	1	приставка-23		По их авторскому свидетельству 287532 от 1970 года виброустройство выносится на отдельную приставку, толкаемую ледоколом, -- вибрация действует только на нее.	90:99	0:158
приставка	NOUN	1918-1990	1	приставка-24		В центре внимания "пространственных" исследований находятся предлоги, приставки и адвербиальные модификаторы глаголов.	70:79	0:118
приставка	NOUN	1991-2017	2	приставка-25		10 -8 г, а РНК -- 1,5 . 10 -9 г. Есть правда, простой способ избежать степеней в этих величинах -- перейти к другим единицам измерений, сделав лишь соответствующие приставки: микро -- 10 -6 , пико -- 10 -12.	164:173	0:207
приставка	NOUN	1918-1990	1	приставка-26		Вернее, это не телефон, а только усилительная приставка к обычному телефону.	46:55	0:76
приставка	NOUN	1918-1990	1	приставка-27		До чего дошло дело: передачи по радио для любителей русского языка: "Труженики-суффиксы и работяги-приставки".	-1:16	0:110
приставка	NOUN	1991-2017	2	приставка-28		Восприятие слова на слух -- не простой процесс, лингвистические модели слов состоят из частей слова (скажем, приставка-корень-суффикс-окончание), а они в свою очередь из звуков и их сочетаний (фонем).	109:140	0:200
приставка	NOUN	1991-2017	2	приставка-29		Запомним также две приставки, которые могут нам пригодиться: немного -- oligo- (олигарх).	19:28	0:89
приставка	NOUN	1918-1990	1	приставка-30		Все эти приставки придают русской речи столько богатейших оттенков.	8:17	0:67
приставка	NOUN	1918-1990	1	приставка-31		В приставке на подшипниках установлен вал, на свободном конце которого закрепляют патрон от дрели.	2:11	0:98
приставка	NOUN	1918-1990	1	приставка-32		Вторая -- очень чувствительная усилительная приставка, помещенная в цилиндрическом кожухе.	44:53	0:90
приставка	NOUN	1918-1990	1	приставка-33		Это достигается заменой передней линзы на увеличительную приставку, состоящую из двух оптических каналов -- инфракрасного и видимого света.	57:66	0:139
приставка	NOUN	1991-2017	2	приставка-34		Выйдет с бюллетеня -- надеюсь, приставка "и.о." исчезнет.	31:40	0:57
приставка	NOUN	1991-2017	2	приставка-35		Так же в свое время приходилось приобретать приставки, позволявшие смотреть передачи дециметрового диапазона.	44:53	0:109
приставка	NOUN	1991-2017	2	приставка-36		ГОСУДАРСТВО У НАС ВНЕ ЭКОНОМИКИ Жизнь идет без правительства и без реформ Трехлетие пребывания Владимира Путина на посту главы государства без приставки "исполняющий обязанности" пресса ознаменовала вялой дискуссией о причинах его высокого рейтинга.	143:152	0:249
приставка	NOUN	1991-2017	2	приставка-37		Для подключения телетайпов к телефонной сети разработаны приставки "модем" ("модулятор -- демодулятор").	57:66	0:104
приставка	NOUN	1918-1990	1	приставка-38		Гидравлический подъемник может быть изготовлен под тележки объемом 200 или 300 л. Шприцы KS имеют широкий спектр дополнительных приспособлений: -- поддерживатель оболочки; -- перекрутчик; -- устройства для надевания оболочки (настольное или устанавливаемое на шприц); -- приемная воронка с возможностью подогрева или охлаждения; -- револьверная головка с функцией перекрутки; -- двойной выпускной штуцер (двойная цевка с раздельным управлением); -- приставка-волчок; -- одноручьевые и пятнадцатиручьевые гильотины; -- насадки для производства спагетти и многое другое.	449:464	0:568
приставка	NOUN	1991-2017	2	приставка-39		Еще был звукорежиссер Феликс, который сам собирал ревербераторы -- не из магнитофонной приставки "Нота", как у всех, а самостоятельной разработки.	87:96	0:146
приставка	NOUN	1991-2017	2	приставка-40		Главное меню и основные закладки электронного атласа авиационных ГТД (www.ad.ugatu.ac.ru) Абстрактный пользовательский интерфейс в Java 2 Platform, Micro Edition: определение, задачи, принципы работы Рассмотрены определение, задачи и принципы работы абстрактного пользовательского интерфейса, предназначенного для применения в пользовательских устройствах с ограниченным ресурсом (таких как мобильные телефоны или телевизионные приставки) в Java 2 Platform, Micro Edition.	428:437	0:472
приставка	NOUN	1991-2017	2	приставка-41		...В 1970 году инженер Московского речного пароходства Г.Я. Сербул разработал ледокольную приставку ЛПС-14, которая, по сути, представляла собой усовершенствованный "ведермановский башмак".	90:99	0:189
приставка	NOUN	1991-2017	2	приставка-42		Зато приставка у Марго была лучше моей -- со стереоочками вместо дисплея.	5:14	0:73
приставка	NOUN	1991-2017	2	приставка-43		Сама помню себя, страдающей по "домам Барби" и "приставкам", но при этом помню, что очень чётко осознавала, что мои родители дают мне свободу, меньше диктуют и запрещают, чем другим и всячески поощряют творчество.	48:58	0:213
приставка	NOUN	1918-1990	1	приставка-44		И находил, что глагол "вести" можно употреблять со всеми этими приставками: навести, привести, завести, увести, свести и т. д. и т. п. Оглядывая присутствующих художников слова взглядом покорителя Эвереста, спрашивал: "Можете себе представить, какую работу проделал Толстой со всеми глаголами, чтобы найти именно тот глагол, к которому подходят все приставки" Заканчивал выступление по-сталински: "Надо писать просто, заботиться о том, чтобы нас прочли и поняли миллионы.	63:74	0:471
приставка	NOUN	1991-2017	2	приставка-45		Он расположил в носовой приставке камеры сгорания, которые соединены через клапаны с каналами, направленными вверх.	24:33	0:115
приставка	NOUN	1991-2017	2	приставка-46		И очень многим предпринимателям хочется дожить до победного финала объявленных преобразований без приставки -- "бывший".	98:107	0:120
приставка	NOUN	1991-2017	2	приставка-47		Также Дыбаль заметил, что Николай Сенкевич, исполняющий обязанности гендиректора, имеет все шансы в скором времени избавиться от приставки "и.о.".	129:138	0:146
приставка	NOUN	1918-1990	1	приставка-48		И разве не изумительно, что ребенок уже на третьем году своей жизни вполне овладевает всем этим обширным арсеналом приставок и великолепно угадывает значение каждой из них.	115:124	0:172
приставка	NOUN	1918-1990	1	приставка-49		Тем более что подобная приставка, сама по себе компактная, почти не снижает маневренности судна и придает "ледокольные свойства" любому кораблю.	23:32	0:144
приставка	NOUN	1918-1990	1	приставка-50		И хотя в отдаленной перспективе телевизионным приставкам прочат исчезновение с рынка (в частности, потому что производители телевизоров все чаще встраивают в них функции подключения к сетям платных операторов), в GS Group убеждены: полный отказ от телевизионных приставок наступит еще не скоро, и особенно хорошие перспективы продажи такого оборудования имеют в странах, где платное спутниковое и кабельное телевидение часто находится на начальном этапе развития.	46:56	0:463
приставка	NOUN	1991-2017	2	приставка-51		Патрон снимают с дрели, а к ней подсоединяют приставку.	45:54	0:55
приставка	NOUN	1918-1990	1	приставка-52		Ибо я не собираюсь вести здесь базар о том, как повесить на машину неоновые трубки или поставить игровую приставку в салон.	105:114	0:123
приставка	NOUN	1991-2017	2	приставка-53		-- А нельзя ли без этой приставки -- Нельзя, -- решительно сказал Леня, и брови его сошлись в прямую черту.	24:33	0:107
приставка	NOUN	1918-1990	1	приставка-54		Имевшие чин сердар-экрем, мушир, ферик и мирлива получали почетную приставку к имени "-паша"; миралай и каймакам -- "-бей"; юз-баши, кол-агаши, бимбаши -- "-ага"; мулязим-зализе, мулязим-зани, мулязим-эуэль -- "-эфенди".	67:76	0:220
приставка	NOUN	1991-2017	2	приставка-55		Звали его, кажется, Мишей, и был он русский до мозга костей, несмотря на фамилию и приставку "фон", которую он постоянно выпячивал в разговоре, надувая губы и многозначительно поглядывая на нас.	83:92	0:194
приставка	NOUN	1918-1990	1	приставка-56		Ирония приставки заключалась в том, что наши гончие, подняв зайца, очень скоро возвращались назад.	7:16	0:98
приставка	NOUN	1918-1990	1	приставка-57		-- Кто, ребята, поможет Нине Первой ответила Майя Башмакова: -- Корень -- "друг", приставка -- "по", окончание -- "а".	82:91	0:118
приставка	NOUN	1918-1990	1	приставка-58		Как вдумчивый педагог, приводил десятки примеров из опыта Толстого, скажем, упражнения в грамматических формах приставок: на, при, за, у, с, под, от, раз, об, вз, до, в, из, вы, пере, про, по -- в сочетании с соответствующими глаголами.	111:120	0:236
приставка	NOUN	1991-2017	2	приставка-59		Судя по всему, они были коммерсанты, получившие дворянство и приставку "Борисовы".	61:70	0:82
приставка	NOUN	1918-1990	1	приставка-60		Как заместитель, с приставкой и.о. -- исполняющий обязанности.	19:29	0:62
приставка	NOUN	1991-2017	2	приставка-61		На этой линии вырабатывается трехкантный брус, который затем подается в пятипильный ленточный станок с фрезерной приставкой.	113:123	0:124
приставка	NOUN	1918-1990	1	приставка-62		Любопытно узнать, каково значение незнакомых нам выражений: "Никита-ста" и "Василий-су" В те далекие времена приставки "су" и "ста" на самом деле придавали обращению вежливость и почтительность.	109:118	0:194
приставка	NOUN	1918-1990	1	приставка-63		На приставке небольшая ручка регулирования громкости.	3:12	0:53
приставка	NOUN	1918-1990	1	приставка-64		На пермской междугородной переговорной станции ко всем телефонам-автоматам, выпускаемым каунасским заводом, подсоединены приставки, с помощью которых с одного автомата можно звонить к абонентам не одной, а шести тарифных зон.	121:130	0:225
приставка	NOUN	1918-1990	1	приставка-65		-- На что это ты так углазилась В этих глаголах меня особенно восхищают приставки, виртуозно придающие каждому слову именно тот оттенок экспрессии, какой придает им народ.	72:81	0:171
приставка	NOUN	1991-2017	2	приставка-66		Например, что приставка "не" не воспринимается психикой.	14:23	0:56
