lemma	pos	date	grouping	identifier	description	context	indexes_target_token	indexes_target_sentence
вино	NOUN	1918-1990	2	вино-0		Возьми, -- скажем, -- господин атаман, своего казака, а нас за то, что сохранили целым, угости вином.	95:100	0:101
вино	NOUN	1918-1990	2	вино-1		Как я наслаждался возможностью одному ходить по улице, есть много хлеба, пить вино и видеть прекрасные лица близких.	78:82	0:116
вино	NOUN	1918-1990	2	вино-2		"И вот приходит еще один вестник к Иову и говорит ему: сыновья твои и дочери твои ели и пили вино в доме первородного брата твоего: и вот большой ветер пришел из пустыни и охватил четыре угла дома, и дом упал на них, и они умерли..."	93:97	0:233
вино	NOUN	1918-1990	2	вино-3		Но он в полной неприкосновенности сохранил свою Русскую душу и несет ее, как чашу переполненную драгоценным вином, полную горячей любви к Родине и ее олицетворению в вашем лице.	108:113	0:177
вино	NOUN	1682-1916	1	вино-4		-- Бог даст, и я вам отслужу, -- сказал он, допивая вино.	52:56	0:57
вино	NOUN	1682-1916	1	вино-5		14 к.; продажная цена: навынос 3 р. 80 к., с распитием -- 5 р., а так как больше всего продается вино с распитием, то барыш оказывается почти неслыханный.	97:101	0:154
вино	NOUN	1918-1990	2	вино-6		-- Все ты со своим вином.	19:24	0:25
вино	NOUN	1918-1990	2	вино-7		Ты сыт и даже получаешь в умеренном количестве вино.	47:51	0:52
вино	NOUN	1682-1916	1	вино-8		-- И вино лилось в келье от зари до зари.	5:9	0:41
вино	NOUN	1682-1916	1	вино-9		Он сказал мне, что в Испании, -- и это я еще прежде слышала, даже читала, -- что в Испании есть какой-то необыкновенный остров, кажется Малага, -- одним словом, похоже на какое-то вино, -- где не только грудные, но даже настоящие чахоточные совсем выздоравливали от одного климата, и что туда нарочно ездят лечиться, разумеется, только одни вельможи или даже, пожалуй, и купцы, но только очень богатые.	180:184	0:402
вино	NOUN	1918-1990	2	вино-10		-- Когда вы с Левонтием все вино это клятое выжрете И когда вы, язвило бы вас, захвораете чем-нибудь, чтоб пить нельзя, чтоб на сторону воротило.	28:32	0:145
вино	NOUN	1918-1990	2	вино-11		Они были так богаты мясом, шерстью, рыбой и вином, так густы лесами и широки полями, что дух у Волка и изголодавшихся его подданных захватывало от предвкушений сытости.	44:49	0:168
вино	NOUN	1682-1916	1	вино-12		-- Отнеси вино отцу.	10:14	0:20
вино	NOUN	1682-1916	1	вино-13		В мое отсутствие матушка получила от новой своей соседки письмо на серой бумаге, запечатанной бурым сургучом, какой употребляется только на почтовых повестках да на пробках дешевого вина.	182:186	0:187
вино	NOUN	1682-1916	1	вино-14		-- Февраля 17, рано поутру, великий князь отправился в Москву; на первом стане, в Ямнах, угостил обедом архиепископа, бояр и житых людей новогородских; принял от них несколько бочек вина и меда; сам отдарил всех, отпустил с милостию в Новгород и приехал в столицу 5 марта.	182:186	0:272
вино	NOUN	1682-1916	1	вино-15		Кажется, недурно -- Но, -- скажет читатель, -- принимая вино, вы можете попробовать его вторично А на сей случай в корзине или подвешенные под юбками продавщицы имеются в запасе две-три бутылки хорошего вина, которые и будут ловко подсунуты вам как вторичная проба.	56:60	0:265
вино	NOUN	1682-1916	1	вино-16		-- Что-с как-с -- Да так, брат, чай бочки-то с ренским вином везут тебе из Крыма, а уж тут, брат, подсластить, да подкрасить сандальцом, да подпустить взварцу какого ни на есть не штука.	55:60	0:186
вино	NOUN	1682-1916	1	вино-17		Все потягивали водку, вино или пиво.	22:26	0:36
вино	NOUN	1682-1916	1	вино-18		А когда уйдут спрашиватели, мы возьмем да двадцать рублей отдадим кесарю, а из других двадцати десять возьму я себе за выдумку, а остальные десять -- вам на вино.	157:161	0:162
вино	NOUN	1682-1916	1	вино-19		Он успокоился, а я пошла в столовую за вином.	39:44	0:45
вино	NOUN	1918-1990	2	вино-20		Аркадий заказал шашлык и вино, Смагин подошел к окну, выходящему на Куру.	25:29	0:73
вино	NOUN	1918-1990	2	вино-21		Бросив бутылку в сторону рыбинспекторской лодки, он еще крикнул: "Двенадцать коп стоит!", и, решив, что такого куража недостаточно, выбрал самую крупную стерлядь, помахал ею, притопывая и напевая: "А-а-ах ты, м-моя дор-рога-а-ая-а, а-а-ах ты, з-зо-ло-та-ая!" Торжество быстро его утомило, погоня напряженной была, да и встал ни свет ни заря, вино, опять же, некачественное пил -- нудит под ложечкой, правда что "менингитник"...	342:346	0:427
вино	NOUN	1682-1916	1	вино-22		Богучаров нам объясняет: в совхозе со времен барона был заведен порядок -- под зарплату выдавалось вино.	99:103	0:104
вино	NOUN	1918-1990	2	вино-23		Потом появлялось и вино: именинник напивался как стелька и непременно ходил по казармам, покачиваясь и спотыкаясь, стараясь показать всем, что он пьян, что он "гуляет", и тем заслужил всеобщее уважение.	19:23	0:202
вино	NOUN	1682-1916	1	вино-24		В Варшавском собрании офицеров Генерального штаба состоялись проводы -- "дорожный посошок" -- бокал вина и поднесение мне подарка -- хорошего револьвера.	100:104	0:153
вино	NOUN	1918-1990	2	вино-25		Собеседники сидели за столом без шапок, но стольники и бояре, смотревшие при столе за порядком и наряжавшие вина, равно как и вся прислуга, были в шапках.	108:112	0:154
вино	NOUN	1918-1990	2	вино-26		В начале 1929 года, когда в нашей стране пошли неурядицы в связи с первой пятилеткой, с индустриализацией, с началом коллективизации, наши вожди стали искать виновников этих неурядиц, сваливали вину на вредителей, на бывших людей, на троцкистов -- словом, на кого угодно, только не на самих себя!	158:168	0:296
вино	NOUN	1918-1990	2	вино-27		Глядя на них, старик думал о том, что вот уже восьмая пара птиц клюёт на его глазах божье зерно; вот уже он не может сделать лишнего глотка вина без опасения головной боли; вот уже и заботливо приготовленный старой баварской монахиней сухарик не лезет в горло потому, что опять не удалось очистить желудок.	140:144	0:306
вино	NOUN	1682-1916	1	вино-28		Везде видны были кучи мяса и рыбы, бочки с вином и пивом и люди пресыщенные, которых все занятие состояло, казалось, в истреблении съестных припасов.	43:48	0:149
вино	NOUN	1682-1916	1	вино-29		Слышим обманный тот звон, видим вино, знаем, какое на глаз, но ведь надо испить его.	32:36	0:84
вино	NOUN	1682-1916	1	вино-30		Владелец бобров оказался не простым торговцем: его универсальный магазин соединен был с гостиницей, самым же главным источником его дохода была торговля контрабандным вином.	167:172	0:173
вино	NOUN	1918-1990	2	вино-31		Ей ничего не стоит ударить гостя по лицу или бросить ему в глаза стакан, наполненный вином, опрокинуть лампу, обругать хозяйку.	85:90	0:127
вино	NOUN	1918-1990	2	вино-32		Возвратились в СССР южные винодельческие районы, которые были отторгнуты, появились хлебные излишки на самогон, снят запрет, были допущены в продажу виноградные вина, слабые наливки и пиво, появился НЭП.	26:40	0:203
вино	NOUN	1918-1990	2	вино-33		В вертикальной колонке карточки были проставлены названия бордоских вин, подразделенных по качествам на четыре "крю" -- группы, а в горизонтальной -- года выхода вин за последние тридцать лет; в образованных от пересечения клеточках были указаны цены от пяти до ста франков за бутылку.	68:71	0:285
вино	NOUN	1682-1916	1	вино-34		Вот Алеша поехал с коряковым зятем, на степь повезли вино, в долг у татар заняли.	53:57	0:81
вино	NOUN	1918-1990	2	вино-35		Язык этот наводит, правда, временный трепет, но никак не сознание и убеждение в вине; без сознания же и убеждения, одни наказания для примера мало приносят пользы, а раздражают и ожесточают.	80:84	0:190
вино	NOUN	1918-1990	2	вино-36		Вот почему Премудрость строит дом, закалывает жертву, растворяет вино и устраивает трапезу, отдавая при этом приказание слугам звать на пир: "кто неразумен, обратись сюда".	65:69	0:172
вино	NOUN	1918-1990	2	вино-37		Фельдфебель выставил замысловатые вина: французские, польские, венгерские и румынские -- трофеи.	34:38	0:96
вино	NOUN	1682-1916	1	вино-38		Вот приедешь в следующий раз -- я тебе приготовлю горшок вина".	57:61	0:63
вино	NOUN	1918-1990	2	вино-39		Мей был по-своему ценитель и знаток стиха, и не его вина, что он остался одинок в своих ранних для того времени попытках.	52:56	0:121
вино	NOUN	1682-1916	1	вино-40		Вот, например, замечательная деталь, характеризующая метод построения всего спектакля: услужливый провокатор и полицейский чин Мокроусов почтительно стоит за спиной своих распивающих вино и совещающихся господ -- у портрета Александра III.	183:187	0:239
вино	NOUN	1918-1990	2	вино-41		Удобств больше: на станциях, где нет буфетов (буфетов от Берлина до Парижа не более 4-х), -- продают всё на лотках, даже вино, херес, мадеру в маленьких бутылочках рюмки в 2, за 7 1/2 зильбер грошей (1 з. гр -- 3 коп.).	121:125	0:219
вино	NOUN	1682-1916	1	вино-42		Главная вина в этом сваливалась на союзников: немцы, мол, не перестают перебрасывать свои силы с Западного фронта на Восточный, но что это были за силы и какой был их состав, авторы телеграммы, разумеется, не указывали, и я мог лишний раз убедиться, что мои донесения о перебросках в расчет не принимались.	8:12	0:306
вино	NOUN	1918-1990	2	вино-43		Выпитое вино сделало его откровеннее.	8:12	0:37
вино	NOUN	1918-1990	2	вино-44		Графин вина нальет и с рук не пускает.	7:11	0:38
вино	NOUN	1918-1990	2	вино-45		Заграница, представленная корреспондентами крупнейших газет и телеграфных агентств всего мира, чинно налегла на хлебное вино и с ужасной вежливостью посматривала на ударников в сапогах и на советских журналистов, которые по-домашнему явились в ночных туфлях и с одними запонками вместо галстуков.	120:124	0:296
вино	NOUN	1682-1916	1	вино-46		Едва мальчишки перевели ему это, как он вышел вон и вскоре воротился с кружкой другого вина.	87:91	0:92
вино	NOUN	1682-1916	1	вино-47		Народ это знает, и в деревнях и на базарах так толкует: "Так не будем же пить, -- дадим зарок; пускай их откупщики да целовальники сами выпьют все вино, а мы не хотим, не станем".	147:151	0:179
вино	NOUN	1682-1916	1	вино-48		Еще с двадцатых годов у нас неизменно пели под гитару песню: Когда с друзьями, да пью вино я, Порой роню в стакан слезу, И вспоминаю я старца Ноя За виноградную лозу.	86:90	0:166
вино	NOUN	1918-1990	2	вино-49		.. стакан вина, -- хрипло бормотал он, облизывая сухие, как вата, губы.	10:14	0:71
вино	NOUN	1682-1916	1	вино-50		Заплакала, в лицо мне плюнула, но согласилась, приняла вину!	55:59	0:60
вино	NOUN	1682-1916	1	вино-51		А как вам кажется это вино Пушкин (запинаясь, но из вежливости): Ничего, кажется вино порядочное.	22:26	0:97
вино	NOUN	1682-1916	1	вино-52		И было ему здесь имя Дионис, -- Дионис или Вакх, -- тот самый Вакх, Бахус, который обычному представлению рисуется беззаботным кутилою, веселым богом вина и пиров.	150:154	0:163
вино	NOUN	1682-1916	1	вино-53		По рассмотрении волостным судом проступка, подлежащего его обсуждению, вписываются в упомянутую выше (ст.91) книгу: имя виновного, самая вина его и мера наложенного на него взыскания.	120:129	0:183
вино	NOUN	1918-1990	2	вино-54		И для того тихого вина бери ты апотечную коробочку.	18:22	0:51
вино	NOUN	1918-1990	2	вино-55		Стенька, его присные, его воинство были пьяны от вина и крови.	49:53	0:62
вино	NOUN	1918-1990	2	вино-56		И первое место в их обрядности занимало нечто поразительное по своей красивой осмысленности: в торжественной процессии миловидный мальчик, оба родителя которого были в живых (amphithales), нес масличную ветвь, увешанную плодами, булочками, кувшинчиками с елеем, медом и вином, одним словом, дарами и Деметры, и Диониса, и Pаллады; это была "иресиона".	270:275	0:351
вино	NOUN	1918-1990	2	вино-57		А что может поделать катепан Согласно договору, заключенному еще в прежние времена, на русские ладьи доставили положенное иждивение: хлебы, мясо, рыбы, вино, различное зелие, соль, а также корабельные снасти и принадлежности.	152:156	0:225
вино	NOUN	1682-1916	1	вино-58		Изредка, взобравшись по рыхлой земле на взлобок, он оставлял на минуту соху и шел к овражку напиться из бутылки воды, заправленной слегка белым вином.	144:149	0:150
вино	NOUN	1682-1916	1	вино-59		-- Вина, Рогожкин! -- сказал он, как бы просыпаясь от неприятного сновидения и приходя в деланный азарт, -- вина, черт побери, вина!	3:7	0:132
вино	NOUN	1682-1916	1	вино-60		Кроме четырнадцати поездок в Кисловодск, мы еще ездили с четой Кауфман на тройках в итальянскую колонию, славящуюся своим вином, и с князем и Васильковскими на моторе в Пятигорск к Провалу.	122:127	0:189
вино	NOUN	1918-1990	2	вино-61		Здесь были цветы, вино, песни и даже было сочинено наскоро величанье "покровителю художников".	18:22	0:94
вино	NOUN	1682-1916	1	вино-62		Любит плясать, петь, нюхает табак, пьет вино.	40:44	0:45
вино	NOUN	1682-1916	1	вино-63		Приняв поздравления от бояр и всяких чинов людей, государи угощали в столовой избе бояр, окольничих, думных и ближних людей водками и ренским вином.	142:147	0:148
вино	NOUN	1682-1916	1	вино-64		Мало у нас сухарей, мало и вина, а вода в колодцах, ну ее к черту, соленая.	27:31	0:75
вино	NOUN	1918-1990	2	вино-65		Сюда принадлежат все казенные сборы, соль, вино, управление казенными крестьянами, лесоводство, часть строительная.	43:47	0:115
вино	NOUN	1918-1990	2	вино-66		Мать послала отца за вином.	21:26	0:27
вино	NOUN	1918-1990	2	вино-67		Даже вино не помогло.	5:9	0:21
вино	NOUN	1682-1916	1	вино-68		Мелкими глотками смаковал вино, бросал в рот миндалины, жевал крепкими белыми зубами.	26:30	0:85
вино	NOUN	1918-1990	2	вино-69		Три дня изменники пробыли в Гуще, грабили наездами всю окрестность; пьянствуя днем и ночью, выпили несколько бочек вина и несколько десятков бочек меда, потчевали моих и соседних хлопей, остальное пораздавали им.	115:119	0:212
вино	NOUN	1682-1916	1	вино-70		Мусоргский должен был оглушаться вином, чтоб слышать голос своего гения в глубине души, понимаете Клим Самгин считал этого человека юродивым.	33:38	0:141
вино	NOUN	1918-1990	2	вино-71		Я заранее приглашаю тебя на прокурорский обед, и будь уверен, что ты всегда найдешь у меня кусок сочного "бульи", и стакан доброго вина!	131:135	0:136
вино	NOUN	1682-1916	1	вино-72		На мой вопрос, почему они покупают сантуринское, а не водку, я получил в ответ, что от употребления хлебного вина, по причине его непомерной дороговизны и недоброкачественности, они отказались всем миром и что в случаях свадеб и пр. они покупают сантуринское.	109:113	0:259
вино	NOUN	1682-1916	1	вино-73		Он знал, что хорошею денежною платою от майора поживиться ему было нельзя, потому что сам Максим Кириллович давно уже не видал у себя лишней копейки; для сего честный еврей, с обыкновенными жидовскими уловками и оговорками, сделал следующее предложение: вместо денег получать от майора -- безделицу, как говорил Ицка Хопылевич -- третью мерку хлеба, получаемого за помол, и это в продолжение двух лет; да безденежное позволение содержать шинок на майоровой земле и подле самой мельницы, тоже на два года с тем, что Ицка нигде, кроме майоровой винокурни, не будет покупать вина, а Максим Кириллович будет ему делать на каждом ведре вина тоже незначительную, по еврейскому смыслу, уступку.	543:552	0:687
вино	NOUN	1682-1916	1	вино-74		На поверхности были отмечены двенадцать часов или эпох, составляющих скотиниотские сутки, а в нижней половине сосуда находился рожок или горлышко, чрез которое выпивалось вино постепенно после каждого часа, для предохранения сосуда от ржавчины; ибо этот металл имел такое свойство, что портился от одного вина и был невредим целые веки, если вино переменяли часто.	171:175	0:364
вино	NOUN	1682-1916	1	вино-75		Дал, кряхтя, золотого вина, дал -- пролитого в кружку.	22:26	0:54
вино	NOUN	1918-1990	2	вино-76		Никогда не надо пить спирта и вино одновременно.	30:34	0:48
