lemma	pos	date	grouping	identifier	description	context	indexes_target_token	indexes_target_sentence
вино	NOUN	1918-1990	2	вино-77		Следующий кадр, в котором участвует Анна Андреевна, -- это несносное ожидание Харджиева: он обещал приехать и привезти вина, но непростительно опоздал, как умели опаздывать только москвичи, когда ни у кого не было часов, а трамваи и автобусы ходили как попало.	119:123	0:260
вино	NOUN	1682-1916	1	вино-78		Никулин пил испанское вино и говорил об испанских диалектах.	22:26	0:60
вино	NOUN	1918-1990	2	вино-79		Мы уже не раз видели участие князя в неправых делах, даже в преступлении: но народный эпос постоянно отдает ему справедливость в том, что он сознается в своей вине и стыдится дурных поступков.	159:163	0:192
вино	NOUN	1682-1916	1	вино-80		Но я не стал пить его вино, попрощался и ушел.	22:26	0:46
вино	NOUN	1918-1990	2	вино-81		Взяло меня горе, ударился я в кабак, стал вином душу отводить -- ничего не помогает, все гложет сердце.	42:47	0:103
вино	NOUN	1682-1916	1	вино-82		Однажды после спектакля он повез меня к себе домой, угостил заграничным вином и познакомил с ней.	72:77	0:97
вино	NOUN	1918-1990	2	вино-83		Много Петр о ней думал, но, видно, о Бругманне думал Петр еще больше; ну, сидел бы там с Бругманном у себя, а то в Целебеево ушел искать общества, и какого общества С батюшкой ушел балагурить, ушел перешучиваться с попадьей; значит, у него поповская кровь Нет, этого она не может думать, не хочет; нет, это все дурные мысли такие пришли, бабкины мысли: разве она не знает, что совсем особенный Петр Нет, не подумает она вовсе, чтоб мог он и вино там, у батюшки, пить, знает хотя, наверное Катя знает, что Петр уже напивался не раз, как в роковой для нее вечер, в городе.	441:445	0:570
вино	NOUN	1682-1916	1	вино-84		Он взглянул на серое дождливое небо в окошке, на глупую морду поросенка, на кислый осадок скверного вина в оловянном кубке, на грязных солдат -- и злоба овладела им.	100:104	0:165
вино	NOUN	1682-1916	1	вино-85		Пустит, и вином угости матроса.	10:15	0:31
вино	NOUN	1918-1990	2	вино-86		Он выпил вина и кричал отдельными фразами: -- Мы обрекаем этот народ на вымирание.	9:13	0:82
вино	NOUN	1918-1990	2	вино-87		Свежий запах вина и жареной картошки обдает меня.	13:17	0:49
вино	NOUN	1682-1916	1	вино-88		Он снял с нее шубу и калоши и в это время ощутил запах белого вина, того самого, которым она любила запивать устриц (несмотря на свою воздушность, она очень много ела и много пила).	62:66	0:181
вино	NOUN	1682-1916	1	вино-89		Он пил, за вино готов был на все.	11:15	0:33
вино	NOUN	1918-1990	2	вино-90		Она несложна: пять-шесть партий в беллот, во время которых профессор будто бы не замечает, что партнер его не прочь приписать на свой счет десять-пятнадцать туров красного вина или перно, взятых Симоновым как бы по ошибке на себя, а особенно искренняя, горячая любовь профессора к Франции и французам -- вот узы этой прочной дружбы, на которую уповает хитрый старый эмигрант.	172:176	0:375
вино	NOUN	1918-1990	2	вино-91		Лист и теперь, несмотря на старость и духовное звание, случалось, выпивал бутылку-другую вина и тогда становился особенно очарователен.	89:93	0:135
вино	NOUN	1682-1916	1	вино-92		Опасно стало в погребе иметь вино, и папа спешно его распродал.	29:33	0:63
вино	NOUN	1682-1916	1	вино-93		-- Нет, пьян напился, и водку и вино -- все выпил и лег спать, -- отвечал постоялец.	32:36	0:84
вино	NOUN	1918-1990	2	вино-94		После этого незнакомец подозвал официанта и по-грузински заказал ему бутылку вина и по порции цыплят табака на всех.	77:81	0:116
вино	NOUN	1918-1990	2	вино-95		До сих пор он наливал вино из жалости.	22:26	0:38
вино	NOUN	1918-1990	2	вино-96		Потом, пока позавтракала (опять с красным вином), пока запрягла, часу в двенадцатом только выехала.	42:47	0:99
вино	NOUN	1918-1990	2	вино-97		Чтения сопровождались ужином с вином.	31:36	0:37
вино	NOUN	1682-1916	1	вино-98		Правительство рассчитывало извлечь выгоду, введя налог в 4 пара с каждой оки вина и в 8 пара с каждой оки водки.	77:81	0:112
вино	NOUN	1682-1916	1	вино-99		(Однако я ужасно много пью вина и болтаю.)	27:31	0:42
вино	NOUN	1918-1990	2	вино-100		При первом освящали водой, при втором -- вином.	41:46	0:47
вино	NOUN	1918-1990	2	вино-101		У него была одна забота: чтобы в кармане его всегда звенели те амулеты, которые могут заставить каждую минуту появиться стакан доброго вина".	135:139	0:141
вино	NOUN	1918-1990	2	вино-102		Приезжал честь по чести, с колокольцами, со сватами, с дружками, с вином сладким и с речами ладными, с присказками складными, а она, раскрасавица наша, чё Да ничё!	67:72	0:163
вино	NOUN	1918-1990	2	вино-103		В таких случаях огорченный пономарь обычно отправлялся на берег Темзы, в грязную харчевню своего приятеля Бена, и пил там пиво, если у него звенели в кармане штанов медные монеты, полученные от-какой-нибудь благочестивой вдовицы за своевременное возжжение лампады в день поминовения покойного, хотя этот простецкий напиток не мог, конечно, сравниться по вкусу и качеству с церковным вином.	383:388	0:389
вино	NOUN	1918-1990	2	вино-104		Разница с красным вином была значительная, но напиток, который можно было назвать жидким кисельком со спиртом, был настолько недурён, что мы решили приготовить его уже в большом количестве.	18:23	0:189
вино	NOUN	1918-1990	2	вино-105		Суп из щавеля, какие-то салаты, цыплята табака, вино, глясе.	48:52	0:60
вино	NOUN	1682-1916	1	вино-106		Ставят "покойников" как живых, утром и вечером поклоняются им и возливают вино.	74:78	0:79
вино	NOUN	1682-1916	1	вино-107		Девушка красивым движением голой руки, откинув лиловую тунику, плеснула вином -- и чашечка коттабы зазвенела, ударившись.	72:77	0:121
вино	NOUN	1682-1916	1	вино-108		Странный судовладелец наказывал запастись на дорогу едой и вином.	59:64	0:65
вино	NOUN	1918-1990	2	вино-109		Может быть, в них говорил маленький местный патриотизм И -- ах! -- нехорошо они в этот вечер подшутили над славными, веселыми итальянцами, когда те, в своей милой международной доверчивости, тыкали пальцами в хлеб, вино, сыр и в другие предметы и спрашивали их названия по-русски, скаля ласково свои чудные зубы.	215:219	0:312
вино	NOUN	1682-1916	1	вино-110		Там продаются красивые, нарядные бутылки с каким-то венгерским вином.	63:68	0:69
вино	NOUN	1918-1990	2	вино-111		Кумир его величиною превосходил рост человека, украшался одеждою короткою, сделанною из разного дерева; имел четыре головы, две груди, искусно счесанные бороды и волосы остриженные; ногами стоял в земле, и в одной руке держал рог с вином, а в другой лук; подле идола висела узда, седло, меч его с серебряными ножнами и рукояткою.	232:237	0:329
вино	NOUN	1682-1916	1	вино-112		Творите сие в Мое воспоминание не значит только: совершите церковную службу, приобщитесь чудом ставшим Плотью и Кровью Христовыми хлебу и вину; это значит: приобщитесь всему тому, всему без остатка, что представляет собой Тайная вечеря как образ Страстной седмицы.	138:142	0:264
вино	NOUN	1918-1990	2	вино-113		Хмельного в рот не берут, ни пива, ни вина, ни браги, ни даже сыченого квасу.	38:42	0:77
вино	NOUN	1682-1916	1	вино-114		То же самое мы видим и в новелле "Царь-чума" (пьяные матросы пируют в зачумленном квартале портового города), хотя здесь вино и пьяное буйство здорового тела в сюжете (но только в сюжете) одерживают победу над чумой и призраками смерти.	121:125	0:236
вино	NOUN	1918-1990	2	вино-115		Лаевский играл, пил вино и думал, что дуэль вообще глупа и бестолкова, так как она не решает вопроса, а только осложняет его, но что без нее иногда нельзя обойтись.	20:24	0:164
вино	NOUN	1682-1916	1	вино-116		Утром уже успел рухнуть поход мамин и Люсин за новогодним вином.	58:63	0:64
вино	NOUN	1918-1990	2	вино-117		По временам поворачивался он на другой бок, всегда с закрытыми глазами, нередко находился как бы в дремоте, часто просил пить красного вина, и всякий раз смотрел на свет, то ли ему подают.	135:139	0:188
вино	NOUN	1682-1916	1	вино-118		Этот ли мог быть соперником Годунову Как бы то ни было, правитель послал ему в подарок бутылку дорогого испанского вина, отведав которого Симеон через несколько дней ослеп, именно вследствие яда, примешанного к вину.	115:119	0:216
вино	NOUN	1682-1916	1	вино-119		Кончилась служба; выйдя с крестом, поп принялся одарять пузатыми просфорами помещицу Уткину, шесть спелых ее дочерей и тех из мужиков, кто побогаче да поважнее, у кого поновей зипун да сапоги со скрипом, кто мудростию своего ума сумел сколотить богатые хаты, скопить деньжищ тайной продажей вина либо мастерскими сделками -- словом, того, чей норов покрупнее да поприжимистее прочих; те подходили к честному кресту благолепно и чинно, не без достоинства склоняя бородатые лица с обрезанными в скобку волосами, пропитанными запахом деревянного масла; а когда отошли от амвона именитые сельчане, поп довольно-таки решительно загулял крестом по носам толпившихся зипунов (недаром шипела "учительша", будто ей, Шкуренковой, поп резанул крестом по зубам, так что зубы болели долго).	291:295	0:777
