lemma	pos	date	grouping	identifier	description	context	indexes_target_token	indexes_target_sentence
участок	NOUN	1918-1990	2	участок-73		Почему не хотят, как это принято делать при господствовании эпидемических зараз, разделить весь город на участки, учредить попечительства над каждым участком по выборам с особыми правами участковых попечителей Выборные от общества попечители должны иметь в своем распоряжении и известный отдел полиции и других помощников.	105:112	0:322
участок	NOUN	1682-1916	1	участок-74		Например, я раньше как-то сложно объяснял актрисе, отчего Раневская не хочет разбить имение на дачные участки и сдавать их.	102:109	0:123
участок	NOUN	1918-1990	2	участок-75		Александру Михайловну пригласили в участок, там еще раз записали все.	35:42	0:69
участок	NOUN	1682-1916	1	участок-76		Не позже девяти он должен был приехать на участок гидромеханизации, чтобы застать там Чарлиева.	42:49	0:95
участок	NOUN	1918-1990	2	участок-77		Новая "королева-королев" Париж ежегодно выбирает из кандидаток, выставляемых каждым городским участком, самую красивую женщину, которая является центральной фигурой во время карнавала.	94:102	0:184
участок	NOUN	1682-1916	1	участок-78		Но оказалось, что горная речка замерзала очень неспокойно и по ее руслу ровные участки льда часто прерывались очень неровными, на которых во время ледостава льдины громоздились одна на другую, напоминая в миниатюре торосы Ледовитого океана.	79:86	0:240
участок	NOUN	1918-1990	2	участок-79		Когда в стране поутихло, крестьяне, уцелевшие на местах или воротившиеся из бегов, увидели вокруг себя множество пустых дворов и дворовых мест с пахотными участками, еще не успевшими порасти лесом.	155:164	0:197
участок	NOUN	1918-1990	2	участок-80		Но, с другой стороны, возникает законный вопрос: как могло получиться, что дежурный по станции допускает ряд грубых нарушений правил технической эксплоатации на глазах у других Это можно объяснить только расхлябанностью, отсутствием бдительности, низким уровнем трудовой дисциплины на этом участке железнодорожного транспорта, низким уровнем политического и общественного развития отдельных работников транспорта.	4:5	0:413
участок	NOUN	1918-1990	2	участок-81		Образно говоря, у нее будто иссекли небольшой участок совершенно здорового мозга, не нарушив ничего остального.	46:53	0:111
участок	NOUN	1682-1916	1	участок-82		Однако когда работа была готова, пришла комиссия проверять результаты работы, меня за день до этого отодвинули на неокопанный еще участок обороны, служивший до этого стыком между ротами, а мой участок передали 1 взводу младшего лейтенанта Николаева.	130:137	0:249
участок	NOUN	1918-1990	2	участок-83		Прежде всего я бываю рад тому, что у вас все обстоит благополучно, а теперь к этому присоединяется и уверенность, что мужики вашего участка голодать уже не будут.	132:139	0:162
участок	NOUN	1682-1916	1	участок-84		Он попался впервые на глаза Лихонину, и студент с удивлением и брезгливостью читал эти строки, изложенные мертвым, казенным языком полицейских участков.	143:151	0:152
участок	NOUN	1682-1916	1	участок-85		Жили они чисто и зажиточно, никакой земледельческой работой лично не занимались; некоторые держали работников, а большинство отдавало свои земельные участки в кортому крестьянам.	149:156	0:178
участок	NOUN	1918-1990	2	участок-86		По ровным участкам, хотя и изборожденным застругами, собаки тянули быстро, так что люди на лыжах едва поспевали за ними.	10:18	0:120
участок	NOUN	1918-1990	2	участок-87		Расшифровываю: Мохов -- прораб, а "наделала" на его участке передовая бригада, выполнив норму на 140%, и теперь Мохова "задавят", увеличив производственный план очередного квартала.	52:59	0:181
участок	NOUN	1682-1916	1	участок-88		По укреплении в собственность участков и восстановлении законных собственников (ст. ст. 2, 12 и 13), все последующие споры о праве собственности на эти земли и о нарушении владения ими подлежат на общем основании ведению судебных учреждений.	30:38	0:241
участок	NOUN	1682-1916	1	участок-89		Толпа стала наступать на городового, требуя его в участок.	50:57	0:58
участок	NOUN	1682-1916	1	участок-90		Пообещать показать какую-то необыкновенную пшеницу, завести на участок, а потом так бесцеремонно выставить вон...	63:70	0:113
участок	NOUN	1918-1990	2	участок-91		Кондей Ильич подозревает, что Михайло Васильич подкупил землемера; Михайло Васильич питает с своей стороны те же подозрения: оба владеют теми же участками, какими владели их отцы и прадеды.	145:154	0:189
участок	NOUN	1918-1990	2	участок-92		Потом он свистнул, одернул ремень и зашагал вниз, на ходу припоминая, что надо послать на первый участок обещанных лошадей и надо разыскать того старика татарина, который жаловался, что его обсчитали.	97:104	0:200
участок	NOUN	1918-1990	2	участок-93		-- Ходил я на участок.	14:21	0:22
участок	NOUN	1918-1990	2	участок-94		Разбросанные по долине реки, густо поросшие орешником холмы чередуются с болотцами и каменистыми участками, лишёнными растительности.	97:106	0:133
участок	NOUN	1918-1990	2	участок-95		Температура воздуха на опытных участках на 2 градуса выше, чем на обычных, расход топлива в несколько раз ниже, чем при использовании других, дымообразующих веществ.	31:39	0:165
участок	NOUN	1682-1916	1	участок-96		Раскопками охвачены пока немногие и относительно небольшие участки города: на Славне, на Ярославовом Дворище, в Кремле и в Неревском конце.	59:66	0:139
участок	NOUN	1918-1990	2	участок-97		Один земский начальник Семеновского уезда рассказывал мне, что в его участке тоже появились среди людей древнего благочестия те же толки об "антихристовой прелести" и ему удалось напасть на один из их источников.	69:76	0:212
участок	NOUN	1918-1990	2	участок-98		Рядом с ним матросы тянули последний участок кабеля уже по берегу.	37:44	0:66
участок	NOUN	1918-1990	2	участок-99		-- Мы сначала обработаем участок, разведем сад, а когда он разрастется -- поставим дом.	25:32	0:87
участок	NOUN	1682-1916	1	участок-100		Сколько уж участков к ним отошло; поселят крестьян, да хозяйство и разводят.	11:19	0:76
участок	NOUN	1682-1916	1	участок-101		По распоряжению г. градоначальника один из этих мальчишек был задержан и препровожден в участок. неизвестный.	88:95	0:109
участок	NOUN	1682-1916	1	участок-102		Служащий, бравший пробы, мог умышленно остановить штрек на достаточно богатом золоте, чтобы позже, когда этот участок россыпи будет выработан, пустить в это место по сговору золотничников для доработки оставленного богатого борта.	110:117	0:230
участок	NOUN	1918-1990	2	участок-103		От штаба Верховного Главнокомандующего На отдельных участках фронта в районе Ловича бои продолжаются.	52:60	0:101
участок	NOUN	1918-1990	2	участок-104		Сопротивление изоляции может быть измерено специальным метром или мостиком для измерения весьма больших сопротивлений, либо может быть получено путем вычисления после измерения падения напряжения на испытуемом участке и силы тока.	210:217	0:230
участок	NOUN	1918-1990	2	участок-105		На местах, выделенных для соревнований, ширина Колы была до 60 метров, мощные пороги с массой крупных валунов в русле чередовались со сравнительно спокойными участками и даже плесами.	5:6	0:183
участок	NOUN	1682-1916	1	участок-106		Так как стена строилась участками, каждым коленом отдельно, то на общем протяжении попадается несколько щелей, доходящих до 3-х сажен.	24:33	0:134
участок	NOUN	1682-1916	1	участок-107		Уже несколько раз в полицейский участок доставляется городовыми или случайными прохожими подбираемая ими в разных местах города металлическая вывеска с надписью "Химико-бактериологическая лаборатория ординатора клиники московского университета доктора Зарифьянца".	32:39	0:264
участок	NOUN	1682-1916	1	участок-108		Таким образом, в самом непродолжительном будущем предстоит открытие действий означенного участка. неизвестный.	89:96	0:110
участок	NOUN	1682-1916	1	участок-109		Вести Недавно в Портовый полиц. участок в Одессе явился неизвестный молодой человек и взволнованно заявил дежурному надзирателю, что он только-что убил свою жену.	32:39	0:162
участок	NOUN	1918-1990	2	участок-110		Тут я заметил комсорга нашего участка.	30:37	0:38
участок	NOUN	1918-1990	2	участок-111		Накормив ближайшие бригады, Клава и Лилька приспособили палку, чтобы нести тяжелый бачок, и пошли на самый дальний участок -- к бригаде Круглова.	115:122	0:145
участок	NOUN	1918-1990	2	участок-112		Уникален механизм сцены, он позволяет менять высоту ее отдельных участков, здесь есть поворотный круг.	65:73	0:102
участок	NOUN	1918-1990	2	участок-113		Комендантский участок состоит из одного офицерского и двух-четырех красноармейских парных комендантских неподвижных постов и одного-двух парных подвижных комендантских постов из резерва комендатуры участки.	14:21	0:206
участок	NOUN	1918-1990	2	участок-114		Хорошо: это случилось потому, что на этом участке фронта -- венгерцы.	42:49	0:69
участок	NOUN	1918-1990	2	участок-115		-- В этом участке таких цен, конечно, нет, -- продолжал он.	10:17	0:59
участок	NOUN	1682-1916	1	участок-116		Целая артиллерийская дивизия с газетой "Советский артиллерист" стоит на этом участке.	77:84	0:85
участок	NOUN	1918-1990	2	участок-117		Если бы были найдены какие-нибудь нервы или участки мозга, раздражение которых было бы необходимо и достаточно для сознавания единства частей объекта или объективной ("данной мне") активности его, то тогда мы бы согласились, что и эти элементы восприятия суть переживания, столь же внутрителесные, как запах или вкус.	44:51	0:317
участок	NOUN	1918-1990	2	участок-118		Японцы подошли на 1 200-2 000 шагов к разным участкам наших позиций.	36:37	0:68
участок	NOUN	1918-1990	2	участок-119		Нормально полк форсирует реку на участке 1-1.5 км, дивизия 3-4 км. 5.	33:40	0:69
