lemma	pos	date	grouping	identifier	description	context	indexes_target_token	indexes_target_sentence
модель	NOUN	1991-2017	2	модель-0		"Провинциалка" связана с текстом "Вечного мужа": герои Достоевского поминают героев Тургенева, салонная комедия служит моделью для психологических умоисступлений.	119:126	0:162
модель	NOUN	1991-2017	2	модель-1		Однако модель государства общественного договора была столь идеализированной, что даже ее сторонники не могли придти к общему мнению, каким оно должно было быть.	7:13	0:161
модель	NOUN	1918-1990	1	модель-2		-- Не может быть! -- возмутилась Алиса, которой разведчики на прощание подарили вырезанную из дерева модель вездехода, шахматы из кости ископаемого параллелепипеда, ножик для разрезания бумаги, выточенный из коры стеклянного дерева, и еще множество интересных вещей, которые они сами мастерили длинными вечерами.	101:107	0:312
модель	NOUN	1918-1990	1	модель-3		В новой роли после пропитки Химические пропитки придают известным ранее тканям новые свойства, а это приводит к созданию новых моделей.	127:134	0:135
модель	NOUN	1918-1990	1	модель-4		Модель всегда будет в чем-то действовать не так, как сам объект.	0:6	0:64
модель	NOUN	1918-1990	1	модель-5		Друзья прошли в комнату, опутанную проводами, загроможденную радиоприемниками, моделями и металлическим хламом.	79:87	0:111
модель	NOUN	1918-1990	1	модель-6		Модель следующая: два черных ящика "угадывают" состояние друг друга (что задумал противник).	0:6	0:92
модель	NOUN	1918-1990	1	модель-7		В музее экспонированы модели советских автомобилей новейших марок.	22:28	0:66
модель	NOUN	1991-2017	2	модель-8		Аналитик ИК "Проспект" Дмитрий Дружинин считает, что среднесрочная перспектива прогноза ASPO вводит в модель слишком большое количество неизвестных.	102:108	0:148
модель	NOUN	1991-2017	2	модель-9		Подобно тому как чучело может крайне скрупулезным образом -- вплоть до последней волосинки на хвосте -- передавать внешний облик животного, так и письменно зафиксированная мелодия может точно соответствовать контуру мелодии, рожденной модусной моделью через посредство принципа varietas в процессе живого пропевания.	244:251	0:316
модель	NOUN	1991-2017	2	модель-10		Более широкое распространение получила каталитическая очистка духовки, при которой вся внутренняя поверхность жарочного шкафа (или только лопасти вентилятора и боковые стенки) покрывают специальной эмалью, поглощающей жиры во время приготовления пищи (модели от ELECTROLUX и ZANUSSI).	252:258	0:284
модель	NOUN	1991-2017	2	модель-11		В противном случае вместо увеличения продаж прогнозируем обратный эффект, называемый маркетологами "каннибализмом": новая модель "съедает" продажи близкой по классу машины, а вместо роста прибыли растут затраты.	122:128	0:211
модель	NOUN	1918-1990	1	модель-12		Большинство крупных производителей часов наносят на корпус моделей монограмму -- полное название компании или ее логотип.	59:66	0:121
модель	NOUN	1991-2017	2	модель-13		Да, немало придумано ухищрений, чтобы заставить модель двигаться с большей скоростью.	48:54	0:85
модель	NOUN	1991-2017	2	модель-14		В очередной обзор летних шин "Автопилот" включил около десятка новинок (на российском шинном рынке) и свыше двадцати моделей шин, уже хорошо зарекомендовавших себя в летней эксплуатации.	117:124	0:186
модель	NOUN	1991-2017	2	модель-15		Скажем, в модели, предлагаемой Кириченко (наиболее развитой в формальном отношении), композиции эклектики характеризуются такими формальными качествами, как дробность, мелочность, аморфность, незавершенность.	10:16	0:208
модель	NOUN	1918-1990	1	модель-16		В то же время теоретическое исследование дидактической эффективности различных способов обучения в АОС и их оптимизация требуют разработки соответствующей модели, адекватной адаптивному характеру управления обучением.	155:161	0:217
модель	NOUN	1991-2017	2	модель-17		Экспериментальные установки для получения управляемой термоядерной реакции предстали и как первые модели космических плазменных феноменов.	98:104	0:138
модель	NOUN	1991-2017	2	модель-18		В ходу раритетные ботинки из second hand или дизайнерские модели из специально состаренной кожи.	58:64	0:96
модель	NOUN	1991-2017	2	модель-19		Оказалось, что большинство процессов лавинообразного роста (биологические процессы, некоторые процессы в экономике, увеличение потока информации, в том числе и возрастание численности населения Земли) происходят не по экспоненциальному закону, а гораздо быстрее, когда параметры системы хотя бы часть времени неограниченно возрастают за конечное время, а это и есть знакомые нам режимы с обострением в различных физических и математических моделях.	440:447	0:448
модель	NOUN	1918-1990	1	модель-20		В этом Доме моделей, тогда очень знаменитом и едва ли не единственном в Москве (если не считать ателье ГУМа), у меня была приятельница, художница Тося.	12:19	0:151
модель	NOUN	1991-2017	2	модель-21		Модель завода (блокированная с действительностью; автоблокировка).	0:6	0:66
модель	NOUN	1918-1990	1	модель-22		Возможные траектории химического превращения в двумерном пространстве составов Таким образом, уже простейший вариант использования модели ЛП приводит к важным в химическом отношении результатам.	131:137	0:194
модель	NOUN	1991-2017	2	модель-23		И все шло Мартыну въ прокъ, -- и хрустящее англйское печенье, и приключеня Артуровыхъ рыцарей, -- та сладкая минута, когда юноша, племянникъ, быть можетъ, сэра Тристрама, въ первый разъ надваетъ по частямъ блестящя выпуклыя латы и детъ на свой первый поединокъ; и каке-то далеке, круглые острова, на которые смотритъ съ берега двушка въ разввающихся одеждахъ, держащая на кисти сокола въ клобучк; и Синдбадъ, въ красномъ платк, съ золотымъ кольцомъ въ ух; и морской змй, зелеными шинами торчащй изъ воды до самаго горизонта; и ребенокъ, нашедшй мсто, гд конецъ радуги уткнулся въ землю; -- и, какъ отголосокъ всего этого, какъ чмъ то родственный образъ, -- чудесная модель длиннаго фанерно-коричневаго вагона въ окн общества спальныхъ вагоновъ и великихъ международныхъ экспрессовъ, -- на Невскомъ проспект, въ тусклый морозный день съ легкой заметью, когда приходится носить черные вязаные рейтузы поверхъ чулокъ и штанишекъ.	666:672	0:926
модель	NOUN	1918-1990	1	модель-24		Говорят, многие из его рисунков созданы в страдное полуночье, при этом вызваны к жизни не живой моделью, а памятью.	96:103	0:115
модель	NOUN	1918-1990	1	модель-25		Возвращаясь къ тканямъ, отмтимъ нсколько появившихся моделей весенихъ костюмовъ изъ бархата, одинъ изъ которыхъ воспроизводимъ въ этомъ номер.	53:60	0:142
модель	NOUN	1918-1990	1	модель-26		Дальнейшая обработка полученной модели связана с синтезом оценок предпочтительности альтернатив на основе применения классических схем МАИ и МАС [1-3].	32:38	0:151
модель	NOUN	1991-2017	2	модель-27		Это проблема особенностей функционирования знаний, понятий, мысленных моделей, с одной стороны, в системе отношений общества, в общественном сознании, а с другой -- в деятельности индивида, реализующей его общественные связи, в его сознании.	70:77	0:241
модель	NOUN	1991-2017	2	модель-28		Для вычисления значения Р использовалась модель, соответствующая принятой схеме формирования выборки УЭ НОБУС: [ ] где kh -- число населенных пунктов, отобранных в h-м регионе на первой ступени формирования выборки УЭ; Lh -- общее количество населения в й-м регионе; lh -- количество населения в 1-м населенном пункте, отобранном в h-м регионе; Gh -- общее число зарегистрированных избирателей в;-м населенном пункте; а -- число зарегистрированных избирателей в/'-м избирательном участке /-го населенного пункта; т. -- число посещенных домохозяйств bj-m избирательном участке;- го населенного пункта; М, -- число домохозяйств в списке по n-му избирательному участку i-го населенного пункта.	41:47	0:690
модель	NOUN	1991-2017	2	модель-29		-- Как же не платить Зачем же вы работаете -- Нам сказали, что каждому купят новые "Жигули" пятой модели.	98:104	0:105
модель	NOUN	1991-2017	2	модель-30		Для создания стандартов на продукцию необходимо разработать классификационные структуры геологической информации различной степени агрегирования, начиная от фактографических данных о свойствах и строении земной коры до моделей геолого-экономических оценок освоения и использования запасов минерально-сырьевых ресурсов конкретных объектов полезных ископаемых.	219:226	0:358
модель	NOUN	1991-2017	2	модель-31		Полученные результаты о ходе исторического времени, о коллективном взаимодействии и месте сознания в развитии, конкретные числа и оценки, полученные в ходе расчетов, вселяют уверенность в правильности предложенных представлений и соответствии модели действительности.	243:249	0:267
модель	NOUN	1918-1990	1	модель-32		Из 130 проданных за год Legacy на долю обновленной модели пришлось 67, из 303 Outback -- 97.	51:57	0:92
модель	NOUN	1991-2017	2	модель-33		Тутъ же стоялъ Гаршинъ, позировавшiй для сына Iоанна Грознаго, и Мясодовъ, служившiй моделью для самого Грознаго.	85:92	0:113
модель	NOUN	1918-1990	1	модель-34		Из всех просмотренных мною биноклей компакт-класса ("Бушель" ("Bushnell"), "Доктер" ("Docter"), "японская" серия) модель 10x25 наиболее предпочтительна ввиду оптимальных размеров как в рабочем, так и в транспортном положении; усредненного поля зрения (96 м на 1000 м); нескользящего покрытия, малого веса и защищающего от ультрафиолета небликующего покрытия линз.	114:120	0:363
модель	NOUN	1991-2017	2	модель-35		В записке, лежащей около сооружения, напоминающего модель насекомого в полете, объяснялась "тема" этого сооружения.	51:57	0:115
модель	NOUN	1918-1990	1	модель-36		Известно, что невиданный рост населения, усложнение экономики, усиление взаимозависимости хозяйственных единиц сделали старые модели социальной организации беспомощными.	126:132	0:169
модель	NOUN	1918-1990	1	модель-37		Пока что заготовлены модели для отливок, добываем другие материалы и пр.	21:27	0:72
модель	NOUN	1918-1990	1	модель-38		Известный историк Леонид Сергеевич Васильев считает социально-экономическую модель Греции мутацией, она же одна была такая долгое время.	76:82	0:136
модель	NOUN	1991-2017	2	модель-39		Собственно, это только модели ваших же будущих романов".	23:29	0:56
модель	NOUN	1918-1990	1	модель-40		Иными словами, это были уже серьезные заявки на настоящие модели, которые приносят людям много радости и эстетического наслаждения.	58:64	0:131
модель	NOUN	1918-1990	1	модель-41		Он взял первую отфрезерованную серебристую модель, на миг вспомнил птицу, что кружилась над ледоходом и летела -- не долетела до его руки.	43:49	0:138
модель	NOUN	1991-2017	2	модель-42		К трансформационным преобразованиям шведского общества следует отнести переход к модели "индивидуализации социальной ответственности".	81:87	0:134
модель	NOUN	1991-2017	2	модель-43		Зворыкина, текстильные предприятия Костромы и области СГУТиД с. матем., физика, рус.яз. и литература 1,5-2 11 15 75 мех.фабрика "РотФронт", обув. фабрики "Виктория", "Скороход" Дизайн костюма МГУДиТ н.в., б., с., м. рис., живопись, композиция, рус.яз., литература и культура (тестирование) 10,2 38 из 40 20 100 Всероссийский дом моделей, Дом моделей "Кузнецкий мост", "Панинтер", "Горизонт" и др.	329:336	0:396
модель	NOUN	1918-1990	1	модель-44		Китайские экономисты рассмотрели несколько моделей соединения планового и рыночного регулирования.	43:50	0:98
модель	NOUN	1991-2017	2	модель-45		После просушки (примерно через сутки) зачищаю модель мелкой шкуркой и крашу в два слоя масляной краской в нужный цвет, а после высыхания краски покрываю лаком (например, акрилфисташковым для живописи).	46:52	0:201
модель	NOUN	1918-1990	1	модель-46		Классическим представителем корпоративной модели социального государства является Япония.	42:48	0:89
модель	NOUN	1991-2017	2	модель-47		Глава 9. Математика до греков 9.1. Ошибка природы Мы уже приводили процесс счета в качестве примера использования модели действительности, которая не содержится в мозгу, а создается на уровне языка.	114:120	0:198
модель	NOUN	1918-1990	1	модель-48		Кроме научных изысканий в тех брошюрах содержались и призывы к заинтересованным читателям: "Приходите посмотреть мои модели в любую среду в 6 часов вечера".	117:123	0:156
модель	NOUN	1991-2017	2	модель-49		Путем демонстрирования ряда остроумных моделей, поясняющих основы теории Эйнштейна, зритель постепенно вводится в понимание оригинальных и, на первый взгляд, парадоксальных воззрений автора теории.	39:46	0:197
модель	NOUN	1918-1990	1	модель-50		Меня не слишком волнуют часы, поэтому я могу приобрести дешевую модель, а то и вовсе обойтись без часов.	64:70	0:104
модель	NOUN	1991-2017	2	модель-51		Однако представители ленинградской группы "Комитета по мотоциклостроению" по-прежнему предлагали начинать с выпуска иностранной модели.	128:134	0:135
модель	NOUN	1991-2017	2	модель-52		Мы ходили в их лаборатории, смотрели на испытания моделей самолетов.	50:57	0:68
модель	NOUN	1991-2017	2	модель-53		Исключительно продуктивным в принципе и работающим в том числе применительно к модели культового кино представляется подход Олега Аронсона, противопоставившего "эпоху советского кино" и "время советского фильма", кинематографическую историю "величия", с ее пафосом большой истории и осознающего свои задачи кинематографического движения, "множеству фильмов, или вовсе лишенных претензии на величие, или в силу каких-то причин не способных предъявить этот порыв".	79:85	0:462
модель	NOUN	1991-2017	2	модель-54		На 7--8-м месте зашифровано обозначение модели: 1J -- Volkswagen Golf, Volkswagen Bora; 1E -- Volkswagen Golf Cabriolet; 3B -- Volkswagen Passat; 3D -- Volkswagen Phaeton; 9N, 6N -- Volkswagen Polo; 6E -- Volkswagen Lupo с расходом 3л/100км; 6X -- Volkswagen Lupo; 7M -- Volkswagen Sharan; 1Y -- Volkswagen New Beetle Cabrio; 9C -- Vokkswagen New Beetle; 1C -- Volkswagen New Beetle для американского рынка; 70 -- Volkswagen Transporter, Caravelle, Multivan, Campingwagen, California; 9K -- Volkswagen Caddy.	40:46	0:508
модель	NOUN	1991-2017	2	модель-55		Максимальные относительные погрешности formula оценки влажности W при наличии шумов в области рабочих значений параметров радиационной модели не превышали 15 и 22% соответственно.	135:141	0:179
модель	NOUN	1918-1990	1	модель-56		На самом деле, сейчас приходится удивляться не трудностям, а успехам так называемой "стандартной модели".	97:103	0:105
модель	NOUN	1918-1990	1	модель-57		После этого доклада все прочие модели выглядят бледно.	31:37	0:54
модель	NOUN	1991-2017	2	модель-58		На стеллажах мы насчитали 42 модели паровых утюгов.	29:35	0:51
модель	NOUN	1991-2017	2	модель-59		Рост человечества, описываемый математической моделью на всем пути его развития, показан в двойном логарифмическом масштабе на рис. 3.5.	46:53	0:136
модель	NOUN	1918-1990	1	модель-60		Недели за две до этого Форд объявил: "250 тысяч автомобилей новой модели отзывается на завод".	66:72	0:94
модель	NOUN	1918-1990	1	модель-61		На красивом постаменте укреплена белая спираль, на которой стоят модели автомобилей.	65:71	0:84
модель	NOUN	1991-2017	2	модель-62		Николай Овчинников представил модель греческого Парфенона, где вместо колонн светящиеся стволы берез.	30:36	0:101
модель	NOUN	1991-2017	2	модель-63		Затем модель программно рассекается на тонкие слои, чтобы получить информацию о контуре каждого слоя, который воспроизводится уже при изготовлении детали.	6:12	0:154
