lemma	pos	date	grouping	identifier	description	context	indexes_target_token	indexes_target_sentence
директор	NOUN	1918-1990	2	директор-0		Зимним вечером к директору МТС вошел незнакомый человек в каракулевой шапке.	17:26	0:76
директор	NOUN	1918-1990	2	директор-1		Рассказ о директоре, который прощал 10 л[ет] жену, что она жила с инж[енером], п[отому] ч[то] инж[енер] -- великий работник, и дело без него (инж[ене]ра) ухудшится.	10:19	0:164
директор	NOUN	1918-1990	2	директор-2		-- А откуда он прибежал -- спросил директор у Серпокрылова, предполагая, что Вера замолчала надолго.	35:43	0:100
директор	NOUN	1918-1990	2	директор-3		Все, кто был в комнате, затаив дыхание слушали, как бывший главный умоляет директора.	75:84	0:85
директор	NOUN	1682-1916	1	директор-4		-- Вот ордер, -- сказал директор, не глядя на меня.	24:32	0:51
директор	NOUN	1918-1990	2	директор-5		В этом заседании я, между прочим, внес предложение, чтобы в театре кружка в течение, по крайней мере, первого сезона не шли пьесы директоров и режиссера.	130:140	0:153
директор	NOUN	1918-1990	2	директор-6		-- Еще я на тебя тем похожий, Василий, что за Верютиным, который Коломенские гривы взял, да за директором магазина, что лосей бьет, технорука Степанова не видал.	95:105	0:161
директор	NOUN	1918-1990	2	директор-7		В отношении личного состава министерства Временное правительство сочло автоматически уволенными только самих министров и товарищей министра; в отношении же директоров департаментов, а тем более младших служащих вопрос зависел от новых министров.	156:166	0:245
директор	NOUN	1682-1916	1	директор-8		-- Знаете ли, почтеннейший, -- осторожным голосом продолжал директор, -- я бы вам советовал не ходить пока в гимназию.	60:68	0:118
директор	NOUN	1682-1916	1	директор-9		Потом он рассказывал о баснословных кутежах, которые в его честь задавал в каком-то губернском городе директор банка, угодивший впоследствии под суд, и о торжественном обеде, устроенном ему в Москве печатью.	102:110	0:207
директор	NOUN	1682-1916	1	директор-10		-- Как я могу сказать,-- говорил он,-- задачу присылают из округа директору, он распечатает ее только на экзамене.	66:75	0:114
директор	NOUN	1918-1990	2	директор-11		"Свинья!" -- сквозь зубы процедил директор и отвернулся.	34:42	0:56
директор	NOUN	1682-1916	1	директор-12		-- Коллектив совхоза, -- заявил директор И.М. Гвоздев, -- горячо благодарит родную Коммунистическую партию и Советское правительство, а также своего земляка, поэта Александра Трифоновича Твардовского за заботу о хлебопашцах, о всех тружениках земли.	32:40	0:249
директор	NOUN	1918-1990	2	директор-13		-- Вы сами, ваше превосходительство, -- проговорил наконец директор.	59:67	0:68
директор	NOUN	1682-1916	1	директор-14		-- Ну, с вашей бригады, бывший директор спортобщества "Динамо".	31:39	0:63
директор	NOUN	1918-1990	2	директор-15		И думается: а что завтра-то А господин Карасев с директором свое: -- Она, конечно, слышала обо мне Я ей могу место устроить в хорошем театре.	49:59	0:141
директор	NOUN	1682-1916	1	директор-16		-- Обними же меня, моя радость, мы так долго не виделись, -- пригласил технический директор.	83:91	0:92
директор	NOUN	1918-1990	2	директор-17		Отец дал мне письмо к дяде Владимиру Ивановичу, бывшему тогда директором канцелярии министерства двора, который и должен был водворить меня у означенного профессора.	62:72	0:165
директор	NOUN	1682-1916	1	директор-18		-- Сами в литературе разыгрываете таких же недоступных директоров-чиновников, над которыми смеетесь.	55:75	0:100
директор	NOUN	1682-1916	1	директор-19		У него мелькнула мысль пойти и упросить директора о переводе его в седьмой класс.	40:49	0:81
директор	NOUN	1918-1990	2	директор-20		-- Сереж, ты заметил, какая колоссальная курточка с молниями на этом мотоциклисте -- толкнул локтем Лачугина сын директора плавательного бассейна.	113:122	0:146
директор	NOUN	1918-1990	2	директор-21		Дальше начинает работать самолюбие: "Чем мы хуже других!", "Придется, ребята, браться, черт бы подрал за этого директора!", "Не сумел организовать ремонта, а мы отдувайся!" Раньше я о таких починах только в газетах читал, а теперь увидел сам.	111:120	0:242
директор	NOUN	1918-1990	2	директор-22		-- Что мы обсуждаем и какая повестка дня -- Я ничего не понимаю, -- со сдержанной враждебностью объяснил Високовский, -- обратитесь к товарищу директору: он должен знать.	143:152	0:170
директор	NOUN	1918-1990	2	директор-23		Кто то таки ест Подуст -- Офицер пристально посмотрел на директора.	57:66	0:67
директор	NOUN	1918-1990	2	директор-24		-- Что удалось посмотреть -- Кабинет директора.	37:46	0:47
директор	NOUN	1918-1990	2	директор-25		Она бывала в Москве не раз, и она, так же как и Любовь Дмитриевна, оказывала большую помощь и внимание Ассоциации памяти Александра Блока, созданной при Государственной Академии художественных наук, директором которой был Петр Семенович Коган.	199:209	0:243
директор	NOUN	1682-1916	1	директор-26		.. директор со всей свитой уже в классе.	3:11	0:40
директор	NOUN	1682-1916	1	директор-27		Вероятно, вследствие этого неудачного ангажемента, директор преисполнился осторожности и вдруг стал чрезмерно скупым на увеличение артистических вознаграждений.	51:59	0:160
директор	NOUN	1682-1916	1	директор-28		Директор совхоза наведался к директору Бородинского музея-заповедника А. Д.	0:8	0:75
директор	NOUN	1918-1990	2	директор-29		По известиям, дошедшим до меня в последнее время, Шамаев выбран директором одной из так блистательно идущих акционерных компаний, и выбран собственно для спасения дела.	64:74	0:168
директор	NOUN	1918-1990	2	директор-30		Был ли Байкалов настоящим директором И да и нет.	26:36	0:48
директор	NOUN	1918-1990	2	директор-31		Вызваны для консультации: профессор по кафедре кожных болезней Василий Васильевич Бундарев и директор московского Ветеринарного Показательного института.	93:101	0:153
директор	NOUN	1682-1916	1	директор-32		В Куршевеле я встретился с нынешним генеральным директором фирмы "Пома" Гастоном Катьяром.	48:58	0:90
директор	NOUN	1918-1990	2	директор-33		По телефону (из Петербурга) Вести с ленских приисков Сегодня уехали в Бодайбо директора Ленского золотопромышленного общества: барон Гинзбург и Золодилов, которые пробудут на приисках до конца сенаторской ревизии.	78:87	0:213
директор	NOUN	1682-1916	1	директор-34		В заводе Абрамов не застал директора и остановился на площадке, что перед аппаратом, в котором жидкая сероватая бурда превращается наконец в подобие сахара.	27:36	0:156
директор	NOUN	1682-1916	1	директор-35		Большинство других товарищей Пушкина, упоминаемых в нашем рассказе, достигло на государственной службе "степеней известных": Ломоносов был посланником в Гаге, барон Корф -- членом государственного совета и директором Императорской Публичной библиотеки, Корнилов -- сенатором, Бакунин -- тверским губернатором, Вальховский -- бригадным генералом, Матюшкин -- адмиралом, Маслов -- директором департамента податей и сборов, Малиновский и Данзас -- полковниками.	206:216	0:458
директор	NOUN	1918-1990	2	директор-36		В. Сталиным, посвятили свои выступления заместитель директора Института философии Академии Наук СССР Ц. А. Степанян и доктор философских наук И. Н. Лущицкий.	52:61	0:157
директор	NOUN	1918-1990	2	директор-37		Уздечкин был худой, неуклюжий, сутулый, -- и так неуклюже и сутуло и стоял перед великолепным директором.	94:104	0:105
директор	NOUN	1682-1916	1	директор-38		Вальган слушал, не произнося ни слова, но Бахирев, продолжая говорить, видел, как в глазах и в лице директора зажигается то выражение просветления и понимания, которое бывает у человека, постигающего сложную задачу.	100:109	0:215
директор	NOUN	1918-1990	2	директор-39		-- Я директора убил, -- вдруг заявил гимназист жидким, заплетающимся голосом.	5:14	0:77
директор	NOUN	1918-1990	2	директор-40		Возможно, наши директора просто не слишком задумывались об этом.	15:24	0:64
директор	NOUN	1918-1990	2	директор-41		Лишь в 1860 г., после смерти Иделера, молодой Горн, сделавшись директором в Шаритэ, внес необходимые преобразования (это было в год опубликования книги Конолли в переводе Брозиуса.	63:73	0:180
директор	NOUN	1682-1916	1	директор-42		Вот вы, Иван Максимович, как директор, и Костя, как секретарь комитета, убеждены, что Патов должен был за год проявить себя.	29:37	0:124
директор	NOUN	1918-1990	2	директор-43		Так что администрация была следующая: директором Русского Общества Одесского Пароходства был адмирал Свиты Его Величества -- H. M.	38:48	0:130
директор	NOUN	1682-1916	1	директор-44		Впоследствии мне приходилось с ним встречаться: после гражданской войны он был у нас председателем городского Совета, а затем директором завода.	126:136	0:144
директор	NOUN	1918-1990	2	директор-45		С речами выступали председатель совета министров Коковцов, бывший председатель совета министров граф Витте, бывший министр торговли и промышленности председатель советской комиссии, рассматривавшей законопроекты Тимирязев (он же директор Ленского т-ва), председатель спб. общества фабрикантов и заводчиков Триполитов и другие, несколько менее известные деятели.	229:237	0:361
директор	NOUN	1918-1990	2	директор-46		Все, все, все, от первоклассников до директора школы, узнают об этом.	37:46	0:69
директор	NOUN	1918-1990	2	директор-47		Сначала директор просто смотрел.	8:16	0:32
директор	NOUN	1682-1916	1	директор-48		Всякий отвлеченный фанатизм был ему совершенно чужд, и впоследствии, в качестве директора театров, он будет усердно заботиться о появлении на русской сцене образцовых произведений западной драматической литературы, будет переводить испанских и итальянских драматургов и мечтать о полном переводе Мольера.	80:89	0:304
директор	NOUN	1682-1916	1	директор-49		Он мог быть и железнодорожным деятелем, и благотворителем, и профессиональным шулером, и директором увеселительного заведения.	89:99	0:126
директор	NOUN	1918-1990	2	директор-50		Газета дала большую публикацию с портретом, посвященную председателю Мосгорисполкома, два письма в поддержку секретаря МГК КПСС, подробные рассказы о нескольких директорах.	161:171	0:172
директор	NOUN	1918-1990	2	директор-51		Однажды мы забрели в кабинет самого могущественного директора Гослитиздата, носившего соответствующую его рангу фамилию Владыкин.	52:61	0:129
директор	NOUN	1918-1990	2	директор-52		Герцен был знаком и с астрономом профессором Д.М.Перевощиковым -- первым директором Московской обсерватории, с которым встречался в доме Щепкина.	73:83	0:145
директор	NOUN	1918-1990	2	директор-53		-- Ясно же, что лучше быть директором комбината, чем всю жизнь разгребать мусор.	27:37	0:80
директор	NOUN	1918-1990	2	директор-54		Дверь в соседний кабинет, где размещался заместитель директора, была открыта.	53:62	0:77
директор	NOUN	1918-1990	2	директор-55		Отдохнуть, что ли Господин Сыроечковский, господин Адольф, и вы, господин директор Стрельцов, не скажете ли нам Что же вы Да, забыл еще упомянуть, что господин Сыроечковский -- народный социалист, а эта партия, как известно, создана для благочестивых, тихих, богобоязненных людей, чтобы спасти маленькое именьице, или крохотный капиталец, или домик от революционных посягателей.	74:82	0:378
директор	NOUN	1682-1916	1	директор-56		И в воцарившейся тишине практикант Моисеев вручил директору петицию с требованием ослабления училищного режима.	50:59	0:111
директор	NOUN	1918-1990	2	директор-57		Несколько лет я не видал Аркадия Николаевича, но имел известия, что он, благодаря хлопотам Наденьки и отчасти своим собственным, устроился очень хорошо: член какой-то временной комиссии, директор в двух правлениях и получает тысяч двенадцать в год.	187:195	0:248
директор	NOUN	1682-1916	1	директор-58		Как я слышал от директора компании Ивана Васильевича Прокофьева, он в начале своего служения трудился ревностно и с большой пользой, но потом, одурев от либеральных мечтаний, охладел к службе и валил через пень колоду.	16:25	0:218
директор	NOUN	1682-1916	1	директор-59		Потом я написал несколько проектов резких до дерзости писем, не мог остановиться ни на одном, и только сегодня почувствовал себя относительно покойным и написал, наконец, к директору театров письмо, в котором высказал свой протест против столь оскорбительного образа действий.	173:182	0:276
директор	NOUN	1682-1916	1	директор-60		Каким образом его оттягал директор Опытной станции Шишков, не знаю, вряд ли Ридигер отдал его добровольно.	26:34	0:106
директор	NOUN	1918-1990	2	директор-61		Лавуазье был генеральный откупщик, один из самых дельных и деятельных по финансовой части директоров огромного коммерческого предприятия; но он создал новейшую химию, и никто в Европе не вздумал отвергать его заслуги науке на том основании, что-де он был промышленник, некогда ему было основательно заниматься химиею.	90:100	0:317
директор	NOUN	1918-1990	2	директор-62		Княжеского титула он не имел, но, как директор Коломенского и член правления Сормовского и других металлургических заводов, мог бы скупить не одно княжеское имение.	38:46	0:164
директор	NOUN	1918-1990	2	директор-63		На сковородке щебетала пятиглазая яичница с салом, шептала о чем-то и глядела на директора своими застенчивыми оранжевыми глазами.	81:90	0:130
директор	NOUN	1682-1916	1	директор-64		Между тем Пушкин входил в кабинет директора.	34:43	0:44
директор	NOUN	1682-1916	1	директор-65		Спрашивала я помощника директора, ему он ничего не говорил о вас.	23:32	0:65
директор	NOUN	1682-1916	1	директор-66		Милиционер со списком стоял в дверях вместе с директором клуба, который с ястребиной зоркостью вглядывался в толпу, кое-кого выдергивая из нее своим взглядом и пропускал в дверь.	46:56	0:178
директор	NOUN	1918-1990	2	директор-67		А директор взял да и оставил Караулова до рождества без отпуска.	2:10	0:64
директор	NOUN	1918-1990	2	директор-68		На правах коммерческого директора переговоры вел Меркурий.	24:33	0:58
директор	NOUN	1918-1990	2	директор-69		Нет, директор Энгельгардт не совсем понимал его.	5:13	0:48
директор	NOUN	1682-1916	1	директор-70		Напрасно вылощенный секретарь старался фильтровать публику, уверяя, что дело от директора не зависит, напрасно и начальник отделения объявлял вызываемым лицам положенные уже резолюции -- ничто не помогало; все хотели видеть самого директора, надеясь через него получить какое-нибудь облегчение участи политиков.	80:89	0:311
директор	NOUN	1682-1916	1	директор-71		Вместе с тем не возьмет ли на себя господин директор труд переговорить с Ребером относительно перемены дня состязания.	44:52	0:118
директор	NOUN	1682-1916	1	директор-72		Начались самые интимные лицейские воспоминания, передразниванья профессоров, директора и прочего начальства, причем Иван Фабианович не то чтобы повернулся спиной к столу, а сел как-то боком, показывая этим, что он хотя и не протестует против такого представления, но и не одобряет его.	77:86	0:285
директор	NOUN	1682-1916	1	директор-73		-- Фабрика не занимается филантропией! -- сухо заметил директор.	55:63	0:64
