lemma	pos	date	grouping	identifier	description	context	indexes_target_token	indexes_target_sentence
директор	NOUN	1682-1916	1	директор-74		Неужели урон, который она терпит от сих контрабандистов, и зло, какое они колониям и служителям ее наносят, не во всем пространстве еще господам директорам известны Кажется, можно быть уверену, что если бы главное правление компании представило о сем зле куда следует и просило бы о защите высочайше дарованных компании привилегий и пособия к обороне ее имущества, то прозорливое и попечительное правительство не отказало бы в просьбе оного {Строки сии были напечатаны в журнале "Сын Отечества" и апреле 1820 года, а в сентябре 1821 года по представлению компании последовал высочайший указ об охранении ее колоний посредством вооруженных крейсеров от поисков и покушений контрабандистов.}, и тем более что для сего не нужно употреблять больших сил и иждивения и что отогнать от своих областей контрабандистов есть дело позволительное, а притом и правительство Американских Соединенных областей объявило уже, что оно не может запретить своим подданным не торговать там-то и там-то и что всякий из них за поступки свои в чужих владениях и за нарушение постановлений в оных должен сам за себя ответствовать.	145:155	0:1105
директор	NOUN	1682-1916	1	директор-75		Рамка на портрет директора, светло-голубая с золотом, вышла очень красива, и портрет он повесил над кушеткою.	17:26	0:109
директор	NOUN	1682-1916	1	директор-76		Но в тот же день я была вызвана телефонным звонком к директору Литинститута В.	53:62	0:78
директор	NOUN	1918-1990	2	директор-77		Молодой человек недоумевал: с чем поздравляет его директор и чему радуется Директор шутливо погрозил длинным костлявым пальцем.	50:58	0:127
директор	NOUN	1682-1916	1	директор-78		Но вот две и три недели прошли уже со времени разговора с директором, а Пушкин по-прежнему чуждался его.	58:68	0:104
директор	NOUN	1682-1916	1	директор-79		Пользы от криков мало! -- спокойно произнес директор пансиона.	44:52	0:62
директор	NOUN	1682-1916	1	директор-80		Новый директор будет Бог весть каких взглядов.	6:14	0:46
директор	NOUN	1918-1990	2	директор-81		Беликовича разжаловать в рядовые и сослать в отдаленный Оренбургский линейный батальон; Гагарина же определить юнкером в один из полков Московского корпуса, с тем чтобы отец его сам наказал, а директору училища (то есть мне) объявить строжайший выговор с внесением в формуляр".	193:202	0:277
директор	NOUN	1682-1916	1	директор-82		Одного только старика рабочего уважают, что на сталелитейном директором состоит.	61:71	0:80
директор	NOUN	1918-1990	2	директор-83		А что же, кроме обузданий, произвела на свет наша талантливость за все время ее векового и притом вполне беспрепятственного существования Представьте себе такой случай: директор департамента призывает к себе столоначальника и говорит ему: "Любезный друг! я желал бы, чтоб вы открыли Америку".	169:177	0:292
директор	NOUN	1682-1916	1	директор-84		Опека над юным миллионером Сегодня в коммерческих кругах Москвы вызвало много толков известие о назначении опеки над имуществом молодого миллионера Н.П. Павлова -- директора-распорядителя мануфактурного товарищества.	164:186	0:216
директор	NOUN	1682-1916	1	директор-85		Пойдемте; я вас представлю вашему директору.	34:43	0:44
директор	NOUN	1682-1916	1	директор-86		Отделение N. Скрепа директора канцелярии.	20:29	0:41
директор	NOUN	1682-1916	1	директор-87		-- Директору нельзя водку пить, директору мадера полагается, -- рассудительно говорил Передонов.	3:12	0:96
директор	NOUN	1918-1990	2	директор-88		Правой рукой Иван Иванович -- так зовут директора -- энергично растирает левую.	40:49	0:79
директор	NOUN	1918-1990	2	директор-89		Ничего не подозревавший директор какого-то далекого завода старательно готовил этот дар.	24:32	0:88
директор	NOUN	1682-1916	1	директор-90		Преподаватель вопросительно посмотрел на директора; директор махнул рукой, серьезно взглянул поверх синих очков в лицо Паше Туманову и чуть-чуть качнул головой.	41:50	0:160
директор	NOUN	1682-1916	1	директор-91		Перед отъездом директор приказал нам, чтобы мы явились в классы в свое время и без опоздания.	15:23	0:93
директор	NOUN	1918-1990	2	директор-92		Приходит художник, ждет директора.	24:33	0:34
директор	NOUN	1918-1990	2	директор-93		Мне никто не хочет помочь, и я прошу вас как директора.	45:54	0:55
директор	NOUN	1682-1916	1	директор-94		Результатом было то, что наследник позвал его в свою комиссию по продовольствию неурожайных губерний и дал в ней простор инициативе Качалова, а затем его позвал к работе бывший директор департамента внешней торговли князь Д. А.	177:185	0:227
директор	NOUN	1682-1916	1	директор-95		Определение и увольнение всех прочих чинов, составляющих департаменты и канцелярии министра, производится министром по представлению директора.	133:142	0:143
директор	NOUN	1682-1916	1	директор-96		Сегодня с ним и с Андреем будет говорить наш директор.	45:53	0:54
директор	NOUN	1918-1990	2	директор-97		Совещание директоров средних учебных заведения постановило воспретить учащимся посещение театра Нового клуба. неизвестный.	10:20	0:122
директор	NOUN	1682-1916	1	директор-98		Сей порядок в 1812 г. изменился тем, что место директора заменено советом из трех членов под председательством старшего и под главным начальством управляющего, что и продолжалось до 1826 г.	47:56	0:189
директор	NOUN	1682-1916	1	директор-99		Директором ее был Сперанский, вице-директором Магницкий, а начальником отделения Ф.П.Лубяновский; столоначальником по отделению статистики М.К.Михайлов.	0:10	0:152
директор	NOUN	1918-1990	2	директор-100		Слова Тимофея Саввича совершенно оправдались: из Вагурина вышел хороший доверенный, и впоследствии он сделался директором Товарищества.	111:121	0:135
директор	NOUN	1918-1990	2	директор-101		-- Это же Байкалов, директор цирка.	20:28	0:35
директор	NOUN	1682-1916	1	директор-102		Таким образом, эти чиновники имели на солдат больше влияния, нежели их офицеры, что весьма естественно, потому что, в конце концов, начальники таможенных округов, подчиненные директору департамента таможенных сборов, были начальниками и пограничной стражи, находящейся в каждом округе.	175:184	0:285
директор	NOUN	1682-1916	1	директор-103		1 М. А. Языков, директор петербургского стеклянного завода, был непременным членом тогдашних литературных кружков.	16:24	0:114
директор	NOUN	1682-1916	1	директор-104		Таков был директор московского реального училища с правами реальных гимназий.	10:18	0:77
директор	NOUN	1682-1916	1	директор-105		Я не знаю, знали ли Вы о моих униполярных динамо-машинах, которые я изобретал, будучи учеником реального училища, но не могу не упомянуть одного "дорогого" курьеза: я измыслил, на основании существовавших тогда теорий такую -- и сейчас скажу -- остроумную машину, что директор завода Густава Листа предложил мне без промедления выстроить машину на 40 лошадиных сил; я сделал все чертежи, машину отлили, сделали (штука вышла в 40 пудов) -- и ток не пошел.	268:276	0:454
директор	NOUN	1682-1916	1	директор-106		Те -- в школу, к директору: подавайте сюда вашего зоолога, людям надо на работу, в магазины, а выйти никто не может.	17:26	0:116
директор	NOUN	1918-1990	2	директор-107		Разрешения министра кратко излагаются на тех же записках директором и по оным изготовляются в отделениях надлежащие исполнения.	57:67	0:127
директор	NOUN	1682-1916	1	директор-108		То конторщик Павлинов запьет и в пьяном виде получит выговор от директора, то штейгерова корова сбесится, то свинья покусает сынишку кухарки чертежника.	64:73	0:152
директор	NOUN	1918-1990	2	директор-109		Рванув Тему за руку, директор одним движением выдернул его в проход и потащил за собой.	21:29	0:87
директор	NOUN	1682-1916	1	директор-110		Умер Кошанский в 1831 году в должности директора института слепых в Петербурге; а любимый профессор лицеистов Куницын -- в 1840 г. директором департамента духовных дел иностранных исповеданий.	39:48	0:192
директор	NOUN	1682-1916	1	директор-111		Вчера вторым отделением Concert classique дирижировал Отто Лозе, директор опер в Кельне.	65:73	0:88
директор	NOUN	1918-1990	2	директор-112		Хикки, после телефонного разговора с Мурой, позвонил Локкарту в Прагу, где тот жил с 1919 года, сначала служа при английской миссии коммерческим атташе, а затем, с 1923 года -- одним из директоров Англо-Австрийского международного банка, который теперь переименовался в международный филиал Английского банка.	186:196	0:309
директор	NOUN	1918-1990	2	директор-113		-- В "Военной книге" буду директором.	26:36	0:37
директор	NOUN	1918-1990	2	директор-114		Хорошо, что директора по очереди будут посылать окрест этих добрых вестников.	12:21	0:77
директор	NOUN	1918-1990	2	директор-115		В приемной застал я директора Мещерского совхоза, с которым был едва знаком.	20:29	0:76
директор	NOUN	1682-1916	1	директор-116		Что ты не ешь -- обратился он к кадету, впоследствии он был директором в банке, Рербергу.	60:70	0:89
директор	NOUN	1682-1916	1	директор-117		Я -- директор дороги, Ардалион Псищев.	5:13	0:38
директор	NOUN	1682-1916	1	директор-118		Я уже давно не был директором, но многие в театре оказывали мне доброе внимание и обращались, когда я приходил на представление, с тем или иным вопросом.	19:29	0:153
директор	NOUN	1918-1990	2	директор-119		Я уже попросил об этом письменно директора департамента полиции.	33:42	0:64
