lemma	pos	date	grouping	identifier	description	context	indexes_target_token	indexes_target_sentence
пружина	NOUN	1682-1916	1	пружина-70		Не слыхал такого -- Бреду, Уханов, веришь Да откуда парень появился -- Помолчите, Голованов, если не соображаете! -- возвысил голос Дроздовский и выпрямился так резко, гибко, словно в нем пружина разогнулась.	188:195	0:208
пружина	NOUN	1918-1990	2	пружина-71		Слишком изнеженные чувствования, запутанные любовные интриги с вечными клятвами безусловной верности, вопреки судьбе и людям, великодушие на ходулях, припадки безрассудной и неуместной ревности, оканчивающиеся обыкновенно мольбою о прощении, низкие слабости, унижающие человечество, как то: нарушение супружеской верности, страсть к игре и проч., эти пружины новейших драм были не в моем вкусе и мне часто случалось отказываться от таких ролей, в которых, по мнению других, я могла бы заслужить благоволение публики".	351:358	0:517
пружина	NOUN	1918-1990	2	пружина-72		Но когда задевали по ногам и я сдвигался, пружины, перемещаясь, тотчас выстреливали и жестко о себе напоминали, после чего вновь приходилось елозить задом и смещаться (и пока я приспосабливался к пружинам, пружины приспосабливались ко мне).	42:49	0:240
пружина	NOUN	1918-1990	2	пружина-73		Надо опустить никель в соответствующую щель, тогда автоматически освобождается кий на какой-то пружине, и весельчак, решивший провести вечер в разгуле, может пять раз стрельнуть стальным шариком.	95:102	0:195
пружина	NOUN	1682-1916	1	пружина-74		Один раз под ее пальцем нечаянно щелкнула на видимая пружина.	53:60	0:61
пружина	NOUN	1682-1916	1	пружина-75		Но можно показать другие реактивные приборы, работающие пружиной, паром, упругостью газов или другими силами, не зависимыми от тяжести.	56:64	0:135
пружина	NOUN	1682-1916	1	пружина-76		Однако помни, что Кундалини свернулась подобно пружине и змея всегда готова к укусу.	47:54	0:84
пружина	NOUN	1918-1990	2	пружина-77		Не имея опытности в вопросах дипломатических, незнакомый с тайными пружинами европейских кабинетов, никогда не бывавший на войне и совершенно не знавший службы, он, однако, ни пред чем не останавливался -- брался за составление нового уложения, и за финансовые вопросы, и за управление политикою русского двора, и за изобретение гаубиц, и за учреждение военного строя.	67:76	0:368
пружина	NOUN	1682-1916	1	пружина-78		Он кидается так, как будто под ним взорвалось что, будто его подкидывает, стремительно развернувшись, стальная пружина.	111:118	0:119
пружина	NOUN	1918-1990	2	пружина-79		Просится в столяры, но уже три недели все пущенные мною в ход пружины об определении его в мастерство не дали ничего.	62:69	0:117
пружина	NOUN	1682-1916	1	пружина-80		Он усиленно шевелился, дышал громко, кашлял, чтобы ничем не походить на покойника, окружал себя живым шумом звенящих пружин, шелестящего одеяла; и чтобы показать, что он совершенно жив, ни капельки не умер и далек от смерти, как всякий другой человек, -- громко и отрывисто басил в тишине и одиночестве спальни: -- Молодцы!	117:123	0:323
пружина	NOUN	1682-1916	1	пружина-81		Мечта исчезла в одно мгновение, и я увидел в ней куклу, которая движется по заведенной пружине.	87:94	0:95
пружина	NOUN	1682-1916	1	пружина-82		Помнят ли читатели сцену из теперь забытого, а некогда делавшего много шуму романа Евгения Сю "Вечный жид", когда иезуит Роден упрекает иезуита Д'Эгриньи в неумении вести дела ордена, в употреблении грубых материальных средств и насилия там, где должна быть пущена в ход тонкая интрига, основанная на нравственных пружинах, не для того только, чтобы заставить наследников опоздать ко дню открытия завещания, но чтобы принудить их добровольно отказаться от баснословного богатства в пользу ордена Таким Роденом, запасным иезуитским провинциалом, является в глазах Европы Австрия с ее католическим, немецким, мадьярским и польским элементами.	314:322	0:640
пружина	NOUN	1682-1916	1	пружина-83		Представим себе два деревянных кружка (фиг. 54 -- 1, с и d), соединенные спиральными пружинами с поперечным бруском б. Через отверстия в этом бруске пропущены два гибкие каучуковые прута (а, а), соединенные поперечной рукояткой (е).	85:94	0:232
пружина	NOUN	1918-1990	2	пружина-84		Правда, в начале разгрузки бочки в желоб придется опускать аккуратно, а в конце работы им нужно будет "помочь" преодолеть сопротивление пружины поддона.	136:143	0:152
пружина	NOUN	1918-1990	2	пружина-85		Неповоротливым чувствовал я себя в этом окружении, но я отдыхал, во мне все-таки ослаблялась пружина всегдашней моей сосредоточенности.	93:100	0:135
пружина	NOUN	1918-1990	2	пружина-86		Распустятся пружины тела от вечерней прохлады, и разомлеют сердца затонщиков.	12:19	0:77
пружина	NOUN	1918-1990	2	пружина-87		Совершенно очевидно, что, коль скоро пружина или груз Р перестанут пополнять расходующуюся при колебаниях энергию, эти колебания прекратятся (затухают).	37:44	0:152
пружина	NOUN	1682-1916	1	пружина-88		Рассказ Лидочки взволновал меня сильно, так что сердце начало у меня в груди колотиться, как соскочившее с пружины.	107:114	0:115
пружина	NOUN	1682-1916	1	пружина-89		Затем я стал понимать не только людей и человеческий характер, но также скрытые пружины общественной жизни.	80:87	0:107
пружина	NOUN	1682-1916	1	пружина-90		С лязгом и грохотом сработала дьявольская пружина катапульты.	42:49	0:61
пружина	NOUN	1918-1990	2	пружина-91		Все события от времени потеряли цвет подробностей и значение внутреннего смыслу; цепь жизни разорвана на куски, пружины и кольца ее распались.	112:119	0:142
пружина	NOUN	1682-1916	1	пружина-92		С этим Термосёсов скинул ногой сапоги и начал умащиваться на диване, ветхие пружины которого гнулись и бренчали под его блудным телом.	76:83	0:134
пружина	NOUN	1682-1916	1	пружина-93		Словно кукла, в которой дернули пружину.	32:39	0:40
пружина	NOUN	1682-1916	1	пружина-94		Санька шел за швейцаром, и мутный воздух бился в груди, и как будто задохнулась голова и ноги не свои, чужие пружины.	109:116	0:117
пружина	NOUN	1918-1990	2	пружина-95		Олинька соскочила с постели, как бы вытолкнутая пружиною, и босая, полунагая, поддерживая рукою валящуюся с плеч рубашку, побежала к розовому платью; потом побежала к белому; потом опять к розовому; потом к столикам; потом снова к платьям.	48:56	0:239
пружина	NOUN	1918-1990	2	пружина-96		Сергей долго любовался им, потом с удовольствием переломил ствол, ощущая сопротивление пружины взвода и прохладу стали, вложил туда свинцовую пульку и выстрелил в стоявшую на полу ржавую банку.	87:94	0:193
пружина	NOUN	1918-1990	2	пружина-97		Сложное устройство Гиппиус было гораздо сложнее "костей и пружин".	58:64	0:66
пружина	NOUN	1918-1990	2	пружина-98		Стоят кресла с вылезшими наружу пружинами и трясущиеся столики с фотографиями.	32:41	0:78
пружина	NOUN	1918-1990	2	пружина-99		Одна за другой, как стальные пружины, они взвивались кверху, вырывая кружки и полосы кожи у кашалота и вновь обвивая его.	29:36	0:121
пружина	NOUN	1682-1916	1	пружина-100		Так бандерша ихняя, сука, знаешь до чего додумалась Приделала к пружинам матраца таксометр.	64:72	0:91
пружина	NOUN	1918-1990	2	пружина-101		Генерал много и убедительно говорил митрополиту о своих скорбях и заботах исторгнуть сына из-под влияния Петербурга и петербургских идей, но между тем на самом деле он не только сам весь тяготел к Петербургу, но и сына не желал удалять от здешних карьерных пружин.	257:263	0:264
пружина	NOUN	1682-1916	1	пружина-102		Только гигантская чугунная труба древнего водопровода, опиравшаяся на скрученных в спиральные пружины железных змей, прямо и неуклонно прорезала хаос развалин.	94:101	0:159
пружина	NOUN	1918-1990	2	пружина-103		И чем туже была закручена пружина, тем дольше продолжается звон.	26:33	0:64
пружина	NOUN	1918-1990	2	пружина-104		Только из них стрелять еще было нельзя, в них не хватало одной малости -- возвратно-боевой пружины.	91:98	0:99
пружина	NOUN	1918-1990	2	пружина-105		Какие пружины движут новым -- невиданным доселе -- человеком Что делает этот человек на земле Чем одержим, чем несчастлив и счастлив В молодости -- путешествия, в старости -- медленные прогулки по Переделкину не были пусты.	6:13	0:223
пружина	NOUN	1682-1916	1	пружина-106		Точно раскручивалась пружина заводной игрушки, и дрожала, и звенела в тихом безмолвии вечера.	21:28	0:93
пружина	NOUN	1682-1916	1	пружина-107		Может быть, сегодня утром мелькнул последний розовый ее луч, а там она будет уже -- не блистать ярко, а согревать невидимо жизнь; жизнь поглотит ее, и она будет ее сильною, конечно, но скрытою пружиной.	193:201	0:202
пружина	NOUN	1918-1990	2	пружина-108		Улыбаясь своей догадке, он подкрался к девочке, выхватил у нее из руки гибкую, прозрачно-желтую гребенку и, сжав ее, как пружину, пустил вверх.	121:128	0:143
пружина	NOUN	1918-1990	2	пружина-109		Теперь миллион отсюда, миллион оттуда с иголками и другими пружинами.	59:68	0:69
пружина	NOUN	1918-1990	2	пружина-110		Часовой мастер Глазиус Шенкер, окруженный колесиками, пенсне и пружинами, сидел под часами, в числе коих были одни башенные.	63:72	0:124
пружина	NOUN	1918-1990	2	пружина-111		Исчезала из тела всякая расхлябанность и вялость, мускулы как будто превращались в стальные пружины.	92:99	0:100
пружина	NOUN	1682-1916	1	пружина-112		Шопенгауэр, бесспорно, один из гениальнейших психологов-наблюдателей во всей истории человечества, и ни в чем сила его проницательности не сказывается с такою поражающей яркостью, как в тех случаях, когда ему приходится разбирать нравственные пружины человеческих действий.	243:250	0:273
пружина	NOUN	1682-1916	1	пружина-113		Он не пропускал ни одного движения, ни одного слова, чтоб не разбранить мальчишек; к словам нередко прибавлял он и тумак или "ковырял масло", то есть щелкал как-то хитро и искусно, как пружиной, большим пальцем и мизинцем по голове.	185:193	0:232
пружина	NOUN	1682-1916	1	пружина-114		Этот характерный призыв ярко освещает безграничную жестокость лиц, державших террористические пружины.	94:101	0:102
пружина	NOUN	1682-1916	1	пружина-115		Замок состоит только из курка, спуска и пружины, прикреплённой на внешней стороне.	40:47	0:82
пружина	NOUN	1682-1916	1	пружина-116		Я любил заглядывать в их души и подмечать там все сокровенные движения и все тайные пружины их поступков, честных и бесчестных, добрых и злых.	84:91	0:142
пружина	NOUN	1682-1916	1	пружина-117		От него узнал я, впервые, что французы не были разбиты, наголову, при Пултуске, Голымине и Прейсиш-Эйлау; что в Варшаве учреждено временное польское правление и сформировано польское войско в 30 000 человек; что прокламации Наполеона ходят здесь по рукам, что до двенадцати тысяч польского юношества, из хороших фамилий и мелкой шляхты, перешло в польскую военную службу, из всех польских провинций, возвращенных России и присоединенных к Австрии, особенно из Волынской губернии и Галиции, что главная пружина этого энтузиазма -- женщины, и что здесь нетерпеливо ожидают вторжения французов.	502:509	0:591
пружина	NOUN	1918-1990	2	пружина-118		на пружинах! своих нет-с!..	3:11	0:27
пружина	NOUN	1918-1990	2	пружина-119		Я объясняю, что ищу музыку для моих спортсменов, что я ищу такую мелодию, которая раскручивалась бы как пружина, так, как это происходит в "Болеро" Равеля, но в то же время абсолютно современную, веселую, волнующую.	104:111	0:215
