lemma	pos	date	grouping	identifier	description	context	indexes_target_token	indexes_target_sentence
пружина	NOUN	1682-1916	1	пружина-0		-- Ты еще не заметил в нем лучшего, -- молвил я, -- это полка с пружиною новой кубачинской выдумки: пожми огниво -- из него отпадет на полку золоченая покрышка, чтобы порох не развеялся и не отсырел, а при выстреле она сама входит в прежнее место.	64:72	0:247
пружина	NOUN	1682-1916	1	пружина-1		Заржавевшая от долгого неупотребления, тайная пружина не поддавалась; много усилий нужно было употребить, чтоб заставить ее повиноваться.	46:53	0:137
пружина	NOUN	1918-1990	2	пружина-2		Пружина развернется -- и тогда.	0:7	0:31
пружина	NOUN	1918-1990	2	пружина-3		Въ остальномъ работа частей пулемета будетъ та же, что и при отвод затворной рамы назадъ за рукоятку, но, такъ какъ спусковой крючекъ нажатъ, затворная рама не остановится въ заднемъ положенiи на боевомъ взвод, а, отойдя назадъ до отказа, дйствiемъ возвратно-боевой пружины тотчасъ устремится впередъ; затворъ вытолкнетъ новый патронъ изъ прiемника магазина и дошлетъ его въ патронникъ, ударникъ разобьетъ капсюль; произойдетъ новый автоматическiй выстрлъ.	266:273	0:456
пружина	NOUN	1918-1990	2	пружина-4		Пружины приоткрытого рояля трещали и вздрагивали, точно от боли.	0:7	0:64
пружина	NOUN	1918-1990	2	пружина-5		Наконец, повозились, потрещали пружинами и успокоились.	31:40	0:55
пружина	NOUN	1682-1916	1	пружина-6		Пружины сломались, меха продырявились, шкуры облезли, из брюха висела гнилая мочала -- и жалкими казались теперь грозные некогда львы российских самодержцев.	0:7	0:157
пружина	NOUN	1682-1916	1	пружина-7		С той минуты, как Пьер увидел это страшное убийство, совершенное людьми, не хотевшими этого делать, в душе его как будто вдруг выдернута была пружина, на которой все держалось и представлялось живым, и все завалилось в кучу бессмысленного сора.	142:149	0:244
пружина	NOUN	1682-1916	1	пружина-8		А вот не получается -- картина моей жизни без ссылки на эту организацию вышла бы неполной, а пружины некоторых сюжетов -- невыясненными и загадочными.	93:100	0:150
пружина	NOUN	1918-1990	2	пружина-9		В ней поселилось теперь твердое убеждение, что это так, хотя существенных доказательств она никаких не имела и не могла разгадать всех нитей и пружин этой дьявольской интриги.	143:149	0:175
пружина	NOUN	1682-1916	1	пружина-10		А иногда за облаками лиц, за облаками глаз вам чудились хитроумные, полные научной тайны чертежи, постройки рока; и слова и дела были какой-то облачной зарей, харей и личиной на многоугольнике, пружине рока.	194:201	0:207
пружина	NOUN	1918-1990	2	пружина-11		Начальник, не уважаемый государем, скоро презрен низшими чинами, и нужно ли изъяснять, сколь много неустройств отсюда происходит Власть и послушание суть, по мнению моему, единственные пружины, движущие политические сферы, разрыв этих двух союзных сил все разрушает.	185:192	0:266
пружина	NOUN	1918-1990	2	пружина-12		В них при торможении энергию поглощают пружины, которые затем, распрямляясь, отдают ее на перемещение рабочих органов.	39:46	0:118
пружина	NOUN	1918-1990	2	пружина-13		Но в Планерской Муравлеву не понравилось, он ругал жену, заманившую его за город редкими путевками, ругал местную кухню, а ночью, почувствовав сердечным боком пружину матраца, пробормотал в полудреме: "Чтоб он сгорел, этот дом отдыха!"	159:166	0:235
пружина	NOUN	1918-1990	2	пружина-14		В результате уплотнитель остается в уравновешенном состоянии, а его прижим к скользящей поверхности осуществляется только пружиной, усилие которой стабильно.	122:130	0:157
пружина	NOUN	1918-1990	2	пружина-15		И даже полиэтиленовая занавеска в ванной повешена необычно -- проволока, на которой она держится, выходит прямо из отверстия в стене, а за стеной, где коридор, укреплена катушка со спиральной пружиной.	192:200	0:201
пружина	NOUN	1682-1916	1	пружина-16		Версию об охоте О. Чайковская принимает за истину и верит тому, что "пистолет-трубка", из которого, по заключению экспертизы, можно произвести только один выстрел, так как "боевая пружина и резьба не выдерживают силы отдачи и деформируются", приготовлен не для того, чтобы под видом несчастного случая избавиться от жены.	180:187	0:321
пружина	NOUN	1918-1990	2	пружина-17		Главные пружины "движущей силы" -- нужда и честолюбие.	8:15	0:54
пружина	NOUN	1682-1916	1	пружина-18		Ветхие пружины, приводившие в движение позолоченные крылья, ослабели.	7:14	0:69
пружина	NOUN	1682-1916	1	пружина-19		Политическая история человечества "на протяжении шестидесяти столетий" имела своей движущей пружиной только "создание человеческой фантазии".	92:100	0:141
пружина	NOUN	1682-1916	1	пружина-20		Вопреки этому мы должны подчеркнуть, что в наших опытах нерв все время лежал на электродах и, следовательно, не вынимался из раны с целью раздражения; что пружина электромагнитного мотора находилась в непрерывном колебании, и таким образом в начале раздражения не возникал новый шум, который мог бы испугать животное; что, наконец, согласно свидетельству вышеприведенных кривых, тот же результат достигался также в состоянии хлоралового сна.	155:162	0:441
пружина	NOUN	1682-1916	1	пружина-21		Обладающий справедливым учением ничего без вернейших объяснений, учинившихся долговременными наблюдениями несомненными и ощутительными, не предлагает; но мечтающий умствователь, гордясь вымышленными своими мудроположениями, повелевает читателям принимать их за истинные пружины всего естества, несмотря на то, что существо оного и текущее обращение его не воображением познаемо быть может, но вопрошением рачительнейшего испытания натуры, которая отрицает всякое откровение в себе пустомысленности, изображающейся суесловием, но обнаруживает себя только тем, кои прилежанием и трудолюбием тщатся проникнуть в творения ее.	270:277	0:621
пружина	NOUN	1682-1916	1	пружина-22		Вторая соединяется с первою шарниром и имеет скрытную пружину, чрез что нога удобно сгибается и опять прямое направление принимает.	54:61	0:131
пружина	NOUN	1682-1916	1	пружина-23		Уверяли, что он как-то расправлял пружинками морщины на своем лице и что эти пружины были, каким-то особенным образом, скрыты в его волосах.	34:44	0:140
пружина	NOUN	1918-1990	2	пружина-24		Глубинный анализ 30-х годов, безыллюзорное исследование "пружин" террора, исторической слепоты живущих в Доме на набережной и объективной вины тех, кто стоял у начал (об этом прямо и недвусмысленно свидетельствует историческая концепция Трифонова в целом, вся "цепь", которую он старался вытащить из колодца истории), проникновение в истоки современного конформизма -- все это есть в недавно опубликованном романе Ю. Трифонова "Исчезновение".	57:63	0:442
пружина	NOUN	1918-1990	2	пружина-25		Наиболее прозрачный характер связи между основной пружиной движения общества -- его производительными силами -- и искусством на ранних ступенях культуры.	50:58	0:153
пружина	NOUN	1918-1990	2	пружина-26		Да и не так уж много энергии вбирает пружина.	37:44	0:45
пружина	NOUN	1918-1990	2	пружина-27		Дверь на тугой пружине с грохотом захлопывается за мною.	15:22	0:56
пружина	NOUN	1682-1916	1	пружина-28		Для вдевания веревки они имеют защелку с пружиной.	41:49	0:50
пружина	NOUN	1918-1990	2	пружина-29		-- На один из вечеров пришел князь Васильчиков и рассказал много интересного; рассказ его отличался совершенным знанием дела, лиц и всех пружин, но положение его и звание заставляют его быть воздержанным в рассказах.	137:143	0:216
пружина	NOUN	1682-1916	1	пружина-30		Дремлющий грузно переворачивается, заставляя трещать все пружины матраца.	57:64	0:73
пружина	NOUN	1918-1990	2	пружина-31		-- Значит, и бога можно понять, как часовую пружину -- проговорил он почти с каким-то азартом.	44:51	0:94
пружина	NOUN	1682-1916	1	пружина-32		Дурак-безумец иногда вдруг как на пружине выскакивал из него с какой-то злобой.	34:41	0:79
пружина	NOUN	1918-1990	2	пружина-33		Он мчался, как птица, крепко и часто ударяя о землю ногами, которые внезапно сделались крепкими, точно две стальные пружины.	116:123	0:124
пружина	NOUN	1682-1916	1	пружина-34		Его лирическая пружина могла бы развернуться до конца только в условиях гармонического, счастливого, с песней живущего общества, где не борьба царит, а дружба, любовь, нежное участие.	15:22	0:183
пружина	NOUN	1918-1990	2	пружина-35		Достигнув заветной двери с тугой пружиной, малыш, весь в снегу и испарине, с трудом одолевает дверь и победоносно просится прямо в "аудиторию", т. е. в комнату для гостей, приспособленную для занятий с детьми.	33:41	0:209
пружина	NOUN	1682-1916	1	пружина-36		Ему вдруг приходит новое объяснение: в последнее время он был говорлив, много расспрашивал, и Аглая Андреевна отстранила его, как бы убоявшись, что он прежде времени обнаружит какие-то тайные стороны или пружины их общеделовой жизни.	204:211	0:233
пружина	NOUN	1918-1990	2	пружина-37		А как покориться Я чувствую, что я закалил пружину и теперь эту пружину приходится сильно гнуть, боюсь, как бы не сломать ее.	43:50	0:125
пружина	NOUN	1682-1916	1	пружина-38		Ему нравилось строить домики, самодвижущиеся коляски с пружинами, коляски с ветряными двигателями, ходившие против ветра.	55:64	0:121
пружина	NOUN	1918-1990	2	пружина-39		Два рода пружин, кои оную приводят в движение, суть нравы и законы.	9:15	0:67
пружина	NOUN	1918-1990	2	пружина-40		Зазвенел сигнальный гонг, могучая пружина швырнула самолет почти отвесно вверх, тело Веды медленно погрузилось в глубь кресла, точно в упругую жидкость.	34:41	0:152
пружина	NOUN	1918-1990	2	пружина-41		Или: вы -- разворачивающаяся пружина.	29:36	0:37
пружина	NOUN	1682-1916	1	пружина-42		И вдруг он вскочил на ноги, выпрямился весь, как пружина, и заговорил звонко, горячо: -- Почему же называют это место -- местом спасения души, если и здесь всё на деньгах построено, для денег живём, как и в миру Я сюда от греха торговли, а она здесь против меня, -- куда бегу теперь Дрожит весь и спешно рассказывает про себя: сын купца, булочника, коммерческое училище кончил и был уже приставлен отцом к торговле.	49:56	0:415
пружина	NOUN	1682-1916	1	пружина-43		Уверяли, что он может нагонять бурю и снег, напустить болезни на людей и скот и т. д. Отправляясь в экспедицию, Пржевальский захватил с собою инструмент доктора Бауншейдта, состоящий из пучка иголок, делавших посредством пружины уколы на коже, смазываемые каким-то маслом.	221:228	0:272
пружина	NOUN	1918-1990	2	пружина-44		И как бы сквозь сон, как райский свет, видел он все выше и выше загоравшиеся над ним лампочки; и вот, наконец, как пение Валькирий, уносивших его душу, слетал к нему громкий трезвон широкого круглого колокола на исходе пружины автомата.	219:226	0:236
пружина	NOUN	1918-1990	2	пружина-45		Но внутри него пружина уже напряглась до предела.	15:22	0:49
пружина	NOUN	1682-1916	1	пружина-46		И посему весьма несомненная и преполезная истина есть то, что воспитание подобно сложной машине, в которой составлены многие разные пружины и колеса, которым надобно приводить в движение одному другое, если должно воспоследовать потребное действие.	132:139	0:248
пружина	NOUN	1682-1916	1	пружина-47		Всеобщая пружина, кажется, приводитъ большую частъ наци въ новую дятельность и жизнь; такое старане, такое домогательство неминуемо должно быть полезно!	9:16	0:152
пружина	NOUN	1682-1916	1	пружина-48		И, уже повернувшись, точно на пружине, на одной ноге, он, не оборачиваясь назад, добавляет певуче и двумя тонами ниже: -- Ра-авнение направа-а!	30:37	0:143
пружина	NOUN	1918-1990	2	пружина-49		Все сии затруднения и препятствия происходят от секретного влияния и действий двух лиц, которые по наружности показывают, что не имеют в делах никакого участия, а в самом деле суть главные пружины всего происходящего.	189:196	0:217
пружина	NOUN	1918-1990	2	пружина-50		Как всегда, если нет глубоких идей, мыслили аналогиями: все хорошо помнили, что частота колебаний пружины с грузиком зависит от ее упругости, следовательно, -- рассуждала часть физиков, -- и в атоме электроны связаны "какими-то" пружинами различной упругости.	98:105	0:259
пружина	NOUN	1918-1990	2	пружина-51		-- Как не понять, что каждый танцует свой танец и дотанцует его до конца, пока не сдохнет, потому как ключик потерялся, еще когда пружину заводили, да и кто его видел, ключик!	130:137	0:175
пружина	NOUN	1682-1916	1	пружина-52		Как спонсор заснет, вы ему под бок эту пружину -- раз!	39:46	0:54
пружина	NOUN	1918-1990	2	пружина-53		С буйной яростью начал было он вырываться, страшно изгибаясь и напрягая свои крепкие, как стальные пружины, мускулы.	99:106	0:116
пружина	NOUN	1918-1990	2	пружина-54		Коляски были разные: то сверкающие никелем на рычагах и пружинах, а то попроще и подешевле.	56:64	0:91
пружина	NOUN	1918-1990	2	пружина-55		В яме валяются машины, куски чугуна, жести, винты, пружины.	51:58	0:59
пружина	NOUN	1682-1916	1	пружина-56		Лопнула, говорит, пружина молоточка.	18:25	0:36
пружина	NOUN	1918-1990	2	пружина-57		Возможно ли им было повиноватися долгое время власти младенца или несмысленнаго Аридея, которой им столь же казался презрителен, как Александр велик Ограничивая власть свою во своих Сатрапствах, они бы разслабили правления пружины.	223:230	0:231
пружина	NOUN	1918-1990	2	пружина-58		Максимов, точно в нем развернулась пружина, сиганул с койки и в два прыжка оказался за дверью.	35:42	0:94
пружина	NOUN	1918-1990	2	пружина-59		Они состояли из электромагнита, а также других деталей, например, из ряда зубчатых колёс и пружин, напоминающих часовой механизм.	91:97	0:129
пружина	NOUN	1682-1916	1	пружина-60		На это он возражал, что такою же причиною самого себя является и моя пружина; и я только тогда успел заставить его замолчать, когда обратил внимание на то, что не заведенные ключом часы продолжают упорно стоять, невзирая ни на какое раскачивание маятника.	69:76	0:255
пружина	NOUN	1682-1916	1	пружина-61		Галицкй прыгнулъ на твердую почву; но, длая напряжене прыгнуть, онъ задлъ пружину -- курокъ спустился, раздался выстрлъ.	74:81	0:120
пружина	NOUN	1682-1916	1	пружина-62		Над дверью громко раздался звонок и, жалобно звеня, закачался на дрожащей пружине.	74:81	0:82
пружина	NOUN	1682-1916	1	пружина-63		Пружины, двигающие этим, ржавеют на море вместе с железом, сталью и многим другим.	0:7	0:82
пружина	NOUN	1682-1916	1	пружина-64		Надо было искать действенную пружину, которая бы вела этого человека.	29:36	0:69
пружина	NOUN	1918-1990	2	пружина-65		Остров как-то глупо хихикнул, дернулся, как на пружине, и сказал: -- Хорошо-с.	47:54	0:78
пружина	NOUN	1682-1916	1	пружина-66		Наконец пружина музыкально прозвенела, и крышку он откинул с их помощью.	8:15	0:72
пружина	NOUN	1682-1916	1	пружина-67		Сверх того, торг на одну сию губернию в Петербурге, под глазами двора, имел и ту преднамеренную цель, чтобы в случае его успеха убедить государыню к изволению и на все губернии производить торги в Сенате, чего он весьма добивался по причинам, кои отгадать всякий может, но до сих пор законы сего ему не позволяли, а здесь Сенат имел в виду, что наддача на Екатеринославскую губернию, послужа доводом государыне в его бескорыстии, решит ее на измену собственным ее законоположениям, для чего потребны были сильные пружины.	513:520	0:521
пружина	NOUN	1682-1916	1	пружина-68		Наконец что-то щелкнуло в пружине замка, дверь заскрипела и отворилась.	26:33	0:71
пружина	NOUN	1682-1916	1	пружина-69		Тогда пластинка продавливается, определенное количество воды вытекает, давление в трубке вновь падает, и пружина вновь прижимает донную пластинку.	105:112	0:146
