lemma	pos	date	grouping	identifier	description	context	indexes_target_token	indexes_target_sentence
гололед	NOUN	1991-2017	2	гололед-89		Вот и остались в городе два вида транспорта: по железной дороге пыхтели паровозы, а на крутых городских улицах, покачивая шеей в такт своим шагам, напрягаясь всем телом, оскальзываясь и больно -- но молча ведь, молча! -- падая в гололед, разбрызгивая грязь глухой осенью и затяжной весной, задыхаясь летней пылью, шли и шли лошади, увозя с заводов ящики с сытыми боками сально блестевших снарядов, а от санитарных составов -- раненых, укрытых серыми суконными одеялами, скрипучей зимой приволакивая из деревень возы сена для собственного же пропитания и много разных других вообразимых и невообразимых грузов.	229:236	0:609
гололед	NOUN	1918-1990	1	гололед-90		Потому замечу, что сегодняшний торговый моряк рискует в сто раз меньше, нежели вы, когда едете в такси по Москве в февральский гололед и, опаздывая на самолет, торопите и понукаете шофера.	127:134	0:188
гололед	NOUN	1918-1990	1	гололед-91		А там авторитетно обещают заморозки на почве и гололед.	47:54	0:55
гололед	NOUN	1991-2017	2	гололед-92		Потребитель, эксплуатирующий ВЛ, должен контролировать процесс гололедообразования на ВЛ и обеспечивать своевременное включение схем плавки гололеда; ВЛ, на которых производится плавка гололеда, должны быть, как правило, оснащены устройствами автоматического контроля и сигнализации гололедообразования и процесса плавки, а также закорачивающими коммутационными аппаратами.	63:82	0:373
гололед	NOUN	1991-2017	2	гололед-93		По гололеду тормоза не держали.	3:11	0:31
гололед	NOUN	1918-1990	1	гололед-94		Поэтому мокрый снег, туман, гололед.	28:35	0:36
гололед	NOUN	1918-1990	1	гололед-95		Когда же температура понижается до минус 8-10C, соленый снег замерзает; образуется гололед и колеи на дорогах, которые остаются на всю зиму.	83:90	0:140
гололед	NOUN	1918-1990	1	гололед-96		Правда, оно было куда легче переносимо мною чем, например, обивка гололеда, рытье мерзлых 1,5--2 метровых рвов, в снежную метель, рубка дров по колени и выше в снегу, в стареньких ботиночках и холодной телогрейке.	66:74	0:213
гололед	NOUN	1918-1990	1	гололед-97		Нигде в мире вы, например, не найдете специальных монастырей для вдов погибших в гололед таксистов.	81:88	0:99
гололед	NOUN	1991-2017	2	гололед-98		Реальная статистика показывает, что число дорожно-транспортных происшествий действительно вырастает во время первых гололедов, когда еще не все водители успевают перестроить свои реакции с летней ситуации на зимнюю.	116:125	0:215
гололед	NOUN	1991-2017	2	гололед-99		2.3.9. Внеочередные осмотры ВЛ или их участков должны проводиться при образовании на проводах и тросах гололеда, при пляске проводов, во время ледохода и разлива рек, при пожарах в зоне трассы ВЛ, после сильных бурь, ураганов и других стихийных бедствий, а также после отключения ВЛ релейной защитой и неуспешного автоматического повторного включения, а после успешного повторного включения -- по мере необходимости.	103:111	0:416
гололед	NOUN	1918-1990	1	гололед-100		С гололедом надо бороться!	2:11	0:26
гололед	NOUN	1918-1990	1	гололед-101		Каких только способов не предлагали вездесущие изобретатели для предотвращения скольжения ног на тротуарах во время гололеда.	116:124	0:125
гололед	NOUN	1918-1990	1	гололед-102		Сегодня (зима 2003-2004 годов) доработанный ХКМ официально признан одним из основных средств борьбы с гололедом.	102:111	0:112
гололед	NOUN	1991-2017	2	гололед-103		Зайцева "Как же быть с гололедом" (1969, 1) заканчивается словами: "Наверное, еще не одну зиму предстоит нам ходить и ездить по соленым тротуарам и улицам".	23:32	0:156
гололед	NOUN	1918-1990	1	гололед-104		Система полного привода нужна автомобилю скорее для езды по асфальту в гололед и снегопады, нежели для преодоления серьезного бездорожья.	71:78	0:137
гололед	NOUN	1991-2017	2	гололед-105		Был гололед, и ездить следовало осторожнее, но мне думалось, машина идет медленно оттого, что за рулем добрый шофер.	4:11	0:116
гололед	NOUN	1991-2017	2	гололед-106		Старушки шли с лыжными палками -- зима была, гололед.	45:52	0:53
гололед	NOUN	1991-2017	2	гололед-107		Гололед на данном пути страшнее сосулек.	0:7	0:40
гололед	NOUN	1991-2017	2	гололед-108		То и дело оскальзываясь на гололеде, Марина и Владислав, которого она держит под руку -- на первый взгляд кажется, просто нежная парочка, но так она его поддерживает -- подходят к парадному.	27:35	0:190
гололед	NOUN	1991-2017	2	гололед-109		ГИБДД только обещает подсчитать, сколько автомобилистов стало жертвами гололеда.	71:79	0:80
гололед	NOUN	1918-1990	1	гололед-110		Транспортная выгода данной акции до сих пор не нашла подтверждения, поскольку пешком до работы так же, а без гололеда -- и того быстрее.	109:117	0:136
гололед	NOUN	1991-2017	2	гололед-111		Это явление мы называем гололедом.	24:33	0:34
гололед	NOUN	1918-1990	1	гололед-112		Что ни говори, а в этом что-то было, -- мы как раз собрались в Сандунах, когда он туда поехал, и Эдик беспокоился, не случилось ли с ним чего: зима стояла недужная, то оттепель, то внезапный резкий мороз, гололед, прохожие руки-ноги ломали на неочищенных тротуарах, даже по телевизору предупреждали, чтоб осторожнее.	205:212	0:316
гололед	NOUN	1918-1990	1	гололед-113		Мой муж, который мало того, что трезвенник, так еще ходит на секцию карате и ведет на работе производственную гимнастику с элементами йоги, так вот, он шел по свежему гололеду, поскользнулся, упал и сломал руку.	167:175	0:211
гололед	NOUN	1991-2017	2	гололед-114		Широко раскрытые глаза На трассе Тверь -- Бежецк дорожный знак "Осторожно -- гололед!" встречается чаще остальных.	77:84	0:114
гололед	NOUN	1991-2017	2	гололед-115		Ради этих радостных минут, которые останутся в памяти на всю жизнь, стоило бороться с водой, работать в 30-градусные морозы и гололед, недосыпать и волноваться так, как только могут родители перед рождением долгожданного ребенка".	126:133	0:230
гололед	NOUN	1918-1990	1	гололед-116		Это охраняет луч антенны от разрыва при увеличении нагрузки от гололеда и ветра, позволяя, благодаря автоматическому удлинению луча, увеличивать его стрелу подвеса и тем самым уменьшать нагрузку на поперечное сечение канатика.	63:71	0:226
гололед	NOUN	1918-1990	1	гололед-117		После Покрова самая осень наступает: дожди студеные, гололед.	53:60	0:61
гололед	NOUN	1991-2017	2	гололед-118		Я всегда вожу машину сама, в любой гололед, в любой снег и слякоть, в любые пробки.	35:42	0:83
гололед	NOUN	1991-2017	2	гололед-119		Ситуацию усугубили январские морозы и гололед, из-за чего положение стало катастрофическим.	38:45	0:91
