lemma	pos	date	grouping	identifier	description	context	indexes_target_token	indexes_target_sentence
приношение	NOUN	1991-2017	2	приношение-65		Фамильные склепы зажиточных семей с богатыми погребальными приношениями -- и нищие могилы бедняков.	59:71	0:99
приношение	NOUN	1918-1990	1	приношение-66		Но самые ценные приношения сделаны Мельпомене.	16:26	0:46
приношение	NOUN	1991-2017	2	приношение-67		Сердечное Вам спасибо за это чудесное приношение.	38:48	0:49
приношение	NOUN	1991-2017	2	приношение-68		Ну а если этих приношений оказывается больше, чем нужно, мы отправляем их в монастырь Сера.	15:25	0:91
приношение	NOUN	1991-2017	2	приношение-69		Стены вокруг неё покрыты приношениями благодарных за исцеление -- золотыми и серебряными скульптурками человеческих органов, которые она излечила, -- она, умершая юной, не процарствовав и полугода.	25:37	0:197
приношение	NOUN	1918-1990	1	приношение-70		Он стоял, опустив руку с приношением, и челюсти его сводило от беззвучных рыданий.	25:36	0:82
приношение	NOUN	1991-2017	2	приношение-71		Вот -- только управлюсь, -- в обед забегу, занесу кое-какие приношения из Ростова.	60:70	0:82
приношение	NOUN	1991-2017	2	приношение-72		Первая есть человеческая проскомидия в самом широком смысле -- как приношение наших даров, нашей благодарной памяти (анамнезис) и нашего покаяния Творцу.	67:77	0:153
приношение	NOUN	1991-2017	2	приношение-73		Они даже привезли с собой из Кондара резные образа Близнецов-надболящим -- и собирались предложить их горцам в качестве приношений.	120:130	0:131
приношение	NOUN	1918-1990	1	приношение-74		Петра, увидел статуи Сатане и Антихристу, увидел трон Человекобога на месте приношения святой жертвы.	76:86	0:101
приношение	NOUN	1918-1990	1	приношение-75		И вот богине плодородия, Афродите, приносят хлеб, вино и блюдо из всех семян -- панспермию, это приношение сопровождается шутками, вызывающими смех.	96:106	0:148
приношение	NOUN	1918-1990	1	приношение-76		Последние годы они, как рассказывала Серафима, повадились к ней -- и то шанежку несут, то пирога горячего, то рыбы малосолой; она не нуждалась в приношениях, пенсия у нее была за заслуги персональная, по самому высшему окладу, два ордена да пять медалей лежат у нее в сундуке над погребальным платьем, сготовленным заранее, но зато нуждалась Серафима в участье, в добром слове, в живом слове, и потому она старушонок не гнала.	145:156	0:426
приношение	NOUN	1918-1990	1	приношение-77		Стоим перед Мечетью Цирульника, с виду она есть квадрат белых стен, окруженных гробницами; скупо расплюснулся купол над ними; простой минарет не высок, но мы входим во внутренний дворик, и хохот их садов, оскаленных точно зубами, колонками -- живо галдит детворой; и -- веселые смехи, галдеж арабчат, не смущаемых святостью места; в мечети -- начальная школа; несутся затейливой черной и белой росписью своды; иные -- в резьбе, поражающей вас изощрением: кубы и линии стали сплошной "арабеской"; лучи посылают лукавые глянцы на пестрый стенной изразец; и опять мы вошли уже в здание самой мечети; она -- небольшая, цветная, таит свою святость: гробницу Цирульника; сверху над нею висят приношения: яйца страусов, ленты, шелка пестротканных знамен; и -- шары.	686:696	0:758
приношение	NOUN	1918-1990	1	приношение-78		Потом села на мокрую землю, подогнув угол набрякшего плаща, и стала есть приношения, запивая святой водой и изредка взглядывая на колеблющееся пламя свечей.	73:83	0:156
приношение	NOUN	1918-1990	1	приношение-79		Живет, кажется, почти исключительно на народное приношение!	48:58	0:59
приношение	NOUN	1918-1990	1	приношение-80		Поэтому я и говорю, что наше приношение нечисто.	29:39	0:48
приношение	NOUN	1991-2017	2	приношение-81		Они раздавались паломникам, посещавшим зимой остров, в обмен на приношения, состоявшие главным образом из кирпичного чая и дзамбы.	64:74	0:130
приношение	NOUN	1918-1990	1	приношение-82		Преподобный пастырь начинает свое исповедание Богу, как бы раздумывая над делами своей жизни, и сразу же встает на путь спасительного покаяния и приношения Богу покаянных слез.	145:155	0:176
приношение	NOUN	1918-1990	1	приношение-83		Вознеси благоухание и из семидала памятную жертву и сделай приношение тучное, как бы уже умирающий; и дай место врачу, ибо и его создал Господь, и да не удаляется он от тебя, ибо он нужен.	59:69	0:188
приношение	NOUN	1918-1990	1	приношение-84		Пришлось подготовленные к гравированию ноты отослать в типографию Шюблера, которому Бах некогда поручил издание "Музыкального приношения".	126:136	0:138
приношение	NOUN	1918-1990	1	приношение-85		"Нужно иметь какие-то особенные головы и сердца, чтоб признавать необходимость приношения человека в жертву неведомому богу будущего", -- думал он, чутко вслушиваясь в спокойную речь, неторопливые слова Туробоева: -- Среди господствующих идей нет ни одной, приемлемой для меня.	79:89	0:277
приношение	NOUN	1918-1990	1	приношение-86		Против таких приношений Герой не сопротивлялся.	13:23	0:47
приношение	NOUN	1991-2017	2	приношение-87		Мы по-прежнему, как изначала совершения Литургии, приглашаемся горе иметь сердца и благодарить Господа, иными словами, участвовать в приношении Даров и молитв, ибо само слово "Евхаристия" означает 'Благодарение'.	133:143	0:212
приношение	NOUN	1991-2017	2	приношение-88		Пусть человек сделает хорошее приношение монастырю, а молиться -- дело монахов.	30:40	0:79
приношение	NOUN	1991-2017	2	приношение-89		Он был главным из приношений, которые получал легендарный император Юй.	18:28	0:71
приношение	NOUN	1918-1990	1	приношение-90		Раз в год полагалось делать приношения далай-ламе и получать его благословение.	28:38	0:79
приношение	NOUN	1991-2017	2	приношение-91		Он -- под ногами; блещут чуть розоватые на заре, а днем белоснежные кубы домов и башенок; через белые стены заборов бьет пурпур цветов в пустую кривую уличку; вон справа -- шелест серебряной чащи оливок; вдали -- розоватый пух расцветающих миндалей, за которыми -- распростерший объятия с востока на запад Тунисский залив, выбегающий Карфагенским мысом; я только что перечитал здесь "Саламбо" Флобера; и знал: две горы, что смыкались справа и лиловели, -- место приношения человеческих жертв; они -- образуют ущелье, в котором Гамилькар Барка некогда отбивался от Сципиона, защищая город; Радес -- переименованное арабами римское местечко "perrates" ("посредством весел"): отсюда переправлялись на лодках в Карфаген; позади нас горы Захуана с остатками римского водопровода; они еще багрянеют; а над Радесом -- легко-лиловые сумерки.	462:472	0:833
приношение	NOUN	1918-1990	1	приношение-92		Скоро лабаз Одноглазой распирало от приношений; она поставила еще один, в глухом месте, подальше от своего становища.	36:46	0:117
приношение	NOUN	1991-2017	2	приношение-93		Верно ли это -- Небо гневается на людей не за приношения, обильные или скудные, -- ответил Чан-Чунь.	46:56	0:100
приношение	NOUN	1918-1990	1	приношение-94		Слабея, имея посвящение в схиму, батюшка полностью отдавал себя людям, являя пример жертвенного приношения себя в деле старческого руководства.	96:106	0:143
приношение	NOUN	1991-2017	2	приношение-95		Посылали ли нас в кладовую, мы нагружали для няни карманы урюком, изюмом, миндальными орехами, а няня, считая, что господское добро пойдет господам же, то есть нам же, при случае только в претворенном виде, и правильно полагая, что у самих себя похитить нельзя, охотно принимала эти приношения.	283:293	0:294
приношение	NOUN	1918-1990	1	приношение-96		Со временем эти наивные изображения богов сойдут с грубого материала, на котором они начертаны осколком кремня или наконечником стрелы; они потребуют многочисленной челяди, мраморных жилищ, почестей, даже кровавых приношений, пока однажды не разобьется волшебное зеркальце и человек, оставшись наедине с природой, примет на себя полную ответственность за порядок в мире, доступном его деятельности.	214:224	0:398
приношение	NOUN	1918-1990	1	приношение-97		Сего ради приношение их Христа ради приимут от рук их денежку и две денежки и, взявши питья, попотчую его.	10:20	0:106
приношение	NOUN	1918-1990	1	приношение-98		Среди приношений можно увидеть макеты кораблей и самолетов, и буквально повсюду -- мраморные плитки, с берущими за сердце словами благодарности для Бон Мэр от простых людей и знаменитостей.	6:16	0:189
приношение	NOUN	1991-2017	2	приношение-99		Конечно, расходы по ее покупке оправдались бы от приношений паломников в течение одного или самое большее двух лет.	49:59	0:115
приношение	NOUN	1918-1990	1	приношение-100		Такие приношения мне всегда доставляют большое удовлетворение.	6:16	0:62
приношение	NOUN	1918-1990	1	приношение-101		Тот дал в ухо, получил за старанье свое приношенье какое из мужицких запасов и дальше ускакал.	40:50	0:94
приношение	NOUN	1991-2017	2	приношение-102		Уверен, что когда-то и сам Сталин в этом "музыкальном приношении" узрел явный подвох.	54:64	0:85
приношение	NOUN	1991-2017	2	приношение-103		Согласно Тертуллиану, брак между христианами свят, ибо его "соединяет Церковь, подтверждает приношение/10, знаменует благословение, Ангелы славят, Отец полагает действительным"/11.	92:104	0:180
приношение	NOUN	1918-1990	1	приношение-104		Уже император Август задыхался от этого фимиама лести; и однажды велел снять около 80 пеших и конных серебряных статуй своих, поставленных ему в Риме, перелить их и обратить вырученные деньги на драгоценные приношения в храме Аполлона -- от своего имени и от имени жертвователей, желая этим подчеркнуть, что поклонение подобает Богу, а императору не подобает принимать лесть.	207:217	0:375
приношение	NOUN	1918-1990	1	приношение-105		Гости вынимают приношения.	15:25	0:26
приношение	NOUN	1991-2017	2	приношение-106		Хотят показать концерт в благодарность за приношения.	42:52	0:53
приношение	NOUN	1991-2017	2	приношение-107		Приношение жертвы богам на этом заканчивается.	0:10	0:46
приношение	NOUN	1918-1990	1	приношение-108		Храм требовал охраны -- у него ведь были, кроме здания, и часто драгоценные приношения, и стада, и земли.	76:86	0:105
приношение	NOUN	1918-1990	1	приношение-109		Приношение начинается так называемым "великим входом" -- духовенство в торжественной процессии приносит дары хлеба и вина и полагает их на престол.	0:10	0:147
приношение	NOUN	1918-1990	1	приношение-110		Через некоторое время Эммануил в сдержанных до сухости выражениях уведомил отца, что приношение его принято милостиво.	85:95	0:118
приношение	NOUN	1918-1990	1	приношение-111		Так в Индии все согрешившие спешат принести своему брамину в жертву козла и другие ценные приношения, и столь же успешно получают прощение и очищение.	90:100	0:150
приношение	NOUN	1918-1990	1	приношение-112		Чернобесов зажег толстую свечу, покрыл ее пленочным кульком из-под приношений, хрипло зарокотал: "Господи помилуй, господи по-ми-луй, гос-по-ди помилуй на-а-а-с!"	67:77	0:162
приношение	NOUN	1918-1990	1	приношение-113		На кустах призрачно висели приношения, намокшее, в желтых разводах плесени женское белье, пелена и полотенца, уже источенные дождями и ветром.	27:37	0:142
приношение	NOUN	1991-2017	2	приношение-114		Это были приношения богам во имя благополучия праздника.	9:19	0:56
приношение	NOUN	1991-2017	2	приношение-115		Наряду с музыкой Арама Хачатуряна в программы фестиваля вошли произведения других авторов -- как приношение памяти композитора.	97:107	0:127
приношение	NOUN	1991-2017	2	приношение-116		Я наблюдал за работами и принимал приношения.	34:44	0:45
приношение	NOUN	1991-2017	2	приношение-117		Кто за нас может освоить наш самый чудовищный опыт несвободы и попытки свободы Прорежется ли зуб новой философии или все кончится почесыванием десны Зуб разума По своему решает его Бердяев: "Моя темы была: ...можно ли перейти от творчества совершенных произведений к творчеству совершенной жизни.." ХАЙДЕГГЕР: "Поэзия есть приношение даров, основоположение и начинание.	323:333	0:369
приношение	NOUN	1918-1990	1	приношение-118		Я распоряжался свежими корнеплодами и кочнами капусты, махновцы имели доступ к мясу, соболятники выделяли нам урюк, рис, мед взамен на наши весомые приношения.	148:158	0:159
приношение	NOUN	1918-1990	1	приношение-119		Перечитал и эту статью, и "Иерархию ценностей", и переднюю главу из Литургии ("Таинство приношения") и ощутил полную неспособность работать.	88:98	0:140
