lemma	pos	date	grouping	identifier	description	context	indexes_target_token	indexes_target_sentence
приношение	NOUN	1991-2017	2	приношение-0		"ПРИНОШЕНИЕ САНКТ-ПЕТЕРБУРГУ".	0:0	0:30
приношение	NOUN	1991-2017	2	приношение-1		И точно -- в разгар парада приношений прибежал, запыхавшись, Коля Соловцов, а следом за ним и небольшая компания во главе с Игорем и Верой Головиными.	27:37	0:150
приношение	NOUN	1918-1990	1	приношение-2		-- И туманно, чтоб не обидеть гостя из дружественной державы, намекнул на опасный опыт троянских коней и данайских приношений.	115:125	0:126
приношение	NOUN	1918-1990	1	приношение-3		С тех пор орочи, удэхе и гольды, когда проходят мимо скал, останавливаются и кладут на камни свои приношения: лоскутки материи, кусочки сахару, листочки табаку или выливают несколько капель водки и просят послать им удачную охоту и счастливое окончание пути.	98:108	0:258
приношение	NOUN	1991-2017	2	приношение-4		Приношение большей части золотого запаса страны в дар Будде не только очень характерно для Мьянмы, но и искренне.	0:10	0:113
приношение	NOUN	1991-2017	2	приношение-5		Едва ли можно было избрать для музыкального приношения учителю, находящемуся в зале среди слушателей, сочинение более подходящее, нежели Виолончельная соната Дмитрия Шостаковича -- произведение великого композитора, классика музыки XX века, еще, казалось бы, совсем недавно нашего старшего современника.	44:54	0:303
приношение	NOUN	1918-1990	1	приношение-6		Приношение пардуса в Москов Герой чуть не пропустил день рождения Москвы.	0:10	0:73
приношение	NOUN	1991-2017	2	приношение-7		Другие оруженосцы и служители принесли мечи прославленной франкской работы, куски шелка, серебряные сосуды, без которых не обходилось ни одно приношение даров.	142:152	0:159
приношение	NOUN	1918-1990	1	приношение-8		Приношения солнцу.	0:10	0:18
приношение	NOUN	1991-2017	2	приношение-9		Инок не ел хлеба, не питался просфорами, как это делали многие монахи, а действительно отличался воздержанием среди других печерских иноков, не отказывавшихся обычно от обильных боярских приношений.	187:197	0:198
приношение	NOUN	1918-1990	1	приношение-10		А поскольку окрестные крестьяне зажиточны, на храмовых праздниках в Швемодо нет недостатка в щедрых приношениях.	100:111	0:112
приношение	NOUN	1991-2017	2	приношение-11		С высокого иконостаса на нас взирают лики святых Божиих, в строгом чине совершающих свое приношение, свою молитву Богу -- Христу, восседающему на высоком Престоле.	89:99	0:163
приношение	NOUN	1918-1990	1	приношение-12		Благодаря обильному снабжению приношениями мы ели вполне удовлетворительно.	30:42	0:75
приношение	NOUN	1918-1990	1	приношение-13		Не отмыть водами Иордана и Урдара следы таких приношений".	46:56	0:58
приношение	NOUN	1991-2017	2	приношение-14		В конце октября пятьдесят первого года, ранним утром, в воскресенье, доктор Шимес приехал к нему из Судака с поллитровкой разведенного спирта, что было чрезвычайно странным приношением исходя из безалкогольных навыков доктора, и попросил Медею -- к большому изумлению Самуила -- оставить их наедине.	173:184	0:299
приношение	NOUN	1991-2017	2	приношение-15		-- Всего хорошего, Наденька, -- он водрузил на барьер приношение.	54:64	0:65
приношение	NOUN	1918-1990	1	приношение-16		В ту далекую эпоху музыкальные приношения были делом обычным.	31:41	0:61
приношение	NOUN	1991-2017	2	приношение-17		Учитель, повернувшись к статуе, торжественно сказал: "Великий Чемпион, я даю тебе героическое приношение твоего брата -- скромного, безвестного борца за святое дело мировой цивилизации.	94:104	0:185
приношение	NOUN	1918-1990	1	приношение-18		Валак отправил новых послов, на сей раз более знаменитых и, несомненно, с более дорогими приношениями.	89:101	0:102
приношение	NOUN	1991-2017	2	приношение-19		Он вел себя непочтительно, поедая посвященное ей приношение, и нарушал закон.	49:59	0:77
приношение	NOUN	1918-1990	1	приношение-20		Впрочем, вместо слова "подати" цзунбэни упорно говорили мне "приношения".	61:71	0:73
приношение	NOUN	1991-2017	2	приношение-21		Довольно широкое пространство вокруг было оставлено пустым: оно предназначалось для жертвенных приношений публики, которой дозволено было присылать депутации с цветами и благовонными курениями.	95:105	0:193
приношение	NOUN	1918-1990	1	приношение-22		Все это так и оставалось в столе, в дальнем углу, аккуратно сложенное и прикрытое бумагой,-- я ни разу не уследил, когда Ирена умудрялась раскладывать по ассортименту эти мои несчастно посильные приношения!	195:205	0:206
приношение	NOUN	1918-1990	1	приношение-23		-- Ремонт существующих храмов и забота о посвятительных дарах тоже дает повод к совещаниям совета и народа: афиняне издают постановление об очищении храма Афродиты Пандемос (М. 682), о своеобразной конверсии приношений "герою Врачу" (М. 687): предполагается из серебра приношений и монет отлить большой винный сосуд, причем имена жертвователей должны быть записаны на каменной плите, и в образованную же для этого дела комиссию избрать двух ареопагитов, трех депутатов от народа и ex officio жреца, стратега по общественным работам и архитектора по священным постройкам; оропийцы -- о таком же сплаве посвящений Амфиарая (М. 827); афиняне о поручении кефисийцу Диоклу, согласно его предложению, дарового ремонта храма Асклепия и Гигиеи с правом поместить об этом памятную надпись над дверьми "для того, чтобы и других приохотить к, подражанию" (М. 690); смирнейцы -- о непричинении обид священным рыбам, "а буде кто таковую причинит, да погибнет он лютою гибелью, сам будучи съеден рыбами" (М. 728).	208:218	0:999
приношение	NOUN	1991-2017	2	приношение-24		Даже если приношение это по тем или иным причинам решено было счесть "несвоевременным", его эстетика чрезвычайно соответствует образу, который стремится создать и сам президент.	10:20	0:177
приношение	NOUN	1991-2017	2	приношение-25		Однако вернемся к приношениям наших глухонемых культуртрегеров.	18:29	0:63
приношение	NOUN	1991-2017	2	приношение-26		Даже лишившись своих владений, монастыри существуют как бы на самофинансировании -- печатают священные книги, производят предметы религиозного культа, а главное, получают добровольные приношения от своих бывших крепостных, за которых монахи возносят молитвы.	184:194	0:258
приношение	NOUN	1991-2017	2	приношение-27		Апрельские музейные собрания задуманы как приношение Сергею Рахманинову, ученику и золотому медалисту Московской консерватории.	42:52	0:127
приношение	NOUN	1991-2017	2	приношение-28		Две трети зерна надо везти в монастырь Ташилумпо в виде арендной платы и приношений.	73:83	0:84
приношение	NOUN	1991-2017	2	приношение-29		Взялась читать приношенье: Когда она кончила читать и застыла с отведенной в сторону гор рукой, все трое виновников торжества встали перед ней на одно колено.	15:25	0:158
приношение	NOUN	1991-2017	2	приношение-30		Делать хорошие приношения монастырям.	15:25	0:37
приношение	NOUN	1991-2017	2	приношение-31		"Приношение Людвигу ван Бетховену" прозвучит 31 мая в Концертном зале им.	1:11	0:73
приношение	NOUN	1918-1990	1	приношение-32		Для почетного гостя резали овцу, украшенную лентами, -- это было жертвенное приношение.	76:86	0:87
приношение	NOUN	1991-2017	2	приношение-33		Не дорого приношение, но дорого внимание.	10:20	0:41
приношение	NOUN	1918-1990	1	приношение-34		Для чего, например, для четырех десятков монахов иметь в стенах обители полтора десятка разных церквей: надвратных, домовых, отдельно стоящих Почему люди, выйдя из мира и избрав для себя самые скромные условия монастырского общежития, с такой тщательностью украшают и придают самый роскошный вид местам богослужений и утвари Наконец, с какой целью саму чудотворную икону, которую и без того легко потерять в обрамлении сияющего оклада, драгоценных камней, лампад, занавесей, раз за разом переоблачают в еще более богатые ризы, даруют новые приношения, в миру имеющие баснословную цену Не подспудное ли это желание когда-нибудь принести и сложить к ногам Господа и Его Матери все золото мира Не смиренная ли просьба засчитать дорогой дар вместо молитвы, которая никак нейдет с ленивых и косных уст; за добро, которое и при всем желании так непросто принести людям Золотая риза для иконы была сделана в 1836 году "по благословению Высокопреосвященного Серафима, митрополита Новгородского и Санкт-Петербургского, тщанием митрополита Илариона с братией, общим же пособием христиан боголюбивых".	540:550	0:1090
приношение	NOUN	1991-2017	2	приношение-35		За приношения она никогда не благодарила.	3:13	0:41
приношение	NOUN	1918-1990	1	приношение-36		Евхаристией и до сих.пор называет Церковь и дары хлеба и вина, и их приношение и их преложения в Тело и Кровь Христовы, и, наконец, причащение им.	68:78	0:146
приношение	NOUN	1918-1990	1	приношение-37		Особенно часто имеет община суждение о надлежащем использовании доходов с пожертвованных разными лицами на те или другие культовые нужды капиталов; так дельфийцы -- с приношения Аттала II, между прочим, на жертвы Аполлону, Артемиде и Латоне (М. 263), они же и с пожертвования некоего Алексиппа в честь того же Аполлона (Циен 78), итакийцы -- с уступленной их Артемиде земли, причем оговорено: "если кто ослушается, то будет заботой богини" (Циен 83); ферейцы -- с отказанной покойною Эпиктетой суммы на жертвоприношения 1) музам, 2) "героям" Фениксу (ее мужу) и Эпиктете и 3) "героям" Кратесилоху и Андрагору (ее сыновьям) (М. 1001); косцы -- о порядке жертв Зевсу и Афине Спасителям из средств Пифокла (Циен 131); илионцы -- об использовании пожертвования Гермия для праздника своих Панафиней (М. 731).	167:177	0:803
приношение	NOUN	1991-2017	2	приношение-38		Ежедневно сменяются приношения: родниковая вода в серебряных чашах, блюда с зерном, цветы, вылепленные с редким искусством из подкрашенного масла.	20:30	0:146
приношение	NOUN	1991-2017	2	приношение-39		Он похищал из храмов приношения граждан.	21:31	0:40
приношение	NOUN	1918-1990	1	приношение-40		Звуковой образ города" -- приношение коллег по Институту искусствознания, и прежде всего Михаила Юнисова, который собрал все относившиеся к данной теме тексты из наследия Сергея, тщательно отредактировал их и написал к ним исключительно тонкое и умное предисловие.	26:36	0:264
приношение	NOUN	1991-2017	2	приношение-41		Куколки привешены и другие приношения -- видно, здесь святыня нимф или Ахелоя" (Платон).	27:37	0:88
приношение	NOUN	1918-1990	1	приношение-42		И в благодарность Церин и Чодрон уже третий год делают щедрое приношение монастырю.	62:72	0:83
приношение	NOUN	1991-2017	2	приношение-43		Есть еще одна сторона: мы молим Господа соединить Себя с нами и взять на Себя всю тяжесть нашей жизни и с нами вместе ее понести; но одновременно мы должны быть готовы взять на себя судьбу воплощенного Сына Божия на земле, принадлежать Небу, Богу, правде, со всеми последствиями, которые могут истечь из этого: прежде всего, внутренней борьбой с неправдой и смертью, которые в нас есть; затем, готовностью стоять за правду Божию, за тайну Царства Божия, любви Божественной на земле в отношениях с людьми, даже там, где это значит приношение какой-то жертвы, принесение себя в жертву.	530:540	0:583
приношение	NOUN	1918-1990	1	приношение-44		И соседи, французские фермеры, нет--нет и побалуют скит какими--нибудь приношениями от своего хозяйства.	71:83	0:104
приношение	NOUN	1918-1990	1	приношение-45		Иногда она входила и в камеры заключенных с отцом, приносившим нам обед или кипяток, и мы давали ей лакомства, если таковые у нас были из приношений милых наших товарок по партии.	138:148	0:179
приношение	NOUN	1991-2017	2	приношение-46		И только при условии сотрудничества, включая политическое угодничество и финансовые приношения, бизнес может рассчитывать на благосклонность власти к его существованию.	84:94	0:168
приношение	NOUN	1991-2017	2	приношение-47		Музыкальное приношение учителю В цикле концертов "Виолончельная школа профессора Анатолия Павловича Никитина", проходящем в Концертном зале имени А. К. Глазунова, выступил с сольной программой заслуженный артист России Сергей Ролдугин.	12:22	0:235
приношение	NOUN	1991-2017	2	приношение-48		Когда-то жители Беломорья совершали здесь жертво-приношения, ритуальные танцы, просили богов послать им хорошую погоду, удачную охоту и рыбалку, не обидеть души соплеменников, погибших в морской пучине.	-1:15	0:202
приношение	NOUN	1991-2017	2	приношение-49		И нет ни одного случая употребления этого греческого глагола в корпусе Новозаветных текстов в смысле обещания, приношения.	111:121	0:122
приношение	NOUN	1991-2017	2	приношение-50		Кто дивился, как много висит в храме Посейдона приношений от пловцов, спасенных богом от кораблекрушений, тому он напоминал: "А от неспасенных было бы в сто раз больше".	47:57	0:169
приношение	NOUN	1991-2017	2	приношение-51		Как и его отец, он верил, что главное -- это сделать хорошее приношение монастырю, а уж ламы лучше знают, как помолиться, чтобы семью миновали беды.	61:71	0:148
приношение	NOUN	1918-1990	1	приношение-52		Люди стали умирать, а боги не получать от них привычных приношений.	56:66	0:67
приношение	NOUN	1991-2017	2	приношение-53		Скоро придут сюда жрецы с приношениями.	26:38	0:39
приношение	NOUN	1918-1990	1	приношение-54		Мама аккуратно выложила из корзины в кормушку свои приношения.	51:61	0:62
приношение	NOUN	1918-1990	1	приношение-55		Перечитал вчера, по фотокопии, главу "Таинство приношения".	47:57	0:59
приношение	NOUN	1918-1990	1	приношение-56		Мать, я знал, поехала купить мне очередной подарок: планомерная ежедневность приношений придавала медленным выздоравливаниям и прелесть и смысл.	77:87	0:144
приношение	NOUN	1918-1990	1	приношение-57		Но как еда присутствует во всех основных обрядах первобытного общества, так и жертвоприношение, съедание богом убитого животного, далеко не исчерпывается одними храмово-религиозными актами закланий, приношений и возлияний, а в разнообразных формах идет по всем линиям жизни божества и семантически заключается в вещах (каковы стол, престол, алтарь, жертвенник, ложе), в праздниках, в культе, в священных сказаниях.	199:209	0:414
приношение	NOUN	1918-1990	1	приношение-58		Мы видели такие круги менгиров со следами приношений.	42:52	0:53
приношение	NOUN	1918-1990	1	приношение-59		На этом приношения прекратились.	8:18	0:32
приношение	NOUN	1918-1990	1	приношение-60		Не о православии пишет баптистский автор, объясняя, что "учение о пресуществлении, связанное с идеей приношения бескровной жертвы за грехи тех, кто участвует в причащении, полностью отрицает единократное искупление грехов единократной жертвой Иисуса Христа".	101:111	0:258
приношение	NOUN	1991-2017	2	приношение-61		И отошел седьмой день, день субботний, и не собрался Израиль у Скинии Собрания, и не принес приношений.	92:102	0:103
приношение	NOUN	1991-2017	2	приношение-62		Некоторые родственники считали, что знаменитая капуста -- чистая отрава, но никому не приходило в голову отказаться от приношения, подносимого обыкновенно с таинственным и взволнованным видом.	119:129	0:192
приношение	NOUN	1991-2017	2	приношение-63		Там есть традиция приношения цветов в храм Будды, имеющая индийские корни.	18:28	0:74
приношение	NOUN	1991-2017	2	приношение-64		Немтина, а в 80-х -- в музыкальных приношениях участвовали также А. Шнитке, Э.	35:46	0:78
