lemma	pos	date	grouping	identifier	description	context	indexes_target_token	indexes_target_sentence
инкубатор	NOUN	1918-1990	1	инкубатор-0		-- Ах, инкубатор!	7:16	0:17
инкубатор	NOUN	1918-1990	1	инкубатор-1		Яйца закладывают в инкубатор, вылупившихся птенцов помещают к "электроквочкам".	19:28	0:79
инкубатор	NOUN	1991-2017	2	инкубатор-2		-- В инкубаторе выращивается человечество, находящееся, в результате тотальной психохимической обработки, в состоянии непрерывной борьбы каждого с каждым и всех со всеми.	5:15	0:170
инкубатор	NOUN	1991-2017	2	инкубатор-3		По последнему слову техники оборудованы были фермы с инкубаторами, и начался большой бизнес.	53:65	0:92
инкубатор	NOUN	1918-1990	1	инкубатор-4		-- Это у вас от невнимательности, -- сказал он и вернулся к инкубатору.	60:70	0:71
инкубатор	NOUN	1918-1990	1	инкубатор-5		Мишка раскрыл книгу и стал показывать чертежи; -- Вот смотри, как настоящий инкубатор устроен.	76:85	0:94
инкубатор	NOUN	1991-2017	2	инкубатор-6		14 богатейших бизнесменов и компаний страны создают инкубатор выведения для России лидеров бизнеса высокого полета".	52:61	0:116
инкубатор	NOUN	1991-2017	2	инкубатор-7		Для этого необходимо, во-первых, как минимум в три раза поднять заработную плату в бюджетной сфере, которая за десятилетие реформ превратилась в инкубатор по разведению бедноты: четверть россиян-бюджетников получают не более трех тысяч рублей в месяц.	145:154	0:251
инкубатор	NOUN	1991-2017	2	инкубатор-8		Инкубатор любви!	0:9	0:16
инкубатор	NOUN	1991-2017	2	инкубатор-9		После этого 100 мкл смеси СП + AT + РСВ переносили в лунки микрокультурального планшета с монослоем клеток МА-104, которые помещали на 6-7 сут в СО2-инкубатор.	-1:11	0:159
инкубатор	NOUN	1918-1990	1	инкубатор-10		А когда мы заглянули в инкубатор в следующий раз, то даже ахнули от изумления.	23:32	0:78
инкубатор	NOUN	1918-1990	1	инкубатор-11		Их насилу успевали вынимать из инкубатора.	31:41	0:42
инкубатор	NOUN	1991-2017	2	инкубатор-12		Бедный читатель статьи вынужден по воле автора, свободного от такого рода долженствований, проделать многое -- познакомиться с "оппонентами беллетризированной психологии", якобы "не видящими принципиального отличия между человеком, крысой или электрическим чайником" (с. 72), вернуться в "густопсовые советские времена" (с. 84), чтобы посетить "стерильный академический инкубатор" (с. 72), увидеть "случайное бесформенное множество ученых голов, умствующую толпу" (с. 73), осуществить вместе с историками психологии "погружение еще и не в такое" (с. 75) и продегустировать "диалектику.	370:379	0:585
инкубатор	NOUN	1991-2017	2	инкубатор-13		Вообще же инкубатор московского террариума считается одним из лучших в мире.	10:19	0:76
инкубатор	NOUN	1918-1990	1	инкубатор-14		Бессменный словенский гегемон, который считается инкубатором, выращивающим из худющих и вываливающихся из кроссовок юниоров звезд европейского баскетбола.	49:60	0:154
инкубатор	NOUN	1991-2017	2	инкубатор-15		Кто знает, может быть, где-нибудь в Мюнхене, или Дюссельдорфе, или в самом Берлине сейчас уже выбрался из инкубатора и проходит некие стадии дрессировки чистокровный янки, смелый и немножко безумный, гениальный и чуть инфантильный, преисполненный нашей идеей и все-таки способный подать ее, эту идею, под соусом, допустим, не голландским, а кумберлен, если переходить на язык гастрономии.	106:116	0:388
инкубатор	NOUN	1918-1990	1	инкубатор-16		Будучи резидентами бизнес-инкубатора технопарка новосибирского Академгородка (Академпарка), авторы "Социального сканера" несут чисто символические затраты на аренду.	-1:15	0:165
инкубатор	NOUN	1991-2017	2	инкубатор-17		Мы с Мишкой сидели на самом почетном месте -- возле инкубатора.	52:62	0:63
инкубатор	NOUN	1991-2017	2	инкубатор-18		Был при советской власти какой-то гигантский инкубатор, где каждый сидел в определенной ячейке -- вверх не прыгнешь, но и вниз не выпадешь.	45:54	0:139
инкубатор	NOUN	1991-2017	2	инкубатор-19		Кроме того, он заявил: "С мелкими проектами мы не работаем напрямую, а будем соинвестировать их через инкубаторы, посевные и венчурные фонды".	102:112	0:142
инкубатор	NOUN	1991-2017	2	инкубатор-20		В инкубаторах Флота в это время вылуплялись из яиц последние солдаты -- от рядовых Добытчиц до Оберсержантов.	2:13	0:109
инкубатор	NOUN	1991-2017	2	инкубатор-21		Так, сегодня на территории Хабаровского края функционируют и создаются новые зоны опережающего развития различного "масштаба" и направления деятельности: индустриальные, агропромышленные парки, бизнес-инкубаторы, территории опережающего социально-экономического развития (ТОСЭР), портовая особая экономическая зона (ПОЭЗ "Советская Гавань").	-1:15	0:341
инкубатор	NOUN	1991-2017	2	инкубатор-22		В Нагатинской пойме предполагается построить бизнес-инкубатор, который займет площадь свыше 1 млн. кв. м.	-1:14	0:105
инкубатор	NOUN	1991-2017	2	инкубатор-23		Сейчас методы регенеративной медицины в основном предполагают перенос стволовых клеток в организм извне, из инкубатора.	108:118	0:119
инкубатор	NOUN	1918-1990	1	инкубатор-24		В результате, такие облака стали своего рода "инкубаторами" нынешних галактик и по сей день их окружают.	46:58	0:104
инкубатор	NOUN	1991-2017	2	инкубатор-25		Она проходила по трубке и нагревала наш инкубатор.	40:49	0:50
инкубатор	NOUN	1991-2017	2	инкубатор-26		В этой стране бессмысленно убивать вождей, потому что на полную мощность работает их инкубатор.	85:94	0:95
инкубатор	NOUN	1991-2017	2	инкубатор-27		Потому что местные начальники выросли в том же инкубаторе, под тем же колпаком, что и новочеркасские бунтовщики.	47:57	0:112
инкубатор	NOUN	1918-1990	1	инкубатор-28		Вечером он сказал: -- Вот возьми инкубатор и подежурь ночью, тогда узнаешь, как рисовать на меня карикатуры.	33:42	0:108
инкубатор	NOUN	1918-1990	1	инкубатор-29		Что ты, побежишь к ребятам с яйцом Мишка вернулся и положил яйцо в инкубатор.	67:76	0:77
инкубатор	NOUN	1991-2017	2	инкубатор-30		Впрочем, Адмирал (к описываемому времени уже совсем старенький) имел в виду не только местных политиков, когда говорил: они все из одного инкубатора.	138:148	0:149
инкубатор	NOUN	1991-2017	2	инкубатор-31		И тогда "инкубаторы" превратятся в ДЕТСКИЕ ДОМА, где будет хорошо и уютно и детям, и сотрудникам.	9:19	0:97
инкубатор	NOUN	1918-1990	1	инкубатор-32		Все, толкая друг друга, бросились к инкубатору.	36:46	0:47
инкубатор	NOUN	1918-1990	1	инкубатор-33		Это я знаю, только я думал, что он не инкубатор, а индюкатор или курбюратор -- забыл, как называется.	38:47	0:101
инкубатор	NOUN	1918-1990	1	инкубатор-34		Вы инкубатор для рассады видели Вот-вот.	3:12	0:40
инкубатор	NOUN	1991-2017	2	инкубатор-35		Помню только, что инкубатор был стеклянный, прозрачный и с градусником.	18:27	0:71
инкубатор	NOUN	1918-1990	1	инкубатор-36		Да зачем вам инкубатор понадобился -- Ну, чтоб цыплят выводить.	13:22	0:63
инкубатор	NOUN	1918-1990	1	инкубатор-37		Мы продолжали нагревать инкубатор и не гасили лампу, но они даже не наклюнулись за ночь.	24:33	0:88
инкубатор	NOUN	1918-1990	1	инкубатор-38		Для привлечения инвестиций в крае действуют более десятка институтов взаимодействия с частным бизнесом, предлагающие предприятиям льготные условия инвестирования в регионе: это Алтайский центр государственно-частного партнерства и привлечения инвестиций, особая экономическая зона туристско-рекреационного типа "Бирюзовая Катунь", индустриальный парк "Новоалтайск южный", Алтайский бизнес-инкубатор, бизнес-инкубатор инновационного типа в Бийске, Алтайский краевой лизинговый фонд, Алтайский фонд микрозаймов, Алтайский гарантийный фонд, Региональный инвестиционный фонд; запущены специализированный многоязычный интернет-портал об инвестиционной деятельности в Алтайском крае и интерактивная инвестиционная карта региона.	-1:14	0:722
инкубатор	NOUN	1991-2017	2	инкубатор-39		Костя увидел инкубатор и спрашивает: -- Что это вы, опять паровую машину делаете -- Что ты!	13:22	0:91
инкубатор	NOUN	1991-2017	2	инкубатор-40		До 2008 года Правительство Москвы планирует предоставить в распоряжение малого бизнеса около 2,5 млн. кв. м -- под эти цели будут отданы неиспользуемые площади завода "Метромаш" и построен бизнес-инкубатор "Промсити" для малых и средних предприятий.	17:18	0:249
инкубатор	NOUN	1991-2017	2	инкубатор-41		Словно все из одного инкубатора повылазили.	21:31	0:43
инкубатор	NOUN	1991-2017	2	инкубатор-42		Здесь оценивалась развитость системы государственной поддержки начинающих предпринимателей, включающей денежные гранты, долевое финансирование, налоговые льготы, бизнес-инкубаторы, а также возможность установления деловых контактов и наставничество.	-1:15	0:249
инкубатор	NOUN	1991-2017	2	инкубатор-43		Ей сейчас нужна теплица, инкубатор.	25:34	0:35
инкубатор	NOUN	1918-1990	1	инкубатор-44		Знаешь, что я придумал Я скажу на уроке естествознания Марье Петровне, что вы устроили инкубатор.	87:96	0:97
инкубатор	NOUN	1918-1990	1	инкубатор-45		Сначала я даже не понял, что случилось, потом вспомнил, что ни разу не вставал ночью, и как ошпаренный бросился к инкубатору.	114:124	0:125
инкубатор	NOUN	1918-1990	1	инкубатор-46		И как ни жалки были эти инкубаторы для сирот при живых ещё родителях, они, требуя известных расходов, ухудшали показатели финансового плана лагуправлений со всеми последствиями для премий руководящему персоналу.	24:34	0:211
инкубатор	NOUN	1918-1990	1	инкубатор-47		Оказалось, и для столь немалых четвероногих есть в Америке инкубатор.	59:68	0:69
инкубатор	NOUN	1918-1990	1	инкубатор-48		И нас тоже не забывайте, потому что это мы сделали инкубатор и, значит, это мы дали вам жизнь, которая такая хорошая и прекрасная.	51:60	0:130
инкубатор	NOUN	1918-1990	1	инкубатор-49		Мишка закрыл инкубатор и сказал: -- Ничего, пусть будет что будет!	13:22	0:66
инкубатор	NOUN	1991-2017	2	инкубатор-50		И немудрено: Чечня все больше превращалась в своеобразный инкубатор по выращиваю ваххабитов.	58:67	0:92
инкубатор	NOUN	1991-2017	2	инкубатор-51		"Вы что -- из инкубатора" -- спросил он.	14:24	0:40
инкубатор	NOUN	1918-1990	1	инкубатор-52		Их будто выводят в одном инкубаторе, и они выходят на свет для одной цели: подставить одну щеку (для удара) режиссеру, а другую (для поцелуя) -- любимым артистам.	25:35	0:162
инкубатор	NOUN	1991-2017	2	инкубатор-53		Неожиданное препятствие -- Давай не будем делать инкубатор, а положим яйца в кастрюлю и поставим на печку, -- предложил я.	49:58	0:122
инкубатор	NOUN	1991-2017	2	инкубатор-54		Казалось, будто луна, подобно лампе гигантского инкубатора, своим леденящим жаром заставляет вылупиться самую суть вещей -- суть, похожую и непохожую на дневные формы, расколотые, бросаемые лежать безо всякого применения.	48:58	0:221
инкубатор	NOUN	1991-2017	2	инкубатор-55		Итак, город Дубна на текущий момент располагает высокоскоростной магистралью передачи данных, объединяющей в единую информационную систему компьютерные сети Международного университета "Дубна", Объединенного института ядерных исследований, НИИ "Атолл", филиала Московского института радиоэлектроники и автоматики, Дубненской центральной городской больницы, администрации города, Инновационного инкубатора, 14-и общеобразовательных школ города с общей численностью вычислительных систем, готовых участвовать в распределенных вычислениях более 1200 штук.	394:404	0:552
инкубатор	NOUN	1918-1990	1	инкубатор-56		Как будто вышли все из одного большого кукольного инкубатора.	50:60	0:61
инкубатор	NOUN	1991-2017	2	инкубатор-57		Человек возводит преграду между не изученным в аспекте питания миром естественных веществ и прирученными животными и птицей, переводя их в стойла скотных дворов и клетки инкубаторов и птицефабрик, считая достаточной свою осведомленность о той совокупности химических веществ, которую нужно включать в корм, чтобы, питаясь мясом и молочными продуктами, самому быть здоровым, мыслящим и энергичным.	170:181	0:396
инкубатор	NOUN	1918-1990	1	инкубатор-58		Как вы думаете, выведутся у них цыплята или нет -- В самодельном инкубаторе получить цыплят можно, только это очень трудное дело, -- сказала Марья Петровна.	65:75	0:156
инкубатор	NOUN	1918-1990	1	инкубатор-59		Мы заглянули в инкубатор.	15:24	0:25
инкубатор	NOUN	1918-1990	1	инкубатор-60		Как выразился он в беседе с автором: "Мы все вышли из одного инкубатора".	61:71	0:73
инкубатор	NOUN	1991-2017	2	инкубатор-61		Где же вы набрали столько цыплят -- Сами вывели в инкубаторе.	50:60	0:61
инкубатор	NOUN	1918-1990	1	инкубатор-62		Лихачева или других производственных площадей скрыты огромные человеческие инкубаторы.	75:85	0:86
инкубатор	NOUN	1991-2017	2	инкубатор-63		Через сутки после закладки в инкубатор 150 куриных яиц на короткое время, 1-1,5 мин., были помещены (в соответствующих условиях) в "северную" воду, а другие 150 -- в "южную", а затем инкубированы на полный срок.	29:38	0:211
инкубатор	NOUN	1918-1990	1	инкубатор-64		Мишка открыл инкубатор и как закричит: -- Батюшки!	13:22	0:50
инкубатор	NOUN	1918-1990	1	инкубатор-65		Кто будет следить за градусником -- Может быть, попросить Майку Мишка позвал Майку, и мы стали просить ее, чтобы она подежурила у инкубатора, пока мы будем в школе.	130:140	0:164
инкубатор	NOUN	1918-1990	1	инкубатор-66		Может быть, США нужно не ослаблять Китай, а лелеять его и поступать наподобие кукушки, которая подкладывает свои яйца в чужие гнезда: сделать из Китая инкубатор, в культурный кокон которого подкладывать свои идеи и духовные ценности, выращивать их и выпускать их через Китай в планетарную Поднебесную.	151:160	0:301
инкубатор	NOUN	1991-2017	2	инкубатор-67		Мы поставили его стоймя, прорезали в верхней стенке ящика круглую дырку и установили инкубатор так, чтоб консервная банка находилась как раз над дыркой.	85:94	0:152
инкубатор	NOUN	1918-1990	1	инкубатор-68		На корабле, стоявшем в тропиках, температура в тени, и даже ночью, была высокая, как в инкубаторе.	87:97	0:98
инкубатор	NOUN	1918-1990	1	инкубатор-69		Потом думаю: "Дай-ка пойду посмотрю, как там инкубатор работает".	45:54	0:65
инкубатор	NOUN	1918-1990	1	инкубатор-70		На кухне все было по-прежнему: инкубатор продолжал нагреваться, лампочка продолжала гореть, но надежда у нас совсем погасла.	31:40	0:124
инкубатор	NOUN	1918-1990	1	инкубатор-71		Я поскорее открыл инкубатор и начал переворачивать яйца на другой бок.	18:27	0:70
инкубатор	NOUN	1918-1990	1	инкубатор-72		Наверно, прилип какой-то мультфильм из инкубатора.	39:49	0:50
инкубатор	NOUN	1991-2017	2	инкубатор-73		С другой стороны, для того же животноводства (а особенно птицеводства -- бройлеры, инкубаторы) крайне важна надежность теплоснабжения.	83:93	0:134
инкубатор	NOUN	1918-1990	1	инкубатор-74		Но инкубатор гораздо лучше.	3:12	0:27
инкубатор	NOUN	1918-1990	1	инкубатор-75		Он мог без устали и отдыха говорить и дни и ночи напролет о различных сортах навоза, о породах свиней, о курах, утках, инкубаторах.	119:130	0:131
инкубатор	NOUN	1918-1990	1	инкубатор-76		Но вот (!) заквохтала с авторской гордостью курица, что означало, что яйцо снесено и готово к помещению на сковороду или в инкубатор.	123:132	0:133
инкубатор	NOUN	1991-2017	2	инкубатор-77		Видно было, что язык у него так и чешется и ему хочется рассказать кому-нибудь про наш инкубатор.	87:96	0:97
инкубатор	NOUN	1918-1990	1	инкубатор-78		Но к тому времени мы уже прекратили доступ в инкубатор, и филологам пришлось смотреть на белых медведей и марсианских богомолов.	45:54	0:128
инкубатор	NOUN	1918-1990	1	инкубатор-79		Майка сидела на своем посту, у инкубатора, и шила своей кукле Зинаиде новое платье.	31:41	0:83
