lemma	pos	date	grouping	identifier	description	context	indexes_target_token	indexes_target_sentence
инкубатор	NOUN	1918-1990	1	инкубатор-80		Но хотя и из одного инкубатора, Аглае ближе других были те, которые продолжали себя называть коммунистами.	20:30	0:106
инкубатор	NOUN	1991-2017	2	инкубатор-81		А другой доктор имярек, разгадавший принцип работы саркофага-инкубатора, оказался в двусмысленном и стыдном положении человека, которому научная общественность приписывает открытие этого принципа, в результате чего он вообще оставил научное поприще и малюет теперь посредственные пейзажи.	-1:18	0:288
инкубатор	NOUN	1918-1990	1	инкубатор-82		Огромное значение будет иметь создание особых экономических зон (ОЭЗ) с участием государственного финансирования -- зон, которые станут "инкубаторами" технических нововведений и изобретений.	137:149	0:190
инкубатор	NOUN	1991-2017	2	инкубатор-83		Я решил полежать еще немного и вдруг вспомнил про инкубатор.	50:59	0:60
инкубатор	NOUN	1918-1990	1	инкубатор-84		Он сидел возле инкубатора и внимательно осматривал яйца.	15:25	0:56
инкубатор	NOUN	1918-1990	1	инкубатор-85		Мы показали ребятам наш инкубатор, рассказали, как производится нагревание, как мы проверяем температуру, как переворачиваем яйца.	24:33	0:130
инкубатор	NOUN	1918-1990	1	инкубатор-86		Очень близкие габариты, база, колея -- как из инкубатора.	46:56	0:57
инкубатор	NOUN	1991-2017	2	инкубатор-87		В инкубаторе на вате лежали куриные яйца, и Петр Францевич объяснил нам, что он вынимает одно яйцо за другим через небольшие промежутки времени и рассматривает под микроскопом, наблюдая различные стадии развития куриного зародыша.	2:12	0:230
инкубатор	NOUN	1991-2017	2	инкубатор-88		Палата приступила к созданию бизнес-инкубатора.	-1:15	0:47
инкубатор	NOUN	1991-2017	2	инкубатор-89		Это своего рода инкубатор, где израильские курицы сидят на "русских" яйцах.	16:25	0:75
инкубатор	NOUN	1918-1990	1	инкубатор-90		Перечислены ингредиенты, инструменты, необходимые для операций с клеточными субстанциями, все, вплоть до инкубатора, стерильной колбы и микроскопа.	105:115	0:147
инкубатор	NOUN	1991-2017	2	инкубатор-91		Но Пролеткульт -- был только питомником, инкубатором, попыткой в кратчайший срок изготовить лабораторным способом новые пролетарские таланты.	41:52	0:141
инкубатор	NOUN	1918-1990	1	инкубатор-92		С раннего утра 1 января и до вечера 3 января нового 38-го года шло практически непрерывное заседание спонтанно образовавшейся Комиссии по инкубатору.	138:148	0:149
инкубатор	NOUN	1918-1990	1	инкубатор-93		А что он делает, этот инкубатор -- Как -- что -- удивился Мишка.	22:31	0:64
инкубатор	NOUN	1918-1990	1	инкубатор-94		Сегодняшний развратник при всем желании не дотянется до инкубаторов и боксов, где подрастает заря человечества.	56:67	0:111
инкубатор	NOUN	1991-2017	2	инкубатор-95		-- Чего возиться Сделаем инкубатор -- они и выведутся.	25:34	0:54
инкубатор	NOUN	1918-1990	1	инкубатор-96		Так, каждый четвертый российский предприниматель считает, что за последние три года доступ к бизнес-инкубаторам в стране значительно улучшился.	-1:16	0:143
инкубатор	NOUN	1991-2017	2	инкубатор-97		Поэтому я призываю всех: бейте инкубаторы!	31:41	0:42
инкубатор	NOUN	1991-2017	2	инкубатор-98		Тел.:(8634)39-97-90, 38-72-48 1435 Инкубатор с терморегулятором на 60 яиц.	35:44	0:74
инкубатор	NOUN	1991-2017	2	инкубатор-99		Юджин любил детей, он собирался тоже как-нибудь заглянуть в Инкубатор и сдать свои клетки, чтобы через две недели получить здорового краснощёкого карапуза лет трёх-четырёх.	60:69	0:172
инкубатор	NOUN	1991-2017	2	инкубатор-100		Тольяттинский бизнес-инкубатор существует в рамках свободной экономической зоны уже несколько месяцев, готовится к запуску технопарк.	-1:14	0:133
инкубатор	NOUN	1991-2017	2	инкубатор-101		Оказалось, что арабы женщин не берут на кладбище не только потому, чтобы они не досаждали Богу своим плачем, но и потому, что они -- символы жизни (очевидно, в отличие от мужчин -- инкубаторов и разносчиков смерти).	181:192	0:215
инкубатор	NOUN	1991-2017	2	инкубатор-102		Утверждается, что именно бизнес-инкубаторы дадут поле для развития существующих предприятий и путевку в жизнь -- новым.	-1:15	0:119
инкубатор	NOUN	1991-2017	2	инкубатор-103		На мой взгляд, эти средства пойдут не только на создание бизнес-инкубаторов, технопарков и других элементов инфраструктуры, но и через муниципальные и региональные фонды на компенсации процентных ставок банковских кредитов, либо в качестве залоговых сумм для частичного обеспечения этих кредитов.	-1:16	0:296
инкубатор	NOUN	1918-1990	1	инкубатор-104		Ученые, делая раскопки, находят в земле помещения, в которых древние египтяне устраивали свои инкубаторы.	94:104	0:105
инкубатор	NOUN	1918-1990	1	инкубатор-105		Инкубаторный период В инкубаторе я просидел четыре месяца.	0:12	0:58
инкубатор	NOUN	1991-2017	2	инкубатор-106		Факс 2-19-65 1462 Инкубаторы наложенным пл. на 70 яиц от 220/12В -- 1420 руб., 220В -- 1130 руб.	18:28	0:96
инкубатор	NOUN	1991-2017	2	инкубатор-107		Я думала, я помесь Симоны де Бовуар и Линды Евангелисты, а на самом деле я просто курица, груша, плодовое дерево, инкубатор.	114:123	0:124
инкубатор	NOUN	1991-2017	2	инкубатор-108		Федеральные власти в лице Министерства финансов РФ по-прежнему относятся к проектам сдержанно, что оборачивается отсутствием финансирования -- в федеральном бюджете 2004 года расходы на развитие бизнес-инкубаторов для малого бизнеса не предусмотрены.	-1:16	0:250
инкубатор	NOUN	1991-2017	2	инкубатор-109		Только вот откуда ему взяться, если все мы в нашем нынешнем высокоученом качестве образовались не в стерильном академическом инкубаторе, а на этой грешной земле если с младых ногтей весь строй отечественной жизни внушал нам мысль, что главное в науке это не поиск некоей абстрактной истины (да и что есть истина), а специфическая проходимость наших научных деяний, их созвучность последним официальным установкам Конечно, мы не были tabula rasa, на которой начальству позволительно рисовать любые иероглифы.	125:135	0:507
инкубатор	NOUN	1918-1990	1	инкубатор-110		Хватит инкубаторов -- снизьте процентную ставку!	7:18	0:48
инкубатор	NOUN	1991-2017	2	инкубатор-111		И потом, пока курица сидит на яйцах и воспитывает цыплят, она не несет яиц, а если цыплят высиживает инкубатор, курица все время несется, и яиц получается гораздо больше.	101:110	0:170
инкубатор	NOUN	1918-1990	1	инкубатор-112		Хубара не желала высиживать, в сарае имелся инкубатор, но яйца оказывались неоплодотворенными.	44:53	0:94
инкубатор	NOUN	1991-2017	2	инкубатор-113		Лишь этот путь, подобный выращиванию цыплят в инкубаторе, позволил обеспечивать нужное промыслам количество раковин.	46:56	0:116
инкубатор	NOUN	1918-1990	1	инкубатор-114		Электрический инкубатор-автомат с безупречной точностью заменяет наседку.	14:30	0:73
инкубатор	NOUN	1918-1990	1	инкубатор-115		И уместно будет сказать: эти малые городки походят один на другой так же, как скворцы или цыплята из инкубатора.	101:111	0:112
инкубатор	NOUN	1991-2017	2	инкубатор-116		Эти площадки занимаются не только объединением уже существующих и реально действующих интернет-магазинов, но и создают своего рода инкубаторы -- предоставляют компаниям, желающим попробовать себя в интернет-торговле, полную технологию создания интернет-прилавка, а после создания магазина включают его в свою торговую площадку и помогают в "раскрутке".	131:141	0:352
инкубатор	NOUN	1991-2017	2	инкубатор-117		В ТПУ создана мощная исследовательская и инновационная инфраструктура, включающая исследовательский ядерный реактор (один из двух в вузах России), сеть центров коллективного пользования современным научным оборудованием, инновационно-технологический центр, центр трансфера технологий, технологический инкубатор и т.д.	301:310	0:317
инкубатор	NOUN	1918-1990	1	инкубатор-118		Я сейчас скажу Марье Петровне про инкубатор.	34:43	0:44
инкубатор	NOUN	1918-1990	1	инкубатор-119		Без запинки чешет: и про связь наших трудовых коллективов -- театра и птицефермы -- и про распрекрасное соревнование инкубатора и театра, обещает дать больше яиц и птицы и чтобы мы в ответ дали больше хороших спектаклей.	117:127	0:220
