lemma	pos	date	grouping	identifier	description	context	indexes_target_token	indexes_target_sentence
перестройка	NOUN	1918-1990	1	перестройка-66		Но потом, по ходу перестройки, классик соцреализма оказался резко позабытым и никому не нужным, и ручеек денежных вливаний мгновенно пересох.	18:29	0:141
перестройка	NOUN	1991-2017	2	перестройка-67		Во-вторых, появление новых, оригинальных течений, собственно плодов перестройки.	68:79	0:80
перестройка	NOUN	1918-1990	1	перестройка-68		Он был незаменим при реорганизации, преобразовании и перестройке.	53:64	0:65
перестройка	NOUN	1918-1990	1	перестройка-69		Это, конечно, не значит, что правы современные троцкисты, которые в антисталинизме троцкизма 30-х годов пытаются разглядеть ростки нашей перестройки.	137:148	0:149
перестройка	NOUN	1918-1990	1	перестройка-70		Он знал, что перед народом встанут грандиозные задачи не только по восстановлению народного хозяйства, но и по перестройке страны на основе науки и техники.	111:122	0:156
перестройка	NOUN	1918-1990	1	перестройка-71		А второй способ, который мы употребляем для того, чтобы страдание не было таким острым, таким душу разрывающим, это его перестройка на гнев.	120:131	0:140
перестройка	NOUN	1918-1990	1	перестройка-72		Особый упор в данном периоде реформы должен быть сделан на освещение следующих вопросов: кадры районного аппарата; материальная база района; организация аппарата районных органов; формы и методы выполнения районными органами новых для них функций; перестройка областного аппарата, формы и методы его работы в направлении приспособления к руководству районами.	248:259	0:359
перестройка	NOUN	1918-1990	1	перестройка-73		По-моему, эта "перестройка" была необходима: неужели обиженные на новый формат поклонники журнала не помнят, как неудобно было раньше его хранить, -- экземпляры занимали много места, пылились, желтели.	15:26	0:201
перестройка	NOUN	1918-1990	1	перестройка-74		Относительно всего другого -- перестройки моторного, ЧЛЦ, загрузки инструментального -- можно спорить: верно -- не верно, рискованно -- не рискованно.	30:41	0:150
перестройка	NOUN	1918-1990	1	перестройка-75		Точно так же, как всякий, кто пристально вглядывается в очертания облаков, с какого-то момента начинает различать смысл, законченные скульптурные формы в их ленивой и случайной перестройке.	177:188	0:189
перестройка	NOUN	1918-1990	1	перестройка-76		Первая часть книги посвящена "перестройке" и ее краху и напоминает речь защитника на суде истории над Горбачевым.	30:41	0:113
перестройка	NOUN	1991-2017	2	перестройка-77		Они возникают как метод художественной перестановки и перестройки традиционных сюжетов и героев -- при скрещении двух диаметрально противоположных художественных течений.	54:65	0:170
перестройка	NOUN	1918-1990	1	перестройка-78		Пользуясь методом М. Ливанова, сотрудники нашего института выявили типичные способы перестройки нейронных мозаик при обучении.	84:95	0:126
перестройка	NOUN	1918-1990	1	перестройка-79		Я, так же как до этого на Форуме, говорил о важности для всего мира, в том числе для Запада, поддержки политики перестройки в СССР, с сохранением позиции по вопросу прав человека.	112:123	0:179
перестройка	NOUN	1918-1990	1	перестройка-80		После перестройки произошла странная вещь: Россия вдруг решила перенять (как уже было сказано, преимущественно из США) то, с чем там уже давно не знают, что делать.	6:17	0:164
перестройка	NOUN	1991-2017	2	перестройка-81		Некоторые приспособительные реакции могут возникать в связи со специфическими условиями среды и встречаться лишь у очень небольшого числа видов живых существ; другие же реакции, в особенности связанные с приспособительной перестройкой основных свойств обмена веществ, могут оказаться более универсальными.	222:234	0:305
перестройка	NOUN	1918-1990	1	перестройка-82		Прекращение гонки вооружений позволило бы найти необходимые средства для быстрой перестройки технологических процессов в промышленности и сельском хозяйстве с целью сократить, а затем и предотвратить загрязнение атмосферы и водной среды.	81:92	0:237
перестройка	NOUN	1918-1990	1	перестройка-83		Прежде всего это перестройка сферы отношений к другим людям, к обществу.	17:28	0:72
перестройка	NOUN	1918-1990	1	перестройка-84		При этом, если нет органического повреждения мозга, а в данном случае речь идет именно о таком варианте, в каких-то зонах мозга (чаще всего -- из основных эмоциогенных структур) развились особенно существенные сдвиги, влекущие за собой, в том числе и по принципу баланса, в новых условиях общемозговую перестройку, отражающуюся также в сверхмедленных процессах.	302:313	0:361
перестройка	NOUN	1991-2017	2	перестройка-85		В денежном отношении 1906 год закончился для меня небольшим избытком, так как перестройка дома и разведение нового сада, а равно обзаведение в нем потребовали около 15 000 рублей, а жизнь и содержание дачи обошлись в 10 000 рублей, тогда как мой приход равнялся 25 750 тысяч рублей.	78:89	0:282
перестройка	NOUN	1991-2017	2	перестройка-86		Продукция TEXACO для энергогенерирующих установок на базе газовых двигателей Вхождение России и стран б. СССР в мировые рыночные отношения сопровождается существенной структурной перестройкой многих отраслей промышленности, в том числе минерально-сырьевых и топливно-энергетических, определяющих в значительной мере конкурентоспособность всей товарной продукции.	179:191	0:362
перестройка	NOUN	1991-2017	2	перестройка-87		С именем Ховрина связано в Москве 5 построек в Москве, с именем Ермолина -- 10 построек -- это не только строительство храмов в Москве, но и восстановление древних храмов во Владимире и собора в Юрьеве-Польском (первые опыты реставрации), и ремонт кремлёвской стены и перестройка Фроловских (Спасских) ворот в Кремле.	268:279	0:317
перестройка	NOUN	1918-1990	1	перестройка-88		Радоваться здесь нечему -- даже либералам, которые, без боя взяв в ходе перестройки радио, телевидение, сферу рекламы, едва ли не все сколько-нибудь влиятельные средства массовой информации, едва ли не все сколько-нибудь значащие вузовские кафедры и на целое десятилетие совпав с прагматический властью в векторе своих реформаторских устремлений, действительно ответственны и за воцарение в обществе режима терпимости, и за превращение мира искусства в арт-рынок, и за то, что состязание художественных инициатив сплошь и рядом воспринимается публикой как тараканьи бега.	72:83	0:571
перестройка	NOUN	1991-2017	2	перестройка-89		Перестройка является объективной необходимостью.	0:11	0:48
перестройка	NOUN	1918-1990	1	перестройка-90		Реорганизация сельского хозяйства вызвала коренную перестройку сельскохозяйственной статистики.	51:62	0:95
перестройка	NOUN	1991-2017	2	перестройка-91		Недаром в его программе говорится: "Цель моей программы: углубление и расширение перестройки, демократизация, плюрализм, правовое государство, социальная и национальная справедливость, эффективная и экологически безопасная экономика, мир и прогресс.	81:92	0:249
перестройка	NOUN	1918-1990	1	перестройка-92		Речь здесь идет об Иване Рассохе (ставшем, кстати, одним из героев публицистической ленты "На путях перестройки") и о колхозном главбухе, соседке Ивана, Анне Иосифовне.	100:111	0:168
перестройка	NOUN	1918-1990	1	перестройка-93		Зато будьте уверены: когда пробьет час победы (а он обязательно пробьет), именно они громче всех закричат: "Мы тоже "пахали", себя не жалели" и т. п. К ним примыкают откровенные демагоги и скрытые противники перестройки.	208:219	0:220
перестройка	NOUN	1918-1990	1	перестройка-94		Рэй учит его обращению со столярным и строительным инструментом, кроме того, Ян помогает ему устанавливать забор вокруг пастбища и участвует в перестройке дома.	143:154	0:160
перестройка	NOUN	1991-2017	2	перестройка-95		Неопределенная, конфликтная или незнакомая ситуация, требующая перестройки поведенческих схем, приспособления к новым ситуационным взаимоотношениям, может привести к возрастанию уровня тревожности.	63:74	0:197
перестройка	NOUN	1991-2017	2	перестройка-96		С "доктриной Брежнева" покончено было с самого начала перестройки.	54:65	0:66
перестройка	NOUN	1991-2017	2	перестройка-97		И когда во время перестройки наши таланты заговорили об этом сокровенном, ушам своим трудно было поверить.	17:28	0:106
перестройка	NOUN	1991-2017	2	перестройка-98		Сложность ситуации усугубляется тем, что основная часть предприятий оказалась в период перестройки в стадии реконструкции производства, которая, из-за недостатка денежных средств, затянулась до настоящего времени.	87:98	0:213
перестройка	NOUN	1991-2017	2	перестройка-99		Однако "спустя четверть века после начала перестройки понимаешь, -- отметил Зубкевич, -- что открытость обсуждения не гарантирует его качества, и на примере роли прессы в освещении проблем депортации кавказских народов эта закономерность просматривается наиболее рельефно".	42:53	0:273
перестройка	NOUN	1918-1990	1	перестройка-100		Солженицын и перестройка Солженицын на Западе Еще в январе 1974 года я смог получить от хорошо знакомых мне корреспондентов некоторых западных газет несколько экземпляров книги Солженицына "Архипелаг ГУЛАГ" и написал большую рецензию на нее, которая была опубликована газетами "Вашингтон пост" и "Нью-Йорк таймс" в начале февраля и широко разошлась в Самиздате.	13:24	0:361
перестройка	NOUN	1991-2017	2	перестройка-101		Еще одна сложная проблема и описанной концепции, и радикальной реформы в целом: как научиться правильно оценивать результаты перестройки народного хозяйства, перевода его на экономические методы управления, когда они станут широко применяться Ведь реформа должна агитировать сама за себя.	125:136	0:288
перестройка	NOUN	1918-1990	1	перестройка-102		Стоит остановиться и привести еще один пример: Александр Мень очень долго не верил в перестройку.	85:96	0:97
перестройка	NOUN	1991-2017	2	перестройка-103		Когда появился Мольер, дело разъяснилось вполне: Ратабон явился с великолепным и полностью разработанным проектом перестройки Лувра, причем для успешного хода этой перестройки было необходимо снести с лица земли не только Малый Бурбон, но и прилегающую к нему церковь Сен-Женевьев д'Оксерруа.	114:125	0:292
перестройка	NOUN	1918-1990	1	перестройка-104		Тогда же правительство вновь заговорило о господдержке отрасли и подписало соглашение о займе на ее структурную перестройку у Международного банка реконструкции и развития.	112:123	0:172
перестройка	NOUN	1991-2017	2	перестройка-105		Все зависит от того, какие цели ставят перед собой эти инициативные группы (такое название мне больше по душе), как эти цели согласуются с идеями нашей перестройки, с насущными социальными и политическими задачами.	152:163	0:214
перестройка	NOUN	1918-1990	1	перестройка-106		Тогда я крайний за перестройку.	19:30	0:31
перестройка	NOUN	1918-1990	1	перестройка-107		Перестройка одного тянет за собой перестройку другого.	0:11	0:54
перестройка	NOUN	1918-1990	1	перестройка-108		Успокоив коллегу, отправился я вместе с ним к дежурной стенографистке и, прекрасно изучив за годы перестройки лексику, фразеологию, аргументы и даже интонацию лидера СССР, продиктовал требуемый Москвой кусочек беседы генсека с колхозниками.	98:109	0:240
перестройка	NOUN	1991-2017	2	перестройка-109		Несомненно, конечно, что параллельно должны развиваться и углубляться и другие аспекты перестройки -- гласность и демократизация; отказ от догматизма и преодоление застоя в политико-экономической сфере; открытое осуждение и исправление всех допущенных ранее ошибок, включая преследования за убеждения; все это будет способствовать стабильности и открытости советского общества, а значит, международному доверию и безопасности.	87:98	0:426
перестройка	NOUN	1918-1990	1	перестройка-110		Чтобы организовать, например, работу нескольких спецлагерников-специалистов на приисковой электростанции, понадобилась бы едва ли не перестройка этой электростанции и дежурство возле нее целого взвода автоматчиков с собакой.	133:144	0:224
перестройка	NOUN	1918-1990	1	перестройка-111		Тот пересмотр посылок онтологии сознания. который таким подходом предполагается в теории, Маркс предпринял позднее в научных работах и совершил радикальный поворот в философии, совпавший с гораздо более поздним общим движением философского опыта и знаний эпохи конца XIX века и ХХ века к новой проблемной реальности, к перестройке структур сознания.	319:330	0:349
перестройка	NOUN	1918-1990	1	перестройка-112		Эмоции, даже у здорового человека, в форме физиолого-химических или преимущественно химических перестроек изменяют состояние мозга и организма.	95:105	0:143
перестройка	NOUN	1991-2017	2	перестройка-113		Я утверждал, что сейчас беспредметно спорить, возможна ли конвергенция, -- она уже идет, в социалистическом мире это -- перестройка.	120:131	0:132
перестройка	NOUN	1918-1990	1	перестройка-114		Эффективной подготовке студентов мешает и формальный подход к соотношению между числом преподавателей и студентов, слабая обеспеченность вузов современной лабораторной базой и т. д. Впрочем, это хорошо известно читателям, об этом много говорят в связи со всенародным обсуждением проекта ЦК КПСС "Основные направления перестройки высшего и среднего специального образования в стране".	317:328	0:383
перестройка	NOUN	1918-1990	1	перестройка-115		Некоторые из них вошли в число официальных лозунгов перестройки.	52:63	0:64
перестройка	NOUN	1991-2017	2	перестройка-116		Юрий Афанасьев, один из наиболее радикальных деятелей перестройки, оказался под судом из-за того, что газета его избирательного округа напечатала его речь на съезде, как и требовалось по правилам.	54:65	0:196
перестройка	NOUN	1991-2017	2	перестройка-117		Что это продвинет перестройку, а победа михалковского кино отбросит ее далеко назад.	18:29	0:84
перестройка	NOUN	1991-2017	2	перестройка-118		Я тогда говорил, к каким тяжелым последствиям неминуемо ведет курс Горбачева, и меня прямо спросили: "Скажи, Сергей, ты что же, противник перестройки".	138:149	0:151
перестройка	NOUN	1991-2017	2	перестройка-119		-- Не будь перестройки, такая встреча не состоялась бы, -- сказал проходя мимо никем не узнанный М.С. Горбачев.	11:22	0:111
