lemma	pos	date	grouping	identifier	description	context	indexes_target_token	indexes_target_sentence
перестройка	NOUN	1991-2017	2	перестройка-0		-- Перестройка его из подвала освободила, а он о ней даже и не слышал.	3:14	0:70
перестройка	NOUN	1991-2017	2	перестройка-1		В тот же день в Ереване другой секретарь ЦК -- Александр Яковлев -- объявил, что право народов на самоопределение -- главный принцип перестройки.	133:144	0:145
перестройка	NOUN	1918-1990	1	перестройка-2		-- Но нужна демократическая перестройка общества.	28:39	0:49
перестройка	NOUN	1918-1990	1	перестройка-3		(Добавление 1987 г. Я надеюсь, что в результате "перестройки" подобные проблемы будут решаться более прямым способом -- без несуществующих работников и формальных нарушений.	49:60	0:173
перестройка	NOUN	1918-1990	1	перестройка-4		2.5 тонны, требует перестройки Перестройка моста под нагрузку Н-8 20.10 Инженерн. управление 8 Сиротинская паром - 6 т. на веслах Ремонт парома, исправление подходов, усиление парома до 10 тонн.	19:30	0:194
перестройка	NOUN	1918-1990	1	перестройка-5		Основной причиной этого является отсутствие перестройки в самой партии.	44:55	0:71
перестройка	NOUN	1918-1990	1	перестройка-6		Перестройка пошла по ложному пути.	0:11	0:34
перестройка	NOUN	1991-2017	2	перестройка-7		Слово "перестройка" впервые произнесено было по-русски.	7:18	0:55
перестройка	NOUN	1991-2017	2	перестройка-8		А один, мой дядька Валентин Карпович Месяц, был министром сельского хозяйства СССР, а потом во время перестройки, при М.С. Горбачеве, первым секретарем Московского обкома партии.	101:112	0:178
перестройка	NOUN	1991-2017	2	перестройка-9		Нет, как раз эта осмотрительность и способность предвидеть хотя бы личный ущерб была у интеллигенции отключена в ходе перестройки.	118:129	0:130
перестройка	NOUN	1918-1990	1	перестройка-10		А потом -- с середины семидесятых и до начала перестройки -- эти успехи растерять, потерпеть ряд жестоких неудач.	46:57	0:113
перестройка	NOUN	1991-2017	2	перестройка-11		Дворец поэтому нуждался в перестройке, которая была поручена архитектору Щуко.	26:37	0:78
перестройка	NOUN	1918-1990	1	перестройка-12		В России ускорение и перестройка.	21:32	0:33
перестройка	NOUN	1918-1990	1	перестройка-13		Таким образом, сейчас в городе полным ходом идут возведение объектов и социальная перестройка.	82:93	0:94
перестройка	NOUN	1991-2017	2	перестройка-14		В основу ее реализации положена структурная перестройка системы организации психиатрической помощи, предусматривающая изменение приоритетов, объема и качества лечебно-диагностического процесса и социально-реабилитационных мероприятий.	44:55	0:234
перестройка	NOUN	1991-2017	2	перестройка-15		Крупные хромосомные перестройки, такие как слияние двух хромосом в одну или, наоборот, разделение, в пределах одного вида встречаются реже, чем при межвидовых сравнениях, но все же встречаются.	20:31	0:193
перестройка	NOUN	1918-1990	1	перестройка-16		В первые годы царствования Людовика VII у Сугерия появляется много свободного времени, и в 1140 г. он начинает перестройку церкви в Сен-Дени.	111:122	0:141
перестройка	NOUN	1991-2017	2	перестройка-17		А впрочем, чего обижаться: на дворе свобода, блин, перестройка, благодать!	51:62	0:74
перестройка	NOUN	1991-2017	2	перестройка-18		В принятых вчера рекомендациях парламенту предложено вводить 100-процентную оплату услуг населением не ранее 2008 года, а правительству до этого провести полную структурную перестройку в ЖКХ с изысканием всех внутренних финансовых источников.	173:184	0:242
перестройка	NOUN	1991-2017	2	перестройка-19		Это были проблемы, возникшие при перестройке системы учета и статистики, создании новой информационной базы для СНС и проведении экспериментальных расчетов для перехода от системы БНХ к Системе национальных счетов.	33:44	0:214
перестройка	NOUN	1918-1990	1	перестройка-20		В этом -- основное "внутреннее противоречие" регенеративного приемника: с одной стороны, желательно увеличение обратной связи почти до "порога генерации"; с другой же стороны малейшее случайное повышение накала или перестройка на иную волну может вызвать начало генерации, и отрывок принимаемой речи будет потерян.	215:226	0:314
перестройка	NOUN	1918-1990	1	перестройка-21		Завершается перестройка органов государственной власти на основе Сталинской Конституции.	12:23	0:88
перестройка	NOUN	1991-2017	2	перестройка-22		Взлет активности нового генерального совпал с началом перестройки.	54:65	0:66
перестройка	NOUN	1991-2017	2	перестройка-23		Но в любом случае я бы забросил в мусорную корзину все мои колебания, сомнения, переживания, исходящие из чувства почти рабской лояльности к Горбачеву, и начал бы действовать без оглядки, соответственно тому, как я понимал обстановку и интересы Перестройки.	245:256	0:257
перестройка	NOUN	1918-1990	1	перестройка-24		Вопрос о соотношении психологии с естественными науками и философией встал особенно остро в 1920-е гг. в связи с необходимостью перестройки психологии на основе марксизма.	128:139	0:171
перестройка	NOUN	1991-2017	2	перестройка-25		Против этого могут выступать только бесталанные, а я обращаюсь ко всем одаренным: не теряйте времени зря, творите больше хороших дел, активно участвуйте в перестройке!	155:166	0:167
перестройка	NOUN	1918-1990	1	перестройка-26		Выбор есть всегда Среди многочисленных предложений, высказанных читателями при ответе на анкету "Горизонта", наиболее настойчивым было: организовать на страницах журнала встречи с писателями, деятелями искусства -- теми, кто сегодня находится на переднем крае перестройки.	260:271	0:272
перестройка	NOUN	1918-1990	1	перестройка-27		Макаров высказывал уверенность, что перестройка носовой части "Ермака" обеспечит ему успех.	36:47	0:91
перестройка	NOUN	1918-1990	1	перестройка-28		Гитлер носится с планами коренной административной перестройки своей "третьей империи".	51:62	0:87
перестройка	NOUN	1918-1990	1	перестройка-29		Наблюдения, которые имеются у каждого человека над людьми, находящимися длительное время в поле его зрения, могут на каждом шагу обнаружить случаи очень серьезной, иногда коренной перестройки как будто уже наметившегося характера.	180:191	0:230
перестройка	NOUN	1918-1990	1	перестройка-30		До перестройки -- несвобода, политический гнёт, невозможность реализовать себя не только как homo politicus, но и как homo economicus.	3:14	0:134
перестройка	NOUN	1991-2017	2	перестройка-31		Поэтому обсуждаемую статью следует всячески приветствовать и оценивать как проявление прекрасных симптомов начавшегося движения научной интеллигенции к более полнокровному выражению своей социальной роли, к так нужной сегодня перестройке теоретической мысли.	226:237	0:258
перестройка	NOUN	1991-2017	2	перестройка-32		До перестройки этот парень работал, наверное, на том же заводе, жил на берегу, любил рыбалку.	3:14	0:93
перестройка	NOUN	1991-2017	2	перестройка-33		Идет перестройка.	5:16	0:17
перестройка	NOUN	1991-2017	2	перестройка-34		Если покаяние можно считать начальным моментом в перестройке ценностно-смысловой системы, то обряд крещения -- принятие на себя "обязательств служить Богу, жить доброй совестью и по заповедям" -- является ее завершением.	49:60	0:220
перестройка	NOUN	1991-2017	2	перестройка-35		Цель: разъяснить задачи Перестройки, многие вопросы которой не были ясны этому руководству.	24:35	0:91
перестройка	NOUN	1918-1990	1	перестройка-36		И казалось ему совершенно простым и ясным, что не в ремонте только нуждается жизнь, а в окончательной перестройке.	102:113	0:114
перестройка	NOUN	1918-1990	1	перестройка-37		Но старик Томас, директор, скрепя сердце принявший тяжелый для него пункт контракта о перестройке одной из печей, под всякими предлогами откладывал эту самую перестройку.	86:97	0:170
перестройка	NOUN	1918-1990	1	перестройка-38		И органически вписался в то, что стало механизмом перестройки тоталитарного общества.	50:61	0:85
перестройка	NOUN	1991-2017	2	перестройка-39		Перестройка -- это возврат не к Троцкому, как уверяют его нынешние идейные наследники, а к Ленину, творческое восприятие его идей о социализме как творении рук самих трудящихся, осуществляемом "без указов сверху".	0:11	0:213
перестройка	NOUN	1991-2017	2	перестройка-40		Им был нужен закладной вексель крупнейшего в стране авиационного завода, купленный банком "Гарантия" еще на заре перестройки за сущие копейки про запас, из расчета "авось когда-нибудь пригодится".	113:124	0:196
перестройка	NOUN	1991-2017	2	перестройка-41		Ответили, что "до перестройки", 68% людей с низкими доходами, 55% со средними и 44% с высокими.	18:29	0:95
перестройка	NOUN	1991-2017	2	перестройка-42		Интереснее приходить на объект в стадии перестройки, когда ты сразу, вместе с архитектором, можешь принять принципиальные решения -- где расположить камин, печку, колонны.	40:51	0:171
перестройка	NOUN	1991-2017	2	перестройка-43		Во-первых, он не задается самокритичным вопросом: почему, собственно, нечто кажется наиболее разумным и рациональным Что убедило в правильности Перестройки с самого начала Какие из исходных посылок могли со временем обнаружить свою недостаточную прочность Во-вторых, нормативный подход фактически отождествляет выгоду и пользу для всего общества с выгодой и пользой для конкретного человека уже сегодня.	144:155	0:403
перестройка	NOUN	1991-2017	2	перестройка-44		История была поставлена в повестку дня перестройкой, но спрос на ее "тайны" не удовлетворен до сих пор, хотя фабрика, штампующая жизнеописания царей, диктаторов, бандитов, куртизанок, революционеров и прочих "замечательных людей", работает с завидной четкостью.	39:51	0:261
перестройка	NOUN	1991-2017	2	перестройка-45		Впереди брезжила реальная перспектива заменить уходящего на заслуженный отдых председателя потребкооперации, что в свете шагающей по стране перестройки выглядело невероятно заманчиво.	140:151	0:183
перестройка	NOUN	1918-1990	1	перестройка-46		К началу перестройки льняной клин составлял около 1 млн. га.	9:20	0:60
перестройка	NOUN	1991-2017	2	перестройка-47		Мао Цзэ-дун и китайская культурная революция", а еще раньше книгу "Перестройка идеологии и психологии тотализма: изучение "промывки мозгов" в Китае", т.е. занимался предметом, по моему убеждению, исключительно близким джонстаунской трагедии.	67:78	0:241
перестройка	NOUN	1991-2017	2	перестройка-48		Как у бедняги Сан Сеича обрубило личные и профессиональные воспоминания на первом же году так называемой "перестройки".	106:117	0:119
перестройка	NOUN	1991-2017	2	перестройка-49		Но как только от провозглашения общих целей перестройки Горбачев переходил к конкретным действиям, тут же обнаруживалось, что его начинания не получают единодушной поддержки, а, наоборот, встречают сильнейшее сопротивление аппарата.	44:55	0:232
перестройка	NOUN	1918-1990	1	перестройка-50		Кем бы я был, если бы не перестройка ИТР с жалкой зарплатой.	25:36	0:60
перестройка	NOUN	1991-2017	2	перестройка-51		Мы не имеем поэтому гарантий необратимости перестройки.	43:54	0:55
перестройка	NOUN	1918-1990	1	перестройка-52		Книга выписывалась Танеевым отовсюду; книжные магазины Готье, Ланг и Кнебель работали для него; все отцовское состояние и весь личный заработок эта книга съедала; чтобы обрамить картину из тысячей томов, понадобился огромный зал; для зала понадобилось перестраивать старый, каменный старинный домину, доставшийся вместе с купленным Демьяновым; Танеев, эстет, перестраивал этот дом, руководствуясь принципами высшей книжной эстетики, -- в ряде годин; перестройка съедала все средства; и полугодиями дом стоял в разворошенном виде: средств не было.	450:461	0:546
перестройка	NOUN	1918-1990	1	перестройка-53		Во втором случае вы сами знаете, о чьей поддержке идет речь, но вам никогда не простят попыток перестройки".	95:106	0:108
перестройка	NOUN	1991-2017	2	перестройка-54		Когда началась "перестройка", Юрасов интересовался в посольстве, отменен ли смертный приговор, который ему заочно вынесли в Москве.	16:27	0:131
перестройка	NOUN	1991-2017	2	перестройка-55		Но вспомним: Андропов -- это агонизирующий застой, преддверие перестройки, острого, смертельного кризиса системы.	62:73	0:113
перестройка	NOUN	1991-2017	2	перестройка-56		Когда-то, еще в пору перестройки, в восемьдесят седьмом году, работая редактором в издательстве, я готовил большую книгу Волошина.	21:32	0:130
перестройка	NOUN	1991-2017	2	перестройка-57		Зато, когда началась так называемая перестройка и открылись первые, еще очень скромные возможности разбогатеть, когда смутный призрак наживы появился на вдруг чудесно и соблазнительно расширившемся горизонте жизни, одним из первых на моей памяти погнался он за этим призраком, в начале девяностых сделавшимся реальностью, обернувшимся банковскими счетами в Швейцарии, лимузинами, телохранителями, яхтами и, по слухам, чуть ли не виллою в Ницце, затем дефолтом, крахом, какими-то, опять же -- по слухам, разборками и наездами, да простят мне взыскательные Музы чудовищные сии выражения, новым началом, прерванным обострившейся, очень редкой, наследственною болезнью крови, с которой, как тогда же и выяснилось, жил он и боролся всю жизнь, финалом, закатом, уходом.	36:47	0:763
перестройка	NOUN	1918-1990	1	перестройка-58		Между тем. медлить с перестройкой работы нельзя.	21:33	0:48
перестройка	NOUN	1918-1990	1	перестройка-59		Получается, что потеря энергии не ведет к перестройке звезды (она должна, остывая, сжиматься, а этого нет).	42:53	0:107
перестройка	NOUN	1991-2017	2	перестройка-60		Мотивы тут ясны, они имеют скорее психологическую основу: отрицание коммунистических идеалов в советскую эпоху, высмеивание бывшего кумира в первые годы перестройки -- и его новое утверждение тогда, когда "советское" стало одним из символов отрицания нынешней российской реальности.	153:164	0:282
перестройка	NOUN	1991-2017	2	перестройка-61		На "Северстали" это понимали, когда принимали решение о структурной перестройке бизнеса.	68:79	0:88
перестройка	NOUN	1918-1990	1	перестройка-62		Научная задача, однако, заключается не в том, чтобы констатировать эту зависимость (она давно констатирована в бесчисленных работах психологов и физиологов), а в том, чтобы исследовать те преобразования деятельности, которые ведут к перестройке ансамблей мозговых психофизиологических функций.	233:244	0:293
перестройка	NOUN	1918-1990	1	перестройка-63		Этот период ставит перед пролетариатом новые задачи о перестройке всей партийной работы на новый, революционный лад, о воспитании рабочих в духе революционной борьбы за власть, о подготовке и подтягивании резервов, о союзе с пролетариями соседних стран, об установлении прочных связей с освободительным движением колоний и зависимых стран и т. д. и т. п. Думать, что эти новые задачи могут быть разрешены силами старых социал-демократических партий, воспитанных в мирных условиях парламентаризма,-- значит обречь себя на безнадежное отчаяние, на неминуемое поражение.	54:65	0:567
перестройка	NOUN	1991-2017	2	перестройка-64		Но он возникнет, если мы сами будем опаздывать, ограничиваться половинчатыми решениями, колебаться или, упаси Господи, дрогнем в проведении Перестройки.	140:151	0:152
перестройка	NOUN	1991-2017	2	перестройка-65		Сразу же после XXVII съезда на заседании Политбюро 13 марта 1986 года Горбачев изложил свою программу Перестройки.	102:113	0:114
