lemma	pos	date	grouping	identifier	description	context	indexes_target_token	indexes_target_sentence
серединный	ADJ	1682-1916	1	серединный-73		А тут вдобавок и самый, так сказать, закон природы: Германия ведь все-таки в Европе страна серединная: как бы она ни была сильна -- с одной стороны Франция, с другой Россия.	91:101	0:173
серединный	ADJ	1918-1990	2	серединный-74		Отрицание серединной культуры -- опасная черта в русских людях, это -- нигилистическая черта.	10:20	0:93
серединный	ADJ	1918-1990	2	серединный-75		На глобусе этому месту по широте соответствуют серединные части Греции, Турции, города Бухара, Ашхабад.	47:57	0:103
серединный	ADJ	1918-1990	2	серединный-76		Перед нами ненавязчивая, но несомненная симметрия построения: крайняя пара эклог, I и IX -- человек и земля; следующая, II и VIII, -- человек и любовь; следующая, III и VII, -- человек и песня; следующая, IV и VI, -- прошлое и будущее; серединная, V, -- земное и божественное; заключительная, X, -- синтез: здесь и природа, и любовь, и песня, и боги.	236:246	0:350
серединный	ADJ	1918-1990	2	серединный-77		Древней работы громадный золотой канделябр, несоразмерно вздувшийся в серединной части, лежал на блюде, как плод, свисал тусклыми кисточками, пузырился крохотными виноградинками.	70:80	0:178
серединный	ADJ	1682-1916	1	серединный-78		По бокам на двух крашеных тумбах сверкали искривленные канделябры, правая сторона гостиной была загромождена роялем, а портьера проходной двери, ведшей в биллиардную, была таинственно опущена; над серединной дверью, по обыкновению, красовался в овальной раме масляный портрет бывшего мухрованского коменданта -- седого генерала с щетинистыми усами и косой черной повязкой, закрывавшей раненый глаз.	197:207	0:398
серединный	ADJ	1682-1916	1	серединный-79		Наполеон направлял атаку (charge de front) серединную.	43:53	0:54
серединный	ADJ	1682-1916	1	серединный-80		Превосходное шоссе вьется до самой вершины серединной скалы.	43:53	0:60
серединный	ADJ	1682-1916	1	серединный-81		На серединном и самом высоком отделе ее гордо веет английский флаг; южный отдел образует легкий скат, оканчивающийся мысом, называющимся Punta de Europa, -- это крайний пункт Европы; северный отдел -- высокая, перпендикулярно поднимающаяся из моря скала.	3:13	0:254
серединный	ADJ	1682-1916	1	серединный-82		Русский народ, как народ апокалиптический, не может осуществлять серединного гуманистического царства, он может осуществлять или братство во Христе, или товарищество в антихристе.	65:76	0:179
серединный	ADJ	1918-1990	2	серединный-83		Раскрытие мужественного духа в России не может быть прививкой к ней серединной западной культуры.	68:78	0:97
серединный	ADJ	1918-1990	2	серединный-84		Сельскохозяйственные районы серединной Америки пустынны с точки зрения плотности населения.	28:38	0:91
серединный	ADJ	1918-1990	2	серединный-85		Когда сверху не имеют ясной позиции, выбирают единственно возможную и удобную -- серединную.	81:91	0:92
серединный	ADJ	1682-1916	1	серединный-86		Так ли это Иногда думаю, что это мое свойство: сперва напор воображения, целый вихрь видений, а когда начинаешь сочинять, записывая, они разрежаются и при ближайшем рассмотрении оказываются не сценами или картинами, которые могут следовать одна за другой, а лишь концовками сцен или серединными эффектами отдельных сцен.	283:294	0:320
серединный	ADJ	1918-1990	2	серединный-87		А затем -- десять месяцев мытарств, сумасшедших домов, экспертов, и -- столько ее таскали, таскали, таскали, и при этом эта бедная тяжкая преступница, вполне виновная, -- в сущности представляет из себя нечто до того несерьезное, безалаберное, до того ничего не понимающее, не законченное, пустое, предающееся, собой не владеющее, серединное, и так даже до самой последней минуты приговора, -- что как-то легче стало, когда ее совсем отпустили.	331:341	0:444
серединный	ADJ	1682-1916	1	серединный-88		Такие летние утра в серединной России необыкновенно благоприятно действуют на всякое живое существо, до изнеможения согретое знойными днями.	20:30	0:140
серединный	ADJ	1682-1916	1	серединный-89		Эта идеология хотела бы отнять у эллинства Афродиту, которая пришла к эллинам от семитов, а у христианства подрубить его серединный и глубочайший корень -- веру в "трансцендентного", или, попросту живого Бога.	121:131	0:209
серединный	ADJ	1682-1916	1	серединный-90		То же и в государственности, по существу серединной и относительной.	41:51	0:68
серединный	ADJ	1682-1916	1	серединный-91		Хотя в современную эпоху Серединному царству не угрожает опасности от организованной вооруженной силы, тем не менее сторожевые пункты поддерживаются в порядке и нередко служат убежищем для правительственных постов, на обязанности которых лежит наблюдение за движением шаек матацзей, хунхузов, мадзеев, т. е. конных разбойников разных наименований, никогда не переводящихся по ту сторону Великой стены, на cеверных склонах Иншаня и в бассейне р.	25:36	0:444
серединный	ADJ	1918-1990	2	серединный-92		Цыгане шумною толпой -- По Бессарабии кочуют -- Они сегодня над рекой -- В шатрах изодранных ночуют -- Как вольность весел их ночлег -- и так далее -- без передышки и без серединных запятых -- до: звон походной наковальни, которую, может быть, принимаю за музыкальный инструмент, а может быть, просто -- принимаю.	171:181	0:313
серединный	ADJ	1918-1990	2	серединный-93		Основной маршрут экспедиции выразился в следующем обширном круге по серединной части Азии.	68:78	0:90
серединный	ADJ	1918-1990	2	серединный-94		Этот архиерей по свойству личного характера всегда отличался способностью к компромиссным мерам, стараясь занимать серединное, "умеренное" положение.	115:125	0:149
серединный	ADJ	1918-1990	2	серединный-95		И долгое-долгое время пришельцы серединной степи разгадывали: отчего не стерегут ее ни татары, ни киргизы, глядя в ее просторы через узкие щелки глаз, уступают землю без слова, сворачивают то ли на север, то ли на юг..	32:42	0:218
