lemma	pos	date	grouping	identifier	description	context	indexes_target_token	indexes_target_sentence
машина	NOUN	1682-1916	1	машина-0		(из зала: "Папа с работы на машине привез!").	28:34	0:45
машина	NOUN	1918-1990	2	машина-1		Начиная от трактиров, где прислуга щеголяет в шелковых рубашках, где двадцатитысячные машины услаждают слух меломанов, где можно найти кипу журналов, до тех заведений, по краям Москвы, в которых деревянные лавки заменяют красные диваны, а половые ходят в опорках, -- везде, если найдете какой недостаток, то уж наверно не в чае, и если возмутит что вашу душу или аппетит, то, конечно, не он.	86:92	0:391
машина	NOUN	1682-1916	1	машина-2		-- Есть так держать! -- в тон штурману отвечал летчик, поворачивая нос машины.	71:77	0:78
машина	NOUN	1918-1990	2	машина-3		-- Что это такое, скажите вы мне, -- говорила она с настойчивостью и начала затем читать текст старинного перевода книги Сен-Мартена: "Мне могут сделать возражение, что человек и скоты производят действия внешние, из чего следует, что все сии существа имеют нечто в себе и не суть простые машины, и когда спросят у меня: какая же разница между их началами действий и началом, находящимся в человеке, то ответствую: сию разность легко тот усмотрит, кто обратится к ней внимательно.	289:295	0:480
машина	NOUN	1918-1990	2	машина-4		-- С красноармейцем, который у аварийной машины.	41:47	0:48
машина	NOUN	1918-1990	2	машина-5		У меня было много, я мог купить себе пять машин, так что я знаю, что говорю.	42:47	0:76
машина	NOUN	1918-1990	2	машина-6		.. ничего...-- говорит Шолохов и садится в седло: унизительно верховому ехать в машине, а лошадь вести в поводу.	80:86	0:112
машина	NOUN	1918-1990	2	машина-7		Не допускается установка машины на дно ванны.	25:31	0:45
машина	NOUN	1682-1916	1	машина-8		10-го числа в первой рас пущена машина с посажирами по новоторской железной дороги до Осташевской станции.	32:38	0:106
машина	NOUN	1682-1916	1	машина-9		Просим товарищей обратить серьезное внимание на наших господ мастеров и метранпажей которые всеми силами стараются сорвать нашу забастовку и которые за малочисленностью штрейкбрехеров заменяют их как-то: метранпажами и помощники фактора (которых два) и кладовщик набирают строки, а мастера машинные накладывают на машинах.	290:298	0:322
машина	NOUN	1682-1916	1	машина-10		Машина заработала на полный ход.	0:6	0:32
машина	NOUN	1918-1990	2	машина-11		И говорят и движутся они размеренно и механично, в ритме молотов и работающих машин; и когда кто-нибудь вдруг выступает отдельно, то кажется, что это откололась частица черной машины, странного сооружения, похожего на неведомое чудовище.	78:83	0:237
машина	NOUN	1682-1916	1	машина-12		Машина опоздала почти на полчаса.	0:6	0:33
машина	NOUN	1918-1990	2	машина-13		Но прииск остался в том самом виде, как был, -- как будто хозяева вчера только уехали и в своем поспешном отъезде оставили на столах скатерти, термометр на веранде, кучи графита на горах и незапертую шахту с машинами.	208:216	0:217
машина	NOUN	1682-1916	1	машина-14		Машины собираются, обслуживаются и даже чинятся собственными усилиями общины, при некоторой временной помощи английских техников.	0:6	0:129
машина	NOUN	1682-1916	1	машина-15		И народ, и разночинцы, и купцы, и чиновники, и интеллигенты -- все захвачены огромной машиной государственной и социальной жизни.	86:93	0:129
машина	NOUN	1682-1916	1	машина-16		Armes Kind! Und du auch hier!.. Noch ein neuer Tod! -- с крушащею болью в сердце прошептал старик, не сводя изумленных глаз со смущенно поникшей Машиной головки.	145:152	0:161
машина	NOUN	1682-1916	1	машина-17		Фомушка измышляет Как ни счастливо разыгралось для Фомушки следствие по поводу Машиной жалобы, он все-таки пришел к заключению, что не мешало бы снова поднять на недосягаемую высоту авторитет своей святости в глазах хозяев.	79:86	0:223
машина	NOUN	1682-1916	1	машина-18		В дополнение к неоднократным моим просьбам еще раз прошу срочной высылки для штарма шести и для каждого из трех корпусов не менее двух мощных легковых машин с полным комплектом запасных частей, без чего управлять операциями не могу.	151:156	0:232
машина	NOUN	1682-1916	1	машина-19		Машина завела грустное-грустное, и Антон, покачивая головой и крепко прижав руку к щеке, запел что-то несуразное, без слов и без мотива.	0:6	0:136
машина	NOUN	1682-1916	1	машина-20		В отверстие, сообразное величине кружков, сии последние вкладываются, при движении машины сами собой приходят в другую форму, по которой продергиваются, оборачиваясь и касаясь до клейма, у одной стороны формы имеющегося, и тоже сами собой падают в устроенное место.	83:89	0:265
машина	NOUN	1682-1916	1	машина-21		74. Семьдесят четвертая машина есть ночник, которым бы ночью улицы осветить, изобретена от господина Фавра, 1703 года.	24:30	0:118
машина	NOUN	1682-1916	1	машина-22		Вода проведена машиною к стене, к которой прикреплена ванна.	15:22	0:60
машина	NOUN	1682-1916	1	машина-23		Так например, в начале этой недели на маленькой 12-сильной машине завода Н.А.Г. в 3 дня покупатель совершил большую поездку из Москвы в Екатеринослав.	59:65	0:150
машина	NOUN	1682-1916	1	машина-24		Водитель вылез из машины, пошел к багажнику.	18:24	0:44
машина	NOUN	1918-1990	2	машина-25		А тут еще возня с приданым, которому Песоцкие придавали не малое значение; от звяканья ножниц, стука швейных машин, угара утюгов и от капризов модистки, нервной, обидчивой дамы, у всех в доме кружились головы.	109:114	0:209
машина	NOUN	1918-1990	2	машина-26		Вслед за машинами посредине мостовой идут цепи вьетнамских солдат.	9:17	0:66
машина	NOUN	1918-1990	2	машина-27		Достигнуть этого на летательной машине почти невозможно.	32:38	0:56
машина	NOUN	1682-1916	1	машина-28		Вы должны были рубить зло в корне, а не в ветвях, и дать такой толчок всеобщему движенью всего, чтобы после вас пошла сама собой работать машина, так чтобы незачем было над ней стоять и надсмотрщику, и сим только воздвигнули бы памятник вечный вашего генерал-губернаторства.	138:144	0:274
машина	NOUN	1682-1916	1	машина-29		-- Пишущая машина!	11:17	0:18
машина	NOUN	1682-1916	1	машина-30		Выделка из торфа бумаги по новому способу не требует особых машин.	60:65	0:66
машина	NOUN	1682-1916	1	машина-31		Здесь Его Высочество был встречен исправляющим должность главного начальника г. полковником Меньшениным 1-м и горным начальником Златоустовских заводов и директором Оружейной фабрики г. полковником Аносовым; по представлении сим последним чиновников местного управления, Его Высочество изволил осматривать Минеральный кабинет, состоящий преимущественно из ископаемых округа Златоустовских заводов; потом фабрику, где производится плавка золотосодержащих наносов в шахтных печах по способу, изобретенному г. полковником Аносовым, причем им представлено было краткое описание плавки и проба золота, полученного из чугуна, опытную амальгамирную фабрику, устроенную по образцу венгерских амальгамирных мельниц; промывку песков в бочках на машине, изобретенной г. Агте.	735:741	0:764
машина	NOUN	1918-1990	2	машина-32		Дедушкин парадный костюм был уже изрядно помят, на нем появились грязные пятна -- видно, он ходил между тесно составленными машинами и задевал за их крылья.	124:132	0:156
машина	NOUN	1918-1990	2	машина-33		Многим понравились наши землеройные машины -- гидравлический экскаватор Э-5015, экскаватор Э-303Б, мелиоративный экскаватор ЭМ-152Б.	36:42	0:132
машина	NOUN	1682-1916	1	машина-34		Для таких баснословных урожаев огородникам приходится обращаться в машины и отказываться от всех радостей жизни, но во всяком случае эти труженики оказали человечеству громадную, неоценимую услугу тем, что они научили нас делать самим себе нужную почву.	67:73	0:253
машина	NOUN	1682-1916	1	машина-35		Изучать органы независимо от их отправления, организмы независимо от их жизни почти так же невозможно, как изучать машину и ее части, не интересуясь их действием.	115:121	0:162
машина	NOUN	1682-1916	1	машина-36		Для устранения этих недостатков, сопряженных с работой на швейной машине, Шеллер и компания в Нью-Йорке рекомендовал снаряд, который легко может быть приделан ко всякой машине и позволяет приводить ее в движение весьма легким давлением.	66:72	0:236
машина	NOUN	1682-1916	1	машина-37		На монетном дворе две машины паровые.	22:28	0:37
машина	NOUN	1918-1990	2	машина-38		Ей удалось сразу же открыть калитку (как он сразу же открыл машину, наитие открывает нам чужие вещи), и дальше она шла по расчищенной дорожке к веранде.	60:66	0:152
машина	NOUN	1918-1990	2	машина-39		Епифанов уже самостоятельно водил машину и три раза ездил в Хабаровск и обратно.	34:40	0:80
машина	NOUN	1918-1990	2	машина-40		Жидкий свет ацетилена, едва пробиваясь сквозь молочную, безвыходную тьму, круто спускался по обрывистому кустарнику, ведя за собой, как на поводу, машину.	147:153	0:154
машина	NOUN	1918-1990	2	машина-41		Нам и так пора наступила сбавлять ход, чтобы застопорить машины для приемки лоцмана в заливе.	57:63	0:93
машина	NOUN	1918-1990	2	машина-42		Журналист: После наших публикаций о "багги" редакция получила около трех тысяч писем от читателей, решивших взяться за постройку такой машины.	135:141	0:142
машина	NOUN	1918-1990	2	машина-43		Скажем, чтобы посеять рис, шести машинам надо неоднократно пройти по пашне.	33:40	0:75
машина	NOUN	1682-1916	1	машина-44		Здесь мерно стучали машины, встряхивая железные ящики с черной землей, шипел и свистел сжатый воздух, на вагонетках стояли готовые формы.	20:26	0:137
машина	NOUN	1918-1990	2	машина-45		Так ли, сяк ли, урожай 1861 года был, хотя с страшными мучениями, перемолочен частию цепами, частию убогою машиной.	107:114	0:115
машина	NOUN	1918-1990	2	машина-46		Здесь мы опускаем историю несостоявшейся свадьбы с Уэллсом, когда Мура грозила Уэллсу, едучи с ним в такси, что выбросится на ходу из машины, если он будет настаивать на венчании.	134:140	0:179
машина	NOUN	1918-1990	2	машина-47		Было еще темно, когда на Московском вокзале меня встретили два незнакомых сотрудника Физтеха, усадили в машину и повезли на Лесной.	104:110	0:131
машина	NOUN	1682-1916	1	машина-48		Или, может, о вашей -- Орландо, едем, куда скажет сеньор Филипп, -- кинула она через плечо, когда втроем -- капрал на два шага сзади -- они выходили из театра к машине.	161:167	0:168
машина	NOUN	1918-1990	2	машина-49		Но понеже таким образом на полу верхней избы много ям чинится, которые хотя и наполнить можно, однако 39 машина, плоская кровля избы изобретена от господина Трушета, 1699, которая помянутый недостаток многих ям уничтожает.	105:111	0:222
машина	NOUN	1918-1990	2	машина-50		Информбюро капитан Навозов отправились на яшиной машине под Чернигов -- ходили еще вчера слухи, что он должен сегодня обязательно пасть.	49:55	0:136
машина	NOUN	1918-1990	2	машина-51		Глаза тигра следили за воздушной машиной.	33:40	0:41
машина	NOUN	1682-1916	1	машина-52		Как только последние удары инструментов докончили русло канала, Драченов на машине понесся к лесоучастку.	76:82	0:105
машина	NOUN	1918-1990	2	машина-53		Кто же это из действительно мыслящих людей верит в наше время в объективный, самой природе присущий нравственный порядок Для людей образованных в огромном большинстве их природа есть равнодушная машина.	195:201	0:202
машина	NOUN	1918-1990	2	машина-54		Мать ее Лукинична гнулась до потемок над швейной машиной -- помогала портнихе, взятой из станицы.	49:56	0:97
машина	NOUN	1918-1990	2	машина-55		Старая машина, она, может, и сто долларов не стоит -- старьё.	7:13	0:61
машина	NOUN	1682-1916	1	машина-56		Миша, видимо, сбился с колеи, машину развернуло поперек дороги.	30:36	0:63
машина	NOUN	1918-1990	2	машина-57		Объявления Мазь "МАДИЯ" высокого качества рекомендуется для смазки машин взамен говяж.	67:72	0:86
машина	NOUN	1682-1916	1	машина-58		Мы садимся в машину.	13:19	0:20
машина	NOUN	1918-1990	2	машина-59		-- Ты действительно думал купить ей машину -- спросил Карташев.	36:42	0:63
машина	NOUN	1682-1916	1	машина-60		На автомобильной гонке на выносливость машин Петербург-Рига-Петербург прибыла первой в 2 часа 23 минуты пополудни машина завода Оппель, фирмы "Победа" без штрафных очков.	39:44	0:170
машина	NOUN	1682-1916	1	машина-61		Сотни работников уверенно ходили между машинами, и ни шаги их, ни голоса не были слышны среди моря звуков.	39:47	0:106
машина	NOUN	1682-1916	1	машина-62		На платформе царствовало необычайное оживление: выгружали земледельческие машины и камень, слышалась беготня и громкие крики на странном горловом жаргоне.	74:80	0:154
машина	NOUN	1682-1916	1	машина-63		Сонно чмокают шлепки плиц, под палубой тяжело возится машина, сипит-вздыхает пар, дребезжит какой-то колокольчик, глухо ерзает рулевая цепь, но все звуки -- не нужны и как будто не слышны в дремотной тишине, застывшей над рекой.	54:60	0:228
машина	NOUN	1682-1916	1	машина-64		Начали работать в машине, выбирать лед и грязь.	18:24	0:47
машина	NOUN	1682-1916	1	машина-65		Людей невозможно считать только умственными машинами, располагая ими так, как располагает полководец массами солдат, когда составляет план баталии.	44:52	0:147
машина	NOUN	1918-1990	2	машина-66		Но он избрал "корвайр", создал ему дурную славу; спрос на эту машину прекратился, и она стала достоянием музеев.	62:68	0:112
машина	NOUN	1918-1990	2	машина-67		Бежала рядом дорога, шоссе -- темное и прямое, -- проносилась по нему машина с желтыми фарами, высвечивала по очереди все дорожные знаки, стрелы и надписи.	70:76	0:155
машина	NOUN	1682-1916	1	машина-68		О том, что машина найдена, он узнал рано утром перед выездом из Лиды, когда по "ВЧ" позвонил в Управление и ему перечислили все основные происшествия минувших суток в районе передовой и в тылах фронта.	11:17	0:201
машина	NOUN	1918-1990	2	машина-69		Это было так же нужно, как обедать, когда есть хочется; и для этого так же нужно, как приготовить обед, нужно было вести хозяйственную машину в Покровском так, чтобы были доходы.	135:141	0:178
машина	NOUN	1682-1916	1	машина-70		О цене машин Полгеймовых стыжуся писать, как несогласно с первым, для которого просил я его зятя, чтоб к нему отписал о присылке последней резолюции, которую, надеюся, получа на предбудущей почте к вам отправлю.	7:12	0:211
машина	NOUN	1682-1916	1	машина-71		Для писателя, привыкшего писать на писальной машине (а в Америке это становится обычным делом), нет абсолютно никакого затруднения самому набирать свое произведение.	45:51	0:165
машина	NOUN	1682-1916	1	машина-72		Общими усилиями -- Семен, Дитятичев, Дудырев, шофер с машины -- цепляясь за густую шерсть на боках, толкая друг друга плечами, перевернули тяжелую тушу.	54:60	0:152
машина	NOUN	1918-1990	2	машина-73		Понятно, что не по каждому делу можно было пускать в ход такую громоздкую машину; при широком развитии частного судопроизводства (так называемых третейских судов, см. с. 133) только самые крупные как гражданские, так и уголовные дела достигали суда "гелиастов".	74:80	0:261
машина	NOUN	1918-1990	2	машина-74		Одна из вражеских машин вышла из строя.	18:23	0:39
машина	NOUN	1918-1990	2	машина-75		Двигатели "Каравеллы" -- так назвали конструкторы реактивный лайнер, положивший начало новому направлению в компоновке самолетов, -- перекочевали на самый хвост машины.	161:167	0:168
машина	NOUN	1682-1916	1	машина-76		Он не ради щегольской фразы, но от глубины чистого и любящего сердца произнес свой афоризм на большом московском собрании матерей: -- Тот, кто написал хорошую книгу для детей или изобрел детские штанишки, не связывающие движений и приятные в носке, -- тот гораздо более достоин благодарного бессмертия, чем все изобретатели машин и завоеватели стран.	324:329	0:350
