lemma	pos	date	grouping	identifier	description	context	indexes_target_token	indexes_target_sentence
машина	NOUN	1918-1990	2	машина-77		Направляя поршневый стержень паровой машины посредством кулисы или параллелей, особенное внимание обращают на то, чтоб они были выполнены с возможным совершенством.	37:43	0:164
машина	NOUN	1918-1990	2	машина-78		Она остановила машину не совсем ладно, мотор заглох.	15:21	0:52
машина	NOUN	1918-1990	2	машина-79		Эмгебистская легковая машина исчезает за углом, а я остаюсь на мостовой с большим плохо связанным узлом в руках.	22:28	0:112
машина	NOUN	1918-1990	2	машина-80		Они понурились и старались не смотреть в сторону машины.	49:55	0:56
машина	NOUN	1918-1990	2	машина-81		Вот какая-то машина проехала слишком близко к милиционеру, и тот отпрыгнул, но тут же засвистел и побежал штрафовать.	13:19	0:117
машина	NOUN	1918-1990	2	машина-82		Последуем же за Гальвани в его знаменитых опытах: "Я разрезал лягушку и положил ее безо всякого умысла на стол, где на некотором расстоянии стояла электрическая машина.	161:167	0:168
машина	NOUN	1918-1990	2	машина-83		Потом -- дача, приезд шурина на машине, богатый стол, батарея водочных бутылок, салат с крабами под майонезом, и домашние грибы в миске -- гриб мелкий, ненабрякший, в меру скользкий, в меру плотный -- хороший, не черный гриб, и хлеб черный -- теплый.	32:38	0:250
машина	NOUN	1918-1990	2	машина-84		Потом они вызвали бы папину персональную машину и, бледные, взволнованные, отправились бы в писчебумажный магазин, обмениваясь по дороге соображениями, зачем мне так подозрительно срочно понадобилась тетрадь.	41:47	0:208
машина	NOUN	1918-1990	2	машина-85		Вам лучше всего переговорить с Ринчино, с военным ведомством, оно посылает три машины за Косичем в Верхнеудинск!".	79:85	0:114
машина	NOUN	1682-1916	1	машина-86		Поэтому все говорит за постройку простейших "багги", машин массового типа, которые могут быть успешно использованы для учебно-тренировочной работы и для участия в кроссах, в первую очередь местного значения.	53:58	0:207
машина	NOUN	1918-1990	2	машина-87		Я уверен, что всякая заминка в деле флота будет для него гибельной, нельзя на полном ходу останавливать или давать задний ход машине -- это ведет к ее поломке.	126:132	0:159
машина	NOUN	1682-1916	1	машина-88		При сем заводе таковых разных машин 13, которые изобрел Полгейм.	30:35	0:64
машина	NOUN	1682-1916	1	машина-89		Эти машины я видел на выставке в Miinchen'e в ходу и, продолжительное время старательно наблюдая их функционирование, убедился в его простоте и правильности, на что мое внимание обратили и в Берлине.	4:10	0:199
машина	NOUN	1682-1916	1	машина-90		Рабочей же силы, по предварительному расчету, понадобится двести тысяч человек, на четыре года, при условии применения лучших и дорогих машин.	136:141	0:142
машина	NOUN	1682-1916	1	машина-91		В стране с неразвитою или первобытною правительственною машиною и промышленностью нет спроса для истинного образования, особенно высшего, и там, где господствуют вялость и формализм, самостоятельные специалисты с высшим образованием не находят деятельности в общественных и государственных сферах, а потому впадают или в метафизические абстракты и уродливые утопии, или просто в отчаяние и излишества, а в лучшем случае -- в ненужную диалектику и декадентское празднословие.	56:63	0:474
машина	NOUN	1682-1916	1	машина-92		Сия машина требует колодезя, который глубоко в землю выкопан и обстроен кирпичом и купно на своем верху имеет четвероугольный ящик для воды, который довольно всегда в себя втекающей воды иметь должен; над глубоким колодезем строят высокие деревянные быки, на которых верхней части ворот находится, который свободно поворачиваться может.	4:10	0:336
машина	NOUN	1682-1916	1	машина-93		Решили поставить таковые при д. Катышево, для чего катышевским обществом обещано выстроить для пожарной машины сарай.	104:110	0:117
машина	NOUN	1918-1990	2	машина-94		Сложнейший комплекс машин перемещался в каменном чреве подводной горы, погружаясь в хрупкий красно-бурый минерал.	20:25	0:113
машина	NOUN	1918-1990	2	машина-95		-- У них есть у кого-нибудь "Москвич-400" Милицейский сержант усмехнулся: -- На те деньги, что они зарабатывают, только машины и покупать.	120:126	0:138
машина	NOUN	1918-1990	2	машина-96		Стали ломать матрицы, вставлять в машину "ё", доливать на словолитне шрифты, на пишущих машинках буквы нет, так две точки над "е" ставили руками, полетели приказы.	34:40	0:163
машина	NOUN	1918-1990	2	машина-97		Невиданный размах производства льнотеребилок в СССР, высокие темпы модернизации и разработки новых машин послужили своеобразным катализатором для зарубежных фирм.	99:104	0:162
машина	NOUN	1682-1916	1	машина-98		Теперь же оказывалось, что т двое, сломавъ машину, спрятали ее, сами притаились было, но погодя, благоразумно объявились.	43:49	0:121
машина	NOUN	1918-1990	2	машина-99		Куриная заявила приставу 2 полиц. части, что украденная у нее в апреле мес. швейная машина находится на Покровской площади, в доме Соломко, где действительно эта машина и была найдена; при чем новая хозяйка ее предъявила расписку, из которой видно, что машина куплена Соломко 30 апреля этого года у М. Пастуновой за 35 руб.	84:90	0:323
машина	NOUN	1918-1990	2	машина-100		Теперь из окон можно было осмотреть машину.	36:42	0:43
машина	NOUN	1918-1990	2	машина-101		-- Хорошо, а где машина находится -- Метров пять от берега.	17:23	0:59
машина	NOUN	1682-1916	1	машина-102		Топором машину не чинят.	8:14	0:24
машина	NOUN	1918-1990	2	машина-103		А раз был такой случай: "При приближении поезда X., желая удержать мою Бетси, поднял руку; лошадь, испугавшись взмаха руки и свистка машины, вдруг поднялась на дыбы и выбила меня из седла; я упала всей тяжестью на левую сторону.	133:139	0:228
машина	NOUN	1682-1916	1	машина-104		Точно так же колхозом производится доставка с.-х. машин и орудий с ж.-д. станции или пристани на усадьбу МТС и с усадьбы к месту работы и обратно.	50:55	0:146
машина	NOUN	1918-1990	2	машина-105		Перешли к машинам, где из листов выбиваются кружки.	10:17	0:51
машина	NOUN	1682-1916	1	машина-106		Тут я впервые приоделся как следует, попил-поел вволю; опять же дача, машина, сертификаты, за границу меня стали понемногу выпускать, сначала в соцстраны, потом глядишь, и в Италию съездил; докторская у меня была уже на подходе, в институте мои недоброжелатели приутихли.	70:76	0:271
машина	NOUN	1918-1990	2	машина-107		"Одно из средств, -- говорится в "Земледельческой газете", -- выхода из настоящего критического положения заключается в сумме тех мер, которые могут поднять хозяйство землевладельцев, вызвать улучшенное хозяйствование, следовательно, прекращение системы сдачи полей кругами, устройство батрачного хозяйства, введение усовершенствованных машин, орудий, пород скота, многопольной системы, улучшение лугов и выгонов и пр. и пр.".	337:342	0:426
машина	NOUN	1682-1916	1	машина-108		У нас на постирушечки две женщины приставлены особо, а белье все машиной.	65:72	0:73
машина	NOUN	1682-1916	1	машина-109		Стачки бывали в России и в 70-х и в 60-х годах (и даже в первой половине XIX века), сопровождаясь "стихийным" разрушением машин и т. п. По сравнению с этими "бунтами" стачки 90-х годов можно даже назвать "сознательными" -- до такой степени значителен тот шаг вперед, который сделало за это время рабочее движение.	122:127	0:313
машина	NOUN	1918-1990	2	машина-110		Удрав с Радио до срока, покатил к старым доблестным моим морякам -- зенитчикам на Глинка-стрит, дабы просить машину под дрова.	109:115	0:126
машина	NOUN	1918-1990	2	машина-111		На заводе, как на настоящей фабрике-кухне, весь процесс формирования продукции осуществляется в закрытых машинах.	105:112	0:113
машина	NOUN	1682-1916	1	машина-112		Через сверкающие окна видны колеса, огни, машины.	42:48	0:49
машина	NOUN	1918-1990	2	машина-113		Гулять на улицу меня не пускали, да и некогда было гулять, -- работа всё росла; теперь, кроме обычного труда за горничную, дворника и "мальчика на посылках", я должен был ежедневно набивать гвоздями на широкие доски коленкор, наклеивать на него чертежи, переписывать сметы строительных работ хозяина, проверять счета подрядчиков, -- хозяин работал с утра до ночи, как машина.	368:374	0:375
машина	NOUN	1682-1916	1	машина-114		Эта машина имеет вид щипцов, обе половины которых удивительно своеобразно сконструированы.	4:10	0:90
машина	NOUN	1682-1916	1	машина-115		Так, например, в Англии в некоторых больших школах, где мальчики живут по пятидесяти и даже по двести человек у учителей, начальники этих пансионов сдают чистку сапог особому предпринимателю, который берет на себя вычистить каждое утро на машине тысячу пар сапог.	239:245	0:263
машина	NOUN	1682-1916	1	машина-116		Это потому, что над землей и в земле стучали без отдыха машины, вертелись чугунные колеса, бежали канаты.	56:62	0:105
машина	NOUN	1682-1916	1	машина-117		Новая пиловалная машина, в которой будет лес пиловатся. д.	17:23	0:58
машина	NOUN	1682-1916	1	машина-118		Я тоже буду куда-то все время мчаться, несмотря на то что зимой мчаться как раз не следует, потому что скользко и машину то и дело заносит.	114:120	0:139
машина	NOUN	1918-1990	2	машина-119		Или по каким-нибудь впечатлениям, которые они могли бы произвести на наши молодые натуры; мы просто отходили от них, как от машин, перестававших действовать, и духовные связи с учителями порывались в минуту, когда кончались отношения ученика к учителю.	124:129	0:252
