lemma	pos	date	grouping	identifier	description	context	indexes_target_token	indexes_target_sentence
однодневка	NOUN	1918-1990	1	однодневка-0		"Противоправная схема включала в себя цепь сделок по купле-продаже акций ведущих российских компаний ("голубых фишек"), где продавцами и покупателями выступали оффшорные компании и фирмы-однодневки, подконтрольные ее организаторам", -- отметили в МВД.	-1:14	0:251
однодневка	NOUN	1991-2017	2	однодневка-1		В отличие от многих произведений документальной литературы, новеллы Атарова отнюдь не однодневки.	86:96	0:97
однодневка	NOUN	1991-2017	2	однодневка-2		-- Не имея на руках денег, -- считает генерал, -- их не отдашь проходимцам или фирмам-однодневкам, как это было раньше, когда под строительство жилья военнослужащим выдавались ссуды.	-1:16	0:182
однодневка	NOUN	1991-2017	2	однодневка-3		Население, крепко ударенное по голове и карманам финансовыми пирамидами и банками с запасом жизненных сил бабочки-однодневки, за последние пять лет прочно уверовало в то, что надежней места, чем "под подушкой", для сохранности капиталов просто не найти.	-1:16	0:253
однодневка	NOUN	1918-1990	1	однодневка-4		А до мотылька-однодневки, послужившего прообразом героя, никому и дела не было.	-1:17	0:79
однодневка	NOUN	1918-1990	1	однодневка-5		Я не могу сказать, что пишу однодневки или даже десятидневки.	28:38	0:61
однодневка	NOUN	1918-1990	1	однодневка-6		А если еще учесть, что, кроме крупных партий, появилась целая стая мелких однодневок типа "евро-азиатской партии", то действительно в этих дебрях заблудиться легко.	74:84	0:164
однодневка	NOUN	1991-2017	2	однодневка-7		А впрочем, сравнивать- к чему Срок жизни собак куда короче срока жизни людей, но тут уж природа, наверно, позаботилась, чтобы каждый живущий успел начать, продолжить и завершить свою судьбу- даже жук-плавунец, даже бабочка-однодневка, -- узнать детство, юность, зрелость и... и всегда всем ну вот вздоха еще одного не хватает.	-1:16	0:326
однодневка	NOUN	1991-2017	2	однодневка-8		А реалии сегодняшнего дня крепки -- не то что позавчерашние мутанты-однодневки, кооператоры и "новые русские".	-1:16	0:110
однодневка	NOUN	1991-2017	2	однодневка-9		Вселенной, для которой вся твоя жизнь с её счастьем, печалями и страстями -- мимолётней, чем для тебя самого -- жизнь бабочки-однодневки.	-1:16	0:137
однодневка	NOUN	1918-1990	1	однодневка-10		Будто стройка, стены завода не фундаментальные -- однодневки, одногодки.	50:60	0:72
однодневка	NOUN	1918-1990	1	однодневка-11		-- Вы, кажется, вообразили себе, будто вы что-то там значите Мы, мол, большие, а вы-де все копошитесь там внизу Мы, мол, каменные, а вы -- плоть гниющая Мы, дескать, во веки веков, а вы -- прах, однодневки Вот вам! -- он показал им дулю.	195:205	0:237
однодневка	NOUN	1918-1990	1	однодневка-12		В осенний день в подвальном помещении маленькой типографии, при потушенных во всем здании огнях, с кучкой рабочих-добровольцев я выпускаю последнюю однодневку "За свободу печати"; вся московская литературная знать дала статьи за полной подписью -- последнее, что мы можем сделать.	148:158	0:280
однодневка	NOUN	1918-1990	1	однодневка-13		В театре постоянно и быстро менялись главные режиссеры, ставились спектакли-однодневки, и зритель постепенно терял интерес к Ленкому.	-1:18	0:133
однодневка	NOUN	1991-2017	2	однодневка-14		В почтовых ящиках по-прежнему не иссякает бурный поток нелегальщины -- "грязных" прокламаций и газетенок-однодневок, а по домам и квартирам ходят ласково агитаторы,ненавязчиво зомбирующие обывателя на предмет любви к определенному кандидату.	-1:18	0:241
однодневка	NOUN	1991-2017	2	однодневка-15		В постсоветской России отличалось созданием мелких и дутых однодневок.	59:69	0:70
однодневка	NOUN	1991-2017	2	однодневка-16		В то же время есть и другие примеры, когда коммерсанты-"однодневки", скупив старую технику, подрегулируют ее, подкрасят и реализуют такие машины сельхозтоваропроизводителям по низкой цене, а затем их след пропадает.	-1:20	0:215
однодневка	NOUN	1991-2017	2	однодневка-17		Это иллюзия ограниченных людей, людей-однодневок, не знающих ни Чечни -- Кавказ это дело другое, -- ни законов общественного развития.	-1:14	0:134
однодневка	NOUN	1918-1990	1	однодневка-18		Ведь тот "произвол" и та звериная жестокость, которые в III веке по Р. X. сидели на римском троне, -- разве их не было в другие эпохи Разве блеск века Елизаветы английской или царя-солнца затмил бы настолько взор Плотина, чтоб он уверовал в благополучие человеческого существования Порфирий нам рассказал, что Плотин стыдился своего тела, -- неужели можно думать, что, живи он в эпоху, когда произвол облачался в видимость справедливости и законности, ему бы зависимость от тела казалась менее постыдной И он не стремился бы всеми силами к тому, чтобы , чтоб душа его была вне тела Или не прославлял бы (бесстрашие перед смертью) как высшую добродетель, (мужество) И не видел бы свой философский идеал в возможности взлететь над знанием (), потому что знание -- есть логос, а логос -- есть множественность А раз так, значит, и при Елизавете, и при Людовике XIV, и когда захотите забота и философский пафос Плотина сводились бы к тому, чтоб бежать, бежать без оглядки из того царства самоочевидностей, в котором на престоле сидят не императоры-однодневки -- как бы они ни назывались, а то "вечное", бесплотное, идеальное начало, которое с незапамятных времен называется "естественной необходимостью" ( ).	15:16	0:1203
однодневка	NOUN	1918-1990	1	однодневка-19		И летят, летят на огонь бабочки-однодневки.	-1:16	0:43
однодневка	NOUN	1991-2017	2	однодневка-20		Ведь я все-таки создавал фирмы-однодневки и осуществлял незаконные сделки.	-1:14	0:74
однодневка	NOUN	1991-2017	2	однодневка-21		Обычно этим нехитрым приемом пользуются фирмы-однодневки, которым легче сбыть свою продукцию, наштамповав ярлыков с громкими названиями.	-1:14	0:136
однодневка	NOUN	1918-1990	1	однодневка-22		Вексельные схемы осуществлялись через три, в настоящий момент уже не существующие фирмы-однодневки -- "Эколайн-К", "Индевер Пром" и "Юнисэт", которые держали счета в МДМ-банке.	66:68	0:176
однодневка	NOUN	1991-2017	2	однодневка-23		Серьезность ее существования в кинематографе, в театре, которая видна уже сегодня, исключает звездную болезнь бабочек-однодневок.	-1:16	0:129
однодневка	NOUN	1991-2017	2	однодневка-24		Все они были сначала переведены на счета американской фирмы-однодневки, а затем на лицевой счет гражданина Вьетнама Ву Фыонг Нама.	-1:14	0:130
однодневка	NOUN	1991-2017	2	однодневка-25		Представители следствия заявили, что противоправная схема включала в себя цепь сделок по купле-продаже акций ведущих российских компаний ("голубых фишек"), где продавцами и покупателями выступали офшорные компании и фирмы-однодневки, подконтрольные ее организаторам.	-1:14	0:266
однодневка	NOUN	1918-1990	1	однодневка-26		Группа выводила средства через сделки с акциями ведущих российских компаний, продавцами и покупателями выступали офшорные компании и фирмы-однодневки, подконтрольные организаторам.	-1:14	0:180
однодневка	NOUN	1991-2017	2	однодневка-27		За то, что не ставил однодневки к датам, не шел на компромисс.	21:31	0:62
однодневка	NOUN	1991-2017	2	однодневка-28		Даже газета-однодневка -- и та может быть воспринята по-разному.	-1:15	0:64
однодневка	NOUN	1991-2017	2	однодневка-29		-- Вы серьезно относитесь к словам песен -- Без стихов и песня не песня, а однодневка.	75:85	0:86
однодневка	NOUN	1918-1990	1	однодневка-30		Ее должны бояться бабочки-однодневки.	-1:16	0:37
однодневка	NOUN	1918-1990	1	однодневка-31		Сколько однодневок, опаленных пламенем Армагеддона!	8:18	0:51
однодневка	NOUN	1918-1990	1	однодневка-32		Естественно, не заикнувшись о том, что даже пристойная формулировка всего лишь пародия на формулу, бумажная бабочка-однодневка.	13:15	0:127
однодневка	NOUN	1991-2017	2	однодневка-33		На деле Вы распознаете, где искренние труженики, а где эфемериды, легкомысленные однодневки.	81:91	0:92
однодневка	NOUN	1918-1990	1	однодневка-34		Какая же судьба была уготована всем этим деньгам-однодневкам Все зависело от того, в чем ощущалась наибольшая нужда у новой власти.	-1:17	0:131
однодневка	NOUN	1991-2017	2	однодневка-35		А всякие "однодневки"-мотыльки, умирающие при закате, не принесут пользу.	-1:17	0:73
однодневка	NOUN	1991-2017	2	однодневка-36		Надо примириться с тем, что это однодневки, бабочки, которые умирают к утру.	32:42	0:76
однодневка	NOUN	1991-2017	2	однодневка-37		Обвинение неопровержимо доказало, что именно я, а не кто-либо другой, покупал фирмы-однодневки, именно я ставил на бумаге круглые печати, именно я подписывал своей рукой финансовые документы.	-1:14	0:191
однодневка	NOUN	1991-2017	2	однодневка-38		Некоторые были "однодневками", но пришло и иное увлечение.	16:28	0:58
однодневка	NOUN	1991-2017	2	однодневка-39		В то же время продолжение книги в газете, которая с определенной точки зрения может рассматриваться как "бестселлер-однодневка", предвосхищает все убыстряющийся процесс устаревания современных товаров длительного пользования (там же).	-1:19	0:234
однодневка	NOUN	1918-1990	1	однодневка-40		Но вместе с тем становилось обидно, что такое искусство и материал потрачены на дешевые карикатуры, годные для газетенки-однодневки, "недопрочитанной, недораскрытой".	-1:18	0:166
однодневка	NOUN	1918-1990	1	однодневка-41		Ну, то-то ладно, что "они", особенно в области ширпотреба, нас перегнали; что то, о чем ты только еще подумал, что такое теоретически как бы может быть, -- так оно у них уже есть и вот-вот уйдет в прошлое; это-то пусть, что любая идея находит себе форму товара, утилизируется и исчезает, как бабочка-однодневка, оставив после себя мертвую форму, как та же бабочка свой хитиновый покров; это-то ладно, что она уступает тут же место следующей форме и иному помыслу, тут же превращающемуся в промысел.	-1:16	0:498
однодневка	NOUN	1918-1990	1	однодневка-42		Она -- однодневка, она не та, что была вчера, и не та, что будет завтра.	7:17	0:72
однодневка	NOUN	1918-1990	1	однодневка-43		Каждый день мне попадаются объявления о новых музыкальных изданиях, но что они такое Пестрые бабочки-однодневки, летают день -- и навеки исчезают!	40:42	0:146
однодневка	NOUN	1918-1990	1	однодневка-44		После того как была проведена перерегистрация предприятий, многие из них, в основном фирмы-однодневки, необходимо будет ликвидировать.	-1:14	0:134
однодневка	NOUN	1991-2017	2	однодневка-45		Там много всякого разного -- от однодневок до экстравагантных глупостей.	32:42	0:72
однодневка	NOUN	1918-1990	1	однодневка-46		При этом непонятно, какая доля в общей задолженности приходится на неуплату НДС фирмами-однодневками.	-1:18	0:101
однодневка	NOUN	1991-2017	2	однодневка-47		В эту категорию шли дельцы однодневки, поднятые со дна войной и революцией, новые и пришлые люди без корня.	27:37	0:107
однодневка	NOUN	1918-1990	1	однодневка-48		С некоторых пор ему стали нравиться заполнившие теле- и радиоэфир шлягеры-однодневки.	-1:16	0:85
однодневка	NOUN	1991-2017	2	однодневка-49		-- Я предлагаю выпустить однодневку сообща.	25:35	0:43
однодневка	NOUN	1918-1990	1	однодневка-50		Сегодняшним днем только эфемериды живут, однодневки.	41:51	0:52
однодневка	NOUN	1918-1990	1	однодневка-51		Жизнь показала, что все пьесы Розова, кроме разве "Вечно живых", -- бабочки-однодневки.	-1:16	0:87
однодневка	NOUN	1918-1990	1	однодневка-52		Стало понятно, почему ежемесячная "Театральная афиша" с трудом справляется с потоком бесчисленных театров-однодневок, коммерческих антреприз, и выживают из них немногие, а заслуживают уважения единицы.	-1:16	0:201
однодневка	NOUN	1991-2017	2	однодневка-53		Когда-то говорили, что песни Булата Окуджавы -- однодневки.	48:58	0:59
однодневка	NOUN	1991-2017	2	однодневка-54		Сторонники законопроекта (в частности, Министерство финансов) утверждают, что новая схема позволит увеличить собираемость налога, улучшить его администрирование и поможет бороться с фирмами-однодневками, специализирующимися на возврате НДС по экспортным схемам.	-1:18	0:261
однодневка	NOUN	1991-2017	2	однодневка-55		С другой -- сейчас еще не предусмотрена система страхования, которая может помочь избежать рисков при работе с ювелирными фирмами-однодневками.	23:25	0:143
однодневка	NOUN	1918-1990	1	однодневка-56		Тянутся к Учению, может быть, подойдут ближе, лишь бы не оказались бабочками-однодневками.	8:9	0:90
однодневка	NOUN	1918-1990	1	однодневка-57		Они, может быть, не однодневки, пусть -- трехдневки.	20:30	0:52
однодневка	NOUN	1918-1990	1	однодневка-58		Это были импровизации, домашние экспромты, однодневки -- всего лишь. говорил он мне вкрадчивым, певучим, тоже каким-то длинным голосом.	43:53	0:135
однодневка	NOUN	1918-1990	1	однодневка-59		Скольких пигмеев потом мы видели, перед сколькими поэтическими канцеляриями благоговели и содрогались, у скольких табличек -- серебром по черному -- жмурили глаза от невыносимого сияния, на скольких текинских и модерновых коврах трепетали коленями из-за своих не вытертых у порога ботинок, из-за уличной грязи, ненароком занесенной в литературное, художественное или научное святилище, сколько пародий на него читали, сколько анекдотов слышали, сколько раз его сбрасывали с корабля современности, сколько раз его святое, веселое имя как бы стушевывалось перед именами лягушек-волов, великанов-однодневок и прочих александрийских столпов-времянок, а ведь до сих пор, когда дитя встанет под елку и скажет свои первые стишки, то мамки-няньки подумают вдруг с обманчивой надеждой -- может, из тебя Пушкин выйдет Потому что вот уже полтора столетия "Пушкин" есть нарицательное имя неложного величия.	-1:18	0:894
