lemma	pos	date	grouping	identifier	description	context	indexes_target_token	indexes_target_sentence
трибунал	NOUN	1918-1990	2	трибунал-0		* * * Дороги войны привели советских кинохроникеров в Берлин, к горящему рейхстагу, а потом в Нюрнберг, где Международный военный трибунал судил гитлеровских военных преступников.	130:138	0:179
трибунал	NOUN	1918-1990	2	трибунал-1		Конечно, влиять на трибуналы, на их решения сказки не могут.	19:28	0:60
трибунал	NOUN	1918-1990	2	трибунал-2		6 августа в Ханькоу вышел первый номер органа Гоминдана "Пипильс Трибунал", после реорганизации редакции.	65:73	0:105
трибунал	NOUN	1918-1990	2	трибунал-3		И опять он на фронте, уже при гаубице; он теряет ящичек с прицелом, и его отдают под трибунал.	85:93	0:94
трибунал	NOUN	1918-1990	2	трибунал-4		: "13-го августа военно-революционный трибунал 14 армии, рассмотрев дело 10-ти граждан гор.	38:46	0:91
трибунал	NOUN	1918-1990	2	трибунал-5		Всем -- "тройка", "особое", в крайнем случае -- трибунал.	48:56	0:57
трибунал	NOUN	1918-1990	2	трибунал-6		Трибунал смог не поступить так, потому и только потому, что тут же дал подсудимому личное имя Абстракция, с каковым и было соотнесено постановление суда.	0:8	0:153
трибунал	NOUN	1918-1990	2	трибунал-7		Трибунал приговорил виновного к пяти годам заключения.	0:8	0:54
трибунал	NOUN	1918-1990	2	трибунал-8		Трибунале, при Особом Отделе, при ЧК да при милиции.	0:9	0:52
трибунал	NOUN	1918-1990	2	трибунал-9		Можно напомнить в этой связи, что Международный Военный Трибунал в Нюрнберге в решениях, под которыми стоит и подпись представителя Советского Союза, указал, что приказы, противоречащие основным правилам морали, попирающие нравственные веления, на которых, зиждется человеческое общество, разрушающие самые основы человеческого общежития, не могут служить ни моральным, ни юридическим оправданием для тех, кто их выполняет.	56:64	0:423
трибунал	NOUN	1918-1990	2	трибунал-10		А в голове: "Часовой на посту утерял боевое оружие с боевыми патронами -- трибунал пять лет десять спишут в матросы.."	74:82	0:118
трибунал	NOUN	1918-1990	2	трибунал-11		В станице на сутки остались Бодягин и комендант трибунала Тесленко.	48:57	0:67
трибунал	NOUN	1682-1916	1	трибунал-12		А кто им дал право, кто они такие, что понаехали с разных концов Мы без трибунала вашего проживем.	72:81	0:98
трибунал	NOUN	1918-1990	2	трибунал-13		Под влиянием своего наставника Вильгельма де Круа и великого канцлера Сельваджио он решился было на реформу инквизиции и дал кортесам торжественное обещание принять новый кодекс трибунала.	178:187	0:188
трибунал	NOUN	1682-1916	1	трибунал-14		А что, ей ведь трибунал не страшен.	15:23	0:35
трибунал	NOUN	1918-1990	2	трибунал-15		Крайность, в которую поверг провожатый Поликарпов, возвратившийся с пустыми руками, заставила миссию обратиться в Трибунал с просьбой об ускорении присылки серебра, а вместе с тем доставила возможность писать в Отечество.	114:122	0:221
трибунал	NOUN	1682-1916	1	трибунал-16		Апраксин, во время заседания допрашивавшего его трибунала, при неосторожном возгласе одного из членов последнего, принятом обвиняемым за намек на пытку, умер, пораженный апоплексическим ударом.	48:57	0:193
трибунал	NOUN	1682-1916	1	трибунал-17		Когда футурист Джино Северини женился на дочери французского "короля поэтов" Поля Фора, он должен был предстать в Милане перед трибуналом футуристов, судившим его за этот проступок (женитьбу!).	127:137	0:193
трибунал	NOUN	1918-1990	2	трибунал-18		Был выездной военный трибунал.	21:29	0:30
трибунал	NOUN	1918-1990	2	трибунал-19		У Ромэна Роллана на суде трибунала Дантон, великий жизнелюб, человек органических страстей, даже в революции словно искавший только чувственного наслаждения стремительностью ее бега и разряженностью ее воздуха, бросает о Робеспьере уничтожающие слова: "Презренное лицемерие грозит заразить весь народ.	25:34	0:301
трибунал	NOUN	1682-1916	1	трибунал-20		В Сересе установлен военный трибунал для производства над гражданскими и военными лицами, виновными во всякого рода преступлениях и проступках.	28:36	0:143
трибунал	NOUN	1682-1916	1	трибунал-21		В Толедо происходили не меньшие бесчинства трибунала.	43:52	0:53
трибунал	NOUN	1682-1916	1	трибунал-22		В разрешении этого вопроса, кроме членов трибунала, приняли участие все находившиеся в Петербурге мальтийские рыцари.	41:50	0:117
трибунал	NOUN	1682-1916	1	трибунал-23		Если бы правительство не довело этого дела до суда, если бы оно терпимо отнеслось к сношениям бывших высших административных лиц с революционерами, с проповедниками террора, с участниками даже кровавого террора, к разоблачениям этих бывших сановников, хранителей государственных тайн, перед революционным трибуналом, то это знаменовало бы не только боязнь перед разоблачениями, не только трусливую робость перед светом гласности, а полный развал государственности (рукоплескания центра).	305:315	0:487
трибунал	NOUN	1682-1916	1	трибунал-24		В случае несогласия концессионеров подчиниться этому требованию, вопрос будет передан на разрешение гаагского трибунала. неизвестный.	110:119	0:133
трибунал	NOUN	1682-1916	1	трибунал-25		Не только с точки зрения эстетической, но и исторической исследователь обращался только к светилам литературы и искусства, и именно к светилам первой величины: выставлял великие достоинства Данте и Шекспира, Ломоносова или Державина, и, с высоты своего эстетического трибунала, -- вооруженный мнимо беспристрастной критикой, -- величаво раздавал мелкие награды прочим писателям, которых удостаивал своей эстетической оценкой.	267:276	0:425
трибунал	NOUN	1682-1916	1	трибунал-26		В этот приблизительно срок начал у нас действовать военно-революционный Трибунал.	72:80	0:81
трибунал	NOUN	1918-1990	2	трибунал-27		Был в торжественном собрании королевского трибунала, и тот же адвокат королевский m. de Broe читал requisitoire противу журнала "Курьер".	42:51	0:137
трибунал	NOUN	1918-1990	2	трибунал-28		Войдя в комнату, где, как мне сказали, заседал Революционный Трибунал, я спросил: -- Зачем меня потребовали Мне ответили: -- Ты арестован.	61:69	0:138
трибунал	NOUN	1918-1990	2	трибунал-29		И вот лейтенант звонит в этот самый военный трибунал.	44:52	0:53
трибунал	NOUN	1682-1916	1	трибунал-30		Вот они, наши силы:Команда трибунала.	27:36	0:37
трибунал	NOUN	1918-1990	2	трибунал-31		Впрочем, к концу XVIII столетия испанская инквизиция была только бледною копией когда-то могучего трибунала.	98:107	0:108
трибунал	NOUN	1682-1916	1	трибунал-32		Время от времени из них в залу трибунала вводили обвиняемых.	31:40	0:60
трибунал	NOUN	1918-1990	2	трибунал-33		Но она не есть высшее и окончательное судилище, пред трибуналом которого разрешаются все вопросы.	53:63	0:97
трибунал	NOUN	1682-1916	1	трибунал-34		Все мечтают о революции как о возможности легального уничтожения своих врагов при помощи революционных трибуналов, общественного прокурора, гильотины и ее слуг -- палача и тюремщика.	103:113	0:182
трибунал	NOUN	1682-1916	1	трибунал-35		Въ силу сихъ договоровъ нын я получилъ изъ Трибунала вашего листъ, и по тому листу учинилъ вновь строжайшее подтверждене.	43:52	0:121
трибунал	NOUN	1918-1990	2	трибунал-36		Вы и подполковник Поляков будете отстранены от занимаемых должностей и преданы суду специального трибунала.	97:106	0:107
трибунал	NOUN	1918-1990	2	трибунал-37		Достаточно прибавить, что ровно через год, шестнадцатого октября 1942 года я стоял перед Военным трибуналом.	97:107	0:108
трибунал	NOUN	1682-1916	1	трибунал-38		Да и когда бы подлинно взводимые на него жестокости были доказаны, для чего не подвергнуть его обыкновенному суду уголовному Что за новизна вовсе бесполезная судить человека голосами дворянскими, кои редко или, скажем правду, никогда не соображаются ни с чем, кроме случая и минутных побуждений Ясно, что мера сия выдумана была для притеснения, ибо суд в трибуналах имеет обряд, закон, порядок, а суд в зале, набитой дворянами, есть шумный приговор, на страстях и бесчиниях основанный.	355:365	0:485
трибунал	NOUN	1682-1916	1	трибунал-39		Этот день -- день торжества и славы трибунала, он наказывает сегодня лютых зверей, врагов религии, и овладевает их достоянием".	36:45	0:127
трибунал	NOUN	1918-1990	2	трибунал-40		Да, еще, -- "из местной жизни": "Вчера по постановлению военно-революционного трибунала расстреляно 18 контрреволюционеров".	78:87	0:124
трибунал	NOUN	1918-1990	2	трибунал-41		Секретарь, распечатав самодельный конверт, прочитал заявление и сразу же пошел докладывать председателю трибунала.	104:113	0:114
трибунал	NOUN	1682-1916	1	трибунал-42		Два другие входа в подземелья тюрьмы и трибунал -- проходят через кордегардии, с сильными караулами.	39:47	0:100
трибунал	NOUN	1918-1990	2	трибунал-43		О ты, святейший трибунал веры, оставайся непоколебимым до скончания веков и сохраняй нас чистыми и твердыми в нашей религии.	16:24	0:124
трибунал	NOUN	1682-1916	1	трибунал-44		Дело получило огласку, и приговор военного трибунала, присудившего Дрейфуса к позорному лишению военного звания и вечному заключению, возмутил все либеральные и "левые" политические круги.	43:52	0:188
трибунал	NOUN	1918-1990	2	трибунал-45		Дело, по апелляции, перешло в литовский трибунал, которого маршалом был тогда двоюродный брат отца моего, Павел Булгарин.	40:48	0:121
трибунал	NOUN	1918-1990	2	трибунал-46		Для них тоже трибунал подберем.	13:21	0:31
трибунал	NOUN	1918-1990	2	трибунал-47		Вскоре на основании этого указа трибунал в Бейтене вынес пятерым гитлеровцам смертный приговор за зверское убийство коммуниста.	32:40	0:127
трибунал	NOUN	1682-1916	1	трибунал-48		Доминиканец Деса, сделанный после его верховным инквизитором, в восемь лет своего председательства "святого Трибунала" осудил до 40 тысяч человек, из которых 2600 были сожжены.	108:117	0:176
трибунал	NOUN	1682-1916	1	трибунал-49		Затем, уже если начальник миссии был уполномочен для переговоров, ему следовало бы обратиться лично к министрами, а он вел все переговоры только с приставом русского подворья, мелким чиновником пекинского трибунала (ли-фань-юань).	205:214	0:230
трибунал	NOUN	1682-1916	1	трибунал-50		Епископы, которым издревле принадлежала забота об этой дисциплине, прибегали в таких случаях к анафеме и церковным наказаниям, но в эпоху великих расстройств, по мнению Торквемады, необходимы были более сильные лекарства, и самым лучшим было учреждение особого трибунала, "более могущественного и более строгого, чем другие".	261:270	0:325
трибунал	NOUN	1682-1916	1	трибунал-51		Он даже как бы желает приписать Торквемаде инициативу введения костров, что очевидно ошибочно, но его слова об отдельном трибунале, более могущественном и более строгом, прекрасно определяют значение Торквемады в истории инквизиции.	121:130	0:232
трибунал	NOUN	1682-1916	1	трибунал-52		Если сравнить его с тучей кровавых приговоров современности, вынесенных на наших глазах тучей революционных трибуналов в процессах еще более упрощенных и фантастических, чем дело о сажании кил, -- то сердце без колебания устремляется к старому порядку, к старому мироощущению и старой душе человеческой, не усугубленной "революционным сознанием".	108:118	0:346
трибунал	NOUN	1918-1990	2	трибунал-53		Тот же трибунал займется рассмотрением "дела 45-ти", обвиняемых в составлении заговора против существующего порядка.	7:15	0:116
трибунал	NOUN	1682-1916	1	трибунал-54		Если улики против подсудимого казались слишком очевидными или, по личным расчетам инквизиторов, считались такими, трибунал немедля произносил приговор и отсылал подсудимого в темницу до исполнения этого приговора.	114:122	0:213
трибунал	NOUN	1682-1916	1	трибунал-55		Когда мараносы, желая добиться гласности инквизиционного процесса, предложили Фердинанду 600 тысяч дукатов на военные издержки, он из собственных средств подарил королю не меньшую сумму и сохранил неприкосновенность трибуналов.	216:226	0:227
трибунал	NOUN	1682-1916	1	трибунал-56		Еще в феврале 1518 года, когда в Вальядолиде были собраны кортесы Кастилии, святой трибунал инквизиции подвергся дружному натиску представителей государства.	83:91	0:157
трибунал	NOUN	1682-1916	1	трибунал-57		Только после этой жестокой формальности его приглашали на заседание трибунала.	68:77	0:78
трибунал	NOUN	1918-1990	2	трибунал-58		И Трибунал в своем приговоре проявляет дерзость: он изрекает расстрел действительно не "всем до одного", а только четырнадцати человекам.	2:10	0:137
трибунал	NOUN	1918-1990	2	трибунал-59		Их накрыл какой-то лейтенант с солдатами и забрал, угрожая судом военного трибунала за мародерство.	74:83	0:99
трибунал	NOUN	1682-1916	1	трибунал-60		И уже видит себя стоящим в рваных сапогах, нечесаным и безумным перед туманным высоким трибуналом.	87:97	0:98
трибунал	NOUN	1918-1990	2	трибунал-61		Давно ли один из сильнейших, из самых смелых мыслителей нашего века, для того чтоб нанести церкве последний удар, секуляризовал ее в трибунал и, вырывая из рук жрецов Исаака, приготовляемого на заклание богу, отдал его под суд, то есть на заклание справедливости Вековой спор, спор тысячелетний о воле и предопределении не кончен.	133:141	0:330
трибунал	NOUN	1682-1916	1	трибунал-62		Их сбивало с толку предположение, что в особом, у нас и в трибунале -- много сил: недаром после того как вооружились они награбленным из транспорта оружием и готовы были идти из казарм в крепость, выслали сначала сильные дозоры к особому и трибуналу -- ждали оттуда удара.	58:67	0:272
трибунал	NOUN	1918-1990	2	трибунал-63		И если в трибуналах прокурор и адвокат перебрасываются над головой обвиняемого оскорблениями и называют друг друга в цветистых выражениях лгунами и мошенниками, -- то, закончив свои речи, они пожимают друг другу руки и поздравляют один другого с блестящим заключением речи.	9:19	0:273
трибунал	NOUN	1918-1990	2	трибунал-64		К. и трибуналов говорилось иногда о снисхождении, которое делалось обвиняемому "принимая во внимание его пролетарское происхождение".	5:15	0:133
трибунал	NOUN	1918-1990	2	трибунал-65		Первый -- председатель выездной сессии Военного трибунала полковник Добренький с папкой в руках.	48:57	0:96
трибунал	NOUN	1682-1916	1	трибунал-66		Лучше -- под трибунал!..	13:21	0:24
трибунал	NOUN	1918-1990	2	трибунал-67		"Под страхом неминуемой ответственности пред трибуналом общества", -- отчеканилась в его сознании знакомая фраза.	45:55	0:113
трибунал	NOUN	1682-1916	1	трибунал-68		На этом основании трибунал сорганизовался из представителей всех партий, по 2 человека от каждой.	18:26	0:97
трибунал	NOUN	1918-1990	2	трибунал-69		Так как до англо-французской войны Китай не позволял никому в свете сноситься с своим богдоханом иначе, как на правах вассалов, то с самого Кяхтинского (Буреинского) трактата графа Владиславича Рагузинского о всех важнейших делах сносились между собою, с русской стороны -- сенат, а с китайской -- ли-фань-юань, трибунал заведывавший делами вассалов.	312:320	0:350
трибунал	NOUN	1682-1916	1	трибунал-70		Немало, видать, попыхтел Порченый, много с кем переговорил и поспорил, может, кого и умаслил, чтоб "в опшэм и целом" дело обошлось без трибунала.	135:144	0:145
трибунал	NOUN	1918-1990	2	трибунал-71		Смерть! -- погребальным эхом пронеслось по помещению, где заседал, тайный трибунал "святых" отцов. -- Sis.	74:82	0:106
