lemma	pos	date	grouping	identifier	description	context	indexes_target_token	indexes_target_sentence
трибунал	NOUN	1682-1916	1	трибунал-72		Но тогда, не давая высказаться послу, дотоле сидевший молча, рыжеватый член революционного трибунала Андреев быстро перебил: -- Может быть, господину германскому послу желательно узнать, какие меры будут приняты трибуналом по делу графа Роберта Мирбаха Немцы не поняли сигнала.	91:100	0:277
трибунал	NOUN	1918-1990	2	трибунал-73		Митрополиты, повсеместно являющиеся греками по национальности, разбирают спорные дела христианских подданных (райи), но если одна из сторон недовольна решением, вынесенным митрополитом, дело передается в трибунал кади.	204:212	0:218
трибунал	NOUN	1918-1990	2	трибунал-74		Но, впрочем, трибунал вполне мог оформить приговор задним числом.	13:21	0:65
трибунал	NOUN	1918-1990	2	трибунал-75		Так фамилий никто и не назвал, а взамен того шумно загалдели о другом, о сыске: -- Красноармейцу стрелять нечем, а тут оружья по трибуналам необеримо, тут шпана окопалась разная да нашего же брата и расстреливает.	129:139	0:213
трибунал	NOUN	1918-1990	2	трибунал-76		Оказывается, та особа приходила сюда, рассказала, взвинтила (потом все прояснилось как обыкновенный шантаж, расчет на дураков), и вот теперь допытывали -- плохонькая гостиная вдруг превратилась в комнату призрачного трибунала, не хватало кожанки и маузера в деревянной коробке: -- Вы уверены, что можете быть счастливы ценою несчастья другого человека Ольга Васильевна лепетала: -- Я не знаю.	216:225	0:392
трибунал	NOUN	1918-1990	2	трибунал-77		Мне не могли, не пожелали сказать, куда и когда точно По телеграмме председателя Револ[юционного] трибунала армии затребовано из Феодосии дело сына, но до с[их] пор это дело еще не попало в руки председателя.	98:107	0:208
трибунал	NOUN	1682-1916	1	трибунал-78		Он вызвал в трибунал Евгения Устиновича Бусько, чтобы побеседовать с ним, но старик не явился.	12:20	0:94
трибунал	NOUN	1918-1990	2	трибунал-79		Обратившись к сидевшему с нами полковнику, он объявил ему, что он свободен -- "вы же, -- сказал он, обращаясь ко мне и к моему шурину, -- по решению судового комитета предаетесь суду революционного трибунала.	198:207	0:208
трибунал	NOUN	1682-1916	1	трибунал-80		Первые три пункта ее говорили об устройстве трибуналов, о публикации приговоров против еретиков и отступников и назначали "отсрочку милосердия" для желающих сознаться и обратиться.	44:54	0:180
трибунал	NOUN	1682-1916	1	трибунал-81		Они изучают его в своих университетах; они руководят им в своих трибуналах, они показывают его в школах; они распространяют его и твердят о нем в своей прессе.	64:74	0:159
трибунал	NOUN	1918-1990	2	трибунал-82		Под трибунал пойдет, не сядет.	4:12	0:30
трибунал	NOUN	1918-1990	2	трибунал-83		Сержанта сволокли в трибунал, где он получил, кажется, десять лет реального срока -- так военюристы называют отсидку в тюрьме, противопоставляя ей "параллельные штрафные роты".	20:28	0:176
трибунал	NOUN	1918-1990	2	трибунал-84		Потом состоялось заседание трибунала -- спектакль с заранее предопределенным финалом.	27:36	0:85
трибунал	NOUN	1918-1990	2	трибунал-85		Когда он был председателем чрезвычайного трибунала, его будил дурак-секретарь с неподписанными приговорами.	41:50	0:107
трибунал	NOUN	1682-1916	1	трибунал-86		Правда, некоторые лица, близко стоящие к центральному комитету партии с.-р., главным образом, Бурцев и Леонид Меньшиков, считая, что провокаторская роль Азефа достаточно выяснена, находят созыв революционного трибунала излишним.	209:218	0:228
трибунал	NOUN	1682-1916	1	трибунал-87		Однако, когда Архиепископ, возвысив голос, заявил уже решительно, что он, как председатель трибунала, находит нужным допрос остановить, брат Фома вдруг оборвал свою речь, как пряха засучившуюся нить, и сказал совсем другим голосом: -- Я, впрочем, вполне согласен с Его Высокопреподобием, потому что действительно в таких важных и трудных делах спешить подобает всего менее.	91:100	0:373
трибунал	NOUN	1918-1990	2	трибунал-88		Пред всеми судилищами мира, включая революционный трибунал РСФСР и жреца-марабута Центральной Африки, Учитель предстал бы как предатель, лжец и зачинщик неисчислимых преступлений.	50:58	0:179
трибунал	NOUN	1918-1990	2	трибунал-89		Лиденбаум -- в интернациональную роту, Никитченко -- к трибуналу!	55:64	0:65
трибунал	NOUN	1682-1916	1	трибунал-90		Принесли Memoire de consultation pour m. Auguste Cairon, и при выходе из трибунала адвокат, выигравший по сему делу, повел меня к редактору новой юридической газеты "Gazette de Tribunaux", которую с 1 ноября сего года начали некоторые из адвокатов издавать здесь; предложили мне участвовать в издании оной доставлением к редактору разных статей в форме писем или какой угодно, о практической и теоретической юриспруденции в России, дали мне первые 9 номеров, вышедшие сей газеты, и объявление об оной.	73:82	0:501
трибунал	NOUN	1682-1916	1	трибунал-91		Он предлагает передать вопрос об этом на решение гаагского трибунала. неизвестный.	59:68	0:82
трибунал	NOUN	1918-1990	2	трибунал-92		Принял комиссарский сан из страху; человек скромный, робкий и теперь дрожит при одном слове "революционный трибунал", бегает по всему дому, умоляя исполнять декреты, -- умеют нагонять страх, ужас эти негодяи, сами всячески подчеркивают, афишируют свое зверство!	107:115	0:261
трибунал	NOUN	1918-1990	2	трибунал-93		Заседание трибунала шло в темной, странной комнате, едва освещенной какими-то лампочками, то загорающимися, то тухнувшими.	10:19	0:122
трибунал	NOUN	1682-1916	1	трибунал-94		Располагавшие влиянием ускользали от правосудия трибунала, даже в том случае, когда их преступления были известны всему свету.	48:57	0:126
трибунал	NOUN	1682-1916	1	трибунал-95		Журналъ нашего посольства по повелню Его Величества взятъ въ Трибуналъ; а изъ Трибунала взнесенъ къ Его Величеству для прочтеня.	61:70	0:128
трибунал	NOUN	1682-1916	1	трибунал-96		Революционный Трибунал состоял из десяти человек, среди которых я заметил россавского комиссара и всех обезоруженных накануне солдат.	14:22	0:133
трибунал	NOUN	1918-1990	2	трибунал-97		Один из этих депутатов, одаренный от природы красноречием, произнес перед трибуналом речь, которая тронула всех судей.	74:84	0:118
трибунал	NOUN	1682-1916	1	трибунал-98		С чувством гордости запечатлели мы на пленку советских солдат, стоящих на посту у двери Нюрнбергского трибунала.	102:111	0:112
трибунал	NOUN	1918-1990	2	трибунал-99		Виленский трибунал, т.е. высшее судебное место для Великого княжества Литовского, заседал известную часть времени в году в Вильне, а другую часть -- в Минске или Новгородке; для Юго-Западной Руси высшим судебным местом сначала был трибунал Луцкий, а потом он соединен с Люблинским трибуналом, общим для всей Малой Польши.	10:18	0:321
трибунал	NOUN	1682-1916	1	трибунал-100		Сами члены трибунала часто были повинны по инструкции Эймерика, и Вольтер вовсе не инсинуировал, когда изображал великого инквизитора любовником прекрасной Кинегунды совместно с богатым евреем.	11:20	0:193
трибунал	NOUN	1682-1916	1	трибунал-101		Таковые суть церковные Синоды и гражданские, чрез обычайные розыски, трибуналы, и советы.	69:78	0:89
трибунал	NOUN	1682-1916	1	трибунал-102		Срок у него был 10 лет, и не Особым Совещанием дан, а военным трибуналом.	62:72	0:73
трибунал	NOUN	1918-1990	2	трибунал-103		Раздраженные этим жители Кордовы решились силою уничтожить инквизицию и, напав на судилище, освободили его узников и прогнали чиновников трибунала.	137:146	0:147
трибунал	NOUN	1682-1916	1	трибунал-104		Та же мера применялась к лицам, которые вздумали бы похвалиться, что не все открыли на допросе трибунала.	95:104	0:105
трибунал	NOUN	1682-1916	1	трибунал-105		Вскоре после вышеописанного эпизода, в полдень пасмурного ноябрьского дня студентка была вызвана в кабинет отца пред трибунал обоих родителей.	117:125	0:142
трибунал	NOUN	1682-1916	1	трибунал-106		Торквемада довел эту практику до перлов жестокости, из орудия охраны религиозных догматов сделал ее орудием религиозной нивелировки и первый придал инквизиционному трибуналу политический характер.	164:173	0:196
трибунал	NOUN	1682-1916	1	трибунал-107		Так поступил папа Григорий IX в 1231 году, с буллы которого, помеченной этим годом, начинается распространение инквизиционных трибуналов по всему Апеннинскому полуострову, исключая Неаполь и Венецию.	126:136	0:199
трибунал	NOUN	1918-1990	2	трибунал-108		Тут погибли в числе прочих уже осужденные трибуналом и половину срока отбывшие в лагере, как напр. по делу Локкарта -- Хвалынский, получивший даже в этом жестоком процессе только 5 лет лагеря.	42:52	0:192
трибунал	NOUN	1918-1990	2	трибунал-109		Весь день проведя у телефона, отвечая на яростные звонки командующего армией, грозившего трибуналом, он ехал сюда, доведенными до крайней степени испуга, содрогаясь от мысли, что необдуманные, поспешные действия Щербатова могут быть расценены немцами как провокация и вызвать конфликт.	89:99	0:285
трибунал	NOUN	1682-1916	1	трибунал-110		Тут тебе и коммунисты как будто заодно, тут тебе можно и "долой коммунистов" кричать, и уничтожать агентов по продразверстке, и требовать разоруженья особотдела и трибунала, свергать все власти военные и гражданские, провозглашать свою мятежную, крепостную власть, -- это вот так коммунисты, с такими и дело любо вести!	163:172	0:319
трибунал	NOUN	1918-1990	2	трибунал-111		Как ни велика была ненависть к трибуналу, старые христиане возмутились при вести об убийстве Арбуэ, и тем же инквизиторам пришлось успокаивать народ и удерживать его от самосуда -- обещанием примерного наказания злоумышленников.	31:40	0:228
трибунал	NOUN	1682-1916	1	трибунал-112		Чтобы оценить вполне, как исполнялась "святая обязанность", по выражению Сикста, необходимо перенестись мыслью в зал инквизиционного трибунала и в мрачные камеры его темниц, лучшею надписью для которых была бы надпись над вратами ада: Глава II.	133:142	0:244
трибунал	NOUN	1682-1916	1	трибунал-113		На беду святого трибунала кто-то дал понять Филиппу, какую опасность представляла бы короне инквизиционная милиция, и привыкший властвовать король поспешил отказать инквизиторам.	16:25	0:178
трибунал	NOUN	1682-1916	1	трибунал-114		Штейнберг, вспоминающий "великодушие", которое царило в трибуналах "первой эпохи октябрьской революции", должен признать, что "нет сомнений" в том, чтобы период от марта до конца августа 1918 был период фактического, хотя и не официального террора".	56:66	0:249
трибунал	NOUN	1918-1990	2	трибунал-115		Вследствие переписки с Пекинским трибуналом внешних сношений о непропущенном в Пекин нашем курьере, полковнике Забаринском, генерал-губернатор извещал китайское правительство, что весной 1855 года он снова с войсками поплывет по Амуру для защиты края от вторжения в него англо-французов и потому просил известить его о месте, назначенном для съезда уполномоченных, и ответ об этом прислать в Мариинский пост, на реку Амур (Кизи).	33:43	0:429
трибунал	NOUN	1682-1916	1	трибунал-116		Я верю, что ваше величество, мой король и повелитель, останется верно крови, которая течет в его жилах, и убедится, что инквизиция -- трибунал Бога и одно из самых лучших учреждений ваших предков".	134:142	0:197
трибунал	NOUN	1682-1916	1	трибунал-117		А Станислав Лещинской намерился было держать трибунал в Петракове, но оной трибунал поляки (которые держались при союзе, учиненном с Россиею) разогнали, також город Калиш, где шведы и их стороны поляки были, приступом взяли.	45:53	0:224
трибунал	NOUN	1682-1916	1	трибунал-118		этот святой трибунал, и дело Господа останется без защитников.	12:20	0:62
трибунал	NOUN	1682-1916	1	трибунал-119		В настоящее время эту последнюю цифру уменьшают, но не нужно забывать, что за инквизицией числятся еще многие тысячи униженных, разоренных и изгнанных, и потому итог Льоренте можно считать вполне основательным относительно жертв трибунала и в то же время далеко не выражающим того зла, которое принесла Испании святая инквизиция.	229:238	0:329
