lemma	pos	date	grouping	identifier	description	context	indexes_target_token	indexes_target_sentence
исполнитель	NOUN	1991-2017	2	исполнитель-0		"Когда Алла узнала, -- пишет Полубояринова, -- что в спешном порядке ищут другого исполнителя на "Орфея", она твердо сказала Слободкину: "Паша, я должна туда поехать!"	82:93	0:167
исполнитель	NOUN	1991-2017	2	исполнитель-1		Если в процессе рассмотрения материалов, представленных на утверждение, будут установлены необъективность или некачественное выполнение работы, допускается привлекать независимого эксперта в качестве оппонента и (или) обязать Исполнителя провести повторную экспертизу (полностью или частично).	226:237	0:293
исполнитель	NOUN	1918-1990	1	исполнитель-2		(вместо слова "шкаф" литератор вставил имя Антона Павловича)... приветствуя вас..." и т. д. Антон Павлович покосился на меня -- исполнителя Гаева, и коварная улыбка пробежала по его губам.	128:139	0:188
исполнитель	NOUN	1918-1990	1	исполнитель-3		Никого из исполнителей пока еще в Петербурге нет, она же находится здесь в качестве маяка, т. е. к ней должны все являться.	10:22	0:123
исполнитель	NOUN	1991-2017	2	исполнитель-4		, а не деятельность иных, несудебных органов, коими являются судебные приставы-исполнители.	-1:18	0:91
исполнитель	NOUN	1991-2017	2	исполнитель-5		И заключает: -- Казенное имущество испорчено, дисциплина нарушена, непосредственный исполнитель -- несовершеннолетний.	84:95	0:118
исполнитель	NOUN	1991-2017	2	исполнитель-6		-- В.Е.), а не в результате действий Т. В связи с этим непонятно, каким же образом Т. вменяется квалифицирующий признак -- повлекшее иные тяжкие последствия, которые образовались в результате эксцесса исполнителя Такая квалификация весьма схожа с объективным вменением".	201:212	0:270
исполнитель	NOUN	1991-2017	2	исполнитель-7		Возможно также, что следователи не торопились обнародовать факт задержания исполнителей убийства в связи с расследованием дела милиционеров-"оборотней".	75:87	0:152
исполнитель	NOUN	1918-1990	1	исполнитель-8		-- Но это, наверное, зависит не только от инструмента, но и от исполнителя Или, может быть, от их взаимоотношений -- Точно.	63:74	0:123
исполнитель	NOUN	1991-2017	2	исполнитель-9		Почти все роли, за небольшим исключением, нашли вдумчивых и серьезных исполнителей.	70:82	0:83
исполнитель	NOUN	1918-1990	1	исполнитель-10		-- Толстой имеет в виду нетвердое знание ролей некоторыми исполнителями в "Смерти Иоанна Грозного", в первую очередь игравшим Грозного В. В. Самойловым.	58:71	0:152
исполнитель	NOUN	1918-1990	1	исполнитель-11		Къ сожалню, несмотря на вс стараня исполнителей, ничего другого на этомъ спектакл не было.	35:47	0:90
исполнитель	NOUN	1918-1990	1	исполнитель-12		2. Договором может быть также предусмотрена обязанность заказчика выдать исполнителю техническое задание и согласовать с ним программу (технико-экономические параметры) или тематику работ.	73:84	0:188
исполнитель	NOUN	1991-2017	2	исполнитель-13		У меня в кабинете на стене висит нарисованная актерами картина, где изображены все участники спектакля и под каждым исполнителем личная подпись.	116:128	0:144
исполнитель	NOUN	1918-1990	1	исполнитель-14		А Регуляторы получили звезды помощников шерифа и как судебные исполнители вызвались доставить повестки адресатам.	62:73	0:113
исполнитель	NOUN	1991-2017	2	исполнитель-15		Там создают реалистическую обстановку декораций, вещей, в которых все правда, но при этом забывают о подлинности самого чувства и переживания исполнителей ролей.	142:154	0:161
исполнитель	NOUN	1918-1990	1	исполнитель-16		А на месте его сидел каменно-твердый исполнитель какого-то долга, глядящий сквозь пальцы и на смерть, и на жизнь.	37:48	0:113
исполнитель	NOUN	1918-1990	1	исполнитель-17		Другие аплодируют с ласковой и выразительной улыбкой, как бы вступая в непосредственное и даже интимное общение с исполнителем.	114:126	0:127
исполнитель	NOUN	1991-2017	2	исполнитель-18		Андрюша не только интересный исполнитель (при всей сложности его натуры, при очень ярком собственном мнении, от которого он всегда тяжело отказывается), он еще и прекрасный педагог-наставник.	29:40	0:191
исполнитель	NOUN	1991-2017	2	исполнитель-19		Нет необходимости объяснять, что такая система может быть создана только для крупного производства с объемами производства сотни миллионов долларов в год, она не может быть создана в короткие сроки т.к. требует последовательных действий: разработки отдельных ее элементов; подготовки коллектива исполнителей требуемой квалификации; перестройки деятельности всей фирмы.	295:307	0:368
исполнитель	NOUN	1991-2017	2	исполнитель-20		Большая жизнь Режиссер и исполнитель Игорь Ларин "МОНПЛЕЗИР -- ТЕАТР индивидуальной фантазии актера Игоря Ларина -- строился доселе на материале подчеркнуто высоком, благородном.	25:36	0:178
исполнитель	NOUN	1991-2017	2	исполнитель-21		Разместившись в гостинице, мы получили бесплатные пропуска на первые два концерта, где выступали уникальные исполнители, игравшие точно так же, как в начале века.	108:119	0:162
исполнитель	NOUN	1918-1990	1	исполнитель-22		В 1929 году бывший танцовщик, выпускник парижской балетной школы дебютировал в качестве исполнителя цыганских романсов в кишиневском ресторане "Лондра".	88:99	0:152
исполнитель	NOUN	1991-2017	2	исполнитель-23		Эту стадию первого соприкосновения исполнителя с намеченным к исполнению произведением можно назвать стадией просмотра.	35:46	0:119
исполнитель	NOUN	1918-1990	1	исполнитель-24		В ее рамках проходят конкурсы городов России за право проведения центральных акций фестиваля и Пара-Артиады до 2005 года включительно, запланированы конкурсы по созданию гимна движения, музыкальной эмблемы, символики, пиктограмм, плакатов, дипломов, открыток, конвертов, марок, видеосюжетов, интернет-дизайна, конкурсы исполнителей, музыкантов, вокалистов, артистов-чтецов, циклы филармонических концертов "Истоки", "Наследники", "Играй, мой баян", "Неиссякаемый родник", "Русский романс", культурная и спортивная программа "Арт-Олимп", мероприятия по борьбе с наркоманией "ТВ и СМИ против наркотиков", выставки "Всемирный день доброты", фестиваль бардовской песни, выставка народных художественных промыслов "Береста: традиции и современность", конкурс патриотической песни "Россия наш дом", Караван мира Северного Кавказа по маршруту Махачкала Назрань Владикавказ -- Нальчик Пятигорск Ставрополь Черкесск -- Майкоп Краснодар Ростов-на-Дону, благотворительная акция "Новогодний подарок сироте" и т.д.	319:331	0:1001
исполнитель	NOUN	1991-2017	2	исполнитель-25		Нам думается, что, обсудив перед голосованием выступления курсантов, жюри смогло бы избегнуть отдельных серьезных ошибок, при которых ряд лучших исполнителей остался за чертой премирования.	145:157	0:189
исполнитель	NOUN	1918-1990	1	исполнитель-26		В последние слова арии Мефистофеля певец вложил весь свой талант исполнителя и весь сарказм, которым великий Гете наделил мудрого и насмешливого врага человеческого рода: -- ...И людская кровь рекой по клинку течет булата.	65:76	0:222
исполнитель	NOUN	1918-1990	1	исполнитель-27		Человек, испытывающий тоскливое беспокойство, с чувством неясного стеснения в груди, и не подозревает, что "исполнители" этого состояния -- мелкие мышцы бронхов (но, конечно, и не только они).	108:119	0:192
исполнитель	NOUN	1918-1990	1	исполнитель-28		В случае, когда наследование осуществляется по завещанию, в котором назначен исполнитель завещания, хранение указанного имущества обеспечивается исполнителем завещания самостоятельно либо посредством заключения договора хранения с кем-либо из наследников или другим лицом по усмотрению исполнителя завещания.	77:88	0:308
исполнитель	NOUN	1991-2017	2	исполнитель-29		В углу того зала сидел молодой еще, но уже поседевший ответственный исполнитель по разнарядке стройматериалов; он уныло глядел в чад пространства своего учреждения, не видя возможности удовлетворить самым необходимым даже ударные строительства и спецработы.	68:79	0:257
исполнитель	NOUN	1918-1990	1	исполнитель-30		В эту меньшую половину входит и глава, смысл которой сводится к тому, что "Протоколы сионских мудрецов" -- это глубокий злодейский план разрушения государства с последующим захватом власти, а Ленин и его партия -- исполнители того плана.	214:225	0:237
исполнитель	NOUN	1991-2017	2	исполнитель-31		Из исполнителей первым был Феона, с большой мэтризой проводивший роль Бульбума.	3:15	0:79
исполнитель	NOUN	1991-2017	2	исполнитель-32		Вот, например, в Америке моментально прославился журналист, настолько ехидно высмеивавший последние альбомы самых знаменитых исполнителей, что на него сразу обратили внимание.	125:137	0:175
исполнитель	NOUN	1991-2017	2	исполнитель-33		Систематизированы средства ведения спортивно-оперативной деятельности в зависимости от возраста и уровня квалификации исполнителей; определены обобщённые и типовые характеристики психовегетативной активности и психофункциональной работоспособности юных спортсменов разных видов единоборств; установлены особенности развития психических качеств сферы практического интеллекта с учётом индивидуально-типовой принадлежности; обоснован методический подход к типологической дифференциации спортсменов способом таксономического анализа показателей когнитивных и психомоторных особенностей.	118:130	0:583
исполнитель	NOUN	1918-1990	1	исполнитель-34		Все эти методы воинского цигун "Спокойных" являются составной частью методики "укоренения ростка "инь", цель которой -- подвести исполнителя к стадии начала формирования "железной рубашки" и свободного манипулирования мощными потоками внешней и внутренней энергии.	129:140	0:264
исполнитель	NOUN	1991-2017	2	исполнитель-35		Обычно в них участвовало не больше трех исполнителей.	40:52	0:53
исполнитель	NOUN	1991-2017	2	исполнитель-36		Деток было нестерпимо жалко и стало еще больше жалко после того, как исполнитель одной из ролей Джастин Пирс повесился в гостиничном номере ровно два года назад -- ему было двадцать пять. *** -- не пропустите, ** -- разве из любопытства Бай Евгений, Левинский Александр, Мязина Елена, Тихонов Алексей.	69:80	0:301
исполнитель	NOUN	1991-2017	2	исполнитель-37		Пока мы сталкиваемся с несовершенством нормативно-правовой базы, с тем, что и заказчик, и исполнитель -- по сути одна организация, с тем, что жилищно-коммунальная реформа практически еще не начиналась.	90:101	0:201
исполнитель	NOUN	1991-2017	2	исполнитель-38		Для того чтобы стать исполнителем такого синтетического жанра, как джаз-рок, надо быть для начала хотя бы терпимым ко всем видам музыки.	21:33	0:136
исполнитель	NOUN	1991-2017	2	исполнитель-39		Теперь вы уже не поймёте, кто кого любил, как и почему они расстались, а если песня такая грустная, то почему исполнители улыбаются.	110:121	0:132
исполнитель	NOUN	1918-1990	1	исполнитель-40		Добивались признания, чтобы расстрелять: ведь Сталин следил, чтобы были уничтожены не только организаторы, исполнители и свидетели убийства, но и те, кто вел по нему следствие, потом и те, кто отправлял на расстрел первых палачей.	107:118	0:230
исполнитель	NOUN	1918-1990	1	исполнитель-41		Можно было не сомневаться, что по единому знаку эти окаменелые фигуры превратятся в нерассуждающих исполнителей любого приказа.	99:111	0:127
исполнитель	NOUN	1991-2017	2	исполнитель-42		Единственное, что не указано в АПК, -- это срок, в течение которого определение об отложении исполнительных действий направляется взыскателю, должнику, судебному приставу-исполнителю, а также не предусмотрена возможность обжалования подобных определений, что, на наш взгляд, нарушает интересы взыскателя и может повлечь за собой невозможность исполнения судебного акта в будущем.	93:107	0:379
исполнитель	NOUN	1991-2017	2	исполнитель-43		Родители Севары -- известные исполнители узбекской народной музыки.	29:40	0:67
исполнитель	NOUN	1918-1990	1	исполнитель-44		Замредактора журнала "Русский хозяин" Андрея Семилетникова и сотрудницу этого издания Елену Липилину следователи считают идеологами погрома, а четырех столичных "скинхедов" -- Андрея Почукаева, Евгения Сержантова, Александра Кузьмина и Валерия Русакова -- исполнителями.	256:269	0:270
исполнитель	NOUN	1991-2017	2	исполнитель-45		Далее в сборник войдут выдержки из критических статей, посвященных знаменитым актерам западной сцены -- исполнителям ролей шекспировского репертуара.	104:116	0:149
исполнитель	NOUN	1918-1990	1	исполнитель-46		И вообще казалось, что хоть Ленин умер, но исполнитель его роли-то жив...	43:54	0:73
исполнитель	NOUN	1991-2017	2	исполнитель-47		Едва законченный лист сейчас же переписывался, отдавался исполнителю, который бежал наверх и по не просохшей еще новой странице уже репетировал только что вышедшую из-под пера сцену.	57:68	0:182
исполнитель	NOUN	1918-1990	1	исполнитель-48		И как для литургии важна совместность, общность в пении и молитве, а не виртуозность исполнителей, так и для массовой культуры общность важнее профессионализма.	85:97	0:160
исполнитель	NOUN	1991-2017	2	исполнитель-49		Среди приведенных цитат нет высказываний музыкантов-исполнителей.	-1:21	0:65
исполнитель	NOUN	1918-1990	1	исполнитель-50		Из сказанного следует, что если реклама, в силу своих объективных качеств, устанавливаемых экспертным путем, не может гарантировать этот результат, или приводит к обратному результату, то налицо ненадлежащее исполнение обязательств со стороны исполнителя.	243:254	0:255
исполнитель	NOUN	1991-2017	2	исполнитель-51		Но началось сражение, а из штаба отряда шли детальные распоряжения, сбивавшие мои планы и вносившие нервность в работу и раздражение среди исполнителей.	139:151	0:152
исполнитель	NOUN	1918-1990	1	исполнитель-52		Иногда я думаю: почему это началось именно в ДК Пищевой промышленности Не потому ли, что духовная пища в брежневскую удушливую эпоху была не менее нужна, чем хлеб Основу клуба составила группа молодых ленинградских авторов, в число которых вошли Евгений Клячкин, Борис Полоскин, Валентин Вихорев, Валерий Сачковский, Юрий Кукин, Валентин Глазанов, исполнители авторских песен Виталий Сейнов и Михаил Кане и некоторые другие.	348:359	0:424
исполнитель	NOUN	1991-2017	2	исполнитель-53		Есть еще одно лицо в пьесе, которое обращает на себя внимание: придворный льстец и исполнитель самых гнусных поручений короля, Атекин.	83:94	0:134
исполнитель	NOUN	1918-1990	1	исполнитель-54		К моему большому огорчению, большинство молодых художников полагают, что дух обновления в искусстве подчинен новым политическим идеям и улучшению социальных условий жизни, благодаря чему они превращаются в исполнителей воли правителей, переставая заниматься обновлением красоты самой по себе.	206:218	0:292
исполнитель	NOUN	1918-1990	1	исполнитель-55		Люди -- лишь его исполнители и слуги, и они должны употреблять ложные Божие дары исключительно в божественных целях, т. е. прежде всего для общих нужд.	17:28	0:151
исполнитель	NOUN	1918-1990	1	исполнитель-56		Министерша ничтоже сумняшеся признала, что одному из наших выдающихся исполнителей за концерт в США платят 4000 долларов.	70:82	0:121
