lemma	pos	date	grouping	identifier	description	context	indexes_target_token	indexes_target_sentence
исполнитель	NOUN	1918-1990	1	исполнитель-57		Но раз таковой произошедший (утеряна часть текста -- 2 абзаца) сообщник в стенах института, а может быть, даже сам налётчик был только техническим исполнителем плана, начертанного этим сообщником-вдохновителем.	147:159	0:210
исполнитель	NOUN	1918-1990	1	исполнитель-58		На этом снимке запечатлен исполнитель главной роли в балете "Тиль Уленшпигель" артист Джером Робине и его "партнер" по танцу -- скелет.	26:37	0:135
исполнитель	NOUN	1918-1990	1	исполнитель-59		Таким не по разуму усердным исполнителем оказался новый инспектор Брызгалов; человек с черной бородой и мертвым лицом, на котором приветливая улыбка казалась гримасой.	28:40	0:167
исполнитель	NOUN	1991-2017	2	исполнитель-60		Настольная книга судебного пристава-исполнителя: Справочно-методическое пособие / Под ред.	-1:18	0:90
исполнитель	NOUN	1991-2017	2	исполнитель-61		Из остальных исполнителей лучшим оказался г. Касторский (Хаген), произносящий свои речитативы в "шаляпинской" манере, ...	13:25	0:121
исполнитель	NOUN	1918-1990	1	исполнитель-62		Начали переговоры с одним киноартистом, исполнителем главных ролей и любимцем женщин (извините, не называю фамилию по причинам нижепонятным).	40:52	0:141
исполнитель	NOUN	1991-2017	2	исполнитель-63		Музыка "Настасьи" была сродни Данилову, он знал, что и его дорога музыканта рядом или хотя бы ведет в ту же сторону, но здесь, в яме, он был не творец, а исполнитель, работник, и помимо всего прочего должен был хорошо считать.	154:165	0:226
исполнитель	NOUN	1991-2017	2	исполнитель-64		Не пропускала выдающихся исполнителей -- Микельанджело, Рихтера, Шварцкопф...	25:37	0:77
исполнитель	NOUN	1991-2017	2	исполнитель-65		Для самой же продолжительности нотной записи таких границ нет, помимо воли композитора и исполнителя или же, наконец, терпения слушателей.	89:100	0:138
исполнитель	NOUN	1918-1990	1	исполнитель-66		Ночью в землянке, в тишине, предшествующей сну, боец сказал исполнителю роли Ленина: -- А ведь в жизни вы басом разговариваете.	60:71	0:127
исполнитель	NOUN	1918-1990	1	исполнитель-67		Мешала лишь толпа, и Волынский пожалел, что его не прикончили тихо, в каком-нибудь укромном месте, где не было бы никого, кроме исполнителей приговора, Но сетовать на это бессмысленно, и он спокойно, даже благожелательно рассматривал человечью несметь, удивляясь, что ни на одном лице, мужском или женском, молодом или старом, не было и тени сострадания.	128:140	0:354
исполнитель	NOUN	1918-1990	1	исполнитель-68		О чем шепчет над водой голос невидимого исполнителя О чем поет голубая мелодия неизвестного инструмента Кого зовет она * "Улица Синих Роз" В.	40:51	0:141
исполнитель	NOUN	1918-1990	1	исполнитель-69		Вместе с ехидным удовольствием от фамилии главного исполнителя акции -- Косорылко!	51:62	0:82
исполнитель	NOUN	1991-2017	2	исполнитель-70		Одобренный на семинаре график работ предусматривает виды работ, которые необходимо провести, конкретные сроки этих работ и их исполнителей, а также проведение ряда совещаний специалистов для обсуждения и согласования различных вопросов методологии и результатов расчетов.	126:138	0:271
исполнитель	NOUN	1991-2017	2	исполнитель-71		При наличии разногласий по проекту разрешения между головным исполнителем и соисполнителями эти разногласия докладываются Руководителю Службы или уполномоченному заместителю Руководителя Службы для принятия окончательного решения.	61:73	0:230
исполнитель	NOUN	1918-1990	1	исполнитель-72		Он выбрал пьесу (или ему ее дали), он выбрал исполнителей (или ему их дали), он время от времени только по делам своего спектакля имеет дело с директором (счастливый!), но, самое главное, он не ощущает за своей спиной это огромное, годами создававшееся учреждение под названием "театр", где две трети артистов не заняты, уже много лет ничего не делают, отвыкли репетировать, не знают, что такое работа над ролью и т.д. Горе режиссеру, который на деле, на самом себе узнает, что такое психология этих артистов.	45:57	0:509
исполнитель	NOUN	1918-1990	1	исполнитель-73		Актер Владлен Давыдов нарисовал ему живописную картину того, как в случае кончины такого рода (что, конечно, маловероятно, Боже упаси!) свинцовый гроб с телом Бориса Александровича будет доставлен в Москву и прах его после сожжения заключат в Кремлевскую стену с подобающими почестями, как и полагается исполнителю роли Ленина, погибшему от пули врагов.	303:314	0:353
исполнитель	NOUN	1918-1990	1	исполнитель-74		Он понимает, как должен звучать инструмент и что исполнитель может из него "вынуть".	49:60	0:84
исполнитель	NOUN	1991-2017	2	исполнитель-75		Лейтенант, как истый режиссер, тщательно следил при этом за каждым из исполнителей.	70:82	0:83
исполнитель	NOUN	1918-1990	1	исполнитель-76		Они -- единственные исполнители в своем будущем фильме, конкурентов у них не существует во всем свете, поэтому они точно знают, что смогут их герои, а чего -- нет.	20:31	0:163
исполнитель	NOUN	1991-2017	2	исполнитель-77		Под конец исполнитель все-таки устал, завял и уже буднично и обыкновенным, своим голосом проинформировал слушателей о развязке истории, ибо знал из опыта, что его все равно заставят ответить на неясные пункты.	10:21	0:209
исполнитель	NOUN	1918-1990	1	исполнитель-78		Организационные задачи во многих случаях не имеют точных алгоритмов решения, а разрешаются в рамках некоторых сценариев, которые в общих чертах хорошо известны исполнителям, но в каждой конкретной ситуации могут частично изменяться.	160:172	0:232
исполнитель	NOUN	1991-2017	2	исполнитель-79		Между прочим, надо добавить: словно на сцене дурные "исполнители", а не настоящие актеры.	53:64	0:89
исполнитель	NOUN	1918-1990	1	исполнитель-80		Ответственный исполнитель темы "Изучение выходов подземных вод в Ладожском озере и Финском заливе с целью охраны вод от загрязнения", которая входит в программу разработки природоохранного мониторинга при геологоразведочных работах на твердые полезные ископаемые континентального шельфа СССР.	14:25	0:292
исполнитель	NOUN	1918-1990	1	исполнитель-81		Видно, она по привычке читала перед сном, а Донька тем временем находился у себя в закутке и, возможно, сымал носки или раздумчиво чесал бок под рубахой, уставясь на свечу и перебирая обрывки дня, как это присуще людям в таких же обстоятельствах, в том числе исполнителям казни.	259:271	0:278
исполнитель	NOUN	1918-1990	1	исполнитель-82		Пианисту -- несомненно даровитому исполнителю -- надо серьезно подумать над дальнейшими путями своего развития.	34:45	0:111
исполнитель	NOUN	1918-1990	1	исполнитель-83		Ну а там -- баночное пиво, омары, крики "Я разорен!" или "Мне в Париж по делу!" хоть и русским языком, но ни исполнитель, ни аудитория этого языка пока не понимают.	109:120	0:164
исполнитель	NOUN	1991-2017	2	исполнитель-84		По результатам рассмотрения заявления о приостановлении или прекращении исполнительного производства судом выносится определение, которое направляется взыскателю, должнику, а также судебному приставу-исполнителю, на исполнении которого находится исполнительный документ.	72:87	0:270
исполнитель	NOUN	1991-2017	2	исполнитель-85		.." -- то спите, как говорится, спокойно, смотрите во сне все, что вам хочется, ибо во сне вы драматург этого действа, режиссер, исполнитель главной роли и, нередко, зритель.	129:140	0:174
исполнитель	NOUN	1918-1990	1	исполнитель-86		Поначалу была делопроизводителем, потом перевели ее секретарем судебного заседания, а последние пятнадцать лет Галина Ивановна -- судебный исполнитель.	139:150	0:151
исполнитель	NOUN	1918-1990	1	исполнитель-87		После первой части он подошел к исполнителям и, пока гремели рукоплескания, сказал Фадею Казимировичу, что за ним приехали, какая-то неприятность и музыку придется прекратить.	32:44	0:175
исполнитель	NOUN	1991-2017	2	исполнитель-88		Потратить сорок миллионов долларов на фильм и не помнить фамилий режиссера и основных исполнителей, что это Мне противно вранье, но, как ни странно, бывают случаи, когда булшит вызывает жалость и сочувствие.	86:98	0:207
исполнитель	NOUN	1991-2017	2	исполнитель-89		"Исполнитель должен быть нейтрален" Где-то в начале 70-х годов у Галича появились такие стихи: Тот протокол положит в стол.	1:12	0:123
исполнитель	NOUN	1918-1990	1	исполнитель-90		Поэтому среди людей, принявших и поддержавших культ личности, были не только перерожденцы и карьеристы, но и "честные исполнители", искренне верившие, что все совершаемое необходимо и полезно для страны и революции.	118:129	0:215
исполнитель	NOUN	1918-1990	1	исполнитель-91		Печально, что я -- как исполнитель в анекдоте о зайце: сначала режу, потом считаю.	23:34	0:82
исполнитель	NOUN	1991-2017	2	исполнитель-92		Появилось много заказных преступлений -- это когда исполнитель получает четкое указание украсть конкретное произведение.	51:62	0:120
исполнитель	NOUN	1991-2017	2	исполнитель-93		Жанры самые разные, но все на высоком уровне: балетная пара, солисты оперы, знаменитый скрипач и тут же -- иллюзионист, акробаты, кукольники, аккордеонист и, конечно, исполнители народных песен и танцев.	167:178	0:203
исполнитель	NOUN	1991-2017	2	исполнитель-94		При этом ответом на атаку в первый сектор будет удар 1, на атаку во второй сектор -- удар 2 и т.д. При сопровождении нож воздействует на конечность противника по ходу ее движения: удар в сектор 1 исполнитель сопровождает движением 2, удар в сектор 2 -- движением 1, удар в сектор 3 -движением 4, удар в сектор 4 -- движением 3.	196:207	0:327
исполнитель	NOUN	1991-2017	2	исполнитель-95		Являясь исполнителем коммунальных услуг, ответчик, независимо от ведомственной принадлежности, формы собственности и организационно-правовой формы, обязан предоставить потребителю услуги, соответствующие по качеству условиям договора, обязательным требованиям стандартов, санитарных правил и норм, установленным нормативам, а также информации о коммунальных услугах согласно ст. 4 Закона РФ "О защите прав потребителей" и п. 15 Правил предоставления коммунальных услуг.	8:20	0:469
исполнитель	NOUN	1918-1990	1	исполнитель-96		РЯЗАНОВ: Скажите, кто дал распоряжение о вырезке и кто произвел эту операцию КОНОНЫХИН: Дело не в конкретных исполнителях.	109:121	0:122
исполнитель	NOUN	1991-2017	2	исполнитель-97		." Заслушав доклад комиссии, объяснения т Лазаренко и многочисленные выступления, президиум в своем постановлении констатировал: недопустимое в художественной организации отношение со стороны руководства Филармонии к исполнительскому составу, граничащее с издевательством (грубость, бюрократизм), несоветские методы исправления финансовых недочетов за счет зарплаты исполнителей, полный отрыв руководства Филармонии от актива исполнителей, отсутствие всякой самокритики в работе Филармонии, отсутствие заботы о росте молодых кадров.	217:233	0:532
исполнитель	NOUN	1918-1990	1	исполнитель-98		Рядом с Асланом стоял веселый головорез Теймыр, неизменный исполнитель черновой, но почетной работы умыкания.	59:70	0:109
исполнитель	NOUN	1918-1990	1	исполнитель-99		Сахара-награды у Тамерлана, конечно, не было, зато публика наградила смехом и аплодисментами исполнителей этой забавной дрессуры наоборот -- человека и льва.	93:105	0:157
исполнитель	NOUN	1918-1990	1	исполнитель-100		Рядом с хоровой песенно-плясовой песнью была и такая, где автор и исполнитель являлись одним и тем же лицом, и это лицо было единично.	66:77	0:134
исполнитель	NOUN	1918-1990	1	исполнитель-101		Он был исполнен высочайшей драматической силы, всем своим существом проникся минутой расставания императора со своим некогда таким победоносным войском и создал властью этого своего проникновения в суть события такое мощное магнетическое поле личной беды, ставшей бедой всеобщей, что присутствовавшие на съемке военные из подшефной части, артисты -- исполнители других ролей и члены съемочной группы с трудом сдерживали волнение.	350:361	0:429
исполнитель	NOUN	1991-2017	2	исполнитель-102		Соответственно судебный исполнитель не исполняет решений в пользу государства и вообще актов, принимаемые административными судами.	24:35	0:131
исполнитель	NOUN	1991-2017	2	исполнитель-103		Опытные люди знают, что в самообороне более эффективна и менее опасна для исполнителя именно "хлесткая" техника, а не "силовая".	74:85	0:128
исполнитель	NOUN	1918-1990	1	исполнитель-104		Стычка цивилизованного германца с языческими казахами совсем не помешала исполнителю жертвоприношения Канату Ибрагимову и Эрнсту сойтись чуть позже снова.	73:84	0:154
исполнитель	NOUN	1991-2017	2	исполнитель-105		Танцуют чинные народные танцы, увлекаются исполнителями простых мелодичных песенок.	42:55	0:83
исполнитель	NOUN	1991-2017	2	исполнитель-106		Судебный пристав-исполнитель должен проверить свободно ли жилое помещение.	-1:17	0:74
исполнитель	NOUN	1991-2017	2	исполнитель-107		Американская неугасимая звезда, режиссер и исполнитель главной роли Клинт Иствуд в новом американском триллере "Абсолютная власть".	43:54	0:131
исполнитель	NOUN	1918-1990	1	исполнитель-108		Считаю необходимым подчеркнуть естественную, здоровую простоту и ясную жизнерадостность дарования Каплана, что делает его исполнительский облик очень близким к подлинно советскому типу исполнителя.	122:137	0:197
исполнитель	NOUN	1918-1990	1	исполнитель-109		Читали, и ничто не шевельнулось в их душах Об исполнителях уж я и не говорю.	46:58	0:76
исполнитель	NOUN	1991-2017	2	исполнитель-110		Убийство депутата было следствием коллективно принятого решения, роль исполнителя возложили на Дроздецкого, человека весьма богатого, но не особо искушенного в организационных вопросах.	70:81	0:185
исполнитель	NOUN	1991-2017	2	исполнитель-111		Но все они друг друга знают очень давно, а он для них -- лишь хороший исполнитель.	70:81	0:82
исполнитель	NOUN	1918-1990	1	исполнитель-112		Хозяева оказались сильнее (немудрено -- выбор исполнителей у них был на порядок больше нашего), но накал страстей не слабее, чем на недавнем чемпионате Европы!	46:58	0:159
исполнитель	NOUN	1991-2017	2	исполнитель-113		Произведения решено было показать музыковедам, композиторам, исполнителям и людям, знавшим Стогния.	61:73	0:99
исполнитель	NOUN	1918-1990	1	исполнитель-114		Хотя каждый из них приставлен к несомненно интеллектуальному занятию и обладает соответствующими умениями ("владеет" в этом смысле орудиями культуры), занятие это предполагает взаимозаменяемость его исполнителей.	199:211	0:212
исполнитель	NOUN	1918-1990	1	исполнитель-115		Только там, в настоящем зале, при настоящей публике пьеса "сваривается" полностью, окончательно-притом нередко не совсем так (а случается, что и совсем не так), как планировал исполнитель.	176:187	0:188
исполнитель	NOUN	1991-2017	2	исполнитель-116		Художественный смысл этого типичного для сказок "моста к действительности" был вполне понятен Алексею Михайловичу, любившему слушать сказки от стариков, живших у него "в верху", в особом помещении -- сказки обычно заканчивались присказками, в которых исполнители выпрашивали себе награждения.	251:262	0:292
