lemma	pos	date	grouping	identifier	description	context	indexes_target_token	indexes_target_sentence
рыночный	ADJ	1918-1990	1	рыночный-0		"Правительственное решение создать именно 10 генкомпаний действительно позволит получить довольно сильных рыночных игроков, -- сказал "Известиям" аналитик ИК "Проспект" Александр Корчагин, -- хотя понятно, что цифра "10" -- достаточно условная".	106:114	0:245
рыночный	ADJ	1991-2017	2	рыночный-1		Исключение было сделано для поземельных налогов, которые население должно было вносить: в пограничных департаментах натурой (зерном), для облегчения продовольствования армий, а в остальной Франции мандатами, по рыночной стоимости зерна в них.	211:219	0:242
рыночный	ADJ	1918-1990	1	рыночный-2		* * * Плановый туризм умер в эпоху хаоса при переходе к рыночным отношениям.	56:64	0:76
рыночный	ADJ	1991-2017	2	рыночный-3		Он ел все самое простое, что значилось в меню столовых, но дома с аппетитом обсасывал кожицу жирного угря, купленного из-под полы у рыночного спекулянта.	132:141	0:153
рыночный	ADJ	1991-2017	2	рыночный-4		-- Как в таком случае отличить демпинг от нормального рыночного снижения цены -- Существуют рекомендованные базовые цены, торговля по которым устраивает всех.	54:63	0:158
рыночный	ADJ	1991-2017	2	рыночный-5		При этом очевидно, что экспансия бюрократии и силовиков носит объективно антимодернизаторский характер, угрожая инвестиционной привлекательности страны и встраиванию России в глобальную рыночную экономику.	186:194	0:205
рыночный	ADJ	1918-1990	1	рыночный-6		-- Представление окончено! -- провозгласил старик и двинулся вперед, проталкиваясь сквозь рыночную толпу.	90:98	0:105
рыночный	ADJ	1918-1990	1	рыночный-7		Мы думали, что мы можем одним взмахом и сразу уничтожить рыночные отношения.	57:65	0:76
рыночный	ADJ	1991-2017	2	рыночный-8		1 октября 1997 года президент Белоруссии Лукашенко издал указ, вводивший задним числом акциз на спирт в размере 2 доллара за литр, что равнялось его рыночной цене.	149:157	0:163
рыночный	ADJ	1991-2017	2	рыночный-9		Анализ расстановки и влияния основных политических сил позволял сделать вывод, что -- независимо от того, чем кончится противостояние президента и парламента, -- Россия будет продолжать мучительное, медленное, с откатами назад продвижение к демократии, к социальному рыночному хозяйству.	267:276	0:287
рыночный	ADJ	1991-2017	2	рыночный-10		Рыночный рай.	0:8	0:13
рыночный	ADJ	1991-2017	2	рыночный-11		КОРНИЛОВ, кандидат экономических наук, доцент Нижегородского государственного технического университета С.Н. ЯШИН, доктор экономических наук, профессор Нижегородского государственного технического университета Формирование рыночных отношений в российской экономике привело к возрастанию потребности субъектов хозяйствования в точности и достоверности оценки объектов рыночного обмена.	223:231	0:384
рыночный	ADJ	1918-1990	1	рыночный-12		[Лист 30] По известному правилу народной экономической жизни -- хлеб является хозяином всех рыночных цен, то есть -- [Жизнь надоедает в детстве, от нее бывает скучно, и человек, проживший лет шесть или семь от роду,] может спросить других -- так, чтобы его поняли -- отчего ему [скучно] стало скучно.	92:100	0:300
рыночный	ADJ	1918-1990	1	рыночный-13		Чтобы проверить, так ли это, сопоставим рыночные цены элементов (А), их кларки (К) и произведение А . К (таблица 1).	40:48	0:116
рыночный	ADJ	1918-1990	1	рыночный-14		А там через два-три дома оказался переулок, который вывел его на какую-то большую, должно быть рыночную, площадь.	95:103	0:113
рыночный	ADJ	1918-1990	1	рыночный-15		Дальше идут вопросы частного капитала, возможное сохранение и даже усиление позиции частного капитала в области товарооборота, затем сохранение рыночного метода товарооборота и возможное ограничение государственно-административного регулирования товарооборота.	144:153	0:260
рыночный	ADJ	1918-1990	1	рыночный-16		База для дальнейшего развития рыночной инфраструктуры, надо подчеркнуть, уже создана, ее технологической основой является единая система газоснабжения.	30:38	0:151
рыночный	ADJ	1991-2017	2	рыночный-17		Но в то же время он, как всякий буржуа, ходит по рыночной "тропинке бедствий": спекулирует ли он мылом или валютой -- неумолимые законы рынка часто хватают его за шиворот и заставляют вспоминать о боге и сатане.	49:57	0:211
рыночный	ADJ	1918-1990	1	рыночный-18		Благодаря всем этим мерам, а также правильному прогнозированию развития ситуации на рынке, "Уралхимпласт" органично вписался в рыночные отношения и добился хороших результатов в хозяйственной деятельности.	127:135	0:205
рыночный	ADJ	1991-2017	2	рыночный-19		Без развития рыночных отношений и элементов конкуренции неизбежно возникновение опасных диспропорций, инфляция и другие негативные явления.	13:21	0:139
рыночный	ADJ	1991-2017	2	рыночный-20		В ближайшем будущем сосновые леса Низменного Заволжья могут стать привлекательным объектом для претворения в жизнь положений Киотского протокола, который предусматривает создание глобальных рыночных механизмов, позволяющих снизить выбросы парниковых газов в атмосферу.	190:198	0:268
рыночный	ADJ	1991-2017	2	рыночный-21		4) Рыночные цены.	3:11	0:17
рыночный	ADJ	1918-1990	1	рыночный-22		В других школах учителя будут говорить о рыночных ценах, о том, как и где удалось отоварить карточки, а в Первой опытно-показательной -- с легкой руки Дмитрия Ивановича -- спорят о методике, об учениках, о современных философских проблемах.	41:49	0:240
рыночный	ADJ	1918-1990	1	рыночный-23		Никак не сходятся теория и практика нашей семейной математики: Теория любит цены государственные, а на практике мы вынуждены обращаться к рыночным, которые, увы, меняются в зависимости от географии и многого другого.	138:146	0:216
рыночный	ADJ	1991-2017	2	рыночный-24		В расчет норматива также включается величина кредитного риска по инструментам, отражаемым на вне-балансовых счетах бухгалтерского учета, величина кредитного риска по срочным сделкам, а также величина рыночного риска.	200:209	0:216
рыночный	ADJ	1991-2017	2	рыночный-25		При реализации ценных бумаг, которые обращаются на организованном рынке, вне его Налоговый кодекс обязывает налогоплательщика сопоставить цены реализации с рыночными.	156:165	0:166
рыночный	ADJ	1991-2017	2	рыночный-26		В стране, уже вступившей во второе десятилетие общественных трансформаций, по-прежнему широко распространены настроения недоверия, а то и вовсе категорического неприятия дальнейших рыночных реформ.	181:189	0:197
рыночный	ADJ	1991-2017	2	рыночный-27		По СЛМ же, выбор Китаем и СССР своих маршрутов был совершенно объективен, поскольку необходимым и достаточным условием реализации каждой из траекторий явился уровень "индустриальности" (СССР вошёл в кризис абсолютизма богатой индустриальной державой, а Китай начал рыночные реформы оставаясь бедным, доиндустриальным).	265:273	0:318
рыночный	ADJ	1918-1990	1	рыночный-28		В частности, речь идет о свободе транзита товаров, включая энергетические; предоставлении режима не менее благоприятного, чем предоставляемого таким товарам, как если бы они перевозились без транзита через территорию ЕС; снижении административных расходов в период расширения ЕС; предоставлении коммерческих услуг, связанных с транзитом, на справедливых и рыночных условиях.	356:364	0:374
рыночный	ADJ	1991-2017	2	рыночный-29		А сколько же было тайных, более мягких и даже вежливых Разве над всеми поголовно не измывались цензора всех эпох и мастей Разве любимых творений не коверкали, дорогих сердцу книг не сжигали Разве жандармы и чекисты не таскали к допросу и не сажали в каталажку, чуть не по очереди, без разбору, за то именно, что -- писатель А полицейский надзор, который порой поручался родному отцу (это было с Пушкиным) А прижимательства и придирки начальства, отравляющие каждую минуту жизни А дикая, одуряющая нищета, с алчностью издателей, с судорожной работой наспех этой великой казнью для всякого художника: быть недовольным своими созданиями А "широкая публика", Своим рыночным спросом вечно снижающая литературный уровень и обрекающая писателя шутовству в той или иной степени От начальства и общества не отставали семьи и ближние.	661:669	0:824
рыночный	ADJ	1918-1990	1	рыночный-30		Вот как оценивает сложившуюся ситуацию наш известный экономист академик Абалкин: "...Мечтали о рынке, а на самом деле получили нечто отвратительное, за которым ничего рыночного и в помине нет.	167:176	0:192
рыночный	ADJ	1991-2017	2	рыночный-31		Мы набрели на рыночную площадь, на древние торговые ряды, на оружие.	14:22	0:68
рыночный	ADJ	1918-1990	1	рыночный-32		Впрочем, начальник отдела экономических исследований МДМ-банка Николай Кащеев полагает, что в нынешней рыночной обстановке решение S&P неактуально: "Кроме того, на глобальном рынке капитала мы большой роли не играем, так что действия S&P можно только принять к сведению".	103:111	0:271
рыночный	ADJ	1991-2017	2	рыночный-33		Рыночные цены: яблоки -- 3 -- 6 рублей, курага -- 9, лимоны -- 2 -- 3 рубля штука, клюква -- 7 рублей.	0:8	0:102
рыночный	ADJ	1918-1990	1	рыночный-34		Все четверо были приговорены к смертной казни через повешение -- казнь должна была состояться на рыночной площади Харькова.	97:105	0:123
рыночный	ADJ	1918-1990	1	рыночный-35		Пока этот повышенный уровень интенсивности труда не стал "общественно-средним, рыночная стоимость штуки товара не изменяется, ибо в понятие рыночной стоимости, определяемой общественно-необходимым рабочим временем производства товара, входит средний, общественно-нормальный уровень интенсивности труда.	79:87	0:302
рыночный	ADJ	1918-1990	1	рыночный-36		Все, что творится в этом фильме, происходит, как говорит т. Арсланов, "при демократической рыночной экономике".	91:99	0:111
рыночный	ADJ	1918-1990	1	рыночный-37		..", -- известно, что однажды попугай рыночной гадалки вытащил Есенину кольцо, которое он потом отдал С. А. Толстой.	38:46	0:116
рыночный	ADJ	1991-2017	2	рыночный-38		Выражение лица -- "половина сахар, половина мед", как любят приговаривать азиатские рыночные мужички, расхваливая свои дыни.	84:92	0:124
рыночный	ADJ	1991-2017	2	рыночный-39		Плечом к плечу с масонами Под каждую реформу Россия изобретала себе подходящий Запад: басурманский, просвещенный, филистерский, рыночный, жидомасонский, общечеловеческий.	128:136	0:170
рыночный	ADJ	1918-1990	1	рыночный-40		Графиня Шперлинг была так испугана рыночными разговорами, что молчала, подавившись негодованием.	35:44	0:96
рыночный	ADJ	1918-1990	1	рыночный-41		Наскоро оглядев лицо в дешевое зеркало, поставленное на рыночный комод, подумал: -- По шадровитой роже и покупка ежели.	56:64	0:119
рыночный	ADJ	1991-2017	2	рыночный-42		Директор по корпоративным исследованиям инвестиционного фонда "Эрмитаж", член комитета по реструктуризации совета директоров РАО Вадим Клейнер сказал "Известиям": "Мы отправили письмо Анатолию Чубайсу, в котором выразили свои опасения в отношении рыночной стоимости акций энергохолдинга.	247:255	0:287
рыночный	ADJ	1991-2017	2	рыночный-43		Что касается развивающихся государств, то временные ограничения на отток капиталов входят в набор мероприятий при проведении рыночных реформ.	125:133	0:141
рыночный	ADJ	1918-1990	1	рыночный-44		Для меня было ясно, что организация экономических связей на рыночных принципах неизбежно и позитивно скажется и на политических проблемах.	60:68	0:138
рыночный	ADJ	1991-2017	2	рыночный-45		Не помню, как мчался я на лошади по горной дороге до Женевы, как приехал дождливым, серым утром в этот тихий прекрасный городок, увидел толпы людей, бегущих по узким улочкам в сторону рыночной площади, и понял, что уже ничего не изменить -- я опоздал.	184:192	0:251
рыночный	ADJ	1918-1990	1	рыночный-46		Его нормальное функционирование и воспроизводство соответствующих социальных отношений достигаются "свободной" игрой экономических механизмов и интересов, закрепленных отношениями собственности, обеспечиваются самоупорядочивающейся стихией рыночной конкуренции.	240:248	0:261
рыночный	ADJ	1918-1990	1	рыночный-47		Эта процессия, во главе с Дионисом и архонтом, останавливалась на рыночной площади, где хор плясал и пел перед статуями богов, а затем выходила через городские ворота и возле Академии ставила изображение Диониса на возвышение, перед которым многочисленные животные приносились в жертву.	66:74	0:286
рыночный	ADJ	1918-1990	1	рыночный-48		Есть рыночный успех, есть успех у университетской профессуры, есть успех у критиков, есть успех у простонародья.	5:13	0:112
рыночный	ADJ	1918-1990	1	рыночный-49		В истории общественно-экономического развития Русского государства X и XI века характеризовались усилением местных рыночных связей.	115:123	0:131
рыночный	ADJ	1991-2017	2	рыночный-50		Затем за квартиру нужно платить ежегодный налог -- его сумма исчисляется не как у нас, с некоей "цены БТИ", а с нормальной, рыночной.	124:132	0:133
рыночный	ADJ	1991-2017	2	рыночный-51		В разработанной в 90-х годах концепции перехода к рыночной экономике намечалось: в многолесных регионах, где сконцентрированы основные лесопользователи, главным образом в виде леспромхозов бывш.	50:58	0:194
рыночный	ADJ	1918-1990	1	рыночный-52		Здесь, в Америке, тоже существует конъюнктура -- рыночная.	49:57	0:58
рыночный	ADJ	1918-1990	1	рыночный-53		Он говорил о словообразе и его окаменении, об эпитете как средстве подновления слова, о "рыночном" искусстве, о смерти вещей и об остранении как способе их воскрешения.	89:97	0:168
рыночный	ADJ	1991-2017	2	рыночный-54		Здравоохранение в условиях рыночной экономики // Под ред.	27:35	0:57
рыночный	ADJ	1991-2017	2	рыночный-55		России сегодня присущ некоторый дуализм, но это не столько традиционное противоречие Азии и Европы, сколько проблема создания современных рыночных и демократических институтов.	138:146	0:176
рыночный	ADJ	1918-1990	1	рыночный-56		Зеленая "Антилопа", скрипя всеми своими частями, промчалась по внешнему проезду Бульвара Молодых Дарований и вылетела на рыночную площадь.	121:129	0:138
рыночный	ADJ	1918-1990	1	рыночный-57		Он видел светлые славянские зеркальные шкафы, железные кровати с никелированными шарами, хрупкие овальные столики, умывальники, деревянные настольные лампы с кустарными разноцветными шелковыми, туго натянутыми легкими круглыми абажурами, -- весь этот рыночный отельный инвентарь, столь обычный вообще и столь непонятный, неуместный, странный здесь, среди этой знойной, древней, пугачевской степи, среди этих воюющих между собой ветров, сквозняков, буранов.	251:259	0:456
рыночный	ADJ	1918-1990	1	рыночный-58		Как нам представляется, ее теоретические положения позволяют понять логику практических шагов "ЯБЛОКА" В результате деятельности ряда правительств эпохи президента Ельцина в России сложилась политико-экономическая система, весьма отличная от классических представлений о рыночной демократии.	271:279	0:291
рыночный	ADJ	1991-2017	2	рыночный-59		Ночью, пошатываясь, он вошел в таверну, где пили купцы, офицеры гвардии драбантов, кавалеристы и рыночные менялы.	97:105	0:113
