lemma	pos	date	grouping	identifier	description	context	indexes_target_token	indexes_target_sentence
рыночный	ADJ	1918-1990	1	рыночный-60		Машины, одна за другой, со скрежетом переключая передачи, с нарастающим рокотом моторов выезжают из ворот мимо диспетчера, хмурого, как спросонья, после суточного дежурства, на свои линии; одни на вокзальную площадь к первым поездам, другие на Ивансусанинскую, к исполкому, на Рыночную площадь, к химкомбинату.	277:285	0:310
рыночный	ADJ	1918-1990	1	рыночный-61		...Вскоре Платон и Вера прощались у рыночных ворот.	36:44	0:51
рыночный	ADJ	1991-2017	2	рыночный-62		Методология оценки эффективности деятельности разнообразных форм ассоциированного предпринимательства, объединяющих существенно различные по экономической природе бизнес-единицы, объективно отличается от методов и подходов к оценке эффективности моноструктурных рыночных субъектов, и поэтому возникает необходимость в комплексном изучении факторов, определяющих действительную эффективность поликорпоративных структур рыночного типа.	262:270	0:433
рыночный	ADJ	1991-2017	2	рыночный-63		Будет ли возобновлена выдача пропусков, пока не разразился скандал в прессе Теперь господин Воронин трудился во вполне рыночном и вполне международном издании "Бизнес уик".	119:127	0:172
рыночный	ADJ	1918-1990	1	рыночный-64		На привокзальной площади, куда он вышел с небольшим чемоданом, раскинулось рыночное торжище.	75:83	0:92
рыночный	ADJ	1918-1990	1	рыночный-65		В рыночной торговле специалисты и руководители совхоза заинтересованы.	2:10	0:70
рыночный	ADJ	1918-1990	1	рыночный-66		Некоторые из них достигли такого совершенства, что, с ходу миновав потерявшую рыночную ценность стадию искусства, научились изначально придавать своим творениям откровенно товарный вид.	78:86	0:185
рыночный	ADJ	1918-1990	1	рыночный-67		Зоя скользила скучающим взором по застывшим навеки красавицам Возрождения, -- они навьючивали на себя несгибающуюся парчу, не стригли волос, видимо, не каждый день брали ванну и гордились такими мощными плечами и бедрами, которых бы постыдилась любая рыночная торговка в Париже.	251:259	0:278
рыночный	ADJ	1991-2017	2	рыночный-68		Но в рыночной экономике, если у кого завелся мильончик, ему тут же спешат найти применение.	5:13	0:91
рыночный	ADJ	1991-2017	2	рыночный-69		Годы перестройки сопровождались резким обнищанием населения, покупательная способность заработной платы упала, сложившиеся в прошлые годы правила распределения квартир перестали работать, а рыночные отношения еще не сложились.	190:198	0:226
рыночный	ADJ	1991-2017	2	рыночный-70		Но вот уже много-много лет занимаемся мы демократизацией, ищем утраченные ценности, создаем гражданское общество, строим рыночные институты, входим в мировое сообщество.	121:129	0:169
рыночный	ADJ	1991-2017	2	рыночный-71		Так, по словам Михаила Смирнова, в "Северстали" сейчас с нетерпением ждут признания рыночного статуса России в странах Америки (Мексика, Венесуэла, Колумбия, Аргентина), а также в ЮАР.	84:93	0:184
рыночный	ADJ	1918-1990	1	рыночный-72		Он даже после первых рыночных знакомств приезжал ко мне домой производить обмен.	21:29	0:80
рыночный	ADJ	1918-1990	1	рыночный-73		Помидоры немедленно были забыты, а мы обнялись и стояли, объятые ташкентским детством, и нас крутила и ворочала рыночная толпа.	112:120	0:127
рыночный	ADJ	1991-2017	2	рыночный-74		Ответ на этот вопрос экономиста достаточно очевиден из сравнительного анализа эффективности метода Poll of Experts и метода рыночного прогноза (Market Method), см. на диаграмме.	124:133	0:177
рыночный	ADJ	1991-2017	2	рыночный-75		По признанию Максима Медведкова, Россия несет потери на этих рынках как раз потому, что не имеет статуса страны с рыночной экономикой.	114:122	0:134
рыночный	ADJ	1918-1990	1	рыночный-76		По одному из уголовных дел, когда виновными было похищено 3335 килограммов рыбы, стоимостью 2400 рублей, Верховный суд РСФСР указал, что хищение социалистического имущества, представляющего особую важность для хозяйства, имеющего высокую рыночную стоимость, а также хищение, совершенное в особо большом количестве или объеме, относится к крупному, если даже стоимость похищенного по розничной цене несколько ниже 2500 рублей.	238:246	0:425
рыночный	ADJ	1918-1990	1	рыночный-77		Положи мя, яко печать, наложенную рыночным контролером, лиловую на малиновом, положи мя, яко печать, на мышце своей!" -- глумливо переиначивает мясницкий топор трепетные стихи, сочиненные пылким царем для возлюбленных, для любовников, для любови их неуемной и великой, умащенной такими благовониями, таким елеем драгоценным, что только и хватит дыхания, чтобы в дурмане запахов и прикосновений воскликнуть: "Ибо я изнемогаю от любви!	34:42	0:433
рыночный	ADJ	1918-1990	1	рыночный-78		Пока же они едва превышают 10 процентов, но я уверен, что их роль постепенно будет увеличиваться по мере распространения рыночной оценки имущества.	121:129	0:147
рыночный	ADJ	1991-2017	2	рыночный-79		И во все остальное время, пока я у него сидел, говорил, как красиво в Марфине, и как там работается, и какая вообще чудесная осень, -- он все косился, поглядывал на книжку (она лежала на столе), все брал ее и начинал снова перелистывать, разглядывать вновь и вновь, глухо посмеивался, что на обложке помещена была рыночная картинка с лебедями, которых рисовали у нас в то время на обратной стороне клеенки.	314:322	0:406
рыночный	ADJ	1918-1990	1	рыночный-80		Поразительно, что сам он относился к этим чудесам иронически, каждый раз подсмеиваясь над нами, словно рыночный фокусник, раскрывающий перед одураченными тайную механику своих проделок.	103:111	0:185
рыночный	ADJ	1918-1990	1	рыночный-81		Главным рыночным местом являются улицы квартала Чжу-ринбочи, занятые лавками и уличными торговцами.	8:16	0:99
рыночный	ADJ	1991-2017	2	рыночный-82		После этого благодарные избиратели на руках внесут Грызлова-триумфатора в думу и даже про "губительное для рыночной экономики перераспределение средств из сектора свободного рынка в монополизированный" совершенно забудут.	107:115	0:221
рыночный	ADJ	1991-2017	2	рыночный-83		Рыночная цена за 1 USD сегодня -- 26,7 руб.	0:8	0:43
рыночный	ADJ	1918-1990	1	рыночный-84		Поэтому школу нельзя судить по рыночным законам.	31:39	0:48
рыночный	ADJ	1991-2017	2	рыночный-85		Позже, правда, выяснилось, что торговали не казенным и по рыночной цене, но их выходка задержала отлет.	58:66	0:103
рыночный	ADJ	1918-1990	1	рыночный-86		При этом возникает необходимость подстраивать деятельность рыночных институтов под реализацию реформ, а это значит, нужно смотреть, как организованы фондовый и финансовый рынки, какова банковская система.	59:67	0:204
рыночный	ADJ	1991-2017	2	рыночный-87		Однажды, на рыночной площади посреди Кембриджа, я нашел на книжном лотке среди подержанных Гомеров и Горациев Толковый Словарь Даля в четырех томах.	12:20	0:148
рыночный	ADJ	1918-1990	1	рыночный-88		Придерживаясь этих принципов, партия шаг за шагом формировала и новую экономическую политику, прошедшую процесс от "плановой товарной экономики" к "социалистической рыночной экономике", курс на построение которой был взят на 3-м пленуме ЦК КПК 14-го созыва в ноябре 1993 г. Авторы подробно рассматривают как труднейший период подступа к началу реформ, так и перипетии самого реформенного процесса, его сложные и противоречивые элементы, откровенно указывая на то, что нередко реформаторам приходилось действовать методом проб и ошибок.	165:173	0:535
рыночный	ADJ	1991-2017	2	рыночный-89		Полученные семена с большим трудом навязывались дехканам, с тем чтобы они раздавали их земледельцам, с обязательством Товарищества, что за хлопок, выращенный из этих семян, будет уплачиваться против рыночных цен на 10--20 копеек за пуд дороже, чем за посеянный из местных семян.	199:207	0:278
рыночный	ADJ	1991-2017	2	рыночный-90		Принуждение с рыночными отношениями несовместимо.	14:23	0:49
рыночный	ADJ	1991-2017	2	рыночный-91		А еще -- сказать слова благодарности людям, сумевшим, несмотря на все сложности девяностых, сохранить верность традициям "Центроспецстроя" и занять достойное место в новой системе рыночных отношений.	180:188	0:199
рыночный	ADJ	1991-2017	2	рыночный-92		Развитие цветной реакции при определении андростенона в свином жире: А -- образование голубой окраски при химическом взаимодействии субстрата с хромогеном (пероксида карбамида с тетраметилбензидином); Б -- изменение голубого цвета раствора на желтый после добавления останавливающего реакцию реагента; а -- высокая интенсивность окраски: б -- низкая интенсивность окраски Отраслевая система добровольной сертификации ХАССП-МЯСО -- шаг к гарантии качества и безопасности продукции В условиях современных рыночных отношений и жесткой конкуренции большое внимание уделяется качеству мясной продукции и безопасности ее потребления, так как привлечь потребителя и обеспечить предприятию прибыль могут только высококачественные продукты.	503:511	0:731
рыночный	ADJ	1991-2017	2	рыночный-93		А, вот, когда страна по уши влезла в рыночную экономику, у "ничьей бабушки" вдруг объявились внуки.	37:45	0:99
рыночный	ADJ	1991-2017	2	рыночный-94		Разработчики включили в этот закон все современные достижения науки об управлении, хорошо зарекомендовавшие себя в странах с развитой рыночной экономикой.	134:142	0:154
рыночный	ADJ	1991-2017	2	рыночный-95		В условиях жесткой рыночной конкуренции институт банкротства имеет двоякое значение: во-первых, он позволяет исключить из экономики страны неплатежеспособных хозяйствующих субъектов в результате их ликвидации под контролем государства; во-вторых, дает возможность оздоровить экономическую ситуацию путем реорганизаций предприятий, которые при разумной поддержке могут вновь достичь финансовой стабильности.	19:27	0:406
рыночный	ADJ	1918-1990	1	рыночный-96		Сказал ему, что в рыночной экономике неизбежно социальное расслоение, но в этот переходный период надо позаботиться не только о том, чтобы появились обеспеченные люди, но и поставить барьер нищенству.	18:26	0:200
рыночный	ADJ	1991-2017	2	рыночный-97		Теперь я видел на рыночной площади автобус с надписью "Калуга -- Керакозово".	18:26	0:77
рыночный	ADJ	1918-1990	1	рыночный-98		Сложные и противоречивые процессы становления рыночных отношений вынесли на поверхность политической и экономической жизни государства новое поколение игроков -- азартных, агрессивных, циничных и лукавых.	46:54	0:204
рыночный	ADJ	1991-2017	2	рыночный-99		Чтобы нашим читателям легче было представить себе рыночные механизмы в издательском деле, им достаточно вспомнить так называемые книжные толчки, нелегальные центры книжной торговли в укромных закоулках Москвы и Ленинграда, где литературным произведениям возвращается их реальная ценность и стоимость, где сознательные официальные советские классики идут по рублю, а идейно чуждые "буржуазные попутчики" вроде Булгакова -- рублей по тридцать или сорок.	50:58	0:451
рыночный	ADJ	1918-1990	1	рыночный-100		Сразу за воротами начинались навесы, как будто крытые рыночные ряды.	54:62	0:68
рыночный	ADJ	1991-2017	2	рыночный-101		Если Зина Васильевна действительно искала дружбы с Таней, как сестрой любимого человека, то Заварихин неминуемо должен был присутствовать на правах жениха последней, а Зотей Бухвостов и прочие с ним плечистые, рыночного обличья молодцы -- в качестве постоянных Николкиных принтелей, будущих шаферов и компаньонов.	210:219	0:313
рыночный	ADJ	1918-1990	1	рыночный-102		Среди этих задач выделяются следующие: -- упрочение рыночного положения газораспределительных организаций и соблюдение приоритета прав потребителя перед производителем; -- автоматизация планирования, учета и контроля основных производственных и финансовых показателей деятельности ОАО "Газпром"; -- автоматизация управления производством в области добычи, переработки и транспортировки газа; -- создание инфраструктуры, включающей программно-аппаратную платформу и сеть передачи данных; -- внедрение проектов, основанных на современных информационных технологиях; -- повышение культуры безопасной эксплуатации систем распределения газа, надежное и бездефицитное газоснабжение предприятий и населения; -- оптимизация всех видов затрат и обеспечение социально приемлемого уровня всех видов рисков при доставке газа потребителям.	52:61	0:826
рыночный	ADJ	1991-2017	2	рыночный-103		Она гораздо меньшее зло, чем идеология, хотя бы потому, что талантливое произведение оказаться рыночным может, а идеологически выдержанным -- никогда.	95:103	0:150
рыночный	ADJ	1991-2017	2	рыночный-104		Страна погрузилась в пучину рыночной стихии, названной М.	28:36	0:57
рыночный	ADJ	1991-2017	2	рыночный-105		Сенаторы констатировали, что за все годы рыночных преобразований в стране так и не были созданы механизмы, обеспечивающие достаточный уровень конкуренции в отрасли.	41:49	0:164
рыночный	ADJ	1918-1990	1	рыночный-106		Таким образом, и по отношению к рыночным реформам, и по эмоционально-психологическому состоянию политически неангажированные группы значительно ближе к сторонникам КПРФ и ЛДПР, чем "Выбора России".	32:40	0:197
рыночный	ADJ	1991-2017	2	рыночный-107		Они вошли в главный рыночный павильон.	20:28	0:38
рыночный	ADJ	1918-1990	1	рыночный-108		То же у меня в комнатке, дешевая рыночная статуэтка, но я так был ей рад.	33:41	0:73
рыночный	ADJ	1918-1990	1	рыночный-109		Второе -- вопросы развития легкой индустрии, как следствие из теории рыночного равновесия.	69:78	0:90
рыночный	ADJ	1918-1990	1	рыночный-110		Учитывая 10-летний период застоя в машиностроении (переход к рыночным отношениям), в настоящее время целесообразно 75-80 % финансовых средств направить на модернизацию уже разработанной техники, а не на создание новой.	61:69	0:218
рыночный	ADJ	1991-2017	2	рыночный-111		С одной стороны, было лестно, с другой -- как-то непонятно-горько: я вдруг как бы бунинскими глазами, со стороны, увидел своего постаревшего, одинокого, немного опустившегося отца с седыми, давно не стриженными семинарскими волосами и черными неглажеными брюками, нашу четырехкомнатную квартиру, казавшуюся мне всегда хорошо, даже богато обставленной, а на самом деле полупустую, с черной мебелью -- рыночной подделкой под дорогую, "черного дерева", которое было обыкновенной дешевой сосной, о чем свидетельствовали потертости и отбитые финтифлюшки -- сверху черные, а внутри белые; этот безвкусный стиль с тумбочками для цветов в виде дорических колонок, кажется, назывался в насмешку "бругага".	400:408	0:696
рыночный	ADJ	1918-1990	1	рыночный-112		Через борьбу на рынке, через рыночные отношения, через конкуренцию государственные предприятия и кооперация будут вытеснять своего конкурента, т. е. частный капитал.	29:37	0:165
рыночный	ADJ	1918-1990	1	рыночный-113		сверх того провинциальный центр с рыночной площадью, почтой и аптекой, -- центр, без всякого промежутка переходящий в окраину.	34:42	0:126
рыночный	ADJ	1918-1990	1	рыночный-114		Это осознают и государственные чиновники, и представители рыночных структур, и регионы.	58:66	0:87
рыночный	ADJ	1991-2017	2	рыночный-115		-- Ее библейский пафос слегка портило рыночное исполнение.	38:46	0:58
