lemma	pos	date	grouping	identifier	description	context	indexes_target_token	indexes_target_sentence
корпус	NOUN	1918-1990	1	корпус-0		(Второй -- в пару ему: корпус ярко-клюквенный, а трубка -- болотистая.)	23:29	0:71
корпус	NOUN	1991-2017	2	корпус-1		И незачем допытываться, где же, в каком па танца или в каком наклоне корпуса лежит "момент критического освоения буржуазного хореографического наследства".	69:76	0:155
корпус	NOUN	1918-1990	1	корпус-2		-- Таня не договорила и повернулась всем корпусом в угол дивана, вдавила голову в широкую спинку.	41:49	0:97
корпус	NOUN	1918-1990	1	корпус-3		В зависимости от глубины армейского района, от протяжения фронта армии, от наличия и состояния путей сообщения и транспорта, от боевых задач, возлагаемых на входящие в состав армии корпуса, и от прочих условий обстановки из армейского (тылового) склада боеприпасов выделялись распоряжением зача вперед, ближе к войскам армейские передовые (промежуточные) склады боеприпасов, большею частью по одному на корпус.	181:188	0:410
корпус	NOUN	1918-1990	1	корпус-4		2 сентября авиация одного из корпусов сообщила, что от Даммартена к югу и юго-западу движется пехота.	29:37	0:101
корпус	NOUN	1918-1990	1	корпус-5		Многие из них были раздавлены его железным корпусом или разрезаны винтами.	43:51	0:74
корпус	NOUN	1918-1990	1	корпус-6		Корпус содрогался и стонал.	0:6	0:27
корпус	NOUN	1918-1990	1	корпус-7		Между вопросами, ответами и повторными вопросами Гладилина пробивался в паузах голос радиста, вызывающего штаб фронта, а Бессонову больше всего хотелось услышать доклад о прибытии Веснина в танковый корпус или хотя бы в 305-ю и вытеснить из сознания беспокойство о нем.	199:205	0:269
корпус	NOUN	1991-2017	2	корпус-8		А на месте двух корпусов дома 41 по Ленинградскому проспекту, которые пойдут под снос, появится Дворец танцевального спорта.	16:24	0:124
корпус	NOUN	1991-2017	2	корпус-9		Отвалы, узкоколейки и глухие корпуса окраин словно отражались в небе, и над гуляющими толпами висели взрытые породы, серые дымы.	29:36	0:128
корпус	NOUN	1918-1990	1	корпус-10		Анализ приведенных в нем статей дает основание считать наиболее эффективными мерами противодействия разрабатываемой системе НПРО суббоеприпасы, ЛЦ-ловушки и боеприпасы с охлажденными корпусами.	183:192	0:193
корпус	NOUN	1991-2017	2	корпус-11		В целях своевременного переключения в ходе боя артиллерийских масс для обеспечения успеха в ином направлении к началу боя командирам артиллерийских корпусов организовать связь по линии взаимодействия с командующим артиллерией соседней армии.	148:156	0:241
корпус	NOUN	1918-1990	1	корпус-12		Армия устояла благодаря корпусу офицеров, который после 1905 года, относясь с большим вниманием, анализом, не раз осуждением, к некоторым явлениям военной и общегосударственной жизни, сохранил характер государственно-охранительной силы.	24:31	0:236
корпус	NOUN	1918-1990	1	корпус-13		Командирам корпусов организовать огни на важнейших направлениях в полосе обороны корпуса и на стыках между дивизиями (бригадами).	11:19	0:129
корпус	NOUN	1991-2017	2	корпус-14		В Петрограде воспитанники 1-го корпуса освистали капитана И. Дзевалтовского, вздумавшего агитировать их за "революционные порядки".	31:38	0:131
корпус	NOUN	1991-2017	2	корпус-15		На сегодня в строящемся корпусе ведется подготовка к отделочным работам.	24:31	0:72
корпус	NOUN	1918-1990	1	корпус-16		В двух километрах от пионерлагеря пролегала дорога, параллельная той, по которой к штабу корпуса проносились автомашины.	89:96	0:120
корпус	NOUN	1991-2017	2	корпус-17		Можно думать, что в этом случае на выручку 20-гo корпуса поспешили бы ближайшие части 10-й армии. 15-й корпус мог выйти из крепости Гродно навстречу главным силам и 26-й корпус ударом на м. Липск сковать находящегося там противника.	49:56	0:232
корпус	NOUN	1918-1990	1	корпус-18		В детстве -- пустота корпуса в субботу и в воскресенье, когда мы не ездили в отпуск.	21:28	0:84
корпус	NOUN	1918-1990	1	корпус-19		Еще на старте Витюха сразу же на целый корпус опередил остальных, потом с каждой секундой разрыв увеличивался, и сейчас, когда Витюха шел по последней прямой, те, другие, еще отталкивались на повороте от стенки.	39:45	0:211
корпус	NOUN	1918-1990	1	корпус-20		В современных конструкциях БРЭМ вращающийся подъемный кран обычно монтируется ближе к борту на крыше корпуса и управляется крановщиком, находящимся внутри машины.	101:108	0:162
корпус	NOUN	1991-2017	2	корпус-21		По близорукости мне еще в Финляндском корпусе разрешили употреблять в классе лорнет.	38:45	0:84
корпус	NOUN	1918-1990	1	корпус-22		Все мы получили совершенно определенный приказ командира корпуса -- овладеть Бескидским хребтом и вторгнуться в Венгрию.	57:64	0:120
корпус	NOUN	1918-1990	1	корпус-23		Во время дебатов по этому поводу в штабе армий сомнения были устранены с получением известия, что корпуса Наревской армии уже частично перешли южную границу Восточной Пруссии и вышли на линию Юха, Пельты, Хоржеле, Кржиновлога, Млава, что могло поставить под угрозу тыл и пути 8-й германской армии к Висле.	98:105	0:305
корпус	NOUN	1918-1990	1	корпус-24		Вчера вошел в город гвардейский корпус Ленфронта.	32:38	0:49
корпус	NOUN	1918-1990	1	корпус-25		И если было положено начало некоторому физическому развитию в кадетских корпусах и в отдельных гимназиях, то ведь это были случайные мероприятия и чтобы создать массовое движение в этом направлении необходимы колоссальные и продолжительные усилия.	72:80	0:247
корпус	NOUN	1991-2017	2	корпус-26		Главное достоинство "Крузенштерна", обеспечивающее его долголетие, -- корпус.	70:76	0:77
корпус	NOUN	1991-2017	2	корпус-27		Я тебя возьму и сегодня же буду писать директору корпуса о своей просьбе.	49:56	0:73
корпус	NOUN	1918-1990	1	корпус-28		Гудериан действительно хотел провести полноценный совместный парад, однако затем согласился на процедуру, предложенную командиром 29-й танковой бригады С.М.Кривошеиным: "В 16 часов части вашего корпуса в походной колонне, со штандартами впереди, покидают город, мои части, также в походной колонне, вступают в город, останавливаются на улицах, где проходят немецкие полки, и своими знаменами салютуют проходящим частям.	194:201	0:419
корпус	NOUN	1991-2017	2	корпус-29		Шагая от стены к стене, как запертый зверь, заполняя спальню могучим корпусом, атаман молчаливо и страшно бесновался.	69:77	0:117
корпус	NOUN	1991-2017	2	корпус-30		Даже если целостность "панциря" была нарушена, это, по мнению специалистов, не могло бы стать причиной "прожога" корпуса при вхождении "Колумбии" в плотные слои атмосферы и никак не отразилось бы на безопасности корабля.	113:120	0:220
корпус	NOUN	1991-2017	2	корпус-31		В чем же заключалась новизна штурмовика "Наше конструкторское бюро заставило броню работать в корпусе самолета, сделав ее рабочим телом.	94:101	0:136
корпус	NOUN	1918-1990	1	корпус-32		Действительно, когда корпус был передан обратно в Донскую армию, Мамонтов вступил вновь в командование им, собрал значительное число сабель, и впоследствии за Доном корпус этот нанес несколько сильных ударов коннице Буденного.	21:27	0:226
корпус	NOUN	1918-1990	1	корпус-33		Империалисты США охотно вняли этой "просьбе" и, как публично заявил в конце января 1952 года директор отдела исследований и усовершенствования химического корпуса армии бригадный генерал Уильям Кризи, Соединенные Штаты ведут широкую подготовку к бактериологической войне.	155:162	0:271
корпус	NOUN	1918-1990	1	корпус-34		Десять объектов сегодня уже выставлены на торги, однако покупатели на давно не видевшие капитального ремонта корпуса, по прогнозам Александра Митлина, вряд ли найдутся: в последнее время платежеспособный спрос на производственные площади резко упал.	109:116	0:249
корпус	NOUN	1991-2017	2	корпус-35		Командующий армией и его штаб обязаны: а) организовать взаимодействие корпусов первого эшелона между собой, а также с войсками второго эшелона, с армейскими средствами усиления и с авиацией; б) поверять решения и планы боя, принятые командирами корпусов, поверять, как организовано управление войсками со стороны командиров корпусов в процессе боя, и контролировать выполнение корпусами поставленных перед ними задач, но не подменять командира корпуса и не командовать дивизиями через его голову; в) организовать материально-техническое обеспечение войск, имея в виду, что стрелковые корпуса самостоятельных тыловых районов не получают и тыловых частей и учреждений не имеют.	70:78	0:675
корпус	NOUN	1918-1990	1	корпус-36		Закон этот, однако, не соблюдался, и в офицерском корпусе состояли не только прапорщики запаса, но и генералы генерального штаба, принявшие до службы христианство.	50:57	0:163
корпус	NOUN	1918-1990	1	корпус-37		В этот памятный день, 3 октября, после полудня, я был послан к командиру 1-го армейского корпуса барону Мейендорфу с приказанием получить от него подробный план атаки сопки с деревом.	89:96	0:183
корпус	NOUN	1991-2017	2	корпус-38		И вдруг корпус корабля дрогнул и начал быстро заваливаться на левый борт.	8:14	0:73
корпус	NOUN	1991-2017	2	корпус-39		Хорошо бы построить мост По словам председателя совета директоров "Парадиз-холдинга" Владислава Жигайло, рассмотрение вариантов эффективного использования корпусов СвСЗ только предстоит, однако в соответствии с планами руководства, в одном из корпусов планируется организовать культурно-развлекательный центр.	155:163	0:309
корпус	NOUN	1918-1990	1	корпус-40		И вспомнил тут я, что при формировании голубого Жандармского корпуса многих армейских офицеров переводили в него помимо их желания.	61:68	0:131
корпус	NOUN	1991-2017	2	корпус-41		В этом случае мотострелковая бригада корпуса движется на автотранспорте и спешивается при невозможности дальнейшего продвижения вследствие огня противника, наступая в пеших боевых порядках, усиливая удар стрелковых частей.	37:44	0:222
корпус	NOUN	1991-2017	2	корпус-42		К наиболее серьезным относятся гипертонус мышц, развитие конечностей в ущерб корпусу и дисбаланс левой и правой сторон тела.	77:84	0:124
корпус	NOUN	1991-2017	2	корпус-43		Зная массу испарившейся жидкости (по величине изменения уровня, площади сечения корпуса и плотности жидкости при температуре кипения) и удельную теплоту парообразования, по известной формуле вычисляют количество теплоты, затраченное на парообразование (1) [формула: Разделив полученное значение теплоты парообразования на время, за которое испарилась данная жидкость (изменился ее уровень), определяют мощность тепловой энергии кромки лесного пожара.	80:87	0:450
корпус	NOUN	1991-2017	2	корпус-44		К недостаткам "американца" наши танкисты неизменно относили высокий корпус, который демаскировал танк на поле боя.	68:74	0:114
корпус	NOUN	1991-2017	2	корпус-45		Работая корпусом, сближение с воображаемым соперником, вхождение в ближний бой, нанесение ударов ногами или подсечек при выходе из ближнего боя Условные бои: 6 раундов по 2 минуты.	8:16	0:180
корпус	NOUN	1918-1990	1	корпус-46		Как и в обороне, истребительно-противотанковые артиллерийские бригады являются подвижными средствами борьбы с танками в руках командующего армией или командира корпуса с задачей обеспечения наступающей пехоты в противотанковом отношении, действуя на танкоопасных направлениях и на флангах в готовности к отражению контратак противника.	160:167	0:335
корпус	NOUN	1918-1990	1	корпус-47		Глаз Курако едва охватывал панораму завода с разбросанными в разных местах агрегатами, лесом труб, множеством корпусов и жилым поселком, прилепившимся к производственным строениям.	110:118	0:180
корпус	NOUN	1918-1990	1	корпус-48		Как мы жили в те годы Днем строили новый корпус и приспосабливали старые, выделенные нам помещения для нужд будущего Института электрофизики, а вечером, зачастую до глубокой ночи, шла разработка новых установок и поиск новых областей их применения.	41:47	0:248
корпус	NOUN	1991-2017	2	корпус-49		-- Но большего у нас нет, а ждать, покуда из России подтянутся резервные корпуса, невозможно.	73:80	0:93
корпус	NOUN	1918-1990	1	корпус-50		Катерина не успела понять, рада она вновь обретенному супругу или не очень, как услышала тарахтение моторов улыбчивой мотопехоты пятьдесят седьмого корпуса четвертой танковой армии, входящей в группу "Центр".	148:155	0:208
корпус	NOUN	1991-2017	2	корпус-51		На следующий день наступление русских корпусов началось только после полудня и продолжалось в ранее указанных им разграничительных линиях (схема 55); каких-либо новых указаний корпуса от армейского командования не получили.	38:46	0:223
корпус	NOUN	1991-2017	2	корпус-52		Ко времени описываемых событий Афанасий Дмитриевич успел выслужить "диплом с гербом на дворянское достоинство", чин майора (по армейской кавалерии) и, состоя в должности адъютанта командира корпуса Внутренней стражи, вёл подобающий его положению светский образ жизни со всеми вытекающими из него соблазнами и удовольствиями.	190:197	0:324
корпус	NOUN	1991-2017	2	корпус-53		Здесь целиком сохранились корпус воздуходувки и здание бытовки.	26:32	0:63
корпус	NOUN	1918-1990	1	корпус-54		Михаил Трунин отмечает: "Физика конденсированных сред таится в сверхнизких температурах, поэтому уже в этом году, наряду с АСМ, в лабораторном корпусе будут установлены "сухие фриджи" -- безгелиевые рефрижераторы растворения, в которых разного типа наноструктуры (в том числе сделанные на уникальном физтеховском нанолитографе) будут охлаждаться до 10 милликельвин".	143:150	0:366
корпус	NOUN	1991-2017	2	корпус-55		Вес корпуса, включая и крылья М, 12 kg.	4:11	0:39
корпус	NOUN	1991-2017	2	корпус-56		Налаживать взаимодействие с Восточным охранным корпусом.	47:55	0:56
корпус	NOUN	1991-2017	2	корпус-57		Командующий им генерал Пааво Талвела впоследствии признал, что Маннергейм еще 5 июня 1941 года предложил ему командовать этим корпусом именно для атаки бывшей столицы империи.	126:134	0:175
корпус	NOUN	1918-1990	1	корпус-58		Например, 8-й корпус генерала Мылова.	14:20	0:37
корпус	NOUN	1918-1990	1	корпус-59		Для придания железобетонным корпусам герметичности Лин предлагает покрывать их изнутри слоем эпоксидной смолы.	28:36	0:110
корпус	NOUN	1991-2017	2	корпус-60		Нас радовали фуражки с молоточками, подтверждавшие принадлежность вчерашних нищих мальчишек к "Горному корпусу".	103:110	0:112
корпус	NOUN	1991-2017	2	корпус-61		А вот, кажется, я вижу, как, озираясь, она бежит вдоль корпуса.	55:62	0:63
корпус	NOUN	1991-2017	2	корпус-62		Не составляли секрета в дипломатическом корпусе Кабула и встречи Амина с американским поверенным в делах Брюсом Амстютцем -- они обсуждались на всех углах.	40:47	0:155
корпус	NOUN	1991-2017	2	корпус-63		Борис -- впоследствии "его превосходительство" и протеже Его Императорского Высочества великого князя Константина Константиновича -- постигал азы военных наук в 3-ем Московском кадетском корпусе.	187:194	0:195
корпус	NOUN	1918-1990	1	корпус-64		Но за эти три дня до начала операции большевиков генерал Кутепов перешел в наступление 1-м армейским корпусом в северо-западном направлении, разрезал 13-ю и 14-ю армии, разбил их и отбросил первую к Курску, вторую -- за Ворожбу.	101:109	0:228
корпус	NOUN	1918-1990	1	корпус-65		Растянувшийся на 80 километров корпус быстро подтягивался к горе Авала.	31:37	0:71
