lemma	pos	date	grouping	identifier	description	context	indexes_target_token	indexes_target_sentence
стиль	NOUN	1918-1990	2	стиль-0		"Язык, а также стиль писем протопопа Аввакума и "Жития" его остаются непревзойдённым образцом пламенной и страстной речи бойца", -- говорит М. Горький, добавляя при этом: "...и вообще в старинной литературе нашей есть чему поучиться".	15:20	0:234
стиль	NOUN	1918-1990	2	стиль-1		Татькина мачеха, Таня Григорьева, дочь преподавателя химии самых лучших и самых прогрессивных гимназий, выросла в самой что ни на есть интеллигентской семье из того крыла, что сохраняли стиль шестидесятников и почитали Белинского и Добролюбова.	186:191	0:244
стиль	NOUN	1682-1916	1	стиль-2		-- К стилю я давно охоту имею.	5:10	0:30
стиль	NOUN	1682-1916	1	стиль-3		Позыв на кислое, острое, жгучее, горькое, потребность в кричащем и извращенном -- вот что характеризует стиль nouveau во всем, ибо так называемый декаданс охватил собою решительно все явления духа -- от философии и искусства до политики и ремесла.	104:109	0:247
стиль	NOUN	1682-1916	1	стиль-4		-- Не разрубить ли сразу гордиев узел, не начать ли так: знаете ли вы самое безвкусное здание в Ленинграде -- зеленое с голубыми воротами, построенное в глупом стиле второй империи, витиеватое, как торт из крема.	160:165	0:212
стиль	NOUN	1918-1990	2	стиль-5		Однако, как устойчивый эстетический уклад, стиль этот отличает, по преимуществу, совокупность евразийской степной и евразийской лесной зоны.	43:48	0:140
стиль	NOUN	1682-1916	1	стиль-6		25 марта 1911 года старого стиля (Благовещенье) Гумилев вернулся из своего путешествия в Африку (Аддис-Абеба).	27:32	0:110
стиль	NOUN	1918-1990	2	стиль-7		Жуковский рано усвоил себе германский романтизм, и, переводя и переделывая немецкие и английские баллады, он более и более уклонялся от искусственного, условного стиля французской литературы.	162:167	0:191
стиль	NOUN	1682-1916	1	стиль-8		Большая переписка с братом помогала, конечно, и выработке "стиля" Дашковой, -- той способности ясно и сжато выражать свои мысли и метко характеризовать несколькими сильными штрихами предмет изложения, которой отличаются ее известные записки.	59:64	0:241
стиль	NOUN	1682-1916	1	стиль-9		На станции Жерновки, Рязанско-Уральской железной дороги, опустился воздушный шар с запиской, что пущен 24 октября нового стиля из Мекленбурга.	121:126	0:142
стиль	NOUN	1682-1916	1	стиль-10		Борьба человека с физическими преградами, так типически изображенная в стихе о Егории Храбром, который на Святой Руси встречает только леса дремучие, болота топучие да змеиные стада, пасомые сверхъестественными, мифическими существами, -- эта борьба с дикими силами природы, соответствующая звериным типам романского стиля, продолжалась на Руси до позднейших времен.	317:322	0:366
стиль	NOUN	1682-1916	1	стиль-11		Борьба с безобразной окраской исторических зданий Петербурга Среди любителей петербургской старины вновь возбужден вопрос о принятии мер к тому, чтобы исторические здания Петербурга окрашивались соответственно их стилю и времени постройки.	213:218	0:239
стиль	NOUN	1682-1916	1	стиль-12		В Нюренберге, напр., есть древняя часть города, где не разрешается возводить построек в ином стиле, чем окружающие здания XV столетия.	93:98	0:134
стиль	NOUN	1682-1916	1	стиль-13		Это поразительное явление, что он не хотел "суворинской правды", сказанной не таким слогом ("стиль -- душа вещей"), и без малейшей в себе болезненности пропускал в свою газету то, с чем был вовсе не согласен ни по существу, ни для пользы России, если опять же по слогу ("душа вещи") видел, что тут горит твоя индивидуальная душа.	93:98	0:329
стиль	NOUN	1682-1916	1	стиль-14		В мягкости Фиренцуолы была одна особенность, типичная одинаково и для его характера, и для стиля его писаний.	91:96	0:109
стиль	NOUN	1918-1990	2	стиль-15		Вся комната битком набита мебелью разных стилей и разной обивки, картинами и рисунками по стенам, старыми художественными вещами.	41:47	0:129
стиль	NOUN	1682-1916	1	стиль-16		В основу его положены английская готика с примесью мавританского и индийского стилей.	78:84	0:85
стиль	NOUN	1682-1916	1	стиль-17		Мы знаем, что собор был выстроен в готическом стиле, но строителям оказалась не под силу техническая задача -- возведение купола.	46:51	0:129
стиль	NOUN	1918-1990	2	стиль-18		В связи с открытием в Париже выставки работ, удостоенных римской премии в 1938 году, газета "Веаuх Агts" отмечает, что произведения, получившие награды, "весьма посредственны, страдают сухостью и отсутствием стиля.	208:213	0:214
стиль	NOUN	1918-1990	2	стиль-19		Она в грузинском стиле, прекрасно выдержанном.	17:22	0:46
стиль	NOUN	1682-1916	1	стиль-20		Великобритания, понятая как Англия в тесном смысле, как соединенное королевство Великобритании и Ирландии, а не как культурное всесветное поприще англосаксонского племени, неразрывно связана с Лондоном, несмотря на всю свою децентрализацию, и связь эта выразилась резче именно с той поры, когда стиль английской культурной государственности определился впервые с ясностью, т. е. с эпохи Тюдоров.	295:300	0:395
стиль	NOUN	1682-1916	1	стиль-21		Христа в этом рассказе Леонид Андреев изображает красивым и очень сентиментальным молодым человеком, в стиле поленовского Христа на Генисаретском озере.	103:108	0:152
стиль	NOUN	1918-1990	2	стиль-22		Вера никак не могла привыкнуть к этому прогулочному стилю, к небольшим залам (почти комнатам!) западных галерей, и втайне тосковала по огромным площадям выставочного зала Союза художников на проспекте Ленина.	52:57	0:208
стиль	NOUN	1918-1990	2	стиль-23		Судья -- женщина, прекрасного стиля большевичка,-- спрашивает: -- Отчего у тебя уши покраснели -- Неловко как-то,-- говорит он со слезами.	30:35	0:138
стиль	NOUN	1682-1916	1	стиль-24		Во многих столицах мы приходили в восторг от национального стиля новых громадных зданий.	59:64	0:88
стиль	NOUN	1682-1916	1	стиль-25		В том же стиле построены были впоследствии домовая церковь и дом для причта; наконец, в пустынной степи воздвиглась маленькая готическая часовня, где хозяин заранее приготовил себе собственную могилу с характеристическою надписью: "Nee timeo, пес spera".	9:14	0:254
стиль	NOUN	1682-1916	1	стиль-26		Вот от этой инерции стиля удавиться можно.	20:25	0:42
стиль	NOUN	1918-1990	2	стиль-27		Лопухин сообщил ему, что 11 ноября ст[арого] стиля к нему на его квартиру, на Сергиевской улице в Петербурге, около 10 часов вечера, явился Азеф и умолял его взять свое показание, данное им Бурцеву, обратно.	45:50	0:207
стиль	NOUN	1682-1916	1	стиль-28		Выставка была устроена в чисто русском стиле, с буфетом, где красовался наш русский самовар.	39:44	0:92
стиль	NOUN	1918-1990	2	стиль-29		Отмечаю (конец августа по нов. стилю), что, несмотря на отсутствие фактов, и даже касающихся севера слухов, -- общее настроение в городе -- повышенное, атмосфера просветленная.	31:36	0:176
стиль	NOUN	1918-1990	2	стиль-30		Два раза в год -- 31 марта и 6 августа по старому стилю -- появлялись эти казаки с белыми лилиями, присаживались к столу, накрытому хозяйкой с особым старанием.	50:55	0:160
стиль	NOUN	1918-1990	2	стиль-31		Если изложить обстоятельства этого дела стилем обвинительного акта, получится приблизительно вот что.	40:46	0:101
стиль	NOUN	1682-1916	1	стиль-32		Для кабинета Самгин подобрал письменный стол, книжный шкаф и три тяжелых кресла под "черное дерево", -- в восьмидесятых годах эта мебель была весьма популярной среди провинциальных юристов либерального настроения, и замечательный знаток деталей быта П. Д. Боборыкин в одном из своих романов назвал ее стилем разочарованных.	301:307	0:323
стиль	NOUN	1918-1990	2	стиль-33		Есть мелодия и гармония стиля.	24:29	0:30
стиль	NOUN	1682-1916	1	стиль-34		Дом этот, отделанный снаружи в растреллиевском стиле, вроде дома князей Белосельских, считался теперь одним из лучших домов в Петербурге.	47:52	0:137
стиль	NOUN	1682-1916	1	стиль-35		Но пришел Чуковский, пощупал пульс стиля и поставил диагноз: пресно, отдает средним сословием.	35:40	0:94
стиль	NOUN	1682-1916	1	стиль-36		Дома у Натальи Петровны пироги с рисом, с капустой, торт "крокодил"; сама не ест, угощает, ее стиль готовки мягкий, без остроты.	94:99	0:128
стиль	NOUN	1918-1990	2	стиль-37		Корнель сам, как мы говорили, бывал в отеле Рамбуйе, он ушел оттуда с глухим предубеждением против этого печального направления и, вероятно, во время руанских свиданий познакомил Мольера с особенностями этого общества и своим отрицательным отношением к нему внушил автору "Любовной досады" желание осмеять нелепости этого утонченного стиля.	334:339	0:340
стиль	NOUN	1918-1990	2	стиль-38		Ее неправильное личико могло растрогать тонкой чистотой очертаний; каждый изгиб, каждая выпуклость этого лица, конечно, нашли бы место в множестве женских обликов, но их совокупность, стиль -- был совершенно оригинален, -- оригинально мил; на этом мы остановимся.	184:189	0:263
стиль	NOUN	1918-1990	2	стиль-39		Но параллельное изучение "высокого стиля" "Двойника" и комически-торжественного сказа гоголевской новеллы о двух Иванах лишь этими сопоставлениями и должно было бы ограничиться.	35:40	0:177
стиль	NOUN	1682-1916	1	стиль-40		Ему противополагается стиль ионический, развившийся в Малой Азии тоже из деревянной архитектуры, но при металлической ее облицовке.	22:27	0:131
стиль	NOUN	1682-1916	1	стиль-41		Белинский же вечного сквозь временное, литературы сквозь стиль, души сквозь моду не чуял, -- и в этом я его упрекаю.	57:62	0:116
стиль	NOUN	1918-1990	2	стиль-42		Жесты отлично выверены, и стиль спектакля, торжественный и строгий, сохраняется во всех деталях.	26:31	0:96
стиль	NOUN	1918-1990	2	стиль-43		Между тем, неоднозначные предложения широко используются в самых разных стилях речи.	72:78	0:84
стиль	NOUN	1682-1916	1	стиль-44		Жирмунский, который систематизировал все найденные им у своих предшественников указания на приемы композиции лирических стихотворений и пополнил их самостоятельными наблюдениями, впал в одну существенную ошибку, которая значительно понижает ценность его работы: он забыл, что "композиция" -- часть стилистики, которая каждое явление стиля изучает с двух точек зрения -- строения (форма) и значения, т. е. морфологической и семасиологической.	298:308	0:441
стиль	NOUN	1918-1990	2	стиль-45		-- Какого стиля эти колонны, по-вашему Обертываюсь -- неугомонный отец Стефан.	10:15	0:78
стиль	NOUN	1682-1916	1	стиль-46		И Архимед, боясь нарушить эту традицию и прослыть вольнодумцем, поступал, как все: скрывал ход своих решений, а доказательства оформлял в стиле приведения к абсурду.	138:143	0:165
стиль	NOUN	1918-1990	2	стиль-47		Это -- икона высокого стиля, а не картина.	22:27	0:42
стиль	NOUN	1682-1916	1	стиль-48		И даже в мраморном храме какой-либо страны различная тяжесть употребляемых в дело камней определяет различие форм, и мы замечаем различные стили".	139:144	0:146
стиль	NOUN	1682-1916	1	стиль-49		Лучшим доказательством бесплодности позднейшего греческого искусства, закосневшего в монастырском стиле Афонской Горы, служит тот факт, что ни от этих столетий, ни от позднейших ничего не осталось на Руси из произведений греческой иконописи, что заслуживало бы особенного внимания в художественном отношении.	98:103	0:308
стиль	NOUN	1918-1990	2	стиль-50		И неовизантийская икона вошла в Италию, то повторяя в точности константинопольские образцы, то вооружая стилем и методом едва успевшую народиться францисканскую живопись.	104:110	0:170
стиль	NOUN	1918-1990	2	стиль-51		Не успел я дождаться ответа из Лондона, как меня вызвал к себе сам Жоффр и показал телеграмму, составленную в истинно английском стиле: "Send me Ignatieff. Ketchener".	129:134	0:167
стиль	NOUN	1682-1916	1	стиль-52		Из всего этого следует, что у переводчиков все же есть возможность воспроизвести в переводе некоторые -- правда, не все -- особенности просторечия, внелитературного стиля, присущие оригинальному тексту, и что, значит, дело вовсе не так безнадежно, как это представляется защитнику.	165:170	0:281
стиль	NOUN	1918-1990	2	стиль-53		Замечу только с своей стороны, что всякое уподобление различных отраслей творчества носят характер случайности и являются только вопросом стиля.	138:143	0:144
стиль	NOUN	1918-1990	2	стиль-54		Индеец хотел поразить Ихтиандра и повел его по главным улицам города -- Авенида Альвар, Вертис, показал площадь Виктории с кафедральным собором и ратушей в мавританском стиле, площадь Фуэрто и площадь Двадцать пятого мая [25 мая 1810 года провинции Ла-Плата образовали революционный союз -- "Хунту", арестовали местную власть, провозгласили временное правительство и отделились от Испании.] с обелиском Свободы, окруженным прекрасными деревьями, президентский дворец.	169:174	0:467
стиль	NOUN	1918-1990	2	стиль-55		Попытаемся представить себе фотографа в соломенном сомбреро, в сношенных сандалиях на больших пыльных ступнях загорелых ног; август, набережная, толпа, фоном -- фонтан и корпуса санатория, построенного в большом стиле конца тридцатых годов; группа здешних отдыхающих сбилась в кучу, и молодцу в сомбреро не сразу удается обуздать это пугливое и бестолковое стадо; но вот наконец мало-мальски пристойный порядок достигнут, отдыхающие построились и пооткрывали рты, уставясь в окошко камеры; птичка выпорхнула, и фотограф отер пот со лба; теперь -- увеличение: обладай наш юноша чуть большим воображением (впрочем, это лишь синоним любопытства), он задался бы вопросом, с чего крашенной перекисью водорода бабенке, четвертой справа во втором ряду, извлекать свое изображение из душноватой глянцевой прошлогодней мути нерезкого халтурного курортного фото И зачем тиражировать немолодую женщину в залихватски напяленной бесформенной панаме и больших пляжных очках, за которыми вовсе не видно ни глаз ее, ни меленьких черт лица, и этого вот гражданина в носках и ботинках, хоть и жарища несусветная, со стальными зубами (в одной руке у него женская пляжная сумка, другая робко водружена -- ради цельности композиции, надо полагать, -- на толстую шею соседки; она же -- игриво напряжена, смотрит в камеру, как на стартовый пистолет, с тем чтоб через мгновение после спуска затвора кокетливо высвободиться из неловкого объятия) Так и застыли они навеки: стыдливый охотник с ненатуральной стальной улыбкой и пугливая счастливая курочка, лелеющая свой многообещающий испуг, -- и какова будет судьба этих, новых отпечатков Пошлет ли она ему их заказным письмом, тайно надеясь если не разрушить провинциальную семью пансионатского ловеласа, то хоть лягнуть его жену, напомнить о себе и о своей уступчивости (привыкли, что для них все легко и даром); или же, всплакнув (сарафанчик-то хорошо сидел, удачные были и фасон, и рисунок), спрячет в ящик комода к другим дорогим вещам, как то: старая трудовая книжка, новая пенсионная, оплаченные еще в том году междугородные телефонные счета, книжка сберегательная, книжка платежей за коммунальные услуги, паспорт с просроченным гарантийным талоном на починку швейной машинки и несколько поздравительных открыток со знаменами, цветами и добродушным Дедом Морозом, а также чудом завалившийся старый-престарый карманный календарь с аккуратно отмеченными "	212:217	0:2384
